dlga_start:mutiny_pretalk_1|嗨， {playername}。我需要告诉您伙计们在发牢骚了！他们想轻松轻松减少进军的负担。
; dlga_lord_start:close_window.1|Too long ago, I asked you to take me one troll alive. But I should have known. How could I expect someone like {playername} to be up to the challange. My servant was not skilled or faithful enough.
; dlga_lord_start:lord_generic_mission_completed.1|News of your accomplishment against the wild trolls reached me. {s12} has one fear less to worry about, thanks to you, {playername}.
; dlga_lord_start:lord_follow_spy_half_completed|Blast and damn you! I wanted TWO prisoners, {playername} -- what you've brought me is one step short of useless! I already know everything the spy knows, it was the handler I was after. Here, half a job gets you half a reward. Take it and begone.
; dlga_lord_start:lord_follow_spy_half_completed.1|I asked you for two prisoners, {playername}, not one. Two. Still, I suppose you did capture the spy's handler, the more important one of the pair. The spy will not dare return here and will prove quite useless to whatever master he served. 'Tis better than nothing. However, you'll understand if I pay you half the promised reward for what is but half a success.
; dlga_lord_start:lord_follow_spy_failed|Truly, {playername}, you are nothing short of totally incompetent. Failing to capture both the spy AND his handler plumbs astonishing new depths of failure. Forget any reward I offered you. You've done nothing to earn it.
dlga_lord_follow_spy_half_completed:lord_pretalk|我尽力了，{s65}。
dlga_lord_follow_spy_completed:lord_pretalk|谢谢你，{s65}。
dlga_lord_follow_spy_failed:lord_pretalk|嗯，随你的便， {s65}。
; dlga_lord_start:lord_generic_mission_completed.2|Damn me, but you've done it, {playername}. All the slaves are back and they're busy preparing for the harvest. You certainly earned your reward. Here, take it, with my compliments.
; dlga_lord_start:lord_bring_back_runaway_serfs_failed|{playername}. I have been waiting patiently for my slaves, yet none have returned. Have you an explanation? Were you outwitted by simple animals, or are you merely incompetent?
dlga_lord_bring_back_runaway_serfs_failed:lord_bring_back_runaway_serfs_failed_1a|原谅我, {s65},那些奴隶狡猾的像条泥鳅
; dlga_lord_bring_back_runaway_serfs_failed_1a:lord_pretalk|Hmph, that is hardly an excuse for failure, {playername}. Now if you will excuse me, I need to capture new men to work these fields before we all starve.
; dlga_lord_start:lord_runaway_serf_half_completed|You disappoint me, {playername}. There were 3 groups of slaves that I charged you to return. 3. Not {reg17}. I suppose the ones who did come back shall have to work twice as hard to make up for those that got away. As for your reward, {playername}, I'll only pay you for the slaves you returned, not the ones you let fly. Here. Take it, and let this business be done.
dlga_lord_runaway_serf_half_completed:lord_pretalk|谢谢你, {s65}. 你真慷慨。
dlga_lord_runaway_serf_half_completed:lord_pretalk.1|呸，这简直是浪费我的时间。
; dlga_lord_start:lord_deliver_cattle_to_army_thank|Ah, {playername}. I am pleased that you delivered {reg13} units of {s4}, as I requested. I'm impressed.
dlga_lord_deliver_cattle_to_army_thank:lord_pretalk|没问题，{s65}。
dlga_lord_deliver_cattle_to_army_thank:lord_pretalk.1|很高兴为您服务。
; dlga_lord_start:lord_scout_waypoints_thank|You make a good scout, {playername}. My runner just brought me your reports of the mission to {s13}, {s14} and {s15}. Well done.
dlga_lord_scout_waypoints_thank:lord_pretalk|一个简单的任务, {s65}.
dlga_lord_scout_waypoints_thank:lord_pretalk.1|没有什么是我解决不了的
dlga_lord_scout_waypoints_thank:lord_pretalk.2|那是我的荣幸，先生.
dlga_lord_start:lord_mission_told_deliver_cattle_to_army|我们部队的物资消耗的太快了, {playername}. 我要你把 {reg3} units of {s4} 带来,那样的话我就能喂饱我的士兵了.我不在乎你从哪里弄来的,尽快把东西带回来.
dlga_lord_mission_told_deliver_cattle_to_army:lord_mission_told_deliver_cattle_to_army_accepted|很好,我能找到一些{s4}.
dlga_lord_mission_told_deliver_cattle_to_army:lord_mission_told_deliver_cattle_to_army_rejected|抱歉,先生,我有其他的计划
dlga_lord_mission_told_deliver_cattle_to_army_accepted:close_window|太棒了!你知道该怎么做, {playername}, 现在就去.我需要那些食物尽快.
dlga_lord_mission_told_deliver_cattle_to_army_rejected:close_window|那 . . . 很不幸, {playername}. 我应该找能胜任此任务的其他人.现在马上离开,我还有工作要做.
dlga_lord_start:lord_report_to_army_asked|啊,你终于来了, {playername}. 我们都盼望你的带来.我希望你带来了足够富有经验的士兵.
dlga_lord_report_to_army_asked:lord_report_to_army_completed|我有一队优秀的老练士兵.我们准备好加入你了.
dlga_lord_report_to_army_asked:lord_report_to_army_continue|我还没有足够的军队.我需要更多的时间.
dlga_lord_report_to_army_completed:close_window|很棒.当我有任务给你的时候我会告诉你.现在.跟紧我们.我们很快就要出发了.
dlga_lord_report_to_army_continue:close_window|那你最好快一点.我们将会很快对抗敌人.我需要所有人都能够集结起来.
dlga_lord_start:lord_mission_told_scout_waypoints|{playername}, 我需要一个人自愿去侦察.我们缺乏情报,在我们继续行军前我必须对形势有一个更好的了解.我需要你去{s13}, {s14} 和 {s15}.把你发现的报告给我.
dlga_lord_mission_told_scout_waypoints:lord_mission_told_scout_waypoints_accepted|你找到你的志愿者了,先生.
dlga_lord_mission_told_scout_waypoints:lord_mission_told_scout_waypoints_rejected|恐怕我必须拒绝.
dlga_lord_mission_told_scout_waypoints_accepted:close_window|好的！简单地通过{s13}, {s14} 和 {s15}附近看看有什么。记下你找到的一切并尽快回复我。
dlga_lord_mission_told_scout_waypoints_rejected:lord_pretalk|嗯.我很失望, {playername}. 非常失望.我们之后再谈,现在我需要另找他人去侦察了.
dlga_lord_start:lord_buy_prisoner|我听说你俘虏了敌人 {s3} 并且他现在还在你手里.做得很好!^把他交给我们,我们会从他嘴里得到很多信息的...^^[你会得到 {reg14}  {s14} 的资源点数]
dlga_lord_buy_prisoner:lord_buy_prisoner_accept|嗯,他都是你的.
dlga_lord_buy_prisoner:lord_buy_prisoner_deny|我恐怕我有对他有其他的计划.
dlga_lord_buy_prisoner_accept:lord_pretalk|非常棒!我会派我的部下赶快把他送到监狱.这将有助于我们的事业.
dlga_lord_buy_prisoner_deny:lord_pretalk|太糟糕了,他对我们来说很有价值, {playername}.
; dlga_lord_start:lord_pretalk|Ah, welcome, {s24}.^You should already know that {s12}. Your duty is to help in our struggle, {playername}. When you prove yourself worthy of my confidence [level {reg1}], I will also allow you access to that chest over there.
dlga_lord_start:lord_talk|那是什么?
dlga_lord_pretalk:lord_talk|還要別的嗎?
dlga_lord_talk:lord_lend_companion_end|我需要 {s14} 回到我身边, {s65}, 如果你不需要 {reg3?her:his} 的服务.
; dlga_lord_lend_companion_end:lord_pretalk|You've too many men in your company already, {playername}. You could not lead any more at the moment.
; dlga_lord_lend_companion_end:lord_pretalk.1|Certainly, {playername}. {reg3?She:He} is a bright {reg3?girl:fellow}, you're a lucky commander to have such worthy companions.
dlga_lord_talk:lord_message_delivered|我从{s9}那带来一条消息。
dlga_lord_talk:lord_message_delivered_enemy|我从{s9}那带来一条消息。
dlga_lord_talk:lord_active_mission_1|关于那件你给我的任务...
dlga_lord_talk:lord_request_mission_ask|你有什么任务可以给我吗？
dlga_lord_talk:find_lost_spears_permission|大人，我希望能进入孤山寻找Bladorthin国王丢失的矛
dlga_find_lost_spears_permission:lord_pretalk|我已经给了你许可了， {playername}。
dlga_find_lost_spears_permission:find_lost_spears_permission_yes|好吧， {playername}，你可以进入孤山。
dlga_find_lost_spears_permission:lord_pretalk.1|我很抱歉，但我并不了解你和足够信任你，{playername}.
dlga_find_lost_spears_permission_yes:lord_pretalk|感谢您，大人
; dlga_lord_give_troops:lord_give_troops_check|Reinforce my party? I can always use a few more soldiers.
; dlga_lord_give_troops:lord_pretalk|Unfortunately you don't have any {s14} soldiers to reinforce me with.
; dlga_lord_give_troops_check:lord_give_troops_check_1|Let me check the soldier roster...
dlga_lord_give_troops_check_1:lord_pretalk|所以你改變主意了..^我知道了.
dlga_lord_give_troops_check_1:lord_pretalk.1|我们用不着这些部队，把他们带回去。
; dlga_lord_talk:lord_get_reward_item_ask|I want to request a special item.
; dlga_lord_get_reward_item_ask:lord_talk|Seems like you have no place in your inventory for anything else. Make some room, then return.
; dlga_lord_get_reward_item_ask:lord_get_reward_item|Really? Remember that you need to hold a certain rank and command considerable influence to deserve special items.^What can I give you?
; dlga_lord_get_reward_item:lord_get_reward_item_answer|{s24}: {s20} [costs {reg14}/{reg15} Influence]
dlga_lord_get_reward_item:lord_pretalk|别在意
dlga_lord_get_reward_item_answer:lord_pretalk|很好，愿你能利用它战胜你的敌人。
; dlga_lord_talk:marshall_ask|I would like to have a council with you about the War.
; dlga_marshall_ask:lord_pretalk|I would hardly take advice if you are merely {s25}, {playername}. I would have been more inclined to listen if you were {s24}, but you are not.
; dlga_marshall_ask:lord_pretalk.1|You are an accomplished commander, {playername}, but your influence is waning. It would not be prudent to listen to your advice.^[{reg15} influence needed, only {reg14} held]
; dlga_marshall_ask:lord_pretalk.2|We can hardly afford to meet the enemy head on, {playername}. We still need to build up our forces and become strong, alas we are merely {s23}.
; dlga_marshall_ask:lord_pretalk.3|We are on a campaign, {playername}, your advice would have to wait.
dlga_marshall_ask:marshall_suggest|我聽著呢， {playername}，你有什麼建議？
; dlga_marshall_suggest:marshall_answer|We should ride to besiege {s1} at once.
dlga_marshall_suggest:lord_pretalk|不要緊，我相信你的判斷。
; dlga_marshall_answer:close_window|Very well, {playername}, I shall defer to your judgement. I shall send messengers to gather our forces.^Follow me and stay close - we ride to {s4}!
; dlga_lord_talk:deliver_gift_1|I bring a gift of {s1} from {s3} to the people of {s2}.
; dlga_send_gift_1:lord_pretalk|You are already {s4}, {playername}. It would be wise to deliver that one first.
; dlga_send_gift_1:lord_pretalk.1|Unfortunately, you cannot afford to send a gift right now {playername}.^^[not enough Resource Points]
; dlga_send_gift_1:send_gift_2|Very well. To whom would you like to deliver a gift?
dlga_send_gift_1:send_gift_2.1|那麼，你想要給誰一些好處？
dlga_send_gift_2:lord_pretalk|别放心上。
dlga_send_gift_3:send_gift_4|你想要給他們什麼禮物？
dlga_send_gift_3:send_gift_4.1|你想要給他們什麼好處？
dlga_send_gift_4:lord_pretalk|别放心上。
dlga_send_gift_5:lord_pretalk|好吧{playername}，祝你好運。
dlga_lord_talk:lord_give_order_ask|我這有些任務可以給你去做。
dlga_lord_give_order_ask:lord_give_order|什麼?
dlga_lord_give_order:lord_give_order_answer|隨我來， [Costs {reg1}/{reg2} influence]
dlga_lord_give_order:lord_give_order_details_ask|去 [Costs {reg1}/{reg2} influence]
dlga_lord_give_order:lord_give_order_details_ask.1|去 [Costs {reg1}/{reg2} influence]巡邏
dlga_lord_give_order:lord_give_order_details_ask.2|吸引 [Costs {reg1}/{reg2} influence]附近的敵人
dlga_lord_give_order:lord_give_order_stop|我暫時不需要你，你可以隨便去哪了。
dlga_lord_give_order:lord_pretalk| 不要緊。
dlga_lord_give_order_details_ask:lord_give_order_details|哪？
dlga_lord_give_order_details:lord_pretalk| 不要緊。
dlga_lord_give_order_stop:lord_pretalk|好的，照你說的辦。
dlga_lord_give_order_answer:lord_pretalk|我很抱歉，我還有別的事情
dlga_lord_give_order_answer_2:close_window|我會去做的。
dlga_lord_give_order_answer_2:lord_pretalk|我很抱歉，但我無法做到
dlga_lord_talk:lord_talk_ask_something|我想問你些事
dlga_lord_talk_ask_something:lord_talk_ask_something_2|嗯？什麼？
dlga_lord_talk_ask_something_2:lord_talk_ask_location|我想知道某人的位置
dlga_lord_talk_ask_something_2:lord_tell_objective|你和你的手下在做什麼？
dlga_lord_talk_ask_something_2:lord_talk_ask_about_war|戰事如何？
dlga_lord_talk_ask_something_2:lord_pretalk| 不要緊。
dlga_lord_talk_ask_location:lord_talk_ask_location_2|好吧，但我可能答不上來。你想了解誰的位置？
dlga_lord_talk_ask_location_2:lord_pretalk| 不要緊。
dlga_lord_talk_ask_about_war_2:lord_talk_ask_about_war_details|告訴我更多關於與 {s1}的戰爭
dlga_lord_talk_ask_about_war_2:lord_pretalk|那就是所有我想問的，謝謝
; dlga_lord_talk_ask_about_war_details:lord_talk_ask_about_war_2|We are {s22} and they are {s23}. Overall, {s9}.
dlga_lord_talk:party_encounter_lord_hostile_ultimatum_surrender|真是適合打仗的一天，{s4}！
; dlga_lord_tell_objective:lord_pretalk|What am I doing? What does it look like I'm doing?! I'm a prisoner here!
; dlga_lord_tell_objective:lord_pretalk.1|I am not commanding any men at the moment.
; dlga_lord_tell_objective:lord_pretalk.2|We are resting at {s1}{s5}.
; dlga_lord_tell_objective:lord_pretalk.3|We are travelling to {s1}{s5}.
; dlga_lord_tell_objective:lord_pretalk.4|We are recruiting new soldiers from {s1}.
; dlga_lord_tell_objective:lord_pretalk.5|We are scouting for the enemy around {s1}{s5}.
; dlga_lord_tell_objective:lord_pretalk.6|We are laying waste to the village of {s1}.
; dlga_lord_tell_objective:lord_pretalk.7|We are retreating to {s1}.
; dlga_lord_tell_objective:lord_pretalk.8|We are besieging {s1}{s5}.
; dlga_lord_tell_objective:lord_pretalk.9|We are fighting against {s1}{s5}.
; dlga_lord_tell_objective:lord_pretalk.10|We are accompanying {s1}{s5}.
; dlga_lord_tell_objective:lord_pretalk.11|We are reconsidering our next objective.
; dlga_lord_tell_objective:lord_pretalk.12|I don't know: {reg1} {s1}
; dlga_lord_active_mission_1:lord_mission_sorcerer_completed|The sorcerer of Mirkwood has been slain, my Lady.
; dlga_lord_active_mission_1:lord_mission_sorcerer_failed|Forgive me, my Lady, but urgent matters have prevented me from slaying the sorcerer, and in the meantime he has fled.
; dlga_lord_active_mission_1:lord_mission_sorcerer_failed.1|The sorcerer of Mirkwood still lives. We interrupted his rituals but he has fled.
; dlga_lord_mission_sorcerer_completed:lord_pretalk|Yes {playername}, I had sensed his death. The veil of sorcery has been lifted from the wood and much of my power has returned. You have performed a great service for our people and as such you are entitled to a gift. Take this...
; dlga_lord_mission_sorcerer_failed:lord_pretalk|Yes {playername}, I sense the dark arts of enemy still pressing upon us. His efforts seem greater now. It is unfortunate that you could not stop him. No doubt he will take additional precautions in future to ward against our efforts. He will likely never be found while Dol Guldur still stands. Thank you for your efforts but leave me now. I grow tired.
; dlga_lord_active_mission_1:lord_lend_companion_end|Oh, you want your companion back? I see...
; dlga_lord_active_mission_1:lord_pretalk|{playername}, I must beg your patience, I still have need of your companion. Please return later when things have settled.
; dlga_lord_active_mission_1:lord_active_mission_2|Yes, have you made any progress on it?
; dlga_lord_active_mission_2:lord_generic_mission_thank|Indeed. I brought you {reg1} prisoners.
; dlga_lord_active_mission_2:lord_generic_mission_thank_extra|Why, I have brought you {reg2} prisoners, in case {reg1} are not enough.
; dlga_lord_active_mission_2:lord_generic_mission_thank.1|Indeed. I have rescued {reg1} allied prisoners and they joined my party.
; dlga_lord_active_mission_2:lord_generic_mission_thank.2|Indeed. I have scouted {s13}.
; dlga_lord_active_mission_2:lord_generic_mission_thank.3|Indeed. I have dispatched the scouts.
; dlga_lord_active_mission_2:lord_generic_mission_thank.4|Indeed. I have defeated enough enemy parties.
; dlga_lord_active_mission_2:capture_enemy_hero_thank|Oh, indeed. I've captured an enemy commander for you.
; dlga_capture_enemy_hero_thank:capture_enemy_hero_thank_2|Many thanks, my friend. He will serve very well for questioning. You've done a fine work here.
dlga_capture_enemy_hero_thank_2:lord_pretalk|当然, {s65}.
dlga_capture_enemy_hero_thank_2:lord_pretalk.1|那没有什么
; dlga_lord_active_mission_2:lord_raise_troops_thank|Indeed. I have raised {reg1} {s13}. You can take them.
; dlga_lord_active_mission_2:lord_hunt_down_fugitive_success|I found {s4} hiding in {s3} and gave him his punishment.
dlga_lord_active_mission_2:lord_hunt_down_fugitive_fail|我恐怕他逃跑了.
; dlga_lord_hunt_down_fugitive_success:lord_hunt_down_fugitive_success_2|And we'll all be a lot better off without him! Thank you, {playername},  for removing this long-festering thorn from my side. 'Tis good to know you can be trusted to handle things  with an appropriate level of tactfulness.  I've sent a note to our intendants already, and you can count on additional supplies from us.
dlga_lord_hunt_down_fugitive_success_2:lord_hunt_down_fugitive_reward_accept|谢谢你，{s65}。
; dlga_lord_hunt_down_fugitive_reward_accept:lord_pretalk|I'll notify our intendants of your service, {playername}. Once again, you've my thanks for ridding me of that {s44}.
; dlga_lord_hunt_down_fugitive_fail:lord_pretalk|It is a sad day when that {s44} manages to avoid my grasp yet again. I thought you would be able to do this, {playername}. Clearly I was wrong.
dlga_lord_active_mission_2:lord_active_mission_3|我仍然在工作.
; dlga_lord_active_mission_2:lord_mission_failed|I am afraid I won't be able to do this quest.
; dlga_lord_active_mission_3:lord_pretalk|Good. Remember, I am counting on you.
; dlga_lord_request_mission_ask:lord_pretalk|You still haven't finished the last task I gave you, {playername}. You should be working on that, not asking me for other things to do.
dlga_lord_request_mission_ask:lord_pretalk.1|我现在并没有任何任务可以交给你去做.
dlga_lord_request_mission_ask:lord_tell_mission|任务?
; dlga_lord_tell_mission:lord_mission_capture_troll_1|You are a brave servant, {playername}, and we will give you a glimpse of our plans. We need fresh monstrous blood and flesh. We need it to twist it and bend it and torture it and tame it and reshape it and breed it, to forge and strengthen our own breeds of colossal warriors!
dlga_lord_mission_capture_troll_1:lord_mission_capture_troll_2|我能为你做什么,我的主人?
; dlga_lord_mission_capture_troll_2:lord_mission_capture_troll_3|A wild cave troll, {playername}. Capture one strong exemplar for me and bring it to me, alive. We need one more of them for Our experiments! Two, would be better. The more we have, the better.
; dlga_lord_mission_capture_troll_3:lord_mission_capture_troll_infoa|Where can such a beast be found?
; dlga_lord_mission_capture_troll_3:lord_mission_capture_troll_infob|How can such a beast be captured?
; dlga_lord_mission_capture_troll_3:lord_mission_capture_troll_infoc|How can such a beast be transported to you?
; dlga_lord_mission_capture_troll_3:lord_mission_capture_troll_accepted|You shall have your wild troll, Master.
; dlga_lord_mission_capture_troll_3:lord_mission_capture_troll_rejected|Mercy, Master! That beast will smash me like a bug!
; dlga_lord_mission_capture_troll_infoa:lord_mission_capture_troll_3|In these time of blood and shadows, wild cave trolls are growing excited and they are spreading from their lairs in the Misty Mountains... the best place where to look would be around the caves there.
; dlga_lord_mission_capture_troll_infob:lord_mission_capture_troll_3|You shall find one, and take it down in combat. Fear not of killing it during the fight: a troll is too coriaceous a beast for your weapons to kill it right away... and they do recover, more than you would expect. After it falls over its own black blood, you shall carry it to our feet, still breathing.
; dlga_lord_mission_capture_troll_infoc:lord_mission_capture_troll_3|You will be provided with a robust wheeled cage. It harbours more than enough space for a troll, and it can be pulled around. Hasten your steps on the way back: not even the metal of the cage is totally safe against the fury of a troll blinded by rage and pain. Make sure it does not break free and kill you.
; dlga_lord_mission_capture_troll_rejected:lord_pretalk|Only now you reveal what you are really worth, but I knew that of you all along. Weak, coward {playername}. Now begone.
; dlga_lord_mission_capture_troll_accepted:lord_pretalk|I knew I could count on your strength and bravery. Slaves, give to {playername} one of our wheeled cages! {playername}, return when you have my gift. I want it before {reg1} dawns are passed.
; dlga_lord_tell_mission:lord_tell_mission_kill_troll|Our land is facing dangers that were unheard of in our times. People are disappearing in the outskirts of {s3}. Not only commoners, but even small armed groups who venture outside the walls never return. There have been the strangest rumors, but I know what we are facing.
; dlga_lord_tell_mission_kill_troll:lord_mission_told|Wild trolls, {playername}. Giant beasts, twisted montrousities. They never ventured so far from their dark caves in the mountains but at least one of them have been sighted around {s3}. I don't know what witchery has caused this, but I need that thing to be dispatched.
; dlga_lord_mission_told:lord_mission_kill_troll_info_a|How can those beasts be fought?
; dlga_lord_mission_kill_troll_info_a:lord_mission_told|A troll is a dangerous creature indeed. A giant monster which possesses an incredible strength in its deformed muscles. Their skin is as hard as iron, and a tree trunk is but a small club when wielded in their hands. It is rumored that a single troll can esily best a group of half a dozen well armed and trained men, wasting each of them with a single blow. Not only men but horses too fear trolls. Be careful if you plan to charge one while mounted.
; dlga_lord_mission_told:lord_mission_kill_troll_info_b|Do you think it comes from Mordor, or Isengard?
; dlga_lord_mission_kill_troll_info_b:lord_mission_told|No, I don't think so. We have news that both the White Wizard and the Black Tower have all kinds of monsters among their ranks, but from what I hear the beast terrifying {s3} is one savage, untamed beast. Remember, there could be more than one. But you can be sure that some obscure craft from the Enemy has led this new plague upon us.
; dlga_lord_tell_mission:lord_mission_investigate_fangorn_0|Here is a mission for a trusted and brave servant like you, {playername}. The strangest rumors reach my ears from the forest of Fangorn. Minions sent to harvest wood, and even my commanders traversing the place, occasionally fail to return. Other times, they report of mysterious losses among their troops. They blame ghosts, spirits of the wood, ancient curses... Nonsense! Puny excuses for their own cowardice or ineptitude!
; dlga_lord_mission_investigate_fangorn_0:lord_mission_investigate_fangorn_1|What do you command me to do about it, Master?
; dlga_lord_mission_investigate_fangorn_0:lord_mission_investigate_fangorn_rejected|But Master, there is danger and pain in Fangorn! I've felt it myself!
; dlga_lord_mission_investigate_fangorn_1:lord_mission_investigate_fangorn_2|Maybe it is just that my other servants are unable to prevent the most cowardly worms in their troops from deserting.  Fools, blinded by superstitions.   Or, maybe, it is the treacherous ambushes of elven scum, hiding in the putrid trees as they usually do.   It could even be lowborn traitors from Rohan.  Or who knows what else. I want you to find out, {playername}.
dlga_lord_mission_investigate_fangorn_2:lord_mission_investigate_fangorn_accepted|我不害怕侏儒和精灵.把这个交给我,主人.
; dlga_lord_mission_investigate_fangorn_2:lord_mission_investigate_fangorn_rejected|Master, pity your servant! Don't ask me to venture in that cursed place!
; dlga_lord_mission_investigate_fangorn_rejected:lord_pretalk|So you are like the other worms: a superstitious, worthless coward.  I overestimated you. Now, begone!
; dlga_lord_mission_investigate_fangorn_accepted:lord_pretalk|Good. Go there and shed some light on this matter. Then return to me and report. I expect to see you back with news before {reg1} dawns are passed.
; dlga_lord_tell_mission:lord_mission_find_lost_spears|Here is a mission for a trusted and brave commander like you, {playername}. We are ill equipped to fight off the Rhun hordes. Our armies are losing battles one by one. A legend tells that once upon a time, there were spears made by Dwarves for the armies of the great King Bladorthin (long since dead), each had a thrice-forged head and their shafts were inlaid with cunning gold, but they were never delivered or paid for..
dlga_lord_mission_find_lost_spears:lord_mission_find_lost_spears_1|主人，你吩咐我做什么呢？
