dlga_start:mutiny_pretalk_1|嗨， {playername}。我需要告诉您伙计们在发牢骚了！他们想轻松轻松减少进军的负担。
; dlga_lord_mission_find_lost_spears_1:lord_mission_find_lost_spears_2|These weapons would increase the effectiveness of our armies, but above all they will lift the spirits of our men. You'll have to find these spears. You'll have to go ask the dwarves for permission to search for the spears in the deeps of the Lonely Mountain. Beware, you may encounter some orcs or trolls in the tunnels. Are you available for this task?
; dlga_lord_mission_find_lost_spears_2:lord_mission_find_lost_spears_accepted|I fear no orcs nor trolls! I will find these spears for you, my lord.
dlga_lord_mission_find_lost_spears_2:lord_mission_find_lost_spears_rejected|我恐怕帮不了你.我的主人.
dlga_lord_mission_find_lost_spears_rejected:lord_pretalk|我知道稳重是你勇气的一部分。也许你应该坚持侦察任务.
dlga_lord_mission_find_lost_spears_accepted:lord_pretalk|那祝你好运吧!
; dlga_lord_tell_mission:lord_mission_mirkwood_sorcerer|There is an important service you can deliver to our people, {playername}.
; dlga_lord_mission_mirkwood_sorcerer:lord_mission_mirkwood_sorcerer_0|My power to defend and preserve Lothlorien has been diminished by the devices of the enemy. A master sorcerer of Dol Guldur is invoking powerful charms that inhibit our defenses. Though he is a mortal, he has become one of the enemies greatest pupils in the use of arcane rituals and he represents a great threat to our people. You must hunt him down and destroy him!
dlga_lord_mission_mirkwood_sorcerer_0:lord_mission_mirkwood_sorcerer_1|我在哪里能找到法师,夫人?
; dlga_lord_mission_mirkwood_sorcerer_1:lord_mission_mirkwood_sorcerer_2|Search for him in Mirkwood forest, not far from Dol Guldur itself. He is both a well guarded and a cautious foe so you will need to use stealth to prevent the alarm from being raised. If he escapes, he will relocate to other dark places that we know not of and continue his wickedness unchallenged. There will be only one opportunity to defeat him. Much depends on your success. Go with our blessings.
; dlga_lord_mission_mirkwood_sorcerer_2:lord_pretalk|As you command, my Lady. I will try my best to eliminate this evil.
; dlga_lord_mission_mirkwood_sorcerer_2:lord_mission_mirkwood_sorcerer_rejected|Forgive me, my Lady. I have some pressing matters to attend before I can help your people with this endevour.
; dlga_lord_mission_mirkwood_sorcerer_rejected:lord_pretalk|I understand, {playername}. But do not tally for too long, I'm growing tired of resisting his evil magic.
; dlga_lord_tell_mission:lord_mission_deliver_message|I need to send a letter to {s13} who should be currently at {s4}. If you will be heading towards there, would you deliver it to him? The letter needs to be in his hands in 30 days.
; dlga_lord_mission_deliver_message:lord_mission_deliver_message_accepted|Certainly, I intend to pass by {s4} and it would be no trouble.
; dlga_lord_mission_deliver_message:lord_mission_deliver_message_rejected|I doubt I'll be seeing {s13} anytime soon, {s65}. You'd best send it with someone else.
; dlga_lord_mission_deliver_message_accepted:close_window|I appreciate it, {playername}. Here's the letter. Give my regards to {s13} when you see him.
; dlga_lord_mission_deliver_message_rejected:lord_pretalk|Ah, all right then. Well, I am sure I will find someone else.
; dlga_lord_tell_mission:lord_mission_deliver_message.1|I need to deliver a letter to {s13} of {s15}, who must be at {s4} currently. If you are going towards there, would you deliver my letter to him? The letter needs to reach him in 40 days.
; dlga_lord_tell_mission:lord_mission_told|There is an urgent matter... My messenger is due to report on our battle plans to commanders in {s14}. His trip has been postponed several times already with all the trouble on the roads, but this time he must get through. So, I want to at least make sure he's well-guarded. I trust you well, {playername} so I would be very grateful if you could escort him to {s14} and make sure he arrives safe and sound.
; dlga_lord_tell_mission:lord_mission_told.1|I have a friend here, an old warrior, who is very sick. Pestilence has infected an old battle wound,and unless he is seen to by a surgeon soon, he will surely die. This man is dear to me, {playername},but he's also stubborn as a hog and refuses to have anyone look at his injury because he doesn't trust the physicians here.I have heard that you've a capable surgeon with you. If you would let your surgeon come here and have a look,{reg3?she:he} may be able to convince him to give his consent to an operation.Please, I will be deeply indebted to you if you grant me this request.
dlga_lord_tell_mission_raise_troops:lord_tell_mission_raise_troops_2|你需要多少人?
dlga_lord_tell_mission_raise_troops_2:lord_mission_raise_troops_told|如果你能训练出{reg1} {s14} 带给我,那就够了.
dlga_lord_mission_raise_troops_told:lord_mission_raise_troops_accepted|当然, {s65}. 给我{reg1} 新兵,我会把他们训练成{s14}.
dlga_lord_mission_raise_troops_told:lord_mission_raise_troops_rejected|我这些天很忙没时间训练他们.
; dlga_lord_mission_raise_troops_accepted:close_window|You've taken a weight off my shoulders, {playername}. I shall tell my sergeants to send you the recruits and attach them to your command. Also, I'll advance you some money to help with expenses. Here, this purse should do it. Thank you for your help.
; dlga_lord_mission_raise_troops_rejected:lord_pretalk|Oh, of course. I had expected as much. Well, good luck to you then.
; dlga_lord_tell_mission:lord_mission_hunt_down_fugitive_told|I have something you could help with, an issue with the lawless villain known as {s4}.  He murdered one of my bodyguards and has been on the run from his judgment ever since. There were news recently that the fugitive has been seen at {s3}. You might be able to hunt him down and deliver him swift justice, and I'll reward you in turn.
; dlga_lord_mission_hunt_down_fugitive_told:lord_mission_hunt_down_fugitive_accepted|Then I will hunt him down and execute the law.
; dlga_lord_mission_hunt_down_fugitive_told:lord_mission_hunt_down_fugitive_rejected|I am too busy to go after him at the moment.
; dlga_lord_mission_hunt_down_fugitive_accepted:close_window|That's excellent, {playername}.  I will be grateful, and of course your prowess wil be duly noted.  Well, good hunting to you.
; dlga_lord_mission_hunt_down_fugitive_rejected:lord_pretalk|As you wish, {playername}.I suppose there are plenty of bounty hunters around to get the job done . . .
; dlga_lord_tell_mission:lord_mission_told.2|Well, some of the slaves working in {s4} have run away.  The ungrateful swine, whose lives we spared!  From what I've been hearing, they're running to {s3} as fast as they can, and have split up into three groups to try and avoid capture. I want you to capture all three groups and fetch them back to {s4} by whatever means necessary. I should really have them hanged for attempting to escape, but we need hands now, so I'll let them go off this time with a good beating.
; dlga_lord_tell_mission:lord_tell_mission_follow_spy|I have good information that a man in this very town is actually an enemy spy. He should be seized and hanged for his impudence, but we also believe that very soon he will leave town to meet with his master, the man to whom the spy feeds all his little whispers. The spy himself is of little import, but the master is a dangerous man, and could tell us a great deal if we could only get our hands on him...
; dlga_lord_tell_mission_follow_spy:lord_tell_mission_follow_spy_2|I want you to wait here until the spy leaves town. Then you must follow him, stealthily, to the meeting place. You must take absolute care not to be seen by the spy on your way, else he may suspect foul play and turn back. When the master appears, you must ambush and arrest them and bring the pair back to me. Alive, if you please.
; dlga_lord_tell_mission_follow_spy_2:lord_tell_mission_follow_spy_accepted|I'll do it, {s65}.
; dlga_lord_tell_mission_follow_spy_2:lord_tell_mission_follow_spy_rejected|No, this skulking is not for me.
; dlga_lord_tell_mission_follow_spy_accepted:close_window|Good, I'm sure you'll do a fine job of it. One of my men will point the spy out to you when he leaves, so you will know the man to follow. Remember, I want them both, and I want them alive.
; dlga_lord_tell_mission_follow_spy_rejected:lord_pretalk|A shame. Well, carry on as you were, {playername}...
; dlga_lord_tell_mission:lord_tell_mission_capture_enemy_hero|There is a difficult job I need done, {playername}, and you may be the one who can carry it off. I need someone to capture one of the enemy commanders and bring him to me. Afterwards, I'll be able to question him on the enemy battle plans. It is a simple enough job, but whomever you choose will be guarded by an elite band of personal retainers. Are you up for a fight?
; dlga_lord_tell_mission_capture_enemy_hero:lord_tell_mission_capture_enemy_hero_accepted|Consider it done, {s65}.
; dlga_lord_tell_mission_capture_enemy_hero:lord_tell_mission_capture_enemy_hero_rejected|I must refuse, {s65}. I don't want to get close to any of them.
; dlga_lord_tell_mission_capture_enemy_hero_accepted:close_window|I like your spirit! Go and bring me one of our enemies, and I'll toast your name in my hall when you return! And reward you for your efforts, of course...
; dlga_lord_tell_mission_capture_enemy_hero_rejected:lord_pretalk|Clearly you lack the mettle I had thought you possessed. Very well, {playername}, I will find someone else.
; dlga_lord_tell_mission:lord_tell_mission_lend_companion|I don't have a task for you right now, but your companion {s3} is a skilled {reg3?lass:fellow} and I need someone with {reg3?her:his} talents. Will you lend {reg3?her:him} to me for a while?
; dlga_lord_tell_mission_lend_companion:lord_tell_mission_lend_companion_2|How long will you be needing {reg3?her:him}?
; dlga_lord_tell_mission_lend_companion_2:lord_mission_lend_companion_told|Just a few days, a week at most.
; dlga_lord_mission_lend_companion_told:lord_tell_mission_lend_companion_accepted|Then I will leave {s3} with you for one week.
; dlga_lord_mission_lend_companion_told:lord_tell_mission_lend_companion_rejected|I am sorry, but I cannot do without {s3} for a whole week.
; dlga_lord_tell_mission_lend_companion_accepted:close_window|I cannot thank you enough, {playername}. Worry not, your companion shall be returned to you with due haste.
; dlga_lord_tell_mission_lend_companion_rejected:lord_pretalk|Well, that's damned unfortunate, but I suppose I cannot force you or {s3} to agree. I shall have to make do without.
; dlga_lord_tell_mission:lord_mission_told.3|Our scouts have noticed a recent increase in enemy activity. Unfortunately they almost never succeed in capturing live prisoners and bring them in for questioning, so we can piece together what the enemy is up to. So, I need a good warrior to find me {reg1} enemy prisoners, that I may question them.
; dlga_lord_tell_mission:lord_pretalk|No, {playername}. I do not need your help at this time.
; dlga_lord_mission_told:lord_mission_accepted|You can count on me, {s65}.
; dlga_lord_mission_told:lord_mission_rejected|I fear I cannot accept such a mission at the moment.
; dlga_lord_mission_accepted:close_window|Excellent, {playername}, excellent. I have every confidence in you.
; dlga_lord_mission_rejected:close_window|Is that so? Well, I suppose you're just not up to the task. I shall have to look for somebody with more mettle.
; dlga_lord_talk:lord_leave_prison|I must leave now.
; dlga_lord_talk:lord_leave|This little chat is over. I leave now.
; dlga_lord_talk:lord_leave.1|I must beg my leave.
dlga_lord_leave_prison:close_window|我们会再次见面的
dlga_lord_leave:close_window|我们会看到的，{playername}.
dlga_lord_leave:close_window.1|当然，{playername}. 再见.
; dlga_lord_leave:close_window.2|Good journeys to you, {playername}.
; dlga_lord_leave:close_window.3|Yes, yes. Farewell.
dlga_lord_leave:close_window.4|我们会再见的
; dlga_start:lady_escort_lady_succeeded|Thank you for escorting me here, {playername}, and ensuring my safe passage. Your services will be duly noted. 
; dlga_lady_escort_lady_succeeded:close_window|It was an honor to serve.
; dlga_start:prison_guard_players|Good day, Commander. Will you be visiting the prison?
; dlga_prison_guard_players:close_window|Yes. Unlock the door.
; dlga_prison_guard_players:close_window.1|No, not now.
; dlga_start:prison_guard_talk|Yes? What do you want?
; dlga_prison_guard_talk:prison_guard_ask_prisoners|Who is imprisoned here?
; dlga_prison_guard_talk:prison_guard_visit_prison|I want to speak with a prisoner.
; dlga_prison_guard_ask_prisoners:prison_guard_talk|Currently, {s51} {reg1?are:is} imprisoned here.
; dlga_prison_guard_visit_prison:close_window|Of course, Commander. Go in.
; dlga_prison_guard_visit_prison:prison_guard_visit_prison_2|You need to get permission from the lord to talk to prisoners.
; dlga_prison_guard_visit_prison_2:close_window|All right then. I'll try that.
; dlga_prison_guard_visit_prison_2:prison_guard_visit_prison_3|Come on now. I thought you were the boss here.
; dlga_prison_guard_visit_prison_3:prison_guard_visit_prison_4|He-heh. You got that right. Still, I can't let you into the prison.
; dlga_prison_guard_visit_prison_4:close_window|All right then. I'll leave now.
; dlga_prison_guard_visit_prison_4:prison_guard_visit_prison_5|I found a purse with 100 denars a few paces away. I reckon it belongs to you.
; dlga_prison_guard_visit_prison_5:close_window|Ah! I was looking for this all day. How good of you to bring it back {sir/madam}. Well, now that I know what an honest {man/lady} you are, there can be no harm in letting you inside. Go in.
dlga_prison_guard_talk:close_window| 不要緊。
dlga_start:castle_guard_players|你的指令，指挥官？
dlga_castle_guard_players:close_window|開門,我要進去
dlga_castle_guard_players:close_window.1| 不要緊。
dlga_start:castle_guard_sneaked_intro_1|滾開，要飯的！你臭死了！
dlga_start:close_window.8|趁我失去耐心前給我滾你個臭要飯的！
dlga_castle_guard_sneaked_intro_1:castle_guard_sneaked_intro_2|我想進入城堡去和領主談話
dlga_castle_guard_sneaked_intro_1:close_window|[我]
dlga_castle_guard_sneaked_intro_2:close_window|你瘋了嗎， {man/woman}？乞丐不准進入大廳，現在給我滾不然我就要幫你滾了。
dlga_start:castle_guard_intro_1|你需要什麼?
dlga_castle_guard_intro_1:castle_guard_intro_2|我想進入大廳去和領主談話
dlga_castle_guard_intro_1:close_window| 不要緊。
dlga_castle_guard_intro_2:castle_guard_intro_2|你可以進去，但是武器必須交給我們保管，沒人能帶著武器進入領主的城堡
dlga_castle_guard_intro_2:close_window|給你，拿走我的武器，我要進去了
dlga_castle_guard_intro_2:castle_guard_intro_2b|不行，我劍不離身
dlga_castle_guard_intro_2b:close_window|那你不能進去
dlga_start:castle_gate_guard_talk|你需要什麼?
dlga_castle_gate_guard_pretalk:castle_gate_guard_talk|什麼?
dlga_castle_gate_guard_talk:castle_gate_open|我們想要找個地方過夜，可以讓我們進去嗎？
dlga_castle_gate_guard_talk:request_meeting_castle_lord|我想和城堡的領主談話
dlga_castle_gate_guard_talk:request_meeting_other|我想和城堡裡的某人談話
dlga_castle_gate_guard_talk:close_window|[我]
dlga_request_meeting_castle_lord:close_window|等著，{s2}會來見你的
dlga_request_meeting_castle_lord:castle_gate_guard_pretalk|我的領主現在不在這
dlga_request_meeting_other:request_meeting_3|那是誰？
dlga_request_meeting_3:close_window| 不要緊。
; dlga_request_meeting_4:request_meeting_5|Wait there. I'll send him your request.
dlga_request_meeting_5:request_meeting_6|我會等的..
dlga_request_meeting_6:close_window|好吧， {s2} 現在會和你談話的
dlga_request_meeting_6:close_window.1|{s2}說他不想見你，現在給我滾
dlga_castle_gate_open:close_window|我的大人{s2}很高興見到您 {sir/madam}，進來吧，我來給您開門。
; dlga_castle_gate_open:close_window.1|My lord {s2} is not in the castle now. But I think he would approve of you taking shelter here. Come on in. I am opening the gates for you.
dlga_castle_gate_open:close_window.2|進來吧，我來給你開門。
; dlga_castle_gate_open:close_window.3|Come on in. But make sure your men behave sensibly within the walls.  My lord {s2} does not want trouble here.
; dlga_castle_gate_open:close_window.4|My lord {s2} does not want you here. Begone now.
dlga_party_relieved:caravan_help0|謝謝你的幫助！現在我們安全了
; dlga_caravan_help0:caravan_help1|Thank you for helping! We are safe now. Have you seen those large orcs before? Those do not look like regular mountain ilk we are used to fend off easily. And the paint on their shields is an ancient Mordor sign. I haven't seen those this side of the river for a long time. Dire things are afoot.. War is coming! I advise you to go to Edoras, the capital of your people, and deliver the message about what you've seen to whomever is in command there. It's an important matter, so please make haste.
dlga_caravan_help1:caravan_help2|是啊，我從沒見過這麼大的獸人，真惡心人
; dlga_caravan_help2:caravan_help3|Also, I see you are a capable warrior. I have a personal business I would like your help with. There is a small fort near Nindalf swamps, where common people and travellers can find food and lodge. It's run by a local chief who does not answer neither to Gondor, nor to Rohan. I'm a merchant traveller myself, so I have respect for people wishing to be free from lordship bonds, as long as they behave. But being independent, they are also powerless before enemy onslaught. War outbreak in next several days looks like a certain thing to me. I want you to get to those people and see if you can help them survive. Tell the chief, Balan, that Torbal asked you to deliver 'a fishslap'. He will recognize it was me who sent you.
; dlga_caravan_help3:close_window|I'll deliver your message. Safe journey to you, Torbal. I'm sure we will meet again.
; dlga_start:close_window.9|You have come just in time. Let us join our forces now and teach our enemy a lesson.
; dlga_start:close_window.10|You are making a big mistake by fighting against us.
; dlga_start:ally_thanks_meet|I don't think we have met properly my friend. You just saved my life out there, and I still don't know your name...
; dlga_start:ally_thanks_meet.1|Your help was most welcome stranger. My name is {s1}. Can I learn yours?
; dlga_start:ally_thanks_meet.2|Thanks for your help, stranger. We haven't met properly yet, have we? What is your name?
dlga_ally_thanks_meet:ally_thanks_meet_2|我叫 {playername}
; dlga_ally_thanks_meet_2:close_window|Well met indeed {playername}. My name is {s1} and I am forever in your debt. If there is ever anything I can help you with, just let me know...
; dlga_ally_thanks_meet_2:close_window.1|Well met {playername}. I am in your debt for what you just did. I hope one day I will find a way to repay it.
; dlga_ally_thanks_meet_2:close_window.2|Well met {playername}. I am {s1}. Thanks for your help and I hope we meet again.
; dlga_start:close_window.11|Again you save our necks, {playername}! Truly, you are the best of friends. {s43}
; dlga_start:close_window.12|You arrived just in the nick of time! {playername}. You have my deepest thanks! {s43}
; dlga_start:close_window.13|You turned up just in time, {playername}. I will not forget your help. {s43}
dlga_start:close_window.14|很高兴见到你 {playername}，{s43}
dlga_start:close_window.17|谢谢您的帮助，指挥官。你在那救了{reg1?我们的命:我的命} 
dlga_start:close_window.18|谢谢您的帮助，指挥官。您扭转了战局。
dlga_start:close_window.19|谢谢您的帮助，指挥官，有你在身边真是荣幸
dlga_start:freed_hero_answer|我向你赎买我的同伴
dlga_freed_hero_answer:freed_hero_answer_1|你哪都别想去，你是我的俘虏了！
dlga_freed_hero_answer_1:close_window|唉，我的运气是永远都别想变了吧？
dlga_freed_hero_answer:freed_hero_answer_2|你自由了，{s65}
dlga_freed_hero_answer_2:close_window|感谢您，指挥官，我永远不会忘记你的恩情
dlga_freed_hero_answer:freed_hero_answer_3|想要加入我吗？
dlga_freed_hero_answer_3:close_window|好吧，我会加入你的
dlga_freed_hero_answer_3:close_window.1|不了，我更喜欢单干
; dlga_start:defeat_hero_answer|You'll not live long to enjoy your victory. My kinsmen will soon wipe out the stain of this defeat.
dlga_defeat_hero_answer:defeat_hero_answer_1|現在你是我的奴隸。
dlga_defeat_hero_answer_1:close_window|去你的，我不会原谅这个的
dlga_defeat_hero_answer:defeat_hero_answer_2|你可以随便去哪了，只是别再闯入我的领地
dlga_defeat_hero_answer_2:close_window|我们会再见的
dlga_start:fugitive_1|是的，你想干什么？
; dlga_fugitive_1:fugitive_2|I am looking for a fugitive by the name of {s4}. You fit his description.
dlga_fugitive_1:close_window|没事，麻烦你了
; dlga_fugitive_2:fugitive_3|I do not know what you are talking about. You must have confused me with someone else.
; dlga_fugitive_3:fugitive_4|Then drop your sword. If you are innocent, you have nothing to fear. We'll go now and talk to the guard captain to see who is confused.
dlga_fugitive_4:close_window|去你的，你哪都别想去！
; dlga_start:follow_spy_talk|Good day. Such fine weather don't you think? If you'll excuse me now I must go on my way.
; dlga_follow_spy_talk:follow_spy_talk_2|In the name of {s1}, you are under arrest!
dlga_follow_spy_talk_2:close_window|你活捉不到我的！
dlga_follow_spy_talk:close_window|别在意我，我只是路过
dlga_start:spy_partners_talk|幸会
dlga_spy_partners_talk:spy_partners_talk_2|以{s1}之名，你被逮捕了！
dlga_spy_partners_talk_2:close_window|你得先踏过我们的尸体！
dlga_spy_partners_talk:close_window|别在意我，我只是路过
dlga_start:runaway_serf_intro_1|日安，大人
; dlga_runaway_serf_intro_1:runaway_serf_intro_2|I have been sent by your {s4} whom you are running from. He will not punish you if you return now.
; dlga_runaway_serf_intro_2:runaway_serf_intro_3|My good master. Our lives at {s1} was unbearable. We worked all day long and still went to bed hungry. We are going to {s6} to start a new life, where we will be treated like humans.
; dlga_runaway_serf_intro_3:runaway_serf_go_back|You have gone against our laws by running from slavery. You will go back to {s1} now!
; dlga_runaway_serf_go_back:close_window|All right master. As you wish. We'll head back to {s5} now.
; dlga_start:runaway_serf_talk_caught|Good day master. We were heading back to {s5}, but I am afraid we lost our way.
; dlga_runaway_serf_talk_caught:runaway_serf_go_back|Do not test my patience. You are going back now!
; dlga_start:runaway_serf_talk_again_return|We are on our way back to {s5} master.
; dlga_runaway_serf_talk_again_return:runaway_serf_talk_again_return_2|Make haste now. The sooner you return the better.
dlga_runaway_serf_talk_again_return:runaway_serf_talk_again_return_2.1|好的，保持前进。
dlga_runaway_serf_talk_again_return_2:close_window|是的主人，如你所愿。
; dlga_mayor_talk:mayor_deliver_wine|I was told to deliver you {reg9} units of {s4}.
; dlga_mayor_deliver_wine:mayor_pretalk|At last! Our stocks were almost depleted. I had arranged for the delivery of the {s4} in advance. And give {s9} my regards.^^[earned {reg14} Resource Points of {s14}]
; dlga_mayor_talk:mayor_deliver_wine_incomplete|I was on a mission to deliver you {reg9} units of {s4}, but I lost some of the cargo to the enemy.
; dlga_mayor_deliver_wine_incomplete:mayor_pretalk|They will pay for this! Well, at least we have some {s4}. Thank you anyway.^^[earned {reg14} Resource Points of {s14}]
; dlga_start:mercenary_tavern_talk|Do you have a need for mercenaries, Commander? {reg3?Me and {reg4?{reg3} of my mates:one of my mates} are:I am} looking for a master. We'll join you for {reg5} denars.
dlga_start:mercenary_after_recruited|有指令嗎？指揮官
dlga_mercenary_after_recruited:mercenary_after_recruited_2|做好準備，我們將要在黃昏時動身
dlga_mercenary_after_recruited:mercenary_after_recruited_2.1|別着急，我們會在小鎮里呆一段時間
dlga_mercenary_after_recruited_2:close_window|好的，指揮官。我們會準備好如果你告訴我們要出發
dlga_mercenary_tavern_talk:mercenary_tavern_talk_hire|好吧，我會雇傭你，給你 {reg5} 第納爾
dlga_mercenary_tavern_talk:mercenary_tavern_talk_hire.1|不错，但是我只能雇佣你们中的{reg6}个，这是 {reg5} 第纳尔。
dlga_mercenary_tavern_talk:tavern_mercenary_cant_lead|听上去不错，但是我现在不能再雇用更多的人了。
; dlga_tavern_mercenary_cant_lead:close_window|That's a pity. Well, {reg3?we will:I will} be lingering around here for a while, if you need to hire anyone.
dlga_mercenary_tavern_talk:tavern_mercenary_cant_lead.1|听上去不错，但是我现在不能再带领更多的人了。
dlga_mercenary_tavern_talk:close_window|抱歉。我现在不需要任何人了。
dlga_start:trainer_pretalk|你在一波箭雨中活下来了 {reg2}。{s4}
dlga_start:trainer_pretalk.1|非常好，你擊倒了所有的對手
dlga_start:trainer_talk|美好的一天，你準備好訓練了嗎？
dlga_trainer_pretalk:trainer_talk|你準備好做一些訓練了嗎？
