dlga_start:mutiny_pretalk_1|嗨， {playername}。我需要告诉您伙计们在发牢骚了！他们想轻松轻松减少进军的负担。
dlga_trainer_talk:trainer_combat_begin|首先，告訴我關於戰鬥的一些事情
dlga_trainer_talk:trainer_choose_mode|我已經準備好訓練
dlga_trainer_talk:close_window|我要離開了，告別
dlga_trainer_combat_begin:trainer_talk_combat|你想知道什麽
dlga_trainer_combat_pretalk:trainer_talk_combat|你還想知道些什麽
dlga_trainer_talk_combat:trainer_explain_defense|告訴我關於自衛的事情
dlga_trainer_talk_combat:trainer_explain_attack|告訴我關於利用武器攻擊的事情
dlga_trainer_talk_combat:trainer_explain_horseback|告訴我關於在馬上戰鬥的事情
dlga_trainer_talk_combat:trainer_pretalk|我想我瞭解了我需要的理論。讓我們聊一些別的。
; dlga_trainer_explain_defense:trainer_explain_defense_2|Good question. The first thing you should know as a fighter is how to defend yourself. Keeping yourself out of harm's way is the first rule of combat, and it is much more important than giving harm to others. Everybody can swing a sword around and hope to cut some flesh, but only those fighters that are experts at defense live to tell of it.
; dlga_trainer_explain_defense_2:trainer_explain_defense_3|Now. Defending yourself is easiest if you are equipped with a shield. Just block with your shield. [Hold down the right mouse button to defend yourself with the shield.] In this state, you will be able to deflect all attacks that come from your front. However, you will still be open to strikes from your sides or your back.
dlga_trainer_explain_defense_3:trainer_explain_defense_4|如果我没有盾牌呢？
; dlga_trainer_explain_defense_4:trainer_combat_pretalk|Then you will have to use your weapon to block your opponent. This is a bit more difficult than defending with a shield. Defending with a weapon, you can block against only ONE attack direction. That is, you block against either overhead swings, side swings or thrusts. Therefore you must watch your opponent carefully and start to block AFTER he starts his attack. In this way you will be able to block against the direction of his current attack. If you start to block BEFORE he makes his move, he may just attack in another direction than the one you are blocking against and score a hit.
; dlga_trainer_explain_attack:trainer_explain_attack_2|Good question. Attacking is the best defence, they say. A tactic many fighters find useful is taking an offensive stance and readying your weapon for attack, waiting for the right moment for swinging it. [You can ready your weapon for attack by pressing and holding down the left mouse button.]
dlga_trainer_explain_attack_2:trainer_explain_attack_3|听上去挺有用。
; dlga_trainer_explain_attack_3:trainer_explain_attack_4|It is a good tactic, but remember that, your opponent may see that and take a defensive stance against the direction you are swinging your weapon. If that happens, you must break your attack and quickly attack from another direction [You may cancel your current attack by quickly tapping the right mouse button].
; dlga_trainer_explain_attack_4:trainer_explain_attack_5|If my opponent is defending against the direction I am attacking from, I will break and use another direction.
; dlga_trainer_explain_attack_5:trainer_combat_pretalk|Yes, selecting the direction you swing your weapon is a crucial skill. There are four main directions you may use: right swing, left swing, overhead swing and thrust. You must use each one wisely. [to control your swing direction with default controls, move your mouse in the direction you want to swing from as you press the left mouse button].
; dlga_trainer_explain_horseback:trainer_combat_pretalk|Very good question. A horse may be a warrior's most powerful weapon in combat. It gives you speed, height, power and initiative. A lot of deadly weapons will become even deadlier on horseback. However you must pay particular attention to horse-mounted enemies couching their lances, as they may take down any opponent in one hit. [To use the couched lance yourself, wield a lance or similar weapon, and speed up your horse without pressing attack or defense buttons. after you reach a speed, you'll lower your lance. Then try to target your enemies by maneuvering your horse.]
; dlga_trainer_choose_mode:trainer_choose_mode_player|We have several training modes to improve our soldiers' skills. Single combat will pit you against one to four opponents, in team combat your team of four will face four, eight or twelve combatants, and, finally, Gauntlet is the ultimate challenge for any warrior - you'll face waves of increasing number of opponents all by yourself. Mass melee is a simple brawl.^Which one do you prefer?
dlga_trainer_choose_mode_player:trainer_choose_opponents|单人战斗。
dlga_trainer_choose_mode_player:trainer_choose_opponents.1|团队战斗。
dlga_trainer_choose_mode_player:trainer_choose_weapon|射击。
dlga_trainer_choose_mode_player:trainer_choose_weapon.1|近战为主。
dlga_trainer_choose_mode_player:trainer_pretalk|算了，我改主意了
dlga_trainer_choose_opponents:trainer_choose_opponents_player|现在选择对手的数量
dlga_trainer_choose_opponents_player:trainer_choose_weapon|一个
dlga_trainer_choose_opponents_player:trainer_choose_weapon.1|两个
dlga_trainer_choose_opponents_player:trainer_choose_weapon.2|三个
dlga_trainer_choose_opponents_player:trainer_choose_weapon.3|四个，我感觉今天运势不错
dlga_trainer_choose_opponents_player:trainer_choose_weapon.4|四个
dlga_trainer_choose_opponents_player:trainer_choose_weapon.5|八个
dlga_trainer_choose_opponents_player:trainer_choose_weapon.6|十二个，我和我的弟兄能抵挡所有人
dlga_trainer_choose_opponents_player:trainer_pretalk|不了，我改主意了
dlga_trainer_choose_weapon:trainer_choose_weapon_player|最后，选择你偏爱的武器类型
dlga_trainer_choose_weapon_player:trainer_begin_training|单手武器
dlga_trainer_choose_weapon_player:trainer_begin_training.1|双手武器
dlga_trainer_choose_weapon_player:trainer_begin_training.2|长柄武器
dlga_trainer_choose_weapon_player:trainer_begin_training.3|弓
dlga_trainer_choose_weapon_player:trainer_begin_training.4|投掷武器
dlga_trainer_choose_weapon_player:trainer_pretalk|不了，我改主意了
dlga_trainer_begin_training:close_window|很好，咱们走吧，等你完成了训练再回来找我
dlga_start:close_window.20|随时恭候，肮脏的乞丐。
dlga_start:mayor_begin|日安，大人
dlga_start:mayor_talk|你好，陌生人，你看上去是刚来 {s9}的，我是这个镇的镇长
dlga_start:mayor_begin.1|日安，{playername}
dlga_mayor_begin:lord_deal_with_night_bandits_completed|干得漂亮{playername}，你教训了这帮无赖！^[获得{s14}的{reg14}点支援点 ]
dlga_lord_deal_with_night_bandits_completed:close_window|他们活该
dlga_mayor_talk:mayor_deliver_iron|我给你买了更高质量的金属，{reg9} 单位的{s4}，当你需要{s3}的时候
dlga_mayor_talk:mayor_deliver_iron.1|这是你的金属补给，{reg9}单位的 {s4}
dlga_mayor_talk:mayor_deliver_iron.2|我已经购买了更多的金属，{reg8}单位的{s4}，当你需要{reg9}个单位的时候
dlga_mayor_deliver_iron:mayor_deliver_iron_completed|干得漂亮 {playername}，我们的史密斯会好好利用他们给的东西的
dlga_mayor_deliver_iron_completed:close_window|我尽我的全力
dlga_mayor_talk:mayor_deliver_food|这里是你的口粮， {reg9}单位
dlga_mayor_deliver_food:mayor_deliver_food_completed|干得漂亮 {playername}，我们的食物商店又满仓了，现在没人会挨饿了
dlga_mayor_deliver_food_completed:close_window|我尽我的全力
dlga_mayor_begin:mayor_looters_quest_response|啊， {playername}.你有什么进展吗？
dlga_mayor_looters_quest_response:mayor_looters_quest_destroyed|我刚杀了些部落兽人
dlga_mayor_looters_quest_response:close_window|还没呢，长官，再会了
; dlga_mayor_looters_quest_destroyed:mayor_looters_quest_destroyed_2|Aye, my scouts saw the whole thing. That should keep those tribal orcs at bay!^^[earned {reg14}x{reg15} Resource Points of {s14}]
; dlga_mayor_looters_quest_destroyed_2:close_window|And that's not the only good news! Thanks to you, the tribal orcs have ceased to be a threat. We've not had a single attack reported for some time now.  If there are any of them left, they've either run off or gone deep into hiding. That's good for the safety of the place!  I think that concludes your task, {playername}. Thank you, and farewell.
; dlga_mayor_looters_quest_destroyed_2:mayor_looters_quest_response|Anything else you need?
; dlga_mayor_begin:close_window|Good to see you again {playername}. I have heard that you have delivered those people successfully.  I will tell our commander how reliable you are.^^[earned {reg14} Resource Points of {s14}]
; dlga_mayor_begin:move_cattle_herd_failed|I heard that you have lost those people on your way to {s9}.  I had a very difficult time explaining your failure to the commander here.  Do you have anything to say?
; dlga_move_cattle_herd_failed:move_cattle_herd_failed_2|I am sorry. But I was attacked on the way.
; dlga_move_cattle_herd_failed:move_cattle_herd_failed_2.1|I am sorry. Those people wandered off during the night.
; dlga_move_cattle_herd_failed_2:close_window|Well, it was your responsibility to deliver them safely, no matter what.  You should know that the commander demanded to know who is responsible for this failure.  So I told him it was you.
; dlga_mayor_begin:mayor_friendly_pretalk|I have heard about your deeds. You have given those goblins the punishment they deserved.  You are really as good as they say.^^[earned {reg14} Resource Points of {s14}]
dlga_mayor_begin:mayor_talk|我能为你做什么？
dlga_mayor_friendly_pretalk:mayor_talk|我还能为你做什么？
dlga_mayor_pretalk:mayor_talk|什麼?
dlga_mayor_talk:mayor_info_begin|你能告诉我你是做什么的吗？
dlga_mayor_talk:merchant_quest_requested|我该怎么做？
dlga_mayor_talk:merchant_quest_last_offered_job|关于那件您给我的任务...
dlga_mayor_talk:merchant_quest_about_job|关于那件你给我的任务...
dlga_mayor_talk:close_window|[我]
; dlga_mayor_info_begin:mayor_info_talk|I am the local authority here in {s9}. You can say I am in charge of everyday tasks. There is always something to do, so if you want to help let me know.
dlga_mayor_info_talk:mayor_info_lord|谁统治着这个城镇？
dlga_mayor_info_lord:mayor_info_talk|我们的领主是{s10}
dlga_mayor_info_talk:mayor_pretalk|那就是全部我想知道的了，谢谢
dlga_merchant_quest_about_job:merchant_quest_about_job_2|怎麼了?
dlga_merchant_quest_about_job_2:merchant_quest_what_if_fail|如果我不能完成它?
dlga_merchant_quest_about_job_2:merchant_quest_about_job_working|我正在办
dlga_merchant_quest_about_job_working:mayor_pretalk|好的，我相信你能处理好
dlga_merchant_quest_last_offered_job:merchant_quest_brief|嗯，你想考虑一下，好吧...
dlga_merchant_quest_what_if_fail:mayor_pretalk|我希望你不要失败，我们无法背负你失败的负担
dlga_merchant_quest_what_if_fail:mayor_pretalk.1|好吧，那你尽力吧
dlga_merchant_quest_taken:mayor_pretalk|太好了，我就指望着你了，祝你好运
dlga_merchant_quest_stall:mayor_pretalk|好吧，我会找找其他人的，但如果你回心转意了就跟我说
dlga_merchant_quest_requested:merchant_quest_brief|嗯，你看起来有点实力，我想我有些工作可以给你
; dlga_merchant_quest_brief:merchant_quest_looters_choice|We've had some fighting near the {s5} lately, with all the chaos that comes with it, and that's attracted a few bands of tribal orcs to raid the surroundings during the confusion. I need somebody to teach those orcs a lesson. Sound like your kind of work?
dlga_merchant_quest_looters_choice:merchant_quest_looters_brief|嗯，我会做的。
; dlga_merchant_quest_looters_choice:merchant_quest_stall|I'm afraid you have to find someone else for that.
; dlga_merchant_quest_looters_brief:close_window|Excellent! You'll find the tribal orcs roaming around the countryside, probably looking to raid more farms. Kill the tribal orcs, and rid us of their presence. I'll pass a word to our supply chief, and you will get rewarded for every band of tribal orcs you destroy, until all the orcs are dealt with.
; dlga_merchant_quest_requested:merchant_quest_brief.1|Thanks for offering to help. Actually I was looking for someone to deliver some {s4}. Perhaps you can do that...
; dlga_merchant_quest_brief:merchant_quest_brief_deliver_wine|I have a cargo of {s6} that needs to be delivered to the {s10} in {s4}. We need {reg5} units of {s6} to reach {s4} in {reg6} days. Can you do that?^^[you will earn {reg14} Resource Points of {s14}]
; dlga_merchant_quest_brief_deliver_wine:merchant_quest_taken|Alright. I will make the delivery.
; dlga_merchant_quest_brief_deliver_wine:merchant_quest_stall|I am afraid I can't carry all that cargo now.
dlga_merchant_quest_requested:merchant_quest_brief.2|感谢你提供帮助。事实上，我正在寻找一个能够为我们提供食物的人。 也许你可以做到...
; dlga_merchant_quest_brief:merchant_quest_brief_deliver_food|Our food supplies are dwindling and the supply trains are getting waylaid by the enemy.I need someone to bring us {reg5} units of food in {reg6} days, or we'll begin to starve.Maybe nearby friendly towns have enough for us too. What do you say?
dlga_merchant_quest_brief_deliver_food:merchant_quest_taken|好吧，我会找到食物并将它带回给你.
dlga_merchant_quest_brief_deliver_food:merchant_quest_stall|我们抱歉，你得找其他人去干这件事
; dlga_merchant_quest_requested:merchant_quest_brief.3|A task, you say? Actually I am looking for someone to supply us with ore and metals. Mines and roads are not safe anymore, and getting resupplied with raw materials is more and more difficult. The enemy must have its own obscure, but efficient ways of extracting ore, as we've seen even orcs and other lowly beasts in their ranks go around covered with metal. Its quality matches that of the wearers: it is low-grade, cheap iron; the kind we would consider treacherous and not trust in normal times. But in these times our smelters learnt how to deal with poor materials too, if necessary. Every little bit helps.
; dlga_merchant_quest_requested:merchant_quest_brief.4|A task, you say? The Master demands more troops every day, and they are never battle-worthy enough for Him... but armours don't just grow on skins, you know?^The maggots in charge of bringing ore supplies are treacherous and weak, they get themselves slaughtered too easily and we are left without materials. But these men, these elves... they always go around covered with shiny, precious metals protecting them as if they were all kings, down to their lowest-born...^Scavenge their corpses and bring me the metal, {playername}. With a pound of that iron, our smelter can make enough material to cover an entire pack of warriors.
; dlga_merchant_quest_brief:merchant_quest_brief_deliver_iron|We need {reg5} units of {s6} in {reg6} days, before our weaponsmiths run out of raw materials. What do you say?
dlga_merchant_quest_brief_deliver_iron:merchant_quest_taken|好的。 我会得到金属废料，并把它们给你。
dlga_merchant_quest_brief_deliver_iron:merchant_quest_stall|我太忙了，以至于不能处理它。
; dlga_merchant_quest_requested:merchant_quest_brief.5|Thanks for offering to help. Actually I was looking for someone to escort a supply train. Perhaps you can do that...
; dlga_merchant_quest_brief:escort_merchant_caravan_quest_brief|I am going to send a supply train to {s8}. However with all those enemy patrols out there, I don't want to send them without an extra escort. A group at least {reg4} would offer them adequate protection. Can you lead that supply train to {s8} in 7 days?^^[you will earn {reg14} Resource Points of {s14}]
dlga_escort_merchant_caravan_quest_brief:merchant_quest_taken|好的。 我将护送供应车。
dlga_escort_merchant_caravan_quest_brief:merchant_quest_stall|恐怕我没有那么多的士兵跟我在一起
dlga_escort_merchant_caravan_quest_brief:merchant_quest_stall.1|抱歉。 我现在不能这样做
; dlga_start:close_window.21|We can cover the rest of the way ourselves. Thanks.
; dlga_start:close_window.22|Well, we have almost reached {s21}. We can cover the rest of the way ourselves. Thanks for escorting us. Good luck.^^[earned {reg14} Resource Points of {s14}]
dlga_start:merchant_caravan_intro_1|您好. 你一定是我們的護衛, 對不對?
dlga_merchant_caravan_intro_1:merchant_caravan_intro_2|是的。我的名字是{playername}。 我会带你到{s1}。
dlga_merchant_caravan_intro_2:escort_merchant_caravan_talk|好，我很高兴得知我们不会单独上路。 你想要我们现在做什么？
dlga_start:escort_merchant_caravan_talk|嗯。 我们已经做了这么远...你想要我们做什么？
dlga_escort_merchant_caravan_talk:merchant_caravan_follow_lead|你跟着我的首领。 我会带你穿过一条安全的路线。
dlga_merchant_caravan_follow_lead:close_window|好的。 我们会在你身后。
dlga_escort_merchant_caravan_talk:merchant_caravan_stay_here|你在这里呆一会儿。 我去看看路。
dlga_merchant_caravan_stay_here:close_window|好的。 我们会在这里等你。
; dlga_merchant_quest_requested:merchant_quest_brief.6|Actually, I was looking for an able commander like you. There's this group of particularly troublesome goblins. They have infested the neighbourhood and are preying on supply trains and stray warriors. They have avoided all our patrols up to now. If someone doesn't stop them soon, I would need to request serious military action...
; dlga_merchant_quest_brief:troublesome_bandits_quest_brief|I need someone to hunt down those troublesome goblins. It's dangerous work. But I believe that you are the one for it. What do you say?^^[you will earn {reg14} Resource Points of {s14}]
dlga_troublesome_bandits_quest_brief:merchant_quest_taken_bandits|好的。 我将会猎杀地精。
dlga_merchant_quest_taken_bandits:close_window|你将要？我非常开心听到这个。祝你好运。
dlga_troublesome_bandits_quest_brief:merchant_quest_stall|對不起，我現在沒有時間來做這個.
; dlga_merchant_quest_requested:merchant_quest_deal_with_night_bandits|Do I indeed! There's a group of rogue goblins harassing the place, and I'm at the end of my rope as to how to deal with them. They've been ambushing and robbing drunken recruits under the cover of night, and then fading away quick as lightning when the guards finally show up. We've not been able to catch a one of them. They only attack lone people, never daring to show themselves when there's a group about. I need someone who can take on these goblins alone and win. That seems to be the only way of getting rid of them. Are you up to the task?
; dlga_merchant_quest_brief:merchant_quest_deal_with_night_bandits|There's a group of rogue goblins harassing the place, and I'm at the end of my rope as to how to deal with them. They've been ambushing and robbing drunken recruits under the cover of night, and then fading away quick as lightning when the guards finally show up. We've not been able to catch a one of them. They only attack lone people, never daring to show themselves when there's a group about. I need someone who can take on these goblins alone and win. That seems to be the only way of getting rid of them. Are you up to the task?
dlga_merchant_quest_deal_with_night_bandits:deal_with_night_bandits_quest_taken|杀了这些流氓地精？为什么，当然！
dlga_merchant_quest_deal_with_night_bandits:merchant_quest_stall|不，我不感兴趣。
dlga_deal_with_night_bandits_quest_taken:mayor_pretalk|那会为我减轻负担，{playername}。如果你成功回来会得到丰厚的报酬。一定要活着，嗯？
dlga_merchant_quest_requested:merchant_quest_brief.7|守备官正在找一个足智多谋的勇士带领一个{s12}的团队去{s13}。
dlga_merchant_quest_brief:move_cattle_herd_quest_brief|这个队伍需要在{reg6}天之内到达 {s13}。当然越快越好，但是一定不能超过{reg6}天。你能完成这个任务吗？^^[你会得到{s14}的资源点{reg14} ]
dlga_move_cattle_herd_quest_brief:move_cattle_herd_quest_taken|嗯，我可以带他们去 {s13}。
dlga_move_cattle_herd_quest_brief:merchant_quest_stall|我很抱歉, 但沒有.
dlga_move_cattle_herd_quest_taken:mayor_pretalk|漂亮。你可以在城镇外面找到他们。在你带他们去 {s13}之后，回来见我我会给你报酬的。
dlga_merchant_quest_requested:mayor_pretalk|多谢了，大人，但现在我们还不需要任何帮助。如果需要的话我会告诉你的。
dlga_goods_merchant_talk:goods_trade_requested|我想买些东西，也许还要卖一点。
dlga_goods_trade_requested:goods_trade_completed|好的好的……来这儿，看看我的宝贝们。
dlga_goods_trade_completed:goods_merchant_talk|還要別的嗎?
dlga_goods_merchant_talk:close_window|沒什麼. 謝謝.
dlga_start:troublesome_bandits_intro_1|什么？我们会杀了你的。我们会拿走你的食物和马，吃的他们。我们还会把你吃了。
dlga_troublesome_bandits_intro_1:troublesome_bandits_intro_2|你们会后悔在这附近惹是生非的。你们本不该离开你们的山洞。
dlga_troublesome_bandits_intro_2:close_window|杀掉，待会吃！
dlga_start:fangorn_orcs_intro_1|嗯？如果你打断他仆人们的工作，这个老人是不会高兴的。
dlga_fangorn_orcs_intro_1:fangorn_orcs_intro_2|不要再伤害森林了！滚开，否则你会后悔的！
dlga_fangorn_orcs_intro_2:close_window|哈哈！我们会随心所欲地砍烧这些树的！在我们解决你之后……
dlga_start:disbanded_troop_ask|你想要我们追随你吗？
dlga_disbanded_troop_ask:disbanded_troop_join|是的，我们开拔吧。
dlga_disbanded_troop_ask:close_window|不. 不是在這個時候.
dlga_disbanded_troop_join:close_window|很不幸，你队伍里没位置容下我们这些人了。
dlga_disbanded_troop_join:close_window.1|我们从现在起听你指挥了。
dlga_start:enemy_talk_1|你以后不会像这次这样抓住我的。
dlga_enemy_talk_1:enemy_talk_2|你没机会战胜我的，放弃吧。
dlga_enemy_talk_2:close_window|當你死亡的時候我才會放棄!
dlga_prisoner_chat_00:close_window|^^咆哮!^^
dlga_prisoner_chat_00:prisoner_chat_3|你已经把我囚禁了，你还想干嘛？
dlga_prisoner_chat_3:prisoner_chat_4|不要嘗試任何事情, 你這個敗類!
dlga_prisoner_chat_3:prisoner_slaughter|你将是我们下一顿晚餐！{s20}
dlga_prisoner_chat_4:close_window|哦，好像我就是个试验品？滚开！
dlga_prisoner_slaughter:prisoner_slaughter_02|总有一天你会付出代价！
dlga_prisoner_slaughter:close_window|总有一天你会付出代价……啊……！
dlga_start:close_window.23|随时恭候，肮脏的乞丐。
dlga_start:town_merchant_talk|你好，指挥官，我能帮你做什么？
dlga_start:town_merchant_talk.1|你好，我能帮你做什么？
dlga_town_merchant_talk:trade_requested_weapons|我要买些新东西，告诉我你这儿有什么卖的。
dlga_town_merchant_talk:trade_requested_horse|我想买一匹马
dlga_trade_requested_weapons:merchant_trade|啊，好的指挥官。你不会找到比这儿更好的货物了。
dlga_trade_requested_horse:merchant_trade|你能了解马啊，指挥官。你不会找到比我这儿更好的马了。
dlga_merchant_trade:town_merchant_talk|還要別的嗎?
dlga_town_merchant_talk:merchant_gossip|告诉我，镇上的人最近都在聊些什么？
dlga_town_merchant_talk:close_window|再見.
dlga_start:town_dweller_talk|請問?
dlga_start:town_dweller_talk.1|再見, 指揮官.
dlga_town_dweller_talk:town_dweller_ask_fugitive|我在找一个名叫{s4}的逃犯。我得到消息说他可能会藏在这儿。
dlga_town_dweller_ask_fugitive:close_window|我们村每天都有很多陌生人来去。如果他藏在这儿，你四处找找就一定能找到他。
dlga_town_dweller_talk:town_dweller_ask_info|你能告訴我這個村莊嗎？
dlga_town_dweller_talk:town_dweller_ask_info.1|你能告訴我這個地方嗎?
dlga_town_dweller_talk:town_dweller_ask_situation|如何在這生活?
dlga_town_dweller_ask_situation:town_dweller_poor|我的家庭遭遇了不幸，{sir/madam}。一场瘟疫摧毁了我们农田中所有的庄稼，我可怜的孩子们躺在家饱受饥饿和疾病，我的邻居们自身难保，帮不了我。
dlga_town_dweller_ask_situation:town_dweller_poor.1|我的生活很悲惨，{sir/madam}。我已经几个月没有找到工作了，我可怜的孩子每天忍受着饥饿入睡。我的邻居们都太穷了，帮不到我。
dlga_town_dweller_poor:town_dweller_poor_paid|收下这300第纳尔吧。希望这会帮到你和你家庭。
dlga_town_dweller_poor:town_dweller_poor_not_paid|那么你必须努力工作并且毫无抱怨地承担你的责任。
dlga_town_dweller_poor_not_paid:close_window|好的{sir/madam}. 我会照你说的做.
dlga_town_dweller_poor_paid:close_window|{我的大人/我的夫人}. 你太好心太大方了，. 我会告诉所有人你怎样帮助我们的.
dlga_town_dweller_ask_situation:close_window|谢谢你的好心{sir/madam}。有了你的帮助我们会过得很好。我会天天为你祈祷的
dlga_town_dweller_ask_situation:town_dweller_talk|日子过得很艰难，{sir/madam}。我们整天努力工作却总是饿着入睡。
