itm_horse_meat|馬 肉 
itm_practice_sword|練 習 劍 
itm_arena_lance|騎 槍 
itm_practice_staff|木 杖
itm_practice_bow|練 習 弓 
itm_wooden_javelin|木 鏢 槍 
itm_human_meat|人 肉 
itm_maggoty_bread|長 蛆 的 麵 包 
itm_cram|裝 滿 的 配 給 
itm_lembas|蘭 巴 斯 精 靈 餅 乾 
itm_smoked_fish|熏 魚 
itm_dried_meat|肉 乾 
itm_cattle_meat|牛 肉 
itm_grain|小 麥 
itm_tools|工 具 
itm_siege_supply|補 給 品 
itm_quest_wine|葡 萄 酒 
itm_quest_ale|麥 酒 
itm_metal_scraps_bad|低 級 金 屬 廢 料 
itm_metal_scraps_medium|可 用 的 金 屬 廢 料 
itm_metal_scraps_good|優 質 的 金 屬 廢 料 
itm_oliphant|象 牙 號 角 
itm_sumpter_horse|馱 馬 
itm_saddle_horse|有 鞍 的 馬 
itm_steppe_horse|草 原 馬 
itm_courser|駿 馬 
itm_hunter|獵 馬 
itm_pony|小 馬 
itm_arnor_warhorse|亞 爾 諾 戰 馬 
itm_dunedain_warhorse|登 丹 戰 馬 
itm_rohirrim_courser|洛 汗 駿 馬 
itm_rohirrim_hunter|洛 汗 獵 馬 
itm_rohirrim_courser2|洛 汗 裝 甲 駿 馬 
itm_rohan_warhorse|洛 汗 戰 馬 
itm_thengel_warhorse|伊 歐 戰 馬
itm_rhun_horse_a|盧 恩 馬 
itm_rhun_horse_b|盧 恩 馬 
itm_rhun_horse_d|盧 恩 馬 
itm_rhun_horse_e|重 盧 恩 馬 
itm_rhun_horse_f|重 盧 恩 馬 
itm_rhun_horse_g|重 盧 恩 馬 
itm_rhun_horse_h|重 盧 恩 馬 
itm_dale_horse|羅 馬 尼 安 馬
itm_dale_warhorse|河 谷 鎮 戰 馬 
itm_riv_warhorse|瑞 文 戴 爾 戰 馬 
itm_riv_warhorse2|瑞 文 戴 爾 駿 馬 
itm_mordor_warhorse|魔 多 戰 馬 
itm_mordor_warhorse2|魔 多 邪 惡 戰 馬 
itm_gondor_courser|剛 鐸 駿 馬 
itm_gondor_hunter|剛 鐸 獵 馬 
itm_dol_amroth_warhorse|多 爾 安 羅 斯 戰 馬 
itm_dol_amroth_warhorse2|多 爾 安 羅 斯 重 戰 馬 
itm_gondor_warhorse|剛 鐸 戰 馬 
itm_gondor_lam_horse|拉 密 頓 披 甲 戰 馬 
itm_lorien_warhorse|羅 斯 洛 立 安 戰 馬 
itm_harad_horse|哈 拉 德 馬 
itm_harad_warhorse|哈 拉 德 戰 馬 
itm_variag_pony|維 瑞 亞 小 馬 
itm_variag_kataphrakt|東 方 戰 馬 
itm_warg_1b|座 狼 
itm_warg_1c|座 狼 
itm_warg_1d|座 狼 
itm_wargarmored_1b|披 甲 座 狼 
itm_wargarmored_1c|披 甲 座 狼 
itm_wargarmored_2b|披 甲 座 狼 
itm_wargarmored_2c|披 甲 座 狼 
itm_wargarmored_3a|披 甲 座 狼 
itm_warg_reward|巨 型 座 狼 
itm_tree_trunk_club_a|樹 幹 
itm_free_giant_hammer|巨 鎚 
itm_giant_mace|巨 錘 
itm_troll_shield_a|食 人 妖 盾 牌
itm_arrows|箭 
itm_gondor_arrows|剛 鐸 箭 
itm_orc_javelin|半 獸 人 重 型 鏢 槍
itm_khergit_arrows|洛 汗 箭 
itm_rohan_arrows_2|洛 汗 箭 
itm_harad_arrows|哈 拉 德 箭 
itm_corsair_arrows|海 盜 箭 
itm_ithilien_arrows|伊 錫 利 恩 箭 
itm_woodelf_arrows|木 精 靈 箭 
itm_elven_arrows|精 靈 箭 
itm_orc_hook_arrow|半 獸 人 倒 鈎 箭 
itm_isengard_arrow|艾 辛 格 箭 
itm_leather_gloves|皮 手 套 
itm_mail_mittens|鏈 甲 手 套 
itm_leather_boots|皮 靴 
itm_white_tunic_a|平 民 服 裝
itm_rohan_shoes|皮 鞋
itm_furry_boots|毛 靴
itm_black_tunic|黑 色 寬 鬆 外 衣 
itm_hood_black|黑 色 兜 帽
itm_hood_green|綠 色 兜 帽
itm_hood_grey|灰 色 兜 帽
itm_hood_leather|皮 兜 帽
itm_axe_b|北 方 鉤 斧
itm_axe_c|北 方 斧
itm_axe_d|北 方 斧
itm_long_bearded_axe|北 方 鉤 長 斧
itm_2_handed_axe|北 方 長 斧
itm_shortened_spear|短 槍
itm_spear|長 槍
itm_light_lance|輕 型 騎 槍
itm_lance|騎 槍 
itm_tab_shield_small_round_b|騎 兵 圓 盾
itm_short_bow|短 弓
itm_regular_bow|弓
itm_nomad_bow|游 牧 弓
itm_gondor_bow|剛 鐸 弓
itm_strong_bow|強 弓
itm_elven_bow|精 靈 弓
itm_corsair_bow|海 盜 弓
itm_dwarf_horn_bow|矮 人 角 弓
itm_dwarf_short_bow|矮 人 短 弓
itm_harad_bow|哈 拉 德 曲 弓
itm_lg_bow|鷹 衛 隊 弓
itm_riv_bow|瑞 文 戴 爾 弓
itm_rhun_bow|畢 額 丘 斯 弓
itm_lorien_bow|加 拉 茲 民 弓
itm_isengard_large_bow|艾 辛 格 大 弓
itm_dale_bow|河 谷 鎮 弓
itm_uruk_bow|半 獸 人 角 弓
itm_mirkwood_bow|幽 暗 密 林 弓
itm_dunland_javelin|登 蘭 德 鏢 槍
itm_orc_throwing_arrow|半 獸 人 飛 鏢
itm_heavy_throwing_spear|重 型 擲 槍
itm_javelin|鏢 槍
itm_harad_javelin|哈 拉 德 鏢 槍
itm_gondor_javelin|剛 鐸 鏢 槍
itm_rohirrim_throwing_axe|北 方 擲 斧
itm_loss_throwing_axes|羅 蕯 那 奇 擲 斧
itm_arnor_helm_a|亞 爾 諾 盔
itm_arnor_helm_b|亞 爾 諾 盔
itm_arnor_helm_c|亞 爾 諾 盔
itm_dunedain_helm_a|登 丹 兜 帽
itm_dunedain_helm_b|亞 爾 諾 裝 飾 盔
itm_arnor_armor_a|亞 爾 諾 鎧 甲
itm_arnor_armor_b|亞 爾 諾 鎧 甲
itm_arnor_armor_c|登 丹 遊 俠 皮 革
itm_arnor_armor_d|登 丹 遊 俠 皮 革
itm_arnor_armor_e|亞 爾 諾 加 強 短 上 衣
itm_arnor_armor_f|亞 爾 諾 高 等 鎧
itm_arnor_greaves|亞 爾 諾 脛 甲
itm_arnor_splinted|亞 爾 諾 夾 板 脛 甲
itm_arnor_shield_a|亞 爾 諾 盾
itm_arnor_shield_c|亞 爾 諾 騎 兵 盾
itm_arnor_shield_b|亞 爾 諾 盾
itm_arnor_shield_d|亞 爾 諾 騎 兵 盾
itm_arnor_sword_a|亞 爾 諾 半 手 劍
itm_arnor_sword_c|亞 爾 諾 半 手 劍
itm_arnor_sword_f|亞 爾 諾 短 劍
itm_riv_helm_a|瑞 文 戴 爾 頭 巾
itm_riv_helm_b|瑞 文 戴 爾 弓 兵 盔
itm_riv_helm_c|瑞 文 戴 爾 步 兵 盔
itm_riv_tiara|精 靈 領 主 王 冠
itm_riv_shield_a|瑞 文 戴 爾 盾
itm_riv_shield_b|瑞 文 戴 爾 盾
itm_riv_bas_sword|瑞 文 戴 爾 半 手 劍
itm_riv_1h_sword|瑞 文 戴 爾 劍
itm_riv_riding_sword|瑞 文 戴 爾 騎 兵 劍
itm_riv_archer_sword|瑞 文 戴 爾 弓 兵 劍
itm_riv_spear|瑞 文 戴 爾 長 槍
itm_riv_light|瑞 文 戴 爾 外 衣 
itm_riv_leather|瑞 文 戴 爾 皮 甲
itm_riv_foot_mail|瑞 文 戴 爾 鎖 子 甲
itm_riv_foot_scale|瑞 文 戴 爾 鱗 甲
itm_riv_surcoat|瑞 文 戴 爾 罩 衫
itm_riv_knight|瑞 文 戴 爾 騎 士 鎧 甲
itm_riv_armor_h_archer|瑞 文 戴 爾 鎧 甲
itm_riv_armor_leader|瑞 文 戴 爾 領 隊 鎧 甲
itm_riv_boots|瑞 文 戴 爾 靴 子
itm_gon_footman|剛 鐸 鎖 子 甲 上 衣
itm_gon_jerkin|剛 鐸 短 上 衣
itm_gon_regular|剛 鐸 重 型 鎖 子 甲
itm_gon_bowman|剛 鐸 布 鎧
itm_gon_archer|剛 鐸 布 鎧 加 披 風
itm_gon_noble_cloak|剛 鐸 貴 族 短 上 衣
itm_gon_squire|剛 鐸 鎖 子 甲 加 披 風
itm_gon_knight|剛 鐸 重 型 鎖 子 甲 和 披 風
itm_gon_ranger_cloak|剛 鐸 遊 俠 披 風
itm_gon_ranger_skirt|剛 鐸 遊 俠 裙
itm_gon_steward_guard|剛 鐸 攝 政 王 衛 隊 鎧 甲
itm_gon_tower_guard|剛 鐸 塔 衛 隊 鎧 甲
itm_gon_tower_knight|剛 鐸 塔 騎 士 鎧 甲
itm_gon_leader_surcoat_cloak|剛 鐸 領 隊 罩 衫
itm_gondor_ranger_hood|綠 色 兜 帽
itm_gondor_ranger_hood_mask|剛 鐸 遊 俠 兜 帽
itm_gondor_light_greaves|剛 鐸 皮 脛 甲
itm_gondor_med_greaves|剛 鐸 中 型 脛 甲
itm_gondor_heavy_greaves|剛 鐸 鎖 子 脛 甲
itm_gondorian_light_helm|剛 鐸 步 兵 盔
itm_gondor_infantry_helm|剛 鐸 步 兵 盔
itm_gondor_auxila_helm|剛 鐸 輕 型 盔
itm_gondorian_light_helm_b|剛 鐸 弓 箭 手 盔
itm_gondorian_archer_helm|剛 鐸 弓 兵 盔
itm_tower_archer_helm|塔 弓 兵 盔
itm_gondor_leader_helm|剛 鐸 高 等 盔
itm_tower_guard_helm|塔 衛 隊 盔
itm_gondor_citadel_knight_helm|堡 壘 騎 士 盔
itm_gondor_squire_helm|剛 鐸 鄉 紳 盔
itm_gondor_knight_helm|剛 鐸 騎 兵 盔
itm_gondor_dolamroth_helm|多 爾 安 羅 斯 盔
itm_swan_knight_helm|天 鵝 騎 士 盔
itm_gondor_lamedon_helm|拉 密 頓 盔
itm_gondor_lamedon_leader_helm|拉 密 頓 高 等 盔
itm_blackroot_archer|墨 松 德 布 甲 與 披 風
itm_blackroot_bowman|墨 松 德 短 上 衣 與 披 風
itm_blackroot_footman|墨 松 德 短 上 衣
itm_blackroot_warrior|墨 松 德 布 甲
itm_blackroot_leader|墨 松 德 鎖 子 甲
itm_blackroot_hood|黑 色 兜 帽
itm_dol_hauberk|多 爾 安 羅 斯 胸 甲
itm_dol_heavy_mail|多 爾 安 羅 斯 重 型 鎖 子 甲
itm_dol_padded_coat|多 爾 安 羅 斯 加 厚 外 套
itm_dol_shirt|多 爾 安 羅 斯 上 衣
itm_dol_very_heavy_mail|多 爾 安 羅 斯 超 重 型 鎖 子 甲
itm_dol_greaves|多 爾 安 羅 斯 脛 甲
itm_dol_shoes|多 爾 安 羅 斯 輕 靴 子
itm_lamedon_clansman|拉 密 頓 族 人 鎧 甲
itm_lamedon_footman|拉 密 頓 步 兵 鎧 甲
itm_lamedon_knight|拉 密 頓 騎 士 鎧 甲
itm_lamedon_leader_surcoat_cloak|拉 密 頓 領 隊 鎧 甲
itm_lamedon_warrior|拉 密 頓 戰 士 鎧 甲
itm_lamedon_veteran|拉 密 頓 老 兵 鎧 甲
itm_lamedon_vet_warrior|拉 密 頓 戰 士 老 兵 鎧 甲
itm_lamedon_hood|兜 帽
itm_pinnath_archer|皮 那 斯 傑 林 弓 兵 鎧 甲
itm_pinnath_footman|皮 那 斯 傑 林 步 兵 鎧 甲
itm_pinnath_leader|皮 那 斯 傑 林 騎 士 盔 甲
itm_pinnath_vet_footman|皮 那 斯 傑 林 資 深 步 兵 鎧 甲
itm_pinnath_warrior|皮 那 斯 傑 林 戰 士 鎧 甲
itm_pel_footman|佩 拉 吉 爾 步 兵 鎧 甲
itm_pel_jerkin|佩 拉 吉 爾 短 上 衣
itm_pel_leader|佩 拉 吉 爾 領 隊 鎧 甲
itm_pel_marine|佩 拉 吉 爾 海 兵
itm_pelargir_marine_leader|佩 拉 吉 爾 海 兵 領 隊
itm_pelargir_regular|佩 拉 吉 爾 正 規 軍
itm_pelargir_hood|白 色 兜 帽
itm_pelargir_helmet_light|佩 拉 吉 爾 盔
itm_pelargir_helmet_heavy|佩 拉 吉 爾 重 盔
itm_pelargir_greaves|佩 拉 吉 爾 脛 甲
itm_lossarnach_shirt|羅 蕯 那 奇 上 衣
itm_lossarnach_axeman|羅 蕯 那 奇 斧 手 鎧 甲
itm_lossarnach_leader|羅 蕯 那 奇 領 隊 鎧 甲
itm_lossarnach_vet_axeman|羅 蕯 那 奇 資 深 斧 手 鎧 甲
itm_lossarnach_vet_warrior|羅 蕯 那 奇 資 深 戰 士 鎧 甲
itm_lossarnach_warrior|羅 蕯 那 奇 戰 士 鎧 甲
itm_lossarnach_cloth_cap|羅 蕯 那 奇 布 帽 子
itm_lossarnach_leather_cap|羅 蕯 那 奇 皮 帽 子
itm_lossarnach_scale_cap|羅 蕯 那 奇 鱗 帽 子
itm_lossarnach_greaves|羅 蕯 那 奇 脛 甲
itm_gondor_shield_a|剛 鐸 鄉 紳 盾
itm_gondor_shield_b|剛 鐸 箏 盾
itm_gondor_shield_c|剛 鐸 塔 盾
itm_gondor_shield_d|剛 鐸 箏 盾
itm_gondor_shield_e|剛 鐸 堡 壘 盾 牌
itm_gon_tab_shield_a|剛 鐸 紋 章 圓 盾
itm_gon_tab_shield_b|剛 鐸 紋 章 方 盾
itm_gon_tab_shield_c|剛 鐸 紋 章 箏 盾
itm_gon_tab_shield_d|剛 鐸 紋 章 塔 盾
itm_amroth_sword_a|多 爾 安 羅 斯 劍
itm_amroth_sword_b|多 爾 安 羅 斯 騎 士 劍
itm_gondor_sword|剛 鐸 步 兵 劍
itm_amroth_bastard|多 爾 安 姆 羅 斯 天 鵝 刀
itm_gondor_short_sword|林 何 短 劍
itm_pelargir_eket|佩 拉 吉 爾 短 劍
itm_pelargir_sword|佩 拉 吉 爾 劍
itm_gondor_ranger_sword|剛 鐸 遊 俠 劍
itm_gondor_bastard|剛 鐸 半 手 劍
itm_gondor_citadel_sword|剛 鐸 堡 壘 劍
itm_gondor_cav_sword|剛 鐸 騎 兵 劍
itm_gondor_spear|剛 鐸 長 槍
itm_gondor_tower_spear|剛 鐸 塔 長 槍
itm_gondor_lance|剛 鐸 騎 槍
itm_loss_axe|羅 蕯 那 奇 戰 鬥 斧
itm_loss_war_axe|羅 蕯 那 奇 戰 斧
itm_lorien_sword_a|羅 斯 洛 立 安 長 劍
itm_lorien_sword_b|羅 斯 洛 立 安 短 劍
itm_lorien_sword_c|羅 斯 洛 立 安 戰 劍
itm_lorien_archer|羅 斯 洛 立 安 弓 兵 鎧 甲
itm_lorien_armor_a|羅 斯 洛 立 安 縫 製 鎧 甲
itm_lorien_armor_b|羅 斯 洛 立 安 鎖 子 甲
itm_lorien_armor_c|羅 斯 洛 立 安 鱗 甲
itm_lorien_armor_d|羅 斯 洛 立 安 皇 家  劍 士 鎧 甲
itm_lorien_armor_e|羅 斯 洛 立 安 守 望 者 披 風
itm_lorien_armor_f|羅 斯 洛 立 安 菁 英 鎧 甲
itm_lorien_boots|羅 斯 洛 立 安 靴 子
itm_lorien_shield_b|羅 斯 洛 立 安 塔 盾
itm_lorien_shield_c|羅 斯 洛 立 安 箏 盾
itm_lorien_round_shield|羅 斯 洛 立 安 圓 盾
itm_lorien_helm_a|羅 斯 洛 立 安 弓 兵 盔
itm_lorien_helm_b|羅 斯 洛 立 安 弓 兵 盔
itm_lorien_helm_c|羅 斯 洛 立 安 步 兵 盔
itm_orc_chain_greaves|半 獸 人 脛 甲
itm_orc_coif|半 獸 人 頭 盔
itm_orc_greaves|半 獸 人 鏈 靴
itm_orc_ragwrap|半 獸 人 破 布 巾
itm_orc_furboots|半 獸 人 毛 靴
itm_orc_furboot_tall|半 獸 人 毛 靴
itm_orc_tribal_a|未 治 療 的 皮 膚
itm_orc_tribal_b|未 治 療 的 皮 膚
itm_orc_tribal_c|未 治 療 的 皮 膚
itm_evil_gauntlets_a|黑 色 手 套
itm_evil_gauntlets_b|黑 色 手 甲
itm_isen_orc_armor_a|艾 辛 格 半 獸 人 鎧 甲
itm_isen_orc_armor_b|艾 辛 格 半 獸 人 鎧 甲
itm_isen_orc_armor_c|艾 辛 格 半 獸 人 鎧 甲
itm_isen_orc_armor_d|艾 辛 格 半 獸 人 鎧 甲
itm_isen_orc_armor_e|艾 辛 格 半 獸 人 鎧 甲
itm_isen_orc_armor_f|艾 辛 格 半 獸 人 鎧 甲
itm_isen_orc_armor_g|艾 辛 格 半 獸 人 鎧 甲
itm_isen_uruk_light_a|強 獸 人 輕 輓 俱
itm_isen_uruk_light_b|強 獸 人 皮 甲
itm_isen_uruk_light_c|強 獸 人 皮 甲
itm_isen_uruk_light_d|強 獸 人 鎖 子 甲 與 皮 革
itm_isen_uruk_light_e|強 獸 人 鎖 子 輓 俱
itm_isen_uruk_heavy_a|強 獸 人 鎖 子 甲 與 皮 革
itm_isen_uruk_heavy_b|強 獸 人 重 型 鎧 甲
itm_isen_uruk_heavy_c|強 獸 人 重 型 鎧 甲
itm_isen_uruk_heavy_d|強 獸 人 追 蹤 者 皮 革
itm_isen_uruk_heavy_e|強 獸 人 追 蹤 者 皮 革
itm_uruk_tracker_boots|半 獸 人 追 蹤 者 靴 子
itm_uruk_greaves|半 獸 人 脛 甲
itm_uruk_chain_greaves|半 獸 人 鏈 子 脛 甲
itm_uruk_ragwrap|半 獸 人 破 布 巾
itm_isen_orc_helm_a|艾 辛 格 半 獸 人 盔
itm_isen_orc_helm_b|艾 辛 格 半 獸 人 盔
itm_isen_orc_helm_c|艾 辛 格 半 獸 人 盔
itm_isen_uruk_helm_a|強 獸 人 盔
itm_isen_uruk_helm_b|強 獸 人 盔
itm_isen_uruk_helm_c|強 獸 人 盔
itm_isen_uruk_helm_d|強 獸 人 上 尉 盔
itm_isen_uruk_helm_e|強 獸 人 追 蹤 者 盔
itm_isen_uruk_helm_f|強 獸 人 追 蹤 者 盔
itm_uruk_pike_a|半 獸 人 長 矛
itm_uruk_pike_b|魔 多 長 矛
itm_uruk_falchion_a|半 獸 人 彎 刀
itm_uruk_falchion_b|半 獸 人 彎 刀
itm_uruk_spear|魔 多 長 槍
itm_uruk_skull_spear|半 獸 人 頭 骨 長 槍
itm_uruk_voulge|半 獸 人 鉤 鐮 槍
itm_uruk_heavy_axe|半 獸 人 重 斧
itm_isengard_sword|艾 辛 格 劍
itm_isengard_axe|艾 辛 格 斧
itm_isengard_hammer|艾 辛 格 錘
itm_isengard_halberd|艾 辛 格 戟
itm_isengard_mallet|艾 辛 格 槌
itm_isengard_heavy_axe|艾 辛 格 重 斧
itm_isengard_heavy_sword|艾 辛 格 重 劍
itm_isengard_spear|艾 辛 格 長 槍
itm_isengard_pike|艾 辛 格 長 矛
itm_isen_orc_shield_a|艾 辛 格 半 獸 人 盾
itm_isen_orc_shield_b|艾 辛 格 半 獸 人 盾
itm_isen_uruk_shield_b|艾 辛 格 強 獸 人 盾
itm_wood_club|木 棍
itm_twohand_wood_club|大 木 棍
itm_bone_cudgel| 骨 棒
itm_skull_club|頭 骨 棍
itm_orc_club_a|半 獸 人 棍
itm_orc_club_b|座 狼 騎 手 棍
itm_orc_club_c|半 獸 人 帶 刺 棍
itm_orc_club_d|邪 惡 戰 錘
itm_orc_sledgehammer|半 獸 人 大 槌
itm_orc_simple_spear|半 獸 人 長 槍
itm_orc_skull_spear|半 獸 人 頭 骨 長 槍
itm_orc_bill|半 獸 人 長 柄 鍥
itm_orc_slasher|半 獸 人 砍 刀
itm_orc_falchion|半 獸 人 彎 刀
itm_orc_scimitar|半 獸 人 半 月 刀
itm_orc_sabre|半 獸 人 軍 刀
itm_orc_machete|半 獸 人 柴 刀
itm_orc_axe|半 獸 人 斧
itm_orc_two_handed_axe|半 獸 人 雙 手 斧
itm_orc_throwing_axes|半 獸 人 擲 斧
itm_orc_bow|半 獸 人 弓
itm_orc_shield_a|半 獸 人 盾
itm_orc_shield_b|半 獸 人 盾
itm_orc_shield_c|半 獸 人 塔 盾
itm_mordor_orc_shield_a|魔 多 半 獸 人 盾
itm_mordor_orc_shield_b|魔 多 半 獸 人 盾
itm_mordor_orc_shield_c|魔 多 半 獸 人 盾
itm_mordor_orc_shield_d|魔 多 半 獸 人 盾
itm_mordor_orc_shield_e|魔 多 半 獸 人 盾
itm_mordor_uruk_shield_a|魔 多 半 獸 人 盾
itm_mordor_uruk_shield_b|魔 多 半 獸 人 盾
itm_mordor_uruk_shield_c|魔 多 半 獸 人 盾
itm_mordor_man_shield_a|魔 多 人 盾
itm_mordor_man_shield_b|魔 多 人 盾
itm_angmar_shield|安 格 馬 盾
itm_orc_nosehelm|半 獸 人 覆 鼻 盔
itm_orc_kettlehelm|半 獸 人 壺 盔
itm_orc_buckethelm|半 獸 人 圓 盔
itm_orc_morion|半 獸 人 船 狀 盔
itm_orc_beakhelm|半 獸 人 鳥 嘴 盔
itm_orc_bughelm|半 獸 人 蟲 盔
itm_orc_visorhelm|半 獸 人 覆 面 盔
itm_m_orc_light_a|魔 多 半 獸 人 輕 型 鎧 甲
itm_m_orc_light_b|魔 多 半 獸 人 輕 型 鎧 甲
itm_m_orc_light_c|魔 多 半 獸 人 輕 型 鎧 甲
itm_m_orc_light_d|魔 多 半 獸 人 輕 型 鎧 甲
itm_m_orc_light_e|魔 多 半 獸 人 輕 型 鎧 甲
itm_m_orc_heavy_a|魔 多 半 獸 人 重 型 鎧 甲
itm_m_orc_heavy_b|魔 多 半 獸 人 重 型 鎧 甲
itm_m_orc_heavy_c|魔 多 半 獸 人 重 型 鎧 甲
itm_m_orc_heavy_d|魔 多 半 獸 人 重 型 鎧 甲
itm_m_orc_heavy_e|魔 多 半 獸 人 重 型 鎧 甲
itm_m_uruk_light_a|半 獸 人 輓 俱
itm_m_uruk_light_b|半 獸 人 皮 甲
itm_m_uruk_light_c|半 獸 人 輕 型 鎖 子 甲
itm_m_uruk_med_a|半 獸 人 重 型 皮 革
itm_m_uruk_med_b|半 獸 人 重 型 鎖 子 甲
itm_m_uruk_med_c|半 獸 人 輕 型 鱗 甲
itm_m_uruk_heavy_a|半 獸 人 重 型 鱗 甲
itm_m_uruk_heavy_b|半 獸 人 鎖 子 裝 甲
itm_m_uruk_heavy_c|路 格 柏 茲 鎖 子 裝 甲
itm_m_cap_armor|魔 多 上 尉 鎧 甲
itm_black_num_armor|黑 努 曼 諾 爾 鎧 甲
itm_m_armor_a|魔 多 鎧 甲
itm_m_armor_b|魔 多 鎧 甲
itm_evil_light_armor|邪 惡 外 衣
itm_uruk_helm_a|半 獸 人 盔
itm_uruk_helm_b|半 獸 人 盔
itm_uruk_helm_c|半 獸 人 尖 嘴 盔
itm_uruk_helm_d|半 獸 人 網 盔
itm_uruk_helm_e|半 獸 人 面 具 盔
itm_uruk_helm_f|半 獸 人 盔
itm_mordor_cap_helm|魔 多 上 尉 盔
itm_mordor_helm|魔 多 盔
itm_black_num_helm|黑 努 曼 諾 爾 盔
itm_mordor_sword|魔 多 半 手 劍
itm_mordor_longsword|魔 多 劍
itm_moria_armor_a|摩 瑞 亞 胸 輓 俱
itm_moria_armor_b|摩 瑞 亞 胸 和 肩 膀
itm_moria_armor_c|摩 瑞 亞 半 獸 人 鎖 子 甲
itm_moria_armor_d|摩 瑞 亞 鉚 釘 皮 革
itm_moria_armor_e|摩 瑞 亞 半 獸 人 重 型 鎖 子 甲
itm_moria_orc_shield_a|摩 瑞 亞 大 盾
itm_moria_orc_shield_b|摩 瑞 亞 半 獸 人 盾
itm_moria_orc_shield_c|摩 瑞 亞 半 獸 人 盾
itm_gundabad_armor_a|剛 達 巴 半 獸 人 破 布
itm_gundabad_armor_b|剛 達 巴 半 獸 人 毛 皮
itm_gundabad_armor_c|剛 達 巴 半 獸 人 鎧 甲
itm_gundabad_armor_d|剛 達 巴 半 獸 人 鎧 甲
itm_gundabad_armor_e|剛 達 巴 半 獸 人 重 型 鎧 甲
itm_gundabad_helm_a|皮 帽 子
itm_gundabad_helm_b|皮 盔
itm_gundabad_helm_c|剛 達 巴 半 獸 人 盔
itm_gundabad_helm_d|剛 達 巴 半 獸 人 盔
itm_gundabad_helm_e|座 狼 騎 手 盔
itm_dunland_wolfboots|登 蘭 德 狼 靴
itm_dunland_armor_a|登 蘭 德 毛 甲
itm_dunland_armor_b|登 蘭 德 毛 甲
itm_dunland_armor_c|登 蘭 德 毛 甲
itm_dunland_armor_d|登 蘭 德 毛 甲
itm_dunland_armor_e|登 蘭 德 毛 甲
itm_dunland_armor_g|登 蘭 德 毛 甲
itm_dunland_armor_h|登 蘭 德 長 毛 甲
itm_dunland_armor_i|登 蘭 德 胸 甲
itm_dunland_armor_j|登 蘭 德 胸 甲
itm_dunland_armor_k|登 蘭 德 酋 長 鎧 甲
itm_dun_helm_a|登 蘭 德 狼 帽
itm_dun_helm_b|登 蘭 德 鹿 角 帽
itm_dun_helm_c|登 蘭 德 高 盔
itm_dun_helm_d|登 蘭 德 高 盔
itm_dun_helm_e|登 蘭 德 鹿 角 盔
itm_dun_shield_a|登 蘭 德 盾
itm_dun_shield_b|登 蘭 德 盾
itm_dun_berserker|登 蘭 德 頭 目 劍
itm_dunnish_antler_axe|登 蘭 德 鹿 角 斧
itm_dunnish_war_axe|登 蘭 德 戰 斧
itm_dunnish_axe|登 蘭 德 斧
itm_dunland_spear|登 蘭 德 長 槍
itm_dunnish_pike|登 蘭 德 長 矛
itm_rohan_cav_sword|洛 汗 騎 乘 劍
itm_rohan_inf_sword|洛 汗 劍
itm_rohan_spear|洛 汗 長 槍
itm_rohan_lance|洛 汗 騎 槍
itm_rohan_sword_c|洛 汗 劍
itm_rohirrim_short_axe|洛 汗 短 斧
itm_rohirrim_long_hafted_axe|洛 汗 長 半 斧
itm_rohan_2h_sword|洛 汗 戰 劍
itm_rohan_recruit|洛 汗 加 厚 短 上 衣
itm_rohan_leather|洛 汗 皮 革 背 心
itm_rohan_mail|洛 汗 胸 甲
itm_rohan_rider|洛 汗 騎 手 盔 甲
itm_rohan_scale|洛 汗 鱗 甲
itm_rohan_surcoat|洛 汗 罩 衫
itm_rohan_guard|洛 汗 衛 隊 鎧 甲
itm_rohan_light_helmet_a|洛 汗 輕 盔
itm_rohan_light_helmet_b|洛 汗 輕 盔
itm_rohan_inf_helmet_a|洛 汗 護 眼 盔
itm_rohan_inf_helmet_b|洛 汗 護 眼 盔
itm_rohan_archer_helmet_a|洛 汗 覆 鼻 盔
itm_rohan_archer_helmet_b|洛 汗 覆 鼻 盔
itm_rohan_archer_helmet_c|洛 汗 衛 兵 盔
itm_rohan_shield_a|洛 汗 盾
itm_rohan_shield_b|洛 汗 盾
itm_rohan_shield_c|洛 汗 盾
itm_rohan_shield_d|洛 汗 盾
itm_rohan_shield_e|洛 汗 盾
itm_rohan_shield_f|洛 汗 盾
itm_rohan_shield_g|洛 汗 皇 家  盾
itm_rohan_light_greaves|洛 汗 輕 型 脛 甲
itm_rohirrim_war_greaves|洛 汗 戰 脛 甲
itm_mirkwood_leather|木 精 靈 皮 甲
itm_mirkwood_pad|巨 綠 森 縫 製 外 套
itm_mirkwood_mail|巨 綠 森 鎖 子 甲
itm_mirkwood_scale|巨 綠 森 輕 型 鱗 甲
itm_mirkwood_heavy_scale|幽 暗 密 林 葉 鱗 甲
itm_mirkwood_great_spear|巨 綠 森 巨 槍
itm_mirkwood_war_spear|巨 綠 森 戰 槍
itm_mirkwood_short_spear|木 精 靈 長 槍
itm_mirkwood_knife|木 精 靈 刀
itm_mirkwood_axe|木 精 靈 斧
itm_mirkwood_spear_shield_a|木 精 靈 盾
itm_mirkwood_spear_shield_b|巨 綠 森 戰 盾
itm_mirkwood_spear_shield_c|木 精 靈 圓 盾
itm_mirkwood_helm_a|木 精 靈 弓 兵 盔
itm_mirkwood_helm_b|巨 綠 森 盔
itm_mirkwood_helm_c|巨 綠 森 重 型 盔
itm_mirkwood_helm_d|巨 綠 森 皇 家 盔
itm_free_mirkwood_leather_greaves|幽 暗 密 林 皮 脛 甲
itm_mirkwood_boots|木 精 靈 靴 子
itm_harad_tunic|哈 拉 德 寬 鬆 外 衣
itm_harad_padded|哈 隆 鐸 加 厚 布 甲
itm_harad_hauberk|哈 隆 鐸 胸 甲
itm_harad_lamellar|哈 拉 加 拉 鎧 甲
itm_harad_heavy|哈 拉 德 貴 族 鎧 甲
itm_harad_skirmisher|哈 拉 德 輕 外 衣
itm_harad_archer|哈 拉 德 弓 兵 鎧 甲
itm_black_snake_armor|馬 拉 卡 鎧 甲
itm_harad_champion|遠 哈 拉 德 外 衣
itm_panther_guard|豹 皮
itm_harad_scale|哈 拉 德 鱗 甲
itm_harad_tiger_scale|虎 衛 隊 鎧 甲
itm_harad_lion_scale|獅 衛 隊 鎧 甲
itm_harad_dragon_helm|奇 洛 卡 盔
itm_harad_cav_helm_a|哈 隆 鐸 騎 兵 盔
itm_harad_cav_helm_b|哈 隆 鐸 騎 兵 盔
itm_black_snake_helm|馬 拉 卡 盔
itm_harad_finhelm|哈 拉 德 大 盔
itm_harad_heavy_inf_helm|哈 拉 德 大 盔
itm_harad_wavy_helm|哈 拉 德 大 盔
itm_harad_eaglehelm|鷹 衛 隊 盔
itm_lion_helm|獅 衛 隊 盔
itm_harad_pantherhelm|豹 衛 隊 帽
itm_harad_khopesh|哈 拉 德 鐮 狀 劍
itm_black_snake_sword|哈 拉 德 重 彎 刀
itm_harad_heavy_sword|哈 拉 德 重 劍
itm_horandor_a|哈 拉 德 半 月 刀
itm_skirmisher_sword|哈 拉 德 散 兵 劍
itm_harad_sabre|哈 拉 德 軍 刀
itm_harad_mace|遠 哈 拉 德 戰 錘
itm_far_harad_2h_mace|遠 哈 拉 德 雙 手 戰 錘
itm_harad_dagger|哈 拉 德 刃
itm_harad_short_spear|哈 拉 德 短 槍
itm_harad_long_spear|哈 拉 德 長 槍
itm_eagle_guard_spear|哈 拉 加 拉 長 柄 武 器
itm_harad_long_shield_a|哈 拉 德 豹 盾
itm_harad_long_shield_b|哈 拉 德 銅 盾
itm_harad_long_shield_c|哈 拉 德 太 陽 盾
itm_harad_long_shield_d|哈 拉 德 蛇 盾
itm_harad_long_shield_e|哈 拉 德 蛇 盾
itm_harad_shield_a|哈 隆 鐸 盾
itm_harad_shield_b|哈 隆 鐸 圓 盾
itm_harad_shield_c|哈 隆 鐸 圓 盾
itm_harad_yellow_shield|哈 拉 德 盾
itm_desert_boots|沙 漠 靴 子
itm_harad_leather_greaves|哈 拉 德 脛 甲
itm_harad_scale_greaves|哈 拉 德 靴 子
itm_harad_lamellar_greaves|哈 拉 德 靴 子
itm_khand_inf_helm_a|侃 德 頭 盔
itm_khand_inf_helm_b|侃 德 頭 盔
itm_khand_inf_helm_c1|侃 德 碗 盔
itm_khand_inf_helm_c2|侃 德 碗 盔
itm_khand_inf_helm_d|侃 德 錐 盔
itm_khand_cav_helm_a|侃 德 騎 手 盔
itm_khand_cav_helm_b|侃 德 騎 手 盔
itm_khand_cav_helm_c|侃 德 裝 飾 頭 盔
itm_khand_helm_mask|侃 德 面 具
itm_khand_light|侃 德 呢 短 裙
itm_khand_light_lam|侃 德 輕 型 片 甲
itm_khand_foot_lam|侃 德 步 兵 鎧 甲
itm_khand_med_lam|侃 德 中 型 片 甲
itm_khand_heavy_lam|侃 德 重 型 片 甲
itm_khand_axe_great|侃 德 大 斧
itm_khand_axe_winged|侃 德 翼 斧
itm_khand_halberd|侃 德 戟
itm_khand_trident|侃 德 三 叉 戟
itm_khand_voulge|侃 德 鉤 鐮 槍
itm_khand_mace1|侃 德 戰 錘
itm_khand_mace2|侃 德 戰 錘
itm_khand_throwing_axe|侃 德 擲 斧
itm_khand_rammace|侃 德 公 羊 錘
itm_khand_pitsword|競 技 場 劍
itm_khand_tulwar|侃 德 彎 刀
itm_khand_2h_tulwar|侃 德 彎 刀
itm_khand_lance|侃 德 騎 槍
itm_easterling_round_horseman|東 方 圓 盾
itm_variag_gladiator_shield|東 方 競 技 場 盾
itm_easterling_hawk_shield|東 方 鷹 盾
itm_rhun_bull1_shield|盧 恩 盾
itm_rhun_bull2_shield|盧 恩 盾
itm_rhun_bull3_shield|盧 恩 盾
itm_rhun_armor_a|盧 恩 輕 型 戰 裝
itm_rhun_armor_b|盧 恩 輕 型 戰 裝
itm_rhun_armor_d|盧 恩 輕 型 戰 裝
itm_rhun_armor_g|盧 恩 重 型 戰 裝
itm_rhun_armor_h|盧 恩 重 型 戰 裝
itm_rhun_armor_j|盧 恩 中 型 戰 裝
itm_rhun_armor_m|盧 恩 中 型 戰 裝
itm_rhun_armor_n|盧 恩 中 型 戰 裝
itm_rhun_armor_o|盧 恩 中 型 戰 裝
itm_rhun_armor_p|盧 恩 貴 族 鎧 甲
itm_rhun_armor_k|盧 恩 貴 族 鎧 甲
itm_rhun_helm_a|盧 恩 帶 刺 盔
itm_rhun_helm_b|盧 恩 帶 刺 盔 與 披 肩
itm_rhun_helm_c|盧 恩 群 眾 盔
itm_rhun_helm_e|盧 恩 群 眾 帶 角 盔
itm_rhun_helm_g|盧 恩 帶 角 壺
itm_rhun_helm_h|盧 恩 帶 角 壺
itm_rhun_helm_i|盧 恩 圓 盔
