; dlga_defeat_lord_answer_1:close_window|I am at your mercy.
dlga_defeat_lord_answer:defeat_lord_answer_2|Ты храбро сражался. Можешь идти.
dlga_start:party_encounter_lord_hostile_attacker|{playername}!
dlga_start:party_encounter_lord_hostile_attacker.1|Стой!
dlga_party_encounter_lord_hostile_attacker_2:party_encounter_offer_dont_fight|Есть ли способ избежать этой битвы? Я не хочу сражаться с тобой.
dlga_party_encounter_lord_hostile_attacker_2:close_window|Не нападайте! Мы сдаемся.
dlga_party_encounter_lord_hostile_attacker_2:close_window.1|Мы будем сражаться с тобой до последнего!
; dlga_party_encounter_offer_dont_fight:close_window|I owe you a favor, don't I. Well... all right then. I will let you go just this once.
dlga_party_encounter_offer_dont_fight:close_window.1|Ха-ха. Но я хочу сражаться с тобой.
; dlga_start:close_window.7|Away with you, vile beggar.
; dlga_start:lord_start|If it isn't my brave champion, {playername}...
dlga_start:lord_start.1|Рад снова видеть тебя, {playername}...
dlga_start:lord_start.2|Еще встретимся, {playername}...
dlga_start:lord_meet_neutral|Я тебя знаю?
dlga_lord_meet_neutral:lord_intro|Я {playername}.
dlga_lord_meet_neutral:lord_intro.1|Мое имя {playername}. К Вашим услугам.
dlga_lord_meet_enemy:lord_intro|Я {playername}.
dlga_lord_meet_enemy:lord_intro.1|Я известен как {playername}. Запомни это имя, ты ещё много услышишь обо мне.
dlga_start:lord_start.3|Хорошо, {playername}...
dlga_lord_start:lord_generic_mission_completed|Ваш врач сумел убедить моего друга и провёл операцию. Всё, что мы можем сейчас сделать, это молиться о его выздоровлении. Так или иначе, я благодарю тебя за то, что ты отправил ко мне своего хирурга, {playername}. У тебя благородный дух. Я никогда об этом не забуду.
dlga_lord_start:lord_investigate_fangorn_completed0|Так, {playername}, ты вернулся из Фангорна. Что ты там узнал?
dlga_lord_investigate_fangorn_completed0:lord_investigate_fangorn_completed1|Живые деревья! Они напали на наших солдат!
dlga_lord_investigate_fangorn_completed1:close_window|Я давно подозревал об этом. Ты сослужил мне хорошую службу, {playername}.
dlga_lord_start:close_window|Моё терпение кончилось. Я ожидал, что ты расскажешь мне что-нибудь о Фангорне, но ты ничего не узнал.
dlga_lord_active_mission_2:lord_capture_troll_completed_two_trolls|Хозяин, я привёз вам не одно, а два чудовища!
dlga_lord_active_mission_2:lord_capture_troll_completed_one_troll|Хозяин, я поработил чудище, как вы и хотели!
dlga_lord_capture_troll_completed_two_trolls:lord_capture_troll_completed_two_trolls_thankyou|Два чудища! Прекрасно, {playername}. Твои навыки и преданность должны быть достойно вознаграждены. С тобой два тролля,для наших экспериментов нам хватит и одного из них. Он полностью обученный раб, готовый драться под чьим-то командованием. Я имею в виду под ВАШИМ командованием, {playername}.
dlga_lord_capture_troll_completed_two_trolls_thankyou:lord_capture_troll_completed_two_trolls_thankyou_info|Может ли дикое чудовище подчиняться командам?
dlga_lord_capture_troll_completed_two_trolls_thankyou:lord_capture_troll_completed_two_trolls_thankyou_accept|Благодарю, Повелитель. Вы будете удовлетворены тому, как этот тролль послужит нашему делу.
dlga_lord_capture_troll_completed_two_trolls_thankyou:lord_capture_troll_completed_two_trolls_thankyou_refuse|Благодарю, Повелитель. Но я не достоин вашего подарка. Он слишком опасен для меня.
dlga_lord_capture_troll_completed_two_trolls_thankyou:lord_capture_troll_completed_two_trolls_thankyou_refuse.1|Благодарю, Повелитель. Но я не достоин вашего подарка. [нет места в отряде!]
dlga_lord_capture_troll_completed_two_trolls_thankyou:lord_capture_troll_completed_two_trolls_thankyou_raise|Повелитель, я принесу больше разрушений, если вы обеспечите чудище бронёй [10/{reg20} влияния].
dlga_lord_capture_troll_completed_two_trolls_thankyou_info:lord_capture_troll_completed_two_trolls_thankyou|Вы подвергаете сомнению решение вашего Владыки, {playername}? Это чудище обучено атаковать врагов, как только их увидит. Этого достаточно. Но, вы и ваши воины должны сохранять дистанцию от чудища во время боя, и никогда не вставать между ним и его жертвами.
dlga_lord_capture_troll_completed_two_trolls_thankyou_accept:lord_pretalk|Теперь неси разрушение моим врагам с моим новым подарком
dlga_lord_capture_troll_completed_two_trolls_thankyou_refuse:lord_pretalk|Как прикажете. Кто-то ещё среди моих прислужников будет знать как использовать это орудие войны.
dlga_lord_capture_troll_completed_two_trolls_thankyou_raise:lord_pretalk|Ты смеешь просить полностью бронированного боевого тролля, {playername}, для служения под двоим командованием? Это не какая-нибудь мелочь, о которой можно просить. Но ты искусный прислужник, и мы знаем твою мотивацию. Нам это нравится.Это будет даровано.
dlga_lord_capture_troll_completed_two_trolls_thankyou_raise:lord_capture_troll_completed_two_trolls_thankyou|Как ты смеешь просить Нас о большем, нежели мы запланировали для тебя в нашей великой Мудрости? {playername}, ты доказал, что ты могучий слуга, но не позволяй своей дерзости испытывать Наше терпение в дальнейшем.
; dlga_lord_capture_troll_completed_one_troll:close_window|Excellent, {playername}. You are a most faithful and useful servant. This troll will be most useful for our purposes. That it is taken to the dungeons!
; dlga_lord_start:close_window.1|Too long ago, I asked you to take me one troll alive. But I should have known. How could I expect someone like {playername} to be up to the challange. My servant was not skilled or faithful enough.
; dlga_lord_start:lord_generic_mission_completed.1|News of your accomplishment against the wild trolls reached me. {s12} has one fear less to worry about, thanks to you, {playername}.
; dlga_lord_start:lord_follow_spy_half_completed|Blast and damn you! I wanted TWO prisoners, {playername} -- what you've brought me is one step short of useless! I already know everything the spy knows, it was the handler I was after. Here, half a job gets you half a reward. Take it and begone.
; dlga_lord_start:lord_follow_spy_half_completed.1|I asked you for two prisoners, {playername}, not one. Two. Still, I suppose you did capture the spy's handler, the more important one of the pair. The spy will not dare return here and will prove quite useless to whatever master he served. 'Tis better than nothing. However, you'll understand if I pay you half the promised reward for what is but half a success.
; dlga_lord_start:lord_follow_spy_failed|Truly, {playername}, you are nothing short of totally incompetent. Failing to capture both the spy AND his handler plumbs astonishing new depths of failure. Forget any reward I offered you. You've done nothing to earn it.
dlga_lord_follow_spy_half_completed:lord_pretalk|Я сделал всё, что мог, {s65}.
dlga_lord_follow_spy_completed:lord_pretalk|Спасибо тебе, {s65}.
dlga_lord_follow_spy_failed:lord_pretalk|Хм. Как хочешь, {s65}.
dlga_lord_start:lord_generic_mission_completed.2|Черт меня побери, но ты это сделал, {playername}. Все рабы вернулись и готовятся к уборке урожая. Определенно, ты заработал свою награду. Вот, прими её вместе с моими поздравлениями.
; dlga_lord_start:lord_bring_back_runaway_serfs_failed|{playername}. I have been waiting patiently for my slaves, yet none have returned. Have you an explanation? Were you outwitted by simple animals, or are you merely incompetent?
; dlga_lord_bring_back_runaway_serfs_failed:lord_bring_back_runaway_serfs_failed_1a|Forgive me, {s65}, those slaves were slippery as eels.
; dlga_lord_bring_back_runaway_serfs_failed_1a:lord_pretalk|Hmph, that is hardly an excuse for failure, {playername}. Now if you will excuse me, I need to capture new men to work these fields before we all starve.
; dlga_lord_start:lord_runaway_serf_half_completed|You disappoint me, {playername}. There were 3 groups of slaves that I charged you to return. 3. Not {reg17}. I suppose the ones who did come back shall have to work twice as hard to make up for those that got away. As for your reward, {playername}, I'll only pay you for the slaves you returned, not the ones you let fly. Here. Take it, and let this business be done.
; dlga_lord_runaway_serf_half_completed:lord_pretalk|Thank you, {s65}. You are indeed generous.
; dlga_lord_runaway_serf_half_completed:lord_pretalk.1|Bah, this proved to be a waste of my time.
; dlga_lord_start:lord_deliver_cattle_to_army_thank|Ah, {playername}. I am pleased that you delivered {reg13} units of {s4}, as I requested. I'm impressed.
dlga_lord_deliver_cattle_to_army_thank:lord_pretalk|Не проблема, {s65}.
dlga_lord_deliver_cattle_to_army_thank:lord_pretalk.1|Рад стараться.
; dlga_lord_start:lord_scout_waypoints_thank|You make a good scout, {playername}. My runner just brought me your reports of the mission to {s13}, {s14} and {s15}. Well done.
dlga_lord_scout_waypoints_thank:lord_pretalk|Простое задание, {s65}.
dlga_lord_scout_waypoints_thank:lord_pretalk.1|Ничего такого, чего бы я не смог сделать.
dlga_lord_scout_waypoints_thank:lord_pretalk.2|С удовольствием, сир.
dlga_lord_start:lord_mission_told_deliver_cattle_to_army|Продовольствие армии быстро истощаются, {playername}. Мне нужно, чтобы ты принёс мне {reg3} единиц {s4}, чтобы я смог прокормить моих солдат. Меня мало заботит где ты её найдёшь, просто принеси её мне как можно скорее.
dlga_lord_mission_told_deliver_cattle_to_army:lord_mission_told_deliver_cattle_to_army_accepted|Очень хорошо, я могу найти тебе несколько {s4}.
dlga_lord_mission_told_deliver_cattle_to_army:lord_mission_told_deliver_cattle_to_army_rejected|Простите, сир, у меня другие планы.
dlga_lord_mission_told_deliver_cattle_to_army_accepted:close_window|Прекрасно! Ты знаешь что делать, {playername}, теперь собери её. Мне нужна это еда как можно быстрее.
dlga_lord_mission_told_deliver_cattle_to_army_rejected:close_window|Это . . . прискорбно, {playername}. Мне стоило найти кого-то другого, кто смог бы выполнить поручение. Прошу, уйди, у меня ещё остались незаконченные дела.
dlga_lord_start:lord_report_to_army_asked|О, ты наконец-то прибыл, {playername}. Мы ожидали тебя. Я надеюсь ты привёл с собой нужное количество обученных бойцов.
dlga_lord_report_to_army_asked:lord_report_to_army_completed|Я привёл с собой хороших, закалённых солдат. Мы готовы присоединиться к вам.
dlga_lord_report_to_army_asked:lord_report_to_army_continue|У меня нет достаточного числа воинов пока что. Мне нужно еще немного времени.
dlga_lord_report_to_army_completed:close_window|Прекрасно. Я отправлю тебе послание, как только у меня появится к тебе задание. На данный момент просто следуй за нами и держись ближе. Мы скоро выдвигаемся.
dlga_lord_report_to_army_continue:close_window|Тогда тебе следует поторопиться. Мы скоро выдвигаемся на встречу врагу и мне понадобится каждый, кто может держать меч руках.
dlga_lord_start:lord_mission_told_scout_waypoints|{playername}, мне нужен доброволец для разведки округа. У нас недостаточно информации, и мне нужна лучшая картина ситуации до того, как мы начнём. Мне нужно, чтобы ты отправился в {s13}, {s14} и {s15} и вернулся с донесением обо всём, что ты там обнаружил.
dlga_lord_mission_told_scout_waypoints:lord_mission_told_scout_waypoints_accepted|Вы нашли своего добровольца, господин.
dlga_lord_mission_told_scout_waypoints:lord_mission_told_scout_waypoints_rejected|Я боюсь, что мне придётся отказаться.
dlga_lord_mission_told_scout_waypoints_accepted:close_window|Хорошо! Просто пройдись рядом с {s13}, {s14} и {s15} и проверь что там. Сделай заметки обо всём, что там увидишь и вернись ко мне так скоро, как только возможно.
dlga_lord_mission_told_scout_waypoints_rejected:lord_pretalk|Хм. Я разочарован, {playername}. Очень разочарован. Мы поговорим позже. Мне нужно найти кого-то, кто бы отправился на разведку.
dlga_lord_start:lord_buy_prisoner|Я слышал, что ты смог захватить нашего врага {s3} и он сейчас с тобой. Отличная работа!^ Отдай его нам, у него много информации, которую нам необходимо извлечь из него...^^[вы получите {reg14} Очков Ресурсов фракции {s14}]
dlga_lord_buy_prisoner:lord_buy_prisoner_accept|Хорошо, он в Вашем распоряжении.
dlga_lord_buy_prisoner:lord_buy_prisoner_deny|Боюсь, что у меня на него другие планы.
dlga_lord_buy_prisoner_accept:lord_pretalk|Прекрасно! Я отправлю своих людей, чтобы забрать его в нашу темницу. Это поможет нашему делу.
dlga_lord_buy_prisoner_deny:lord_pretalk|Плохо, он был ценным для нас, {playername}.
dlga_lord_start:lord_pretalk|А, добро пожаловать, {s24}.^Ты должен был уже знать это {s12}. Твой долг помогать нашей борьбе, {playername}. Когда ты докажешь, что достоин моего доверия [уровень {reg1}], Я позволю тебе пользоваться сундуком позади меня.
dlga_lord_start:lord_talk|Что это?
dlga_lord_pretalk:lord_talk|Что-нибудь еще?
dlga_lord_talk:lord_lend_companion_end|Я хотел бы вернуть себе {s14}, {s65}, если вы больше не требуешь услуг {reg3?her:his}.
dlga_lord_lend_companion_end:lord_pretalk|В твоём отряде слишком много людей, {playername}. Ты больше не можешь набирать новых воинов в данный момент.
dlga_lord_lend_companion_end:lord_pretalk.1|Конечно, {playername}. {reg3?She:He} достойный {reg3?girl:fellow}, тебе повезло, что ты командуешь столь преданным компаньоном.
dlga_lord_talk:lord_message_delivered|У меня сообщение от  {s9}.
dlga_lord_talk:lord_message_delivered_enemy|У меня сообщение от {s9}.
dlga_lord_talk:lord_active_mission_1|По поводу задания, которое Вы дали мне...
dlga_lord_talk:lord_request_mission_ask|У тебя найдутся поручения для меня?
dlga_lord_talk:find_lost_spears_permission|Мой господин, мне бы хотелось войти в Одинокую Гору, чтобы найти потерянные копья Короля Бладортина.
dlga_find_lost_spears_permission:lord_pretalk|Я уже дал тебе разрешение, {playername}.
dlga_find_lost_spears_permission:find_lost_spears_permission_yes|Хорошо, {playername}, ты можешь войти в гору.
dlga_find_lost_spears_permission:lord_pretalk.1|К сожалению, я не знаю и не доверяю тебе, {playername}.
dlga_find_lost_spears_permission_yes:lord_pretalk|Благодарю Вас, мой Повелитель.
dlga_lord_give_troops:lord_give_troops_check|Усилить мой отряд? Я всегда могу использовать ещё несколько воинов.
dlga_lord_give_troops:lord_pretalk|К сожалению, у тебя нет воинов {s14} для усиления моего отряда.
dlga_lord_give_troops_check:lord_give_troops_check_1|Позволь мне проверить список солдат...
dlga_lord_give_troops_check_1:lord_pretalk|Итак, ты передумал...^Понятно.
dlga_lord_give_troops_check_1:lord_pretalk.1|Я не могу использовать этих воинов здесь...^Забери их обратно.
dlga_lord_talk:lord_get_reward_item_ask|Я бы хотел запросить специальный предмет.
dlga_lord_get_reward_item_ask:lord_talk|Кажется, у тебя не достаточно места в инвентаре. Освободи место, а затем возвращайся.
dlga_lord_get_reward_item_ask:lord_get_reward_item|Серьёзно? Не забыл, что для заслуги специального предмета, надо иметь определённый ранг и владеть значительным влиянием.^Что я могу дать тебе?
dlga_lord_get_reward_item:lord_get_reward_item_answer|{s24}: {s20} [стоит {reg14}/{reg15} влияния]
dlga_lord_get_reward_item:lord_pretalk|Тогда, не важно.
dlga_lord_get_reward_item_answer:lord_pretalk|Очень хорошо. Используй его для победы над нашими врагами.
dlga_lord_talk:marshall_ask|Я бы хотел посовещаться с вами по поводу Войны.
dlga_marshall_ask:lord_pretalk|Я едва ли буду принимать советы от простого {s25}, {playername}. Я бы склонился к тому, чтобы вас выслушать, если бы вы были {s24}, но вы не имеете такого звания.
dlga_marshall_ask:lord_pretalk.1|Ты достойный командир, {playername}, но ваше влияние слишком мало. Будет неблагоразумно слушать твоих советов.^[{reg15} влияния необходимо, имеется только {reg14}]
dlga_marshall_ask:lord_pretalk.2|Мы едва можем позволить себе столкнуться лицом к лицу с нашим врагом, {playername}. Нам требуется повысить наши силы и стать сильнее, увы, но мы просто {s23}.
dlga_marshall_ask:lord_pretalk.3|Мы находимся в кампании, {playername}, ваши советы подождут.
dlga_marshall_ask:marshall_suggest|Я слушаю, {playername}. Каково твоё предложение?
dlga_marshall_suggest:marshall_answer|Нам следует осадить {s1}.
dlga_marshall_suggest:lord_pretalk|Не берите в голову, я доверяю вашим решениям.
dlga_marshall_answer:close_window|Прекрасно, {playername}, я подчинись твоему решению. Я отправлю сообщения об объединении наших сил.^Следуй за мной и держись ближе - мы отправляемся к {s4}!
dlga_lord_talk:deliver_gift_1|Я принёс подарок от {s1} из {s3} людям {s2}.
dlga_send_gift_1:lord_pretalk|Вы уже {s4}, {playername}. Будет мудро сначала доставить это.
dlga_send_gift_1:lord_pretalk.1|К сожалению, вы не доставить подарок сейчас, {playername}.^^[не достаточно Очков Ресурсов]
dlga_send_gift_1:send_gift_2|Очень хорошо. Кому ты хочешь отправить подарок?
dlga_send_gift_1:send_gift_2.1|Очень хорошо. Кому вы хотите отправить взятку?
dlga_send_gift_2:lord_pretalk|Не бери в голову.
dlga_send_gift_3:send_gift_4|Какой подарок ты хочешь им отправить?
dlga_send_gift_3:send_gift_4.1|Какую взятку ты хочешь им отправить?
dlga_send_gift_4:lord_pretalk|Не бери в голову.
dlga_send_gift_5:lord_pretalk|Хорошо, {playername}. Удачи.
dlga_lord_talk:lord_give_order_ask|У меня есть для тебя новое задание.
dlga_lord_give_order_ask:lord_give_order|Да?
dlga_lord_give_order:lord_give_order_answer|Следуй за мной. [Стоит {reg1}/{reg2} влияния]
dlga_lord_give_order:lord_give_order_details_ask|Отправляйся в... [Стоит {reg1}/{reg2} влияния]
dlga_lord_give_order:lord_give_order_details_ask.1|Патрулируйте вокруг... [Стоит {reg1}/{reg2} влияния]
dlga_lord_give_order:lord_give_order_details_ask.2|Атакуйте врага в округе... [Стоит {reg1}/{reg2} влияния]
dlga_lord_give_order:lord_give_order_stop|Ты мне не понадобишься некоторое время. Ты свободен делать что хочешь.
dlga_lord_give_order:lord_pretalk|Не важно.
dlga_lord_give_order_details_ask:lord_give_order_details|Где?
dlga_lord_give_order_details:lord_pretalk|Не важно.
dlga_lord_give_order_stop:lord_pretalk|Хорошо. Я это сделаю.
dlga_lord_give_order_answer:lord_pretalk|Сожалею. Я нужен в другом месте в данный момент.
dlga_lord_give_order_answer_2:close_window|Сделаю.
; dlga_lord_give_order_answer_2:lord_pretalk|I am sorry, it is not possible for me to do that.
dlga_lord_talk:lord_talk_ask_something|Я хочу кое-что спросить у тебя.
dlga_lord_talk_ask_something:lord_talk_ask_something_2|Да? Что же?
dlga_lord_talk_ask_something_2:lord_talk_ask_location|Мне хотелось бы узнать местоположения одного человека.
dlga_lord_talk_ask_something_2:lord_tell_objective|Что ты и твои люди делают?
dlga_lord_talk_ask_something_2:lord_talk_ask_about_war|Как проходит война?
dlga_lord_talk_ask_something_2:lord_pretalk|Не важно.
dlga_lord_talk_ask_location:lord_talk_ask_location_2|Очень хорошо, я возможно знаю, а возможно и нет, ответ на твой вопрос. О ком ты хотел узнать?
dlga_lord_talk_ask_location_2:lord_pretalk|Не важно.
dlga_lord_talk_ask_about_war_2:lord_talk_ask_about_war_details|Расскажи мне больше о войне с {s1}.
dlga_lord_talk_ask_about_war_2:lord_pretalk|Это всё, что я хотел узнать. Спасибо тебе.
dlga_lord_talk_ask_about_war_details:lord_talk_ask_about_war_2|Мы {s22} а они {s23}. В целом, {s9}.
dlga_lord_talk:party_encounter_lord_hostile_ultimatum_surrender|Сегодня прекрасный день для боя, {s4}!
dlga_lord_tell_objective:lord_pretalk|Что я делаю? А на что это похоже? Я пленён здесь!
dlga_lord_tell_objective:lord_pretalk.1|Я не командую войсками в данный момент.
