dlga_start:mutiny_pretalk_1|Эй, {playername}. Вот, что мы тебе скажем.. ^Парни шепчутся! Они хотят больше веселья, и меньше походов.
dlga_mutiny_pretalk_1:mutiny_pretalk_2|Вернись в строй, слизняк! Мы на войне и я ваш командир.
dlga_mutiny_pretalk_2:close_window|Как пожелаете, командир. Как пожелаете...
dlga_start:mutiny_talk_1|Эй, командир. Вот что мы тебе скажем... Парни не счастливы, вообще не счастливы. ^Мало человеческого мяса, мало веселья. ^Парни говорят, что вы не достаточно хороши, командир!
dlga_mutiny_talk_1:mutiny_talk_2|Что? Мятеж во время войны? ^Это карается смертью, червяк!
dlga_mutiny_talk_2:close_window|Вот что мы тебе скажем... ^Парни тут подумали, что из меня выйдет командир получше, после того как Я ТЕБЯ УБЬЮ!
dlga_start:troll_introduce_1|Проблемы?
dlga_start:troll_talk_1|Ты с ума сошел?
dlga_troll_introduce_1:troll_goodbye|Ух ты! Говорящий тролль?!
dlga_troll_introduce_1:close_window|Я владею лошадью.
dlga_troll_talk_1:troll_talk_2|Потролль меня, тролль!
dlga_troll_talk_1:close_window|Я владею лошадью.
dlga_troll_talk_2:troll_talk_3|Вызов принят!^^{s4}
dlga_troll_beaten:troll_talk_1|Я кланяюсь перед вашей мудростью, Мастер Преследователь Троллей! 
dlga_troll_goodbye:close_window|ТРОЛЛОЛОЛОЛОЛОЛОЛОЛОЛОЛ!
dlga_start:hobbit_merry_talk_met|Еще раз здравствуй, {playername}!
dlga_start:hobbit_pippin_talk_met|Еще раз здравствуй, {playername}!
dlga_start:hobbit_general_talk_1|Здравствуйте, {sir/madam}! Меня зовут Мериадок Брендибак, но Вы можете называть меня Мерри!
dlga_start:hobbit_general_talk_1.1|Здравствуйте, {sir/madam}! Меня зовут Перегрин Тук, но Вы можете называть меня Пиппин!
dlga_hobbit_general_talk_1:close_window|У меня сейчас нет времени.
dlga_hobbit_general_talk_1:hobbit_general_talk_first_met|Скажи. Я думаю, я никогда не видел кого-то вроде тебя.
dlga_hobbit_general_talk_1:hobbit_general_talk_second_met|Скажи. Я думаю, я видел кого-то вроде тебя в Эдорасе.
dlga_hobbit_general_talk_1:hobbit_general_talk_second_met.1|Скажи. Я думаю, я видел кого-то вроде тебя в Минас Тирите.
dlga_hobbit_general_talk_first_met:hobbit_general_talk_3|Я знаю. Я пришел издалека. Я хоббит, {sir/madam}, из Шира.
dlga_hobbit_general_talk_second_met:hobbit_general_talk_3|О, это, должно быть, мой дорогой кузин! Перегрин Тук, или Пиппин, как он себя называет. Мы Хоббиты, {sir/madam}, и мы пришли из Шира, мы оба! Старый добрый Пиппин, интересно, как он поживает в Минас Тирите.
dlga_hobbit_general_talk_second_met:hobbit_general_talk_3.1|О, это, должно быть, мой дорогой кузин! Мериадок Брендибак, или Мерри, как он себя называет. Мы Хоббиты, {sir/madam}, и мы пришли из Шира, мы оба! Старый добрый Мерри, интересно, как он поживает в Эдорасе.
dlga_hobbit_general_talk_3:close_window|Ну что же, прощай.
dlga_start:hobbit_merry_talk_met.1|С возвращением, {playername}!
dlga_start:hobbit_pippin_talk_met.1|С возвращением, {playername}!
dlga_hobbit_merry_talk_met:close_window|Здравствуйте, господин Мерри.
dlga_hobbit_pippin_talk_met:close_window|Здравствуйте, господин Пиппин.
dlga_start:treebeard_introduce_1|(Вы находите, что смотрите на самое необычное создание. Оно очень высокое, с жёсткими ногами, у него подобная коре кожа, и оно покрыто листвой вместо волос. Мох также покрывает его тело. В данный момент вы отличаете мало, но глаза. Глубокие глаза, рассматривают вас, медленно и торжественно, но очень остро и проникающе.  Вам видится что они коричневые, с зеленоватым оттенком.)
dlga_treebeard_introduce_1:treebeard_introduce_2|(Вы собираетесь что-то сказать, но странное чувство духоты падает на вас, как будто воздух слишком сжатый или слишком скудный для дыхания ... С отчаянным вдохом воздуха вам удастся привести себя в чувство и огромное дерево - как существо - немного понизит интенсивность своего взгляда. существо продолжает смотреть на вас, и вы замечаете, что другие огромные существа-деревья смотрят на вас ,тоже, как будто ожидая, чтобы вы скажете...)
dlga_treebeard_introduce_2:treebeard_introduce_3|Прошу простить меня за вторжение... Я всего лишь уставший путешественник в поисках пристанища от последних событий... меня зовут {playername}. Могу ли я узнать, кто Вы?
dlga_treebeard_introduce_3:treebeard_introduce_4|(Жестко очерченный деревянный гигант медленно открывает рот, который скрывается за небольшими ветвями, листьями и мхом. Глубоким, протяжным и громовым голосом он очень медленно излагает самым начальствующим образом:.) ^ Хроом ... Хмм...      * Я * не собираюсь рассказывать вам мое имя ... В любом случае. С одной стороны это займет много времени. Мое имя все время растет, и я жил очень, очень долго; вообщем, моё имя как история. Настоящие имена расскажут вам историю вещей, которые принадлежат моему языку, Старому Языку Энтов, как вы его называете. Это прекрасный язык, но  занимает очень много времени, что-бы сказать что-нибудь , мы не разговариваем на нём, потому что на это тратится много времени, чтобы говорить, и слушать.
dlga_treebeard_introduce_4:treebeard_introduce_5|О, так Вы Энт! О вас ходят легенды, и для меня честь быть вместе с Вами. Я не хочу навязываться и покину Вас, если пожелаете.
dlga_treebeard_introduce_5:treebeard_questtalk|(Сильно колыхаясь, гигант и его коллеги Энты стояли в течение нескольких минут в молчании, пока ветер пролетал среди их листовых волосков и бород. Они не смотрят друг на друга еще длительное время, пока внезапно Энт напоминающий дерево-рябину кажется захотел что-то сказать. Тем не менее, он молчит, пока гигант Энт продолжает колыхаться)
dlga_treebeard_questtalk:treebeard_quest_brief|{reg2?Как я сказал раньше...:Хрум... Мы ценим вежливость, показанную вами. Это {reg1?весьма необычно для вашей расы:приятно разговаривать с эльфами вновь}.} Настали плохие времена, с тех самых пор, как исчезли энтихи - и теперь множество злых существ освобождено Тёмным Лордом, который пытается уничтожить наш дом. Мы ищем кого-нибудь быстрого, но не торопливого. Кого-нибудь, кто может помочь нам, пока мы обсуждаем планы наших действий.^Множество орочьих банд совершают набеги на леса и сжигают наши деревья огненными стрелами - если вы уничтожите орков  и будете уверены, что они больше не представляют угрозу лесу мы будем благодарны и признаем в вас настоящего друга. Что ж, сделайте это и мы поговорим ещё раз.
dlga_treebeard_quest_brief:close_window|Орки, в самом деле, самые подлые существа. Я удостоверюсь, что они не причинят вреда лесу снова.
dlga_treebeard_quest_brief:treebeard_pretalk|Извини. У меня сейчас нет на это времени.
; dlga_treebeard_questtalk:close_window|(The Ent leader slowly opens his concealed mouth and the other Ents look at you and also slowly begin to utter a long deep sound that makes the ground shake a little - you realize that they are laughing in an Entish way. A relatively young Rowan tree looking Ent stomps his seven-toed large feet in the ground and the shake almost makes you fall.)^'Easy there, Quickbeam, we don't want to hurt our young warrior friend. Hrrrm... I am Treebeard, the oldest of the Ents, and we are all grateful for your services... Hrrrm... Let me give you a gift of Ent Water to celebrate your success.'
; dlga_treebeard_questtalk:close_window.1|(The stiff-limped giant and his fellow Ents stand still in silence while a breeze passes through their leafy hairs and beards.)
dlga_treebeard_pretalk:treebeard_talk_response|Хрууум... Что бы ты хотел узнать, юный друг?
dlga_treebeard_talk_response:treebeard_about_himself|Расскажи еще о себе.
; dlga_treebeard_talk_response:treebeard_about_entwives|Tell me about the Entwives.
dlga_treebeard_talk_response:treebeard_about_ents|Расскажи мне об Энтах.
dlga_treebeard_talk_response:close_window|Не важно, прощай.
; dlga_treebeard_about_himself:treebeard_pretalk|(The Ent leader looks distant and solemn. After a while he slowly says:)^'Don't be hasty... we can talk more about this when the woods are safe from the orcs.'
; dlga_treebeard_about_himself:treebeard_pretalk.1|Hrooom... I am the oldest of my kind hmmm... I am known as Treebeard by a few mortals and the Elves call me Fangorn. Hummm... I, Skinbark and Leaflock are the only Ents who have walked the forests before the Darkness. I am no longer very bendable as I used to be... young Quickbeam can bend and sway, like a slender tree in the wind... Hummm... If the Entwives were here...
; dlga_treebeard_about_entwives:treebeard_pretalk|(The Ent leader suddenly gets an expression of sadness and his voice is unusually deep.)^'Hummm... This is a sad tale... when the woods are free from the orcs we can discuss this.'
; dlga_treebeard_about_entwives:treebeard_pretalk.1|Ahummm... the beautiful Entwives... they like to plant and grow... we should have listened more to them... Hrooom... then they left to the Brown Lands to plant gardens and they taught mortals about making the lands fertile... we used to visit them... until... Sauron attacked... the Entwives are now lost... Hummm... Fimbrethil... her hue of ripe grain... we have looked for them... but not found them... yet...
; dlga_treebeard_about_ents:treebeard_pretalk|Hrooom... We are shepherds of the Trees and we protect them from perils. We are older than any of the mortal races but not as old as the Elves who cured us from dumbness. Things have changed over the ages. In the beginning we were more hasty and flexible. Over time many of us have been lost. Some of us are still true Ents, and lively enough in our fashion, but many are growing sleepy, going tree-ish, as you might say. Most of the trees are just trees, of course; but many are half awake. Some are quite wide awake, and a few are, well, ah, well getting Entish. That is going on all the time. When that happens to a tree, you find that some have bad hearts. Still, we do what we can. We keep off strangers and the foolhardy; and we train and we teach, we walk and we weed.
dlga_start:close_window.1|Ммммм?
; dlga_start:close_window.2|Mmhhrmmm?
; dlga_start:close_window.3|Mmmrhrrhmm?
dlga_start:looters_2_join|Склонитесь перед могуществом {s4} и служите мне!
; dlga_looters_2_join:close_window|We will obey, Master.
; dlga_start:close_window.4|^^GROWL!^^
dlga_start:member_castellan_talk|Да, {playername}? Что я могу для тебя сделать?
dlga_member_castellan_pretalk:member_castellan_talk|Что-нибудь еще?
dlga_member_castellan_talk:member_review_castle_garrison|Я хочу осмотреть гарнизон замка.
dlga_member_review_castle_garrison:member_castellan_pretalk|Конечно. Вот наши списки, дайте знать, если понадобятся изменения.
dlga_member_castellan_talk:member_review_castellan_equipment|Дай взглянуть на твоё снаряжение.
dlga_member_review_castellan_equipment:member_castellan_pretalk|Хорошо, вот...
dlga_member_castellan_talk:member_castellan_join|Я хочу, чтобы вы покинули замок и присоединились к мне.
; dlga_member_castellan_join:close_window|I've grown quite fond of the place... But if it is your wish, {playername}, I'll come with you.
dlga_member_castellan_join:member_castellan_pretalk|А где же мы будем спать? Ты таскаешь за собой целую армию, {playername}, здесь не хватает комнат на всех нас.
dlga_member_castellan_talk:close_window|[Уйти]
dlga_member_chat_00:member_lady_1|{playername}, как по-твоему, когда мы уже доберемся?
dlga_member_lady_1:close_window|Нам всё еще предстоит долгий путь.
dlga_member_lady_1:close_window.1|Очень скоро. Мы уже почти на месте.
dlga_member_chat_00:member_scout_1|Мы готовы пойти в разведку. Нам отправиться сейчас?
; dlga_member_scout_1:close_window|Yes, you've got your orders. Goodbye.
dlga_member_scout_1:close_window.1|Погоди минутку, не сейчас.
dlga_do_member_trade:member_talk|Что-нибудь еще?
dlga_member_chat_00:member_talk|Да, {s5}?
dlga_member_talk:member_trade|Дай взглянуть на твоё снаряжение.
dlga_member_trade:do_member_trade|Простите, но моё снаряжение - это моё дело.
dlga_member_trade:do_member_trade.1|Хорошо, вот...
dlga_member_talk:view_member_char_requested|Что можешь рассказать мне о своих умениях?
dlga_view_member_char_requested:do_member_view_char|Хорошо, позволь мне сказать тебе...
dlga_member_talk:member_separate|Нам нужно разделиться на некоторое время.
; dlga_member_separate:member_separate_confirm|Oh really? Well, I'm not just going to wait around here. I'm going to go back to {s4}. Is that what you want?
dlga_member_separate_confirm:member_separate_yes|Верно, нам нужно разделиться.
dlga_member_separate_confirm:do_member_trade|Нет, я предпочел бы, чтобы ты был со мной.
; dlga_member_separate_yes:close_window|Well. I'll be off, then. Look me up if you need me.
dlga_member_talk:member_question|Я хотел бы спросить тебя кое-о-чем.
dlga_member_talk:close_window|Не важно.
dlga_member_question:member_question_2|Очень хорошо. Что ты хотел спросить?
; dlga_member_question_2:member_morale|How do you feel about the way things are going in this company?
dlga_member_question_2:member_health|Как твое здоровье?
dlga_member_question_2:member_background_recap|Поведай мне свою историю еще раз.
; dlga_member_background_recap_3:do_member_trade|Then shortly after, I joined up with you.
dlga_do_member_view_char:member_talk|Что-нибудь еще?
dlga_start:close_window.5|Отправимся, как только ты будешь готов.
dlga_start:close_window.6|Пожалуйста, не трать больше моего времени сегодня. Возможно, еще увидимся.
; dlga_companion_recruit_signup_response:close_window|Unfortunately, I can't take on any more hands in my party right now.
; dlga_companion_recruit_rank:close_window|It seems that you are not esteemed enough by my people, {playername}. You are a {s29} and you need to be a {s24} for me to join [{reg3} more rank points needed].^Let's speak again when you are more accomplished.
; dlga_companion_recruit_rank:companion_recruit_payment.1|I'm glad to see you have become {s29}, and I'm looking forward to joining you.
; dlga_companion_recruit_payment_response:close_window|Well, there's little I can do then.
; dlga_start:companion_recruit_meet_again|We meet again.
; dlga_companion_recruit_meet_again:companion_recruit_backstory_delayed|So... What have you been doing since our last encounter?
dlga_start:companion_recruit_secondchance|Да?
dlga_companion_recruit_secondchance:close_window|Не важно.
; dlga_companion_recruit_backstory_delayed_response:companion_recruit_signup_b|I might be able to use you in my company.
dlga_companion_recruit_backstory_delayed_response:close_window|Не важно. Возможно, в другой раз.
dlga_companion_recruit_signup_confirm:close_window|Хорошо! Дайте мне немного времени на приготовления и я буду готов отправиться.
; dlga_start:companion_rehire|My offer to rejoin you still stands, if you'll have me.
; dlga_start:companion_rehire.1|It is good to see you alive, {s5}! {s6}, and I did not know whether you had been captured, or slain, or got away. I've been waiting here since then, looking for news of your fate. Shall I get my gear together and rejoin your company?
; dlga_start:companion_was_dismissed|It is good to see you, {s21}! To tell you the truth, I had hoped to run into you.
; dlga_companion_was_dismissed:companion_rehire|{s5}. Would you want me to rejoin your company?
dlga_companion_rehire:companion_recruit_signup_confirm|С возвращением, мой друг!
; dlga_companion_rehire:companion_rehire_refused|Sorry, I can't take on anyone else right now.
; dlga_companion_rehire_refused:close_window|Well... Look me up if you change your mind, eh?
dlga_companion_objection_response:close_window|Спасибо, я ценю твою поддержку.
dlga_companion_objection_response:close_window.1|К счастью, этого не случится снова.
; dlga_companion_objection_response:close_window.2|Your objection is noted, but I have more important things on my mind.
; dlga_companion_personalityclash2_response:close_window|I deem {s11} a valuable member of this company. You should appreciate {reg11?her:him} more.
; dlga_companion_personalityclash2_response:close_window.1|You are right. I'm not happy with {s11}'s behavior myself and will let {reg11?her:him} know that.
; dlga_companion_personalityclash2_response:close_window.2|I don't have time for petty squabbles.
; dlga_companion_personalityclash_response:close_window|I deem {s11} a valuable member of this company. You should appreciate {reg11?her:him} more.
; dlga_companion_personalityclash_response:close_window.1|You are right. I'm not happy with {s11}'s behavior myself and will let {reg11?her:him} know that.
; dlga_companion_personalityclash_response:close_window.2|I don't have time for petty squabbles.
dlga_companion_personalitymatch_response:close_window|Очень хорошо.
; dlga_event_triggered:companion_faction_demolished|{s5}, {reg6?our:my} {s6} homeland is suffering grievously in the War, I ask you to consider helping {reg6?our:my} people as soon as we are rested and ready.
; dlga_companion_faction_demolished:close_window|Then we shall ride to aid {s6} immediately.
dlga_companion_faction_demolished:close_window.1|Прошу прощения, но нам нужно идти.
dlga_companion_home_description:companion_home_description_2|Расскажи еще.
dlga_companion_home_description:close_window|Сейчас не время болтать.
dlga_companion_home_description:close_window.1|Я бы хотел, чтобы мои компаньоны не беспокоили меня по таким пустякам.
; dlga_start:player_hire_troop|{s33}^^I am in charge of the forces garrisoned here at {s21}. Did you want to see me?
; dlga_player_hire_troop:player_hire_troop_give|Some of the soldiers in my group would be more useful here, to defend {s21}.
; dlga_player_hire_troop:close_window|I want to review my soldiers stationed here.
dlga_player_hire_troop:close_window.1|Мне нужно немного потренироваться.
dlga_player_hire_troop:tld_sell_prisoners|Я привел Вам немного пленников.
; dlga_tld_sell_prisoners:tld_sell_prisoners_check|{s33} Let's see the wretched scum.
; dlga_tld_sell_prisoners_check:tld_sell_prisoners_2|Let me check our dungeon records...
dlga_tld_sell_prisoners_2:player_hire_troop_nextcycle|Передумал, а?
; dlga_tld_sell_prisoners_2:player_hire_troop_nextcycle.1|I'll make sure they won't escape from our dungeons.
dlga_player_hire_troop:close_window.2|Прощайте.
; dlga_player_hire_troop_pre_pre_nextcycle:player_hire_troop_pre_nextcycle|Let me check the troop roster...
dlga_player_hire_troop_pre_nextcycle:player_hire_troop_nextcycle|Итак, ты передумал... Понятно.
; dlga_player_hire_troop_reunite:player_hire_troop_reunite_1|Let me check the troop roster...
dlga_player_hire_troop_reunite_1:player_hire_troop_nextcycle|Итак, ты передумал... Понятно.
; dlga_player_hire_troop_reunite_1:player_hire_troop_nextcycle.1|We don't have use for those troops here...^Take them back.
dlga_player_hire_troop_nextcycle:player_hire_troop|Что-нибудь еще?
dlga_start:player_siege_castle_commander_1|Что тебе нужно?
dlga_player_siege_castle_commander_1:player_siege_ask_surrender|Сдавайся! Твое положение безнадежно!
dlga_player_siege_castle_commander_1:close_window|Ничего. Я ухожу.
; dlga_player_siege_ask_surrender:player_siege_ask_surrender_treatment|Perhaps... Do you give your word of honour that we'll be treated well?
; dlga_player_siege_ask_surrender:player_siege_ask_leave_unmolested|We are ready to leave this castle to you and march away if you give me your word of honour that you'll let us leave unmolested.
dlga_player_siege_ask_surrender:close_window|Сдаться? Ха! Да мы можем удерживать эти стены, пока все не помрем от старости.
dlga_player_siege_ask_surrender_treatment:player_siege_ask_surrender_treatment_reject|Ничего я тебе не дам. Сдавайся сейчас или приготовься умереть!
dlga_player_siege_ask_surrender_treatment_reject:close_window|Ублюдок. Мы будем биться с тобой до последнего!
; dlga_player_siege_ask_surrender_treatment:player_siege_ask_surrender_treatment_accept|You will be ransomed and your soldiers will live. I give you my word.
dlga_player_siege_ask_surrender_treatment_accept:close_window|Ну хорошо. На этих условиях я согласен сдаться.
; dlga_player_siege_ask_leave_unmolested:player_siege_ask_leave_unmolested_accept|You have my word. You will not come under attack if you leave the castle.
; dlga_player_siege_ask_leave_unmolested_accept:close_window|Very well. Then we leave this castle to you. You have won this day. But we'll meet again.
dlga_player_siege_ask_leave_unmolested:player_siege_ask_leave_unmolested_reject|Неприемлемо. Мне нужны пленники.
; dlga_player_siege_ask_leave_unmolested_reject:close_window|Then we will defend this castle to the death, and this parley is done. Farewell.
dlga_defeat_lord_answer:defeat_lord_answer_1|Теперь ты мой пленник.
