; dlga_start:lady_escort_lady_succeeded|Thank you for escorting me here, {playername}, and ensuring my safe passage. Your services will be duly noted. 
dlga_lady_escort_lady_succeeded:close_window|Было честью служить Вам.
dlga_start:prison_guard_players|Добрый день, Командир. Желаете посетить тюрьму?
dlga_prison_guard_players:close_window|Да. Откройте дверь.
dlga_prison_guard_players:close_window.1|Нет, не сейчас.
dlga_start:prison_guard_talk|Да, что тебе нужно?
dlga_prison_guard_talk:prison_guard_ask_prisoners|Кто заключен здесь?
dlga_prison_guard_talk:prison_guard_visit_prison|Я хочу поговорить с пленником.
; dlga_prison_guard_ask_prisoners:prison_guard_talk|Currently, {s51} {reg1?are:is} imprisoned here.
dlga_prison_guard_visit_prison:close_window|Конечно, Командир. Входите.
dlga_prison_guard_visit_prison:prison_guard_visit_prison_2|Вам нужно получить разрешение от Лорда, чтобы поговорить с заключенными.
dlga_prison_guard_visit_prison_2:close_window|Тогда все в порядке. Я постараюсь сделать это.
; dlga_prison_guard_visit_prison_2:prison_guard_visit_prison_3|Come on now. I thought you were the boss here.
; dlga_prison_guard_visit_prison_3:prison_guard_visit_prison_4|He-heh. You got that right. Still, I can't let you into the prison.
dlga_prison_guard_visit_prison_4:close_window|Тогда все в порядке. Я сейчас же выступаюю
; dlga_prison_guard_visit_prison_4:prison_guard_visit_prison_5|I found a purse with 100 denars a few paces away. I reckon it belongs to you.
; dlga_prison_guard_visit_prison_5:close_window|Ah! I was looking for this all day. How good of you to bring it back {sir/madam}. Well, now that I know what an honest {man/lady} you are, there can be no harm in letting you inside. Go in.
dlga_prison_guard_talk:close_window|Не важно.
dlga_start:castle_guard_players|Ваши приказания, Командир?
dlga_castle_guard_players:close_window|Открой дверь. Я войду.
dlga_castle_guard_players:close_window.1|Не важно.
; dlga_start:castle_guard_sneaked_intro_1|Get out of my sight, beggar! You stink!
; dlga_start:close_window.8|Get lost before I lose my temper you vile beggar!
; dlga_castle_guard_sneaked_intro_1:castle_guard_sneaked_intro_2|I want to enter the hall and speak to the lord.
dlga_castle_guard_sneaked_intro_1:close_window|[Уйти]
; dlga_castle_guard_sneaked_intro_2:close_window|Are you out of your mind, {man/woman}? Beggars are not allowed into the hall. Now get lost or I'll beat you bloody.
dlga_start:castle_guard_intro_1|Что тебе нужно?
; dlga_castle_guard_intro_1:castle_guard_intro_2|I want to enter the hall and speak to the lord.
dlga_castle_guard_intro_1:close_window|Не важно.
dlga_castle_guard_intro_2:castle_guard_intro_2|Ты можешь пройти после того, как оставишь мне свое оружие. Никому не позволено носить оружие в покоях господина.
dlga_castle_guard_intro_2:close_window|Вот, возьми мое оружие. Я войду.
dlga_castle_guard_intro_2:castle_guard_intro_2b|Нет, я никому не отдам свое оружие.
dlga_castle_guard_intro_2b:close_window|Тогда ты не войдешь.
dlga_start:castle_gate_guard_talk|Что тебе нужно?
dlga_castle_gate_guard_pretalk:castle_gate_guard_talk|Да?
dlga_castle_gate_guard_talk:castle_gate_open|Нам нужно пристанище на ночь. Позволите ли нам войти?
dlga_castle_gate_guard_talk:request_meeting_castle_lord|Я хочу поговорить с господином этого замка.
dlga_castle_gate_guard_talk:request_meeting_other|Я хочу поговорить с кем-нибудь в этом замке.
dlga_castle_gate_guard_talk:close_window|[Уйти]
dlga_request_meeting_castle_lord:close_window|Подожди здесь. {s2} встретиться с тобой.
dlga_request_meeting_castle_lord:castle_gate_guard_pretalk|Моего господина сейчас здесь нет.
dlga_request_meeting_other:request_meeting_3|Кто там?
dlga_request_meeting_3:close_window|Не важно.
dlga_request_meeting_4:request_meeting_5|Жди тут. Я передам ему твою просьбу.
dlga_request_meeting_5:request_meeting_6|Я жду...
dlga_request_meeting_6:close_window|Все в порядке. {s2} поговорит с тобой сейчас.
; dlga_request_meeting_6:close_window.1|{s2} says he will not see you. Begone now.
; dlga_castle_gate_open:close_window|My lord {s2} will be happy to see you {sir/madam}. Come on in. I am opening the gates for you.
; dlga_castle_gate_open:close_window.1|My lord {s2} is not in the castle now. But I think he would approve of you taking shelter here. Come on in. I am opening the gates for you.
dlga_castle_gate_open:close_window.2|Заходи быстрее. Я открою ворота для тебя.
; dlga_castle_gate_open:close_window.3|Come on in. But make sure your men behave sensibly within the walls.  My lord {s2} does not want trouble here.
; dlga_castle_gate_open:close_window.4|My lord {s2} does not want you here. Begone now.
dlga_party_relieved:caravan_help0|Спасибо за помощь! Теперь мы в безопасности.
; dlga_caravan_help0:caravan_help1|Thank you for helping! We are safe now. Have you seen those large orcs before? Those do not look like regular mountain ilk we are used to fend off easily. And the paint on their shields is an ancient Mordor sign. I haven't seen those this side of the river for a long time. Dire things are afoot.. War is coming! I advise you to go to Edoras, the capital of your people, and deliver the message about what you've seen to whomever is in command there. It's an important matter, so please make haste.
; dlga_caravan_help1:caravan_help2|Yeah, I never seen such a large orc before. Nasty things.
; dlga_caravan_help2:caravan_help3|Also, I see you are a capable warrior. I have a personal business I would like your help with. There is a small fort near Nindalf swamps, where common people and travellers can find food and lodge. It's run by a local chief who does not answer neither to Gondor, nor to Rohan. I'm a merchant traveller myself, so I have respect for people wishing to be free from lordship bonds, as long as they behave. But being independent, they are also powerless before enemy onslaught. War outbreak in next several days looks like a certain thing to me. I want you to get to those people and see if you can help them survive. Tell the chief, Balan, that Torbal asked you to deliver 'a fishslap'. He will recognize it was me who sent you.
; dlga_caravan_help3:close_window|I'll deliver your message. Safe journey to you, Torbal. I'm sure we will meet again.
dlga_start:close_window.9|Ты прибыл как раз вовремя. Давай объединим наши силы и преподадим нашему врагу урок.
dlga_start:close_window.10|Ты допускаешь большую ошибку, сражаясь с нами.
; dlga_start:ally_thanks_meet|I don't think we have met properly my friend. You just saved my life out there, and I still don't know your name...
; dlga_start:ally_thanks_meet.1|Your help was most welcome stranger. My name is {s1}. Can I learn yours?
; dlga_start:ally_thanks_meet.2|Thanks for your help, stranger. We haven't met properly yet, have we? What is your name?
dlga_ally_thanks_meet:ally_thanks_meet_2|Меня зовут {playername}.
; dlga_ally_thanks_meet_2:close_window|Well met indeed {playername}. My name is {s1} and I am forever in your debt. If there is ever anything I can help you with, just let me know...
; dlga_ally_thanks_meet_2:close_window.1|Well met {playername}. I am in your debt for what you just did. I hope one day I will find a way to repay it.
; dlga_ally_thanks_meet_2:close_window.2|Well met {playername}. I am {s1}. Thanks for your help and I hope we meet again.
; dlga_start:close_window.11|Again you save our necks, {playername}! Truly, you are the best of friends. {s43}
; dlga_start:close_window.12|You arrived just in the nick of time! {playername}. You have my deepest thanks! {s43}
; dlga_start:close_window.13|You turned up just in time, {playername}. I will not forget your help. {s43}
dlga_start:close_window.14|Рад тебя здесь видеть, {playername}. {s43}
; dlga_start:close_window.17|Thank you for your help, Commander. You saved {reg1?our lives:my life} out there.
; dlga_start:close_window.18|Thank you for your help, Commander. Things didn't look very well for us but then you came up and everything changed.
; dlga_start:close_window.19|Thank you for your help, Commander. It was fortunate to have you nearby.
dlga_start:freed_hero_answer|Я в долгу перед тобой за то, что ты меня освободил, друг.
; dlga_freed_hero_answer:freed_hero_answer_1|You're not going anywhere. You'll be my prisoner now!
; dlga_freed_hero_answer_1:close_window|Alas. Will my luck never change?
dlga_freed_hero_answer:freed_hero_answer_2|Можешь идти, {s65}.
; dlga_freed_hero_answer_2:close_window|Thank you, Commander. I never forget someone who's done me a good turn.
dlga_freed_hero_answer:freed_hero_answer_3|Хочешь присоединиться ко мне?
dlga_freed_hero_answer_3:close_window|Хорошо, я присоединюсь к тебе.
dlga_freed_hero_answer_3:close_window.1|Нет, я хочу быть сам по себе.
; dlga_start:defeat_hero_answer|You'll not live long to enjoy your victory. My kinsmen will soon wipe out the stain of this defeat.
dlga_defeat_hero_answer:defeat_hero_answer_1|Теперь ты мой пленник.
; dlga_defeat_hero_answer_1:close_window|Damn you. You will regret this.
dlga_defeat_hero_answer:defeat_hero_answer_2|На этот раз можешь идти, но не попадись снова мне на пути.
dlga_defeat_hero_answer_2:close_window|Еще увидимся.
dlga_start:fugitive_1|Да, что тебе нужно?
; dlga_fugitive_1:fugitive_2|I am looking for a fugitive by the name of {s4}. You fit his description.
dlga_fugitive_1:close_window|Ничего. Извини за беспокойство.
; dlga_fugitive_2:fugitive_3|I do not know what you are talking about. You must have confused me with someone else.
; dlga_fugitive_3:fugitive_4|Then drop your sword. If you are innocent, you have nothing to fear. We'll go now and talk to the guard captain to see who is confused.
; dlga_fugitive_4:close_window|Damn you! You will not be going anywhere!
dlga_start:follow_spy_talk|Добрый день. Хорошая погода, не так ли? Прошу меня простить, но меня ждут дела.
dlga_follow_spy_talk:follow_spy_talk_2|Во имя {s1}, вы арестованы!
dlga_follow_spy_talk_2:close_window|Живым я тебе не дамся!
dlga_follow_spy_talk:close_window|Не обращай внимания. Я просто прохожу мимо.
dlga_start:spy_partners_talk|Приветствую.
dlga_spy_partners_talk:spy_partners_talk_2|Во имя {s1}, Вы арестованы!
dlga_spy_partners_talk_2:close_window|Сначала тебе придется сразиться с нами!
dlga_spy_partners_talk:close_window|Не обращай внимания. Я просто прохожу мимо.
dlga_start:runaway_serf_intro_1|Добрый день, господин.
; dlga_runaway_serf_intro_1:runaway_serf_intro_2|I have been sent by your {s4} whom you are running from. He will not punish you if you return now.
; dlga_runaway_serf_intro_2:runaway_serf_intro_3|My good master. Our lives at {s1} was unbearable. We worked all day long and still went to bed hungry. We are going to {s6} to start a new life, where we will be treated like humans.
; dlga_runaway_serf_intro_3:runaway_serf_go_back|You have gone against our laws by running from slavery. You will go back to {s1} now!
; dlga_runaway_serf_go_back:close_window|All right master. As you wish. We'll head back to {s5} now.
; dlga_start:runaway_serf_talk_caught|Good day master. We were heading back to {s5}, but I am afraid we lost our way.
; dlga_runaway_serf_talk_caught:runaway_serf_go_back|Do not test my patience. You are going back now!
; dlga_start:runaway_serf_talk_again_return|We are on our way back to {s5} master.
; dlga_runaway_serf_talk_again_return:runaway_serf_talk_again_return_2|Make haste now. The sooner you return the better.
; dlga_runaway_serf_talk_again_return:runaway_serf_talk_again_return_2.1|Good. Keep going.
dlga_runaway_serf_talk_again_return_2:close_window|Да, господин. Как пожелаете.
; dlga_mayor_talk:mayor_deliver_wine|I was told to deliver you {reg9} units of {s4}.
; dlga_mayor_deliver_wine:mayor_pretalk|At last! Our stocks were almost depleted. I had arranged for the delivery of the {s4} in advance. And give {s9} my regards.^^[earned {reg14} Resource Points of {s14}]
; dlga_mayor_talk:mayor_deliver_wine_incomplete|I was on a mission to deliver you {reg9} units of {s4}, but I lost some of the cargo to the enemy.
; dlga_mayor_deliver_wine_incomplete:mayor_pretalk|They will pay for this! Well, at least we have some {s4}. Thank you anyway.^^[earned {reg14} Resource Points of {s14}]
; dlga_start:mercenary_tavern_talk|Do you have a need for mercenaries, Commander? {reg3?Me and {reg4?{reg3} of my mates:one of my mates} are:I am} looking for a master. We'll join you for {reg5} denars.
dlga_start:mercenary_after_recruited|Какие будут приказания, Командир?
; dlga_mercenary_after_recruited:mercenary_after_recruited_2|Make your preparations. We'll be moving at dawn.
; dlga_mercenary_after_recruited:mercenary_after_recruited_2.1|Take your time. We'll be staying in this town for a while.
; dlga_mercenary_after_recruited_2:close_window|Yes, Commander. We'll be ready when you tell us to leave.
; dlga_mercenary_tavern_talk:mercenary_tavern_talk_hire|All right. I will hire all of you. Here is {reg5} denars.
; dlga_mercenary_tavern_talk:mercenary_tavern_talk_hire.1|All right. But I can only hire {reg6} of you. Here is {reg5} denars.
; dlga_mercenary_tavern_talk:tavern_mercenary_cant_lead|That sounds good. But I can't afford to hire any more men right now.
; dlga_tavern_mercenary_cant_lead:close_window|That's a pity. Well, {reg3?we will:I will} be lingering around here for a while, if you need to hire anyone.
; dlga_mercenary_tavern_talk:tavern_mercenary_cant_lead.1|That sounds good. But I can't lead any more men right now.
; dlga_mercenary_tavern_talk:close_window|Sorry. I don't need any other men right now.
; dlga_start:trainer_pretalk|You have survived up to Gauntlet wave {reg2}. {s4}
dlga_start:trainer_pretalk.1|Очень хорошо, Вы справились со всеми противниками.
dlga_start:trainer_talk|Добрый день. Готовы немного потренироваться сегодня?
dlga_trainer_pretalk:trainer_talk|Готов немного потренироваться?
; dlga_trainer_talk:trainer_combat_begin|First, tell me something about combat...
dlga_trainer_talk:trainer_choose_mode|Я готов к тренировке.
dlga_trainer_talk:close_window|Мне нужно уходить. Прощай.
dlga_trainer_combat_begin:trainer_talk_combat|Что бы ты хотел узнать?
dlga_trainer_combat_pretalk:trainer_talk_combat|Что еще ты бы хотел узнать?
dlga_trainer_talk_combat:trainer_explain_defense|Расскажи о самозащите.
; dlga_trainer_talk_combat:trainer_explain_attack|Tell me about attacking with weapons.
; dlga_trainer_talk_combat:trainer_explain_horseback|Tell me about fighting on horseback.
; dlga_trainer_talk_combat:trainer_pretalk|I guess I know all the theory I need. Let's talk about something else.
; dlga_trainer_explain_defense:trainer_explain_defense_2|Good question. The first thing you should know as a fighter is how to defend yourself. Keeping yourself out of harm's way is the first rule of combat, and it is much more important than giving harm to others. Everybody can swing a sword around and hope to cut some flesh, but only those fighters that are experts at defense live to tell of it.
; dlga_trainer_explain_defense_2:trainer_explain_defense_3|Now. Defending yourself is easiest if you are equipped with a shield. Just block with your shield. [Hold down the right mouse button to defend yourself with the shield.] In this state, you will be able to deflect all attacks that come from your front. However, you will still be open to strikes from your sides or your back.
dlga_trainer_explain_defense_3:trainer_explain_defense_4|Что, если у меня нет щита?
; dlga_trainer_explain_defense_4:trainer_combat_pretalk|Then you will have to use your weapon to block your opponent. This is a bit more difficult than defending with a shield. Defending with a weapon, you can block against only ONE attack direction. That is, you block against either overhead swings, side swings or thrusts. Therefore you must watch your opponent carefully and start to block AFTER he starts his attack. In this way you will be able to block against the direction of his current attack. If you start to block BEFORE he makes his move, he may just attack in another direction than the one you are blocking against and score a hit.
; dlga_trainer_explain_attack:trainer_explain_attack_2|Good question. Attacking is the best defence, they say. A tactic many fighters find useful is taking an offensive stance and readying your weapon for attack, waiting for the right moment for swinging it. [You can ready your weapon for attack by pressing and holding down the left mouse button.]
; dlga_trainer_explain_attack_2:trainer_explain_attack_3|That sounds useful.
; dlga_trainer_explain_attack_3:trainer_explain_attack_4|It is a good tactic, but remember that, your opponent may see that and take a defensive stance against the direction you are swinging your weapon. If that happens, you must break your attack and quickly attack from another direction [You may cancel your current attack by quickly tapping the right mouse button].
; dlga_trainer_explain_attack_4:trainer_explain_attack_5|If my opponent is defending against the direction I am attacking from, I will break and use another direction.
; dlga_trainer_explain_attack_5:trainer_combat_pretalk|Yes, selecting the direction you swing your weapon is a crucial skill. There are four main directions you may use: right swing, left swing, overhead swing and thrust. You must use each one wisely. [to control your swing direction with default controls, move your mouse in the direction you want to swing from as you press the left mouse button].
; dlga_trainer_explain_horseback:trainer_combat_pretalk|Very good question. A horse may be a warrior's most powerful weapon in combat. It gives you speed, height, power and initiative. A lot of deadly weapons will become even deadlier on horseback. However you must pay particular attention to horse-mounted enemies couching their lances, as they may take down any opponent in one hit. [To use the couched lance yourself, wield a lance or similar weapon, and speed up your horse without pressing attack or defense buttons. after you reach a speed, you'll lower your lance. Then try to target your enemies by maneuvering your horse.]
; dlga_trainer_choose_mode:trainer_choose_mode_player|We have several training modes to improve our soldiers' skills. Single combat will pit you against one to four opponents, in team combat your team of four will face four, eight or twelve combatants, and, finally, Gauntlet is the ultimate challenge for any warrior - you'll face waves of increasing number of opponents all by yourself. Mass melee is a simple brawl.^Which one do you prefer?
; dlga_trainer_choose_mode_player:trainer_choose_opponents|Single combat.
; dlga_trainer_choose_mode_player:trainer_choose_opponents.1|Team combat.
; dlga_trainer_choose_mode_player:trainer_choose_weapon|Gauntlet.
; dlga_trainer_choose_mode_player:trainer_choose_weapon.1|Mass melee.
; dlga_trainer_choose_mode_player:trainer_pretalk|None of that, I've changed my mind.
dlga_trainer_choose_opponents:trainer_choose_opponents_player|Теперь выберите число противников.
dlga_trainer_choose_opponents_player:trainer_choose_weapon|Один.
dlga_trainer_choose_opponents_player:trainer_choose_weapon.1|Два.
dlga_trainer_choose_opponents_player:trainer_choose_weapon.2|Три.
dlga_trainer_choose_opponents_player:trainer_choose_weapon.3|Четыре. Удача сегодня на моей стороне.
dlga_trainer_choose_opponents_player:trainer_choose_weapon.4|Четыре.
dlga_trainer_choose_opponents_player:trainer_choose_weapon.5|Восемь.
; dlga_trainer_choose_opponents_player:trainer_choose_weapon.6|Twelve, me and my companions can take on anyone.
; dlga_trainer_choose_opponents_player:trainer_pretalk|None, I've changed my mind.
dlga_trainer_choose_weapon:trainer_choose_weapon_player|И, наконец, выберите оружие, которое предпочитаете.
dlga_trainer_choose_weapon_player:trainer_begin_training|Одноручное оружие.
dlga_trainer_choose_weapon_player:trainer_begin_training.1|Двуручное оружие.
; dlga_trainer_choose_weapon_player:trainer_begin_training.2|Polearms.
; dlga_trainer_choose_weapon_player:trainer_begin_training.3|Bows.
dlga_trainer_choose_weapon_player:trainer_begin_training.4|Бросай оружие.
; dlga_trainer_choose_weapon_player:trainer_pretalk|None, I've changed my mind.
; dlga_trainer_begin_training:close_window|Very well, here we go. Once you finish training, come back and speak to me.
; dlga_start:close_window.20|Away with you, vile beggar.
; dlga_start:mayor_begin|Good day, my lord.
; dlga_start:mayor_talk|Hello stranger, you seem to be new to {s9}. I am the guild master of the town.
dlga_start:mayor_begin.1|Добрый день, {playername}.
; dlga_mayor_begin:lord_deal_with_night_bandits_completed|Very nice work, {playername}, you made short work of those lawless curs!^^[earned {reg14} Resource Points of {s14}]
; dlga_lord_deal_with_night_bandits_completed:close_window|They had it coming.
; dlga_mayor_talk:mayor_deliver_iron|I've brought you better quality metal, {reg9} units of {s4}, when you requested {s3}.
; dlga_mayor_talk:mayor_deliver_iron.1|Here's your metal supply, {reg9} units of {s4}.
; dlga_mayor_talk:mayor_deliver_iron.2|I've brought more metal, {reg8} units of {s4}, when you requested {reg9}.
; dlga_mayor_deliver_iron:mayor_deliver_iron_completed|Very nice work, {playername}. Our smiths will find ways to put everything they are given to good use.
dlga_mayor_deliver_iron_completed:close_window|Делаю, что могу.
; dlga_mayor_talk:mayor_deliver_food|Here's your food, {reg9} units.
; dlga_mayor_deliver_food:mayor_deliver_food_completed|Very nice work, {playername}, our food stores are full again and nobody will starve for now.
dlga_mayor_deliver_food_completed:close_window|Делаю, что могу.
; dlga_mayor_begin:mayor_looters_quest_response|Ah, {playername}. Have you any progress to report?
; dlga_mayor_looters_quest_response:mayor_looters_quest_destroyed|I've killed some tribal orcs.
dlga_mayor_looters_quest_response:close_window|Еще нет, сэр. Прощайте.
; dlga_mayor_looters_quest_destroyed:mayor_looters_quest_destroyed_2|Aye, my scouts saw the whole thing. That should keep those tribal orcs at bay!^^[earned {reg14}x{reg15} Resource Points of {s14}]
; dlga_mayor_looters_quest_destroyed_2:close_window|And that's not the only good news! Thanks to you, the tribal orcs have ceased to be a threat. We've not had a single attack reported for some time now.  If there are any of them left, they've either run off or gone deep into hiding. That's good for the safety of the place!  I think that concludes your task, {playername}. Thank you, and farewell.
dlga_mayor_looters_quest_destroyed_2:mayor_looters_quest_response|Тебе нужно что-нибудь еще?
; dlga_mayor_begin:close_window|Good to see you again {playername}. I have heard that you have delivered those people successfully.  I will tell our commander how reliable you are.^^[earned {reg14} Resource Points of {s14}]
; dlga_mayor_begin:move_cattle_herd_failed|I heard that you have lost those people on your way to {s9}.  I had a very difficult time explaining your failure to the commander here.  Do you have anything to say?
; dlga_move_cattle_herd_failed:move_cattle_herd_failed_2|I am sorry. But I was attacked on the way.
; dlga_move_cattle_herd_failed:move_cattle_herd_failed_2.1|I am sorry. Those people wandered off during the night.
; dlga_move_cattle_herd_failed_2:close_window|Well, it was your responsibility to deliver them safely, no matter what.  You should know that the commander demanded to know who is responsible for this failure.  So I told him it was you.
; dlga_mayor_begin:mayor_friendly_pretalk|I have heard about your deeds. You have given those goblins the punishment they deserved.  You are really as good as they say.^^[earned {reg14} Resource Points of {s14}]
dlga_mayor_begin:mayor_talk|Что я могу сделать для тебя?
; dlga_mayor_friendly_pretalk:mayor_talk|Now... What else may I do for you?
