dlga_lord_tell_objective:lord_pretalk.2|Мы отдыхаем в {s1}{s5}.
dlga_lord_tell_objective:lord_pretalk.3|Мы путешествуем в {s1}{s5}.
dlga_lord_tell_objective:lord_pretalk.4|Мы собираем новых солдат из {s1}.
dlga_lord_tell_objective:lord_pretalk.5|Мы разведываем территорию вокруг {s1}{s5}.
; dlga_lord_tell_objective:lord_pretalk.6|We are laying waste to the village of {s1}.
dlga_lord_tell_objective:lord_pretalk.7|Мы отступаем в {s1}.
dlga_lord_tell_objective:lord_pretalk.8|Мы осаждаем {s1}{s5}.
dlga_lord_tell_objective:lord_pretalk.9|Мы сражаемся против {s1}{s5}.
dlga_lord_tell_objective:lord_pretalk.10|Мы сопровождаем {s1}{s5}.
dlga_lord_tell_objective:lord_pretalk.11|Мы пересмотрим наши следующие задачи.
dlga_lord_tell_objective:lord_pretalk.12|Я не знаю: {reg1} {s1}
dlga_lord_active_mission_1:lord_mission_sorcerer_completed|Колдун из Лихолесья был убит, моя Госпожа.
dlga_lord_active_mission_1:lord_mission_sorcerer_failed|Простите меня, моя Госпожа, но срочные вопросы препятствовали тому, чтобы убить Колдуна, и тем временем он сбежал.
dlga_lord_active_mission_1:lord_mission_sorcerer_failed.1|Колдун из Лихолесья остался в живых. Мы прервали его ритуал, но он смог сбежать.
dlga_lord_mission_sorcerer_completed:lord_pretalk|Да, {playername}, я почувствовала его смерть. Завеса Колдуна была снята с лесов и большая часть моих сил вернулась ко мне. Ты совершил огромную службу нашим людям и поэтому ты заслужил этот подарок. Возьми его...
; dlga_lord_mission_sorcerer_failed:lord_pretalk|Yes {playername}, I sense the dark arts of enemy still pressing upon us. His efforts seem greater now. It is unfortunate that you could not stop him. No doubt he will take additional precautions in future to ward against our efforts. He will likely never be found while Dol Guldur still stands. Thank you for your efforts but leave me now. I grow tired.
; dlga_lord_active_mission_1:lord_lend_companion_end|Oh, you want your companion back? I see...
; dlga_lord_active_mission_1:lord_pretalk|{playername}, I must beg your patience, I still have need of your companion. Please return later when things have settled.
; dlga_lord_active_mission_1:lord_active_mission_2|Yes, have you made any progress on it?
; dlga_lord_active_mission_2:lord_generic_mission_thank|Indeed. I brought you {reg1} prisoners.
; dlga_lord_active_mission_2:lord_generic_mission_thank_extra|Why, I have brought you {reg2} prisoners, in case {reg1} are not enough.
; dlga_lord_active_mission_2:lord_generic_mission_thank.1|Indeed. I have rescued {reg1} allied prisoners and they joined my party.
; dlga_lord_active_mission_2:lord_generic_mission_thank.2|Indeed. I have scouted {s13}.
; dlga_lord_active_mission_2:lord_generic_mission_thank.3|Indeed. I have dispatched the scouts.
; dlga_lord_active_mission_2:lord_generic_mission_thank.4|Indeed. I have defeated enough enemy parties.
; dlga_lord_active_mission_2:capture_enemy_hero_thank|Oh, indeed. I've captured an enemy commander for you.
; dlga_capture_enemy_hero_thank:capture_enemy_hero_thank_2|Many thanks, my friend. He will serve very well for questioning. You've done a fine work here.
dlga_capture_enemy_hero_thank_2:lord_pretalk|Конечно, {s65}.
; dlga_capture_enemy_hero_thank_2:lord_pretalk.1|It was nothing.
; dlga_lord_active_mission_2:lord_raise_troops_thank|Indeed. I have raised {reg1} {s13}. You can take them.
; dlga_lord_active_mission_2:lord_hunt_down_fugitive_success|I found {s4} hiding in {s3} and gave him his punishment.
dlga_lord_active_mission_2:lord_hunt_down_fugitive_fail|Боюсь, он убежал.
; dlga_lord_hunt_down_fugitive_success:lord_hunt_down_fugitive_success_2|And we'll all be a lot better off without him! Thank you, {playername},  for removing this long-festering thorn from my side. 'Tis good to know you can be trusted to handle things  with an appropriate level of tactfulness.  I've sent a note to our intendants already, and you can count on additional supplies from us.
dlga_lord_hunt_down_fugitive_success_2:lord_hunt_down_fugitive_reward_accept|Спасибо тебе, {s65}.
; dlga_lord_hunt_down_fugitive_reward_accept:lord_pretalk|I'll notify our intendants of your service, {playername}. Once again, you've my thanks for ridding me of that {s44}.
; dlga_lord_hunt_down_fugitive_fail:lord_pretalk|It is a sad day when that {s44} manages to avoid my grasp yet again. I thought you would be able to do this, {playername}. Clearly I was wrong.
dlga_lord_active_mission_2:lord_active_mission_3|Я все еще над этим работаю.
dlga_lord_active_mission_2:lord_mission_failed|Боюсь, что не смогу выполнить это задание.
dlga_lord_active_mission_3:lord_pretalk|Хорошо. Помни, я на тебя рассчитываю.
; dlga_lord_request_mission_ask:lord_pretalk|You still haven't finished the last task I gave you, {playername}. You should be working on that, not asking me for other things to do.
dlga_lord_request_mission_ask:lord_pretalk.1|Сейчас у меня нет поручений для тебя.
dlga_lord_request_mission_ask:lord_tell_mission|Задание?
; dlga_lord_tell_mission:lord_mission_capture_troll_1|You are a brave servant, {playername}, and we will give you a glimpse of our plans. We need fresh monstrous blood and flesh. We need it to twist it and bend it and torture it and tame it and reshape it and breed it, to forge and strengthen our own breeds of colossal warriors!
; dlga_lord_mission_capture_troll_1:lord_mission_capture_troll_2|How can I serve, Master?
dlga_lord_mission_capture_troll_2:lord_mission_capture_troll_3|Дикий пещерный тролль, {playername}. Схвати одного посильнее и приведи ко мне, живьем. Нам нужен еще один из них для наших экспериментов! А лучше два. Чем у нас будет троллей, тем лучше.
dlga_lord_mission_capture_troll_3:lord_mission_capture_troll_infoa|Где можно отыскать такого зверя?
dlga_lord_mission_capture_troll_3:lord_mission_capture_troll_infob|Как можно изловить такого зверя?
dlga_lord_mission_capture_troll_3:lord_mission_capture_troll_infoc|Как можно привезти тебе такого зверя?
dlga_lord_mission_capture_troll_3:lord_mission_capture_troll_accepted|Будет Вам дикий тролль, Господин.
dlga_lord_mission_capture_troll_3:lord_mission_capture_troll_rejected|Пощадите, Господин! Эта тварь раздавит меня, как жука!
; dlga_lord_mission_capture_troll_infoa:lord_mission_capture_troll_3|In these time of blood and shadows, wild cave trolls are growing excited and they are spreading from their lairs in the Misty Mountains... the best place where to look would be around the caves there.
; dlga_lord_mission_capture_troll_infob:lord_mission_capture_troll_3|You shall find one, and take it down in combat. Fear not of killing it during the fight: a troll is too coriaceous a beast for your weapons to kill it right away... and they do recover, more than you would expect. After it falls over its own black blood, you shall carry it to our feet, still breathing.
; dlga_lord_mission_capture_troll_infoc:lord_mission_capture_troll_3|You will be provided with a robust wheeled cage. It harbours more than enough space for a troll, and it can be pulled around. Hasten your steps on the way back: not even the metal of the cage is totally safe against the fury of a troll blinded by rage and pain. Make sure it does not break free and kill you.
; dlga_lord_mission_capture_troll_rejected:lord_pretalk|Only now you reveal what you are really worth, but I knew that of you all along. Weak, coward {playername}. Now begone.
; dlga_lord_mission_capture_troll_accepted:lord_pretalk|I knew I could count on your strength and bravery. Slaves, give to {playername} one of our wheeled cages! {playername}, return when you have my gift. I want it before {reg1} dawns are passed.
; dlga_lord_tell_mission:lord_tell_mission_kill_troll|Our land is facing dangers that were unheard of in our times. People are disappearing in the outskirts of {s3}. Not only commoners, but even small armed groups who venture outside the walls never return. There have been the strangest rumors, but I know what we are facing.
; dlga_lord_tell_mission_kill_troll:lord_mission_told|Wild trolls, {playername}. Giant beasts, twisted montrousities. They never ventured so far from their dark caves in the mountains but at least one of them have been sighted around {s3}. I don't know what witchery has caused this, but I need that thing to be dispatched.
dlga_lord_mission_told:lord_mission_kill_troll_info_a|Как можно сразить этих тварей?
; dlga_lord_mission_kill_troll_info_a:lord_mission_told|A troll is a dangerous creature indeed. A giant monster which possesses an incredible strength in its deformed muscles. Their skin is as hard as iron, and a tree trunk is but a small club when wielded in their hands. It is rumored that a single troll can esily best a group of half a dozen well armed and trained men, wasting each of them with a single blow. Not only men but horses too fear trolls. Be careful if you plan to charge one while mounted.
; dlga_lord_mission_told:lord_mission_kill_troll_info_b|Do you think it comes from Mordor, or Isengard?
; dlga_lord_mission_kill_troll_info_b:lord_mission_told|No, I don't think so. We have news that both the White Wizard and the Black Tower have all kinds of monsters among their ranks, but from what I hear the beast terrifying {s3} is one savage, untamed beast. Remember, there could be more than one. But you can be sure that some obscure craft from the Enemy has led this new plague upon us.
; dlga_lord_tell_mission:lord_mission_investigate_fangorn_0|Here is a mission for a trusted and brave servant like you, {playername}. The strangest rumors reach my ears from the forest of Fangorn. Minions sent to harvest wood, and even my commanders traversing the place, occasionally fail to return. Other times, they report of mysterious losses among their troops. They blame ghosts, spirits of the wood, ancient curses... Nonsense! Puny excuses for their own cowardice or ineptitude!
dlga_lord_mission_investigate_fangorn_0:lord_mission_investigate_fangorn_1|Что прикажете с этим делать, Господин?
; dlga_lord_mission_investigate_fangorn_0:lord_mission_investigate_fangorn_rejected|But Master, there is danger and pain in Fangorn! I've felt it myself!
; dlga_lord_mission_investigate_fangorn_1:lord_mission_investigate_fangorn_2|Maybe it is just that my other servants are unable to prevent the most cowardly worms in their troops from deserting.  Fools, blinded by superstitions.   Or, maybe, it is the treacherous ambushes of elven scum, hiding in the putrid trees as they usually do.   It could even be lowborn traitors from Rohan.  Or who knows what else. I want you to find out, {playername}.
dlga_lord_mission_investigate_fangorn_2:lord_mission_investigate_fangorn_accepted|Я не боюсь ни эльфов, ни духов. Предоставьте это мне, Господин.
; dlga_lord_mission_investigate_fangorn_2:lord_mission_investigate_fangorn_rejected|Master, pity your servant! Don't ask me to venture in that cursed place!
; dlga_lord_mission_investigate_fangorn_rejected:lord_pretalk|So you are like the other worms: a superstitious, worthless coward.  I overestimated you. Now, begone!
; dlga_lord_mission_investigate_fangorn_accepted:lord_pretalk|Good. Go there and shed some light on this matter. Then return to me and report. I expect to see you back with news before {reg1} dawns are passed.
; dlga_lord_tell_mission:lord_mission_find_lost_spears|Here is a mission for a trusted and brave commander like you, {playername}. We are ill equipped to fight off the Rhun hordes. Our armies are losing battles one by one. A legend tells that once upon a time, there were spears made by Dwarves for the armies of the great King Bladorthin (long since dead), each had a thrice-forged head and their shafts were inlaid with cunning gold, but they were never delivered or paid for..
dlga_lord_mission_find_lost_spears:lord_mission_find_lost_spears_1|Что прикажете с эти сделать, мой повелитель?
; dlga_lord_mission_find_lost_spears_1:lord_mission_find_lost_spears_2|These weapons would increase the effectiveness of our armies, but above all they will lift the spirits of our men. You'll have to find these spears. You'll have to go ask the dwarves for permission to search for the spears in the deeps of the Lonely Mountain. Beware, you may encounter some orcs or trolls in the tunnels. Are you available for this task?
dlga_lord_mission_find_lost_spears_2:lord_mission_find_lost_spears_accepted|Я не боюсь ни орков, ни троллей! Я найду для Вас эти копья, мой повелитель.
dlga_lord_mission_find_lost_spears_2:lord_mission_find_lost_spears_rejected|Боюсь, что не смогу Вам помочь, мой повелитель.
; dlga_lord_mission_find_lost_spears_rejected:lord_pretalk|I see that discretion is the better part of your valor. Maybe you should stick to scouting duties.
dlga_lord_mission_find_lost_spears_accepted:lord_pretalk|В таком случае удачи!
; dlga_lord_tell_mission:lord_mission_mirkwood_sorcerer|There is an important service you can deliver to our people, {playername}.
; dlga_lord_mission_mirkwood_sorcerer:lord_mission_mirkwood_sorcerer_0|My power to defend and preserve Lothlorien has been diminished by the devices of the enemy. A master sorcerer of Dol Guldur is invoking powerful charms that inhibit our defenses. Though he is a mortal, he has become one of the enemies greatest pupils in the use of arcane rituals and he represents a great threat to our people. You must hunt him down and destroy him!
; dlga_lord_mission_mirkwood_sorcerer_0:lord_mission_mirkwood_sorcerer_1|Where can I find the sorcerer, my Lady?
; dlga_lord_mission_mirkwood_sorcerer_1:lord_mission_mirkwood_sorcerer_2|Search for him in Mirkwood forest, not far from Dol Guldur itself. He is both a well guarded and a cautious foe so you will need to use stealth to prevent the alarm from being raised. If he escapes, he will relocate to other dark places that we know not of and continue his wickedness unchallenged. There will be only one opportunity to defeat him. Much depends on your success. Go with our blessings.
dlga_lord_mission_mirkwood_sorcerer_2:lord_pretalk|Как прикажете, моя Леди. Я приложу все усилия, чтобы покончить с этим злом.
; dlga_lord_mission_mirkwood_sorcerer_2:lord_mission_mirkwood_sorcerer_rejected|Forgive me, my Lady. I have some pressing matters to attend before I can help your people with this endevour.
; dlga_lord_mission_mirkwood_sorcerer_rejected:lord_pretalk|I understand, {playername}. But do not tally for too long, I'm growing tired of resisting his evil magic.
; dlga_lord_tell_mission:lord_mission_deliver_message|I need to send a letter to {s13} who should be currently at {s4}. If you will be heading towards there, would you deliver it to him? The letter needs to be in his hands in 30 days.
; dlga_lord_mission_deliver_message:lord_mission_deliver_message_accepted|Certainly, I intend to pass by {s4} and it would be no trouble.
; dlga_lord_mission_deliver_message:lord_mission_deliver_message_rejected|I doubt I'll be seeing {s13} anytime soon, {s65}. You'd best send it with someone else.
; dlga_lord_mission_deliver_message_accepted:close_window|I appreciate it, {playername}. Here's the letter. Give my regards to {s13} when you see him.
; dlga_lord_mission_deliver_message_rejected:lord_pretalk|Ah, all right then. Well, I am sure I will find someone else.
; dlga_lord_tell_mission:lord_mission_deliver_message.1|I need to deliver a letter to {s13} of {s15}, who must be at {s4} currently. If you are going towards there, would you deliver my letter to him? The letter needs to reach him in 40 days.
; dlga_lord_tell_mission:lord_mission_told|There is an urgent matter... My messenger is due to report on our battle plans to commanders in {s14}. His trip has been postponed several times already with all the trouble on the roads, but this time he must get through. So, I want to at least make sure he's well-guarded. I trust you well, {playername} so I would be very grateful if you could escort him to {s14} and make sure he arrives safe and sound.
; dlga_lord_tell_mission:lord_mission_told.1|I have a friend here, an old warrior, who is very sick. Pestilence has infected an old battle wound,and unless he is seen to by a surgeon soon, he will surely die. This man is dear to me, {playername},but he's also stubborn as a hog and refuses to have anyone look at his injury because he doesn't trust the physicians here.I have heard that you've a capable surgeon with you. If you would let your surgeon come here and have a look,{reg3?she:he} may be able to convince him to give his consent to an operation.Please, I will be deeply indebted to you if you grant me this request.
dlga_lord_tell_mission_raise_troops:lord_tell_mission_raise_troops_2|Сколько людей тебе понадобится?
; dlga_lord_tell_mission_raise_troops_2:lord_mission_raise_troops_told|If you can raise {reg1} {s14} and bring them to me, that will probably be enough.
; dlga_lord_mission_raise_troops_told:lord_mission_raise_troops_accepted|Of course, {s65}. Give me {reg1} fresh recruits and I'll train them to be {s14}.
dlga_lord_mission_raise_troops_told:lord_mission_raise_troops_rejected|Я слишком занят сейчас, чтобы кого-то тренировать.
; dlga_lord_mission_raise_troops_accepted:close_window|You've taken a weight off my shoulders, {playername}. I shall tell my sergeants to send you the recruits and attach them to your command. Also, I'll advance you some money to help with expenses. Here, this purse should do it. Thank you for your help.
; dlga_lord_mission_raise_troops_rejected:lord_pretalk|Oh, of course. I had expected as much. Well, good luck to you then.
; dlga_lord_tell_mission:lord_mission_hunt_down_fugitive_told|I have something you could help with, an issue with the lawless villain known as {s4}.  He murdered one of my bodyguards and has been on the run from his judgment ever since. There were news recently that the fugitive has been seen at {s3}. You might be able to hunt him down and deliver him swift justice, and I'll reward you in turn.
; dlga_lord_mission_hunt_down_fugitive_told:lord_mission_hunt_down_fugitive_accepted|Then I will hunt him down and execute the law.
dlga_lord_mission_hunt_down_fugitive_told:lord_mission_hunt_down_fugitive_rejected|Я сейчас слишком занят чтобы следовать за тобой.
; dlga_lord_mission_hunt_down_fugitive_accepted:close_window|That's excellent, {playername}.  I will be grateful, and of course your prowess wil be duly noted.  Well, good hunting to you.
dlga_lord_mission_hunt_down_fugitive_rejected:lord_pretalk|Как
; dlga_lord_tell_mission:lord_mission_told.2|Well, some of the slaves working in {s4} have run away.  The ungrateful swine, whose lives we spared!  From what I've been hearing, they're running to {s3} as fast as they can, and have split up into three groups to try and avoid capture. I want you to capture all three groups and fetch them back to {s4} by whatever means necessary. I should really have them hanged for attempting to escape, but we need hands now, so I'll let them go off this time with a good beating.
; dlga_lord_tell_mission:lord_tell_mission_follow_spy|I have good information that a man in this very town is actually an enemy spy. He should be seized and hanged for his impudence, but we also believe that very soon he will leave town to meet with his master, the man to whom the spy feeds all his little whispers. The spy himself is of little import, but the master is a dangerous man, and could tell us a great deal if we could only get our hands on him...
; dlga_lord_tell_mission_follow_spy:lord_tell_mission_follow_spy_2|I want you to wait here until the spy leaves town. Then you must follow him, stealthily, to the meeting place. You must take absolute care not to be seen by the spy on your way, else he may suspect foul play and turn back. When the master appears, you must ambush and arrest them and bring the pair back to me. Alive, if you please.
dlga_lord_tell_mission_follow_spy_2:lord_tell_mission_follow_spy_accepted|Я сделаю это, {s65}.
dlga_lord_tell_mission_follow_spy_2:lord_tell_mission_follow_spy_rejected|Нет, эти прятки не для меня.
; dlga_lord_tell_mission_follow_spy_accepted:close_window|Good, I'm sure you'll do a fine job of it. One of my men will point the spy out to you when he leaves, so you will know the man to follow. Remember, I want them both, and I want them alive.
; dlga_lord_tell_mission_follow_spy_rejected:lord_pretalk|A shame. Well, carry on as you were, {playername}...
; dlga_lord_tell_mission:lord_tell_mission_capture_enemy_hero|There is a difficult job I need done, {playername}, and you may be the one who can carry it off. I need someone to capture one of the enemy commanders and bring him to me. Afterwards, I'll be able to question him on the enemy battle plans. It is a simple enough job, but whomever you choose will be guarded by an elite band of personal retainers. Are you up for a fight?
dlga_lord_tell_mission_capture_enemy_hero:lord_tell_mission_capture_enemy_hero_accepted|Считай, что уже сделано, {s65}.
; dlga_lord_tell_mission_capture_enemy_hero:lord_tell_mission_capture_enemy_hero_rejected|I must refuse, {s65}. I don't want to get close to any of them.
; dlga_lord_tell_mission_capture_enemy_hero_accepted:close_window|I like your spirit! Go and bring me one of our enemies, and I'll toast your name in my hall when you return! And reward you for your efforts, of course...
; dlga_lord_tell_mission_capture_enemy_hero_rejected:lord_pretalk|Clearly you lack the mettle I had thought you possessed. Very well, {playername}, I will find someone else.
; dlga_lord_tell_mission:lord_tell_mission_lend_companion|I don't have a task for you right now, but your companion {s3} is a skilled {reg3?lass:fellow} and I need someone with {reg3?her:his} talents. Will you lend {reg3?her:him} to me for a while?
dlga_lord_tell_mission_lend_companion:lord_tell_mission_lend_companion_2|Как долго тебе понадобится {reg3?her:him}?
dlga_lord_tell_mission_lend_companion_2:lord_mission_lend_companion_told|Всего лишь несколько дней. Самое большее - неделя.
dlga_lord_mission_lend_companion_told:lord_tell_mission_lend_companion_accepted|Затем я покину {s3} с тобой на одну неделю.
; dlga_lord_mission_lend_companion_told:lord_tell_mission_lend_companion_rejected|I am sorry, but I cannot do without {s3} for a whole week.
; dlga_lord_tell_mission_lend_companion_accepted:close_window|I cannot thank you enough, {playername}. Worry not, your companion shall be returned to you with due haste.
; dlga_lord_tell_mission_lend_companion_rejected:lord_pretalk|Well, that's damned unfortunate, but I suppose I cannot force you or {s3} to agree. I shall have to make do without.
; dlga_lord_tell_mission:lord_mission_told.3|Our scouts have noticed a recent increase in enemy activity. Unfortunately they almost never succeed in capturing live prisoners and bring them in for questioning, so we can piece together what the enemy is up to. So, I need a good warrior to find me {reg1} enemy prisoners, that I may question them.
dlga_lord_tell_mission:lord_pretalk|Нет, {playername}. На этот раз мне не нужна твоя помощь.
dlga_lord_mission_told:lord_mission_accepted|Можете на меня рассчитывать, {s65}.
dlga_lord_mission_told:lord_mission_rejected|Боюсь, что не могу сейчас взять на себя это задание.
dlga_lord_mission_accepted:close_window|Превосходно, {playername}, превосходно. Я полагаю все надежды на тебя.
dlga_lord_mission_rejected:close_window|Это так? Ну я полагаю, что вам это просто не по плечу. Я найду кого-то более смелого.
dlga_lord_talk:lord_leave_prison|Я должен уйти.
dlga_lord_talk:lord_leave|Этот небольшой разговор окончен. Я ухожу.
dlga_lord_talk:lord_leave.1|Прошу прощения, я ухожу.
dlga_lord_leave_prison:close_window|Увидимся.
dlga_lord_leave:close_window|Еще посмотрим,  {playername}.
dlga_lord_leave:close_window.1|Конечно, {playername}. Прощай.
dlga_lord_leave:close_window.2|Удачной дороги тебе, {playername}.
dlga_lord_leave:close_window.3|Да, да. Прощай.
dlga_lord_leave:close_window.4|Еще увидимся.
