
str_battle_won_unfriendly_default|О, ты здесь. Что ж, лучше поздно, чем никогда.
str_battle_won_unfriendly_martial|В прошлом мы не очень ладили, но сейчас давай просто порадуемся победе!
str_battle_won_unfriendly_quarrelsome|Если ждешь благодарностей, то жди себе дальше. Твоя помощь была не особо нужна, да и у тебя не было других дел, правда?
str_battle_won_unfriendly_pitiless|Ты приш{ёл/ла} сюда, как шакал на труп льва! Ну что ж, угощайся, не буду тебе мешать.
str_battle_won_unfriendly_cunning|{playername}... Что ж, думаю, ты тут не помешаешь, хотя не могу сказать, что мне приятно видеть тебя.
str_battle_won_unfriendly_sadistic|Прочь, стервятник! Это моя победа, и не думай даже украсть хоть малую часть моей славы!
str_battle_won_unfriendly_goodnatured|О, это ты. Ну что ж, думаю, надо поблагодарить тебя за помощь.
str_battle_won_unfriendly_upstanding|Спасибо, что приш{ёл/ла} ко мне на помощь. Пожалуй, я пойду, а то еще наговорю лишнего...
str_troop_train_request_default|Мне нужен кто-то, как ты, чтобы привести их в форму.
str_troop_train_request_martial|Им нужен тот, кто объяснит им всю значимость славы.
str_troop_train_request_quarrelsome|Жирные лентяи. Меня от них тошнит!
str_troop_train_request_pitiless|Они боятся врага больше, чем меня, а это не дело.
str_troop_train_request_cunning|Воины, как и мечи, закаляются только в огне!
str_troop_train_request_sadistic|Им нужен кто-то со стержнем внутри, чтобы сделать их смелее или убить на пути к этому.
str_troop_train_request_goodnatured|Они неплохие ребята, но, боюсь, пока не готовы к битвам.
str_troop_train_request_upstanding|Вести их в бой в таком состоянии равносильно самоубийству.
str_unprovoked_attack_default|Что? Зачем ты нападаешь на нас? А ну говори!
str_unprovoked_attack_martial|Я не возражаю против боя, но хочу спросить, зачем ты на нас напал{/а}?
str_unprovoked_attack_quarrelsome|Ты совершаешь большую ошибку, {мальчик/девочка}. Что это ты затеваешь?
str_unprovoked_attack_pitiless|Правда? Если ты решил{/а} сегодня умереть, я тебе с радостью помогу, но мне любопытно, что же ты задумал{/а}?
str_unprovoked_attack_cunning|Да ну? Ты поступаешь очень глупо. Чего ты надеешься этим достичь?
str_unprovoked_attack_sadistic|Что это? Любишь, когда тебе глаза выкалывают?
str_unprovoked_attack_goodnatured|Зачем ты это делаешь? Нам ведь незачем ссориться, {уважаемый/уважаемая}.
str_unprovoked_attack_upstanding|Я считаю это незаконным нападением и пожалуюсь твоему королю. Зачем ты это делаешь?
str_unnecessary_attack_default|Если придется, я убью тебя без колебаний, но сперва дам тебе шанс спастись.
str_unnecessary_attack_martial|Я с удовольствием приму твой вызов, {уважаемый/уважаемая}, но все же даю тебе время передумать.
str_unnecessary_attack_quarrelsome|Тьфу! У меня нет времени на ерунду! А ну с дороги!
str_unnecessary_attack_pitiless|Сегодня у меня хорошее настроение, и я притворюсь, что ты ничего не сказал{/а}.
str_unnecessary_attack_cunning|Не знаю, зачем ты ищешь вражды со мной. Может, тебе лучше просто уехать?
str_unnecessary_attack_sadistic|Я не собираюсь тратить на тебя время, ничтожество. Прочь с дороги!
str_unnecessary_attack_goodnatured|Не знаю, зачем ты ищешь со мною драки, {уважаемый/уважаемая}. Лучше уезжай.
str_unnecessary_attack_upstanding|Если ты хочешь боя, {уважаемый/уважаемая}, то ты его получишь, но сперва подумай как следует.
str_lord_challenged_default|Как хочешь. Готовься к смерти!
str_lord_challenged_martial|Так и быть. Защищайся!
str_lord_challenged_quarrelsome|Дерзкий червяк! Сейчас получишь!
str_lord_challenged_pitiless|Если ты так хочешь умереть, то я не стану тебе в этом отказывать.
str_lord_challenged_cunning|Что ж, ты не оставляешь мне выбора...
str_lord_challenged_sadistic|Грязное ничтожество! Сейчас ты пожалеешь о своем появлении на свет!
str_lord_challenged_goodnatured|Хорошо. Жаль, что нам не удалось избежать этого, но выбора у меня нет.
str_lord_challenged_upstanding|Так и быть. Жаль, что убедить тебя мне не удалось.
str_lord_mission_failed_default|Ты меня разочаровал{/а}, но у тебя будет еще много шансов оправдаться.
str_lord_mission_failed_martial|Проваленное задание не делает тебе чести, но я приму твои слова на веру.
str_lord_mission_failed_quarrelsome|Не вышло? Тьфу. И чего только от тебя ожидать?
str_lord_mission_failed_pitiless|Не получилось? Очень плохо... Ты меня разочаровал{/а}, и очень зря.
str_lord_mission_failed_cunning|Ты меня разочаровал{/а}, но это ничего. Неудачи со всеми случаются.
str_lord_mission_failed_sadistic|Правда? Те, кто подводят меня, не всегда доживают до того момента, когда могут об этом пожалеть.
str_lord_mission_failed_goodnatured|Ох. Ну, особой надежды у меня и не было. Спасибо за старания!
str_lord_mission_failed_upstanding|Ничего страшного. Думаю, ты старал{ся/ась} изо всех сил.
str_lord_follow_refusal_default|Следовать за тобой? Ты забываешься, {уважаемый/уважаемая}.
str_lord_follow_refusal_martial|Если когда-нибудь ты увенчаешь себя воинской славой, я последую за тобой. Но не сегодня.
str_lord_follow_refusal_quarrelsome|Следовать за кем-то вроде тебя? Нет уж.
str_lord_follow_refusal_pitiless|Военачальники, вроде меня, не следуют за так{им/ой}, как ты, {уважаемый/уважаемая}.
str_lord_follow_refusal_cunning|Сначала докажи, что не заманишь меня в ловушку, а потом я, может, и пойду с тобой.
str_lord_follow_refusal_sadistic|Нет уж! Лучше ты иди за мной, как дворняжка за хозяином.
str_lord_follow_refusal_goodnatured|У меня сейчас много дел. Давай потом.
str_lord_follow_refusal_upstanding|Сначала докажи, что за тобой и впрямь стоит идти, а там посмотрим.
str_lord_insult_default|сучий потрох
str_lord_insult_martial|бесчестный плут
str_lord_insult_quarrelsome|дрянной ублюдок
str_lord_insult_pitiless|подлый червь
str_lord_insult_cunning|неосмотрительный болван
str_lord_insult_sadistic|сопливый трус
str_lord_insult_goodnatured|плохой парень
str_lord_insult_upstanding|бесчестный мерзавец
str_rebellion_dilemma_default|[liege]
str_rebellion_dilemma_martial|{s45} was clearly wronged. Although I gave an oath to {s46}, it does not bind me to support him if he usurped his throne illegally.
str_rebellion_dilemma_quarrelsome|Hmm. {s46} has never given me my due, so I don't figure I owe him much. However, maybe {s45} will be no better, and {s46} has at least shown himself .
str_rebellion_dilemma_pitiless|Hmm. {s45} says {reg3?she:he} is the rightful heir to the throne. That is good -- it absolves me of my oath to {s46}. But still I must weight my decision carefully.
str_rebellion_dilemma_cunning|Hmm. I gave an oath of homage to {s46}, yet the powerful are not bound by their oaths as our ordinary people. Our duty is to our own ability to rule, to impose order and prevent the war of all against all.
str_rebellion_dilemma_sadistic|Hmm. In this vile world, a wise man must think of himself, for no one else will. So -- what's in it for me?
str_rebellion_dilemma_goodnatured|I do not know what to say. I gave an oath to {s46} as the lawful ruler, but if he is not the lawful ruler, I don't know if I am still bound.
str_rebellion_dilemma_upstanding|This is troublesome. It is a grave thing to declare my homage to {s46} to be null and void, and dissolve the bonds which keep our land from sinking into anarchy. Yet I am also pledged to support the legitimacy of the succession, and {s45} also has a valid claim to the throne.
str_rebellion_dilemma_2_default|[liege]
str_rebellion_dilemma_2_martial|On the other hand, {s46} has led us in war and peace, and I am loathe to renounce my allegiance.
str_rebellion_dilemma_2_quarrelsome|So tell me, why should I turn my back on the bastard I know, in favor of {reg3?a woman:the bastard} I don't know?
str_rebellion_dilemma_2_pitiless|It is a most perilous position to be in, to be asked whom I would make {reg3?ruler:king} of this land. Yet it is also a time of opportunity, for me to reap the rewards that have always been my due!
str_rebellion_dilemma_2_cunning|{s46} has been challenged, and thus he will never be able to rule as strongly as one whose claim has never been questioned. Yet if {s45} takes the throne by force, {reg3?she:he} will not be as strong as one who succeeded peacefully.
str_rebellion_dilemma_2_sadistic|Perhaps if I join {s45} while {reg3?she:he} is still weak {reg3?she:he} will enrich me, but perhaps if I bring {s46} your head he will give me an even greater reward.
str_rebellion_dilemma_2_goodnatured|{s46} has always treated me decently, yet it's true that he did wrong to {s45}. I hesitate to renounce my homage to {s46}, yet I also don't think it's right to support injustice.
str_rebellion_dilemma_2_upstanding|I feel that I must do whatever is best for the realm, to avoid it being laid waste by civil war and ravaged by its enemies.
str_rebellion_prior_argument_very_favorable|I have already heard some arguments for supporting your candidate for the throne, and I tend to agree with them.
str_rebellion_prior_argument_favorable|I have already heard some arguments for supporting your candidate for the throne, and I tend to agree with them.
str_rebellion_prior_argument_unfavorable|I have already heard some arguments for supporting your candidate for the throne, but I do not find them convincing.
str_rebellion_prior_argument_very_unfavorable|I have already heard some arguments for supporting your candidate for the throne, but I disagree with most of them.
str_rebellion_rival_default|[liege]
str_rebellion_rival_martial|{s49} your ally {s44} once questioned my honour and my bravery. It's not often I get the chance to face him in battle, and make him retract his statement.
str_rebellion_rival_quarrelsome|{s49} you're working with {s44}. He's a crafty weasel, and I don't trust him one bit.
str_rebellion_rival_pitiless|{s49} you seem to have enlisted the support of {s44} -- who is soft, and weak, and not fit to govern a fief, and whom I have always detested.
str_rebellion_rival_cunning|{s49} {s44}, who has already joined you, is headstrong and quarrelsome, and a bit of liability.
str_rebellion_rival_sadistic|{s49} I have no desire to fight alongside your ally {s44}, who puts on such a nauseating display of virtue.
str_rebellion_rival_goodnatured|{s49} I'd be reluctant to be on the same side as {s44}, who has quite a reputation for cruelty.
str_rebellion_rival_upstanding|{s49} your ally {s44} is in my opinion a dangerous, unreliable, and highly unprincipled man.
str_rebellion_argument_favorable|I respect your line of argument
str_rebellion_argument_neutral|I find your line of argument only moderately compelling
str_rebellion_argument_unfavorable|I do not find your line of argument compelling
str_rebellion_persuasion_favorable|you state your case eloquently
str_rebellion_persuasion_neutral|you make a reasonable case
str_rebellion_persuasion_unfavorable|you make an unconvincing case
str_rebellion_relation_very_favorable|I have the greatest respect for you personally.
str_rebellion_relation_favorable|I know and respect you personally.
str_rebellion_relation_neutral|I do not know you as well as I might like.
str_rebellion_relation_unfavorable|I do not trust you.
str_and_comma_3|Более того, 
str_but_comma_3|Однако
str_and_comma_1|, и 
str_but_comma_1|, но 
str_and_comma_2|. Кроме того, 
str_but_comma_2|. Тем не менее, 
str_rebellion_agree_default|[liege]
str_rebellion_agree_martial|I have decided. I will back {s45} as the rightful heir.
str_rebellion_agree_quarrelsome|Ahh, I've thought long enough. I never did like {s46} much anyway. Let's go take his throne away from him.
str_rebellion_agree_pitiless|You are fortunate. I have decided to join you. Pray do not give me cause to regret this decision.
str_rebellion_agree_cunning|This is a most dangerous decision, but after careful consideration, I have decided that I will join you. Let's hope it is for the best.
str_rebellion_agree_sadistic|I have decided. I will back your {reg3?woman:man} {s45}. But you'd best make sure that {reg3?she:he} rewards me well!
str_rebellion_agree_goodnatured|All right. I think your {reg3?woman:man} will be a good ruler. I'll join you.
str_rebellion_agree_upstanding|So be it. My first duty is to this realm, and to save it from lawlessness I will back {s45} and renounce my homage to {s46}. May the Heavens forgive me if I do wrong.
str_rebellion_refuse_default|[liege]
str_rebellion_refuse_martial|I am sorry. {s45} has a good claim, but it's not enough for me to turn my back on {s46}. I will remain loyal to my liege.
str_rebellion_refuse_quarrelsome|Nah. Your whelp {s45} doesn't have what it takes to rule this realm. I'm sticking with {s46}.
str_talk_later_default|[liege]
str_talk_later_martial|Now is not the time to talk politics! I am here today with my fellow lords, armed for battle. You'd better prepare to fight.
str_talk_later_quarrelsome|Do you expect me to discuss betraying my liege with you, while we are surrounded by his army? What do you take me for, a bloody idiot?
str_talk_later_pitiless|Still your tongue! Whatever I have to say on this matter, I will not say it here and now, while we are in the midst of our army.
str_talk_later_cunning|This is hardly the time or the place for such a discussion. Perhaps we can discuss it at a later time and a different place, but for now we're still foes.
str_talk_later_sadistic|You should have your mouth sewn shut! Can you imagine what would happen if the other vassals see me talking to you of treason?
str_talk_later_goodnatured|So you wish to discuss your rebellion with me? Try that again when we aren't surrounded by my liege's army, and I will hear what you have to say.
str_talk_later_upstanding|Whatever my thoughts on the legitimacy of the succession, I am not about to discuss them here and now. If we meet again when we can talk in privacy, I will hear what you have to say on the matter. But for now, consider me your enemy.
str_gossip_about_character_default|They say that {s6} doesn't possess any interesting character traits.
str_gossip_about_character_martial|They say that {s6} loves nothing more than war.
str_gossip_about_character_quarrelsome|They say that {s6} almost came to blows with another lord lately, because the man made a joke about his nose.
str_gossip_about_character_selfrighteous|I heard that {s6} had a squire executed because the unfortunate man killed a deer in his forest.
str_gossip_about_character_cunning|They say that {s6} is a cunning opponent.
str_gossip_about_character_sadistic|They say that {s6} likes to torture his enemies. I wouldn't want to get on the bad side of that man.
str_gossip_about_character_goodnatured|They say that {s6} is a good man and treats people living in his lands decently. That is more than what can be said for most of the nobles.
str_gossip_about_character_upstanding|People say that it is good to be in the service of {s6}. He is good to his followers, and rewards them if they work well.
str_latest_rumor|Последний слух, в котором упоминается {s6}, это:
str_faction_strength_crushed|уничтожена
str_faction_strength_spent_and_wavering|колеблется на грани поражения
str_faction_strength_weakened|слаба
str_faction_strength_fair|ослаблена
str_faction_strength_average|более-менее сильна
str_faction_strength_strong|сильна
str_faction_strength_quite_strong|очень сильна
str_faction_strength_very_strong|мощна
str_faction_strength_unmatched|непобедима
str_faction_strength_last|INVALID
str_theater_se|Гондор
str_theater_sw|Рохан
str_theater_c|Южный Рованион
str_theater_n|Северный Рованион
str_faction_side_name|Свободные Народы
str_faction_side_name1|Багровое Око
str_faction_side_name2|Белая Длань
str_party_greet_friend_gondor|Приветствуем, друг Белого Древа!
str_party_greet_enemy_gondor|Обнажите мечи, если у вас хватит духу, врага Гондора!
str_party_greet_friend_dwarf|Народ Дурина приветствует друга гномов!
str_party_greet_enemy_dwarf|Барук кхазад! Кхазад ай-мену!
str_party_greet_friend_rohan|Мы рады встрече, друг роханцев!
str_party_greet_enemy_rohan|Всадники Рохана готовы бросить тебе вызов!
str_party_greet_friend_mordor|Победа будет за Оком!
str_party_greet_enemy_mordor|Ваши головы будут неплохо смотреться на воротах Мораннона!
str_party_greet_friend_isengard|Да славится Белая Длань!
str_party_greet_enemy_isengard|Премудрый Хозяин будет рад увидеть ваши трупы!
str_party_greet_friend_lorien|Приветствую, друг прекрасного Лориэна!
str_party_greet_enemy_lorien|Мерзкое создание, мы положим конец твоим страданиям!
str_party_greet_friend_imladris|Приветствуем, друг Имладриса и Эльронда!
str_party_greet_enemy_imladris|Сегодня мы выйдем на бой против врагов Имладриса и всего прекрасного!
str_party_greet_friend_woodelf|Приветствуем, друг эльфов Темнолесья!
str_party_greet_enemy_woodelf|Всякий, кто войдёт в Темнолесье со злым умыслом, не уйдёт живым!
str_party_greet_friend_dale|Приветствуем, друг славного Дэйла!
str_party_greet_enemy_dale|Обнажите мечи, мы люди Дэйла!
str_party_greet_friend_harad|Приветствуем, друг харадцев!
str_party_greet_enemy_harad|Ваши трупы будут втоптаны в песок!
str_party_greet_friend_rhun|Приветствуем, друг истерлингских племён и Дорвиниона!
str_party_greet_enemy_rhun|Гномы и люди не совладают с нашей свирепостью!
str_party_greet_friend_khand|Гус гивати гьок, друг варьягов! Твои шрамы делают тебе честь.
str_party_greet_enemy_khand|Наденьте боевые маски, ибо сегодня мы выйдем навстречу судьбе!
str_party_greet_friend_umbar|Ни-йози зирбит кийад, друг корсаров!
str_party_greet_enemy_umbar|Будь мы в море, ты бы уже прош{ёлся/лась} по доске!
str_party_greet_friend_moria|Да славится Белая Длань!
str_party_greet_enemy_moria|Орки Мории перережут вам глотки!
str_party_greet_friend_guldur|Победа будет за Оком!
str_party_greet_enemy_guldur|Эльфы и их дружки падут под нашими клинками!
str_party_greet_friend_gundabad|Бойся мощи Ангмара!
str_party_greet_enemy_gundabad|Мы схватим тебя и попируем твоими кишками!
str_party_greet_friend_dunland|Приветствуем, враг лошадников!
str_party_greet_enemy_dunland|Мы сожжём ваши дома и перережем ваши семьи!
str_party_greet_friend_beorn|Приветствуем, друг Беорна!
str_party_greet_enemy_beorn|Вы познаете ярость медвежьего народа!
str_subfaction_gondor_name_begin|Гондор
str_subfaction_gondor_name1|Пеларгир
str_subfaction_gondor_name2|Дол-Амрот
str_subfaction_gondor_name3|Ламедон
str_subfaction_gondor_name4|Лоссарнах
str_subfaction_gondor_name5|Пиннат-Гелин
str_subfaction_gondor_name6|Долина Мортонда
str_subfaction_gondor_name7|Итилиэн
str_default_rumor|Война. Все говорят о войне.
str_rohan_rumor_begin|Мое сердце разрывается, когда я вижу своих детей, идущих на войну! Вместо них должны идти взрослые мужчины.
str_rohan_rumor_2|Я слышал орки едят лошадей. Грязные выродки! А также и пленных. Это тоже плохо, конечно.
str_rohan_rumor_3|Нет коней лучше роханских. Даже эльфы получают от нас лошадей!
str_rohan_rumor_4|Если вы можете помочь моим людям, пожалуйста, позаботьтесь должным образом о наших конях.
str_rohan_rumor_5|Дайте мне восемь вьючных лошадей, он сказал... после вчерашней просьбы о семи животных. Не кажется вам странным?
str_rohan_rumor_6|Гондорцы предпочитают более выносливых лошадей. Наши всадники любят скорость. Эльфы ездят только на лучших. А наши враги - конокрады!
str_rohan_rumor_7|Я видел помесь пустынных кобыл и варьягских коней. Кони Рохана чистокровнее, но и требуют более опытной руки.
str_rohan_rumor_8|Варги не такие быстрые, но маневренней. По сравнению с чистокровными боевыми конями, варги довольно уязвимые.
str_rohan_rumor_9|Армия пикинеров и копейщиков идёт на Рохан, идёт против лучших его всадников. Предатель Саруман вырубит весь лес Фангорн до конца, чтобы снарядить свои войска.
str_rohan_rumor_10|Чтобы стать лучшим всадником страны, нужно вырастить лучшего скакуна. 
str_rohan_rumor_11|Большинством лошадей Гондор снабжаем мы. Они предпочитают менее быстроходных коней, способных нести на себе тяжелую броню.
