
; str_rohan_faction_intro|^Rohirrim are the horse lords of the Mark of Rohan, led by king Théoden.^^Rohirrim have very good cavalry, ranging from heavy lancers to agile horse archers. They have an infantry line as well, branching into shieldwall-forming troops and heavy swordsmen bearing longswords.
; str_mordor_faction_intro|^Mordor represents Sauron’s own forces bred in the darkness of the Black Land.^^Armies of Mordor consist of orcs, Uruks and evil men (Black Númenoreans). Uruks of Mordor are a better-equipped and stronger breed of orcs, but have no archery line. Most regular orcs are infantry, skirmishers or archers, but there are also orc warg-riders. Black Númenoreans are comparatively rare, but very dangerous as infantry or cavalry. Sauron has also bred fierce battle trolls, but they’re extremely hard to obtain.
; str_isengard_faction_intro|^Isengard is ruled by Saruman, the traitor wizard. He created his own version of orcs: the Uruk-hai.^^The forces of Isengard are quite well-equipped, though the weapons and armour may seem crude. The orcs are comparable to any other orcs, but the Uruk-hai are truly deadly killing machines wielding pikes, halberds, heavy axes and nasty cleavers. They also have the largest and most powerful bows among any of the orcish races.
; str_lorien_faction_intro|^The Elves of Lothlórien, known as the tree-dwelling “Galadhrim”, are a powerful group of Nandor and Sindar living in the Lórien woods, led by Lord Celeborn and Lady Galadriel.^^Their forces consist of an infantry line and a scout line, with the occasional incorporation of an elite unit of Noldorin horse archers. All their troops are highly skilled, equipped with the finest arms and armour of Elven make, and overall extremely deadly in combat. A rain of arrows from under the forest cover, followed by a devastating infantry charge, is their main tactic.
; str_imladris_faction_intro|^The Elves of Imladris (Rivendell) are Sindar and Noldor led by Lord Elrond and his two sons. They are custodians of the ancient lore of the west, as well as powerful and ancient artifacts dating back to the First Age. Under their banner, the Dúnedain of the North march as well – the remnants of the broken Northern kingdoms of Men are tall dark-haired rangers and nobles, clad in sturdy leathers or ancient maille.^^The soldiers of Imladris are among the most highly-skilled in Middle-Earth, and are extremely well-equipped. Their armies are capable of considerable tactical flexibility.
; str_woodelf_faction_intro|^The Silvan Elves, called “wood-elves” in ancient times, live today in Mirkwood, led by King Thranduil.^^The Elves of Mirkwood have a competent infantry line that features both spears and swords. Their scouts and archers are the mainstay of their armies, more so than for their cousins of Lórien. Their armour is light but affords a great deal of protection.
; str_dale_faction_intro|^Dale is a city rebuilt by Northmen who share ancestry with the Rohirrim, joined by the survivors from the lake city of Esgaroth (after it was burnt down by Smaug).^^Men of Dale provide tough infantry focused on polearms, famous archer troops including the legendary Barding bowmen, and a merchant guard line acting as reasonably good cavalry.
; str_harad_faction_intro|^The Haradrim, the “hosts of the South” in Sindarin, come from the deserts and rainforests of the far South. They have a fondness for wearing bright colours and heavy gold ornamentation in warfare.^^Haradrim have average but competent infantry (skirmishers/archers and spearmen/swordsmen) from Great Harad, a cavalry line (incorporating both heavy cavalry and horse archers) from Harondor and a Far Harad line of tribal warriors.
; str_rhun_faction_intro|^Men of Rhûn are tribal Easterlings hailing from around the sea of Rhûn, far to the east.^^The bulk of their army is cavalry - horse archers and lancers, both very lightly-equipped. Their top-tier cavalrymen ride much larger and heavier mounts, with more barding. Their infantrymen are also quite lightly-armoured and wield large axes and swords. In the open field, a cavalry host of Rhûn can be a fearsome force to face.
; str_khand_faction_intro|^The Variags of Khand are fierce Easterling raiders who wear terrifying battlemasks into battle.^^They rely on fast light infantry (skirmishers and blademasters) and heavy axemen, while their cavalry line contains both light agile skirmishers and heavy kataphracts. The light infantry fling devastating volleys of throwing spears while screening the advance of the main host. The most savage among them charge into battle wearing little armour, attacking with great strength and ferocity.
str_umbar_faction_intro|^Умбарские корсары - южные враги Гондора, потомки черных Нуменорцев, которые проводили бесчисленные набеги на Гондорскую береговую линию. ^^Корсары используют легко-вооруженных застрельщиков и более тяжелых мечников, а так же опытных лучников. Будучи в основном мореплавателями, они жертвуют броней ради мобильности
str_moria_faction_intro|^Орки Мории занимают залы Кхазад-Дума, некогда могущественного гномьего королевства. ^^Как  и у обычных орков их силы состоят из смеси пехоты, лучников, застрельщиков и наездников варгов, однако в основном они лучше экипированы, чем обычные орки благодаря остаткам железа найденным в Мории. Некоторые везунчики имеют доступ к украденным частям гномьей брони и оружия. Вожди Орков Мории показали себя как сильнейшие и свирепейшие из своего рода, они очень опасны в бою.
str_guldur_faction_intro|^Дол Гулдур - это старая крепость Саурона в Лихолесье. Именно она причина по которой "Великое Зеленолесье" теперь известно под своим темным именем. ^^Здесь верный Мордору готовят и  тренируют великое воинство, совершают частые набеги на Эльфов и на группы Людей проходящих через лес. Войска Дол Гулдура преимущественно состоят из орков в таком же составе как и Мордорские орки (пехота, лучники, застрельщики и наездники варгов), но с меньшем разнообразием.
; str_gundabad_faction_intro|^Gundabad was a place sacred to the Dwarves, but in these days it has become a massive Orc stronghold in the northern mountains.^^The Gundabad orcs, though more savage than their fellows from other places, fight much like any other orcs, with a similar army lineup (infantry, archers, skirmishers, warg riders). Their equipment is primitive and their fighting style barbaric. Their warg riders are unrivalled in toughness and ferocity. Some among the orcs of Gundabad can even whip themselves into a battle-frenzy.
; str_dunland_faction_intro|^The Dunlendings are the “wild men of Dunland”, enemies of the Rohirrim who drove them from their homeland.^^Dunland is barren and poor. The Dunlendings wear very little real armour – mostly furs and cured leather, with some metal signifying status. For weaponry, they wield long pikes and antler axes, with rare swords serving as emblems of prestige. Their horses are thin and weak, certainly no match for the steeds of Rohan, though occasionally the Dunlendings will ride them into battle as skirmishers. In battle, the pikemen advance en masse, presenting a crude but formidable wall of sharp polearms. Some Dunlendings have also cultivated affinity with creatures of the wild, and may unleash packs of savage wolves against their foes.
; str_beorn_faction_intro|^Beornings, the descendants of Beorn, are a people of the upper Vales of Anduin, between Mirkwood and the Misty Mountains. They dwell mostly in the forests, though they keep the Old Ford clear for trade, exacting a toll on merchant caravans for their service.^^As woodsmen, they wield stout sticks and sharp axes, but wear little in the way of armour. Heavier Beorning infantry fight with shields as well. Beorning foresters are skilled bowmen and provide a valuable archer line.
; str_intro_faction_intro_strings_end|faction intro END
; str_gondor_extra_info|Good^^Hard^^Gondor (South-East)^^Prince Imrahil^^Mordor, Umbar, Khand, Harad
str_dwarf_extra_info|Добро^^Легко^^Северный Рованион (Север)^^Король Даин II Железностоп^^Рун, Гундабад
str_rohan_extra_info|Добро^^Средний^^Рохан (Юго-Запад)^^Король Теоден^^Изенгард, Дунланд
str_mordor_extra_info|Саурон^^Легко^^Гондор (Юго-Восток)^^Готмог^^Гондор
str_isengard_extra_info|Саруман^^Легко^^Рохан (Юго-Запад)^^Углук^^Рохан
str_lorien_extra_info|Добро^^Очень Легко^^Южный Рованион (Центр)^^Келеборн^^Мория, Дол Гулдур
str_imladris_extra_info|Добро^^Очень Легко^^Южный Рованион (Центр)^^Лорд Элронд^^Мория, Дол Гулдур
str_woodelf_extra_info|Добро^^Очень Легко^^Южный Рованион (Центр)^^Король Трандуил^^Мория, Дол Гулдур
str_dale_extra_info|Добро^^Средний^^Северный Рованион (Север)^^Король Бранд^^Рун, Гундабад
str_harad_extra_info|Саурон^^Легко^^Гондор (Юго-Восток)^^Вождь Ул-Улкари^^Гондор
; str_rhun_extra_info|Sauron^^Hard^^North Rhovanion (North)^^Jarl Helcaroth^^Dale, Dwarves, Mirkwood, Beornings
; str_khand_extra_info|Sauron^^Easy^^Gondor (South-East)^^Shibh Krukmahur^^Gondor
str_umbar_extra_info|Саурон^^Легко^^Гондор (Юго-Восток)^^Адмирал Тулмир^^Гондор
; str_moria_extra_info|Saruman^^Very Hard^^South Rhovanion (Center)^^Master Bolg the Lesser^^Imladris, Lothlorien
; str_guldur_extra_info|Sauron^^Very Hard^^South Rhovanion (Center)^^Master Fuinur^^Imladris, Lothlorien
; str_gundabad_extra_info|Saruman^^Very Hard^^North Rhovanion (North)^^Master Burza Krual^^Dale, Dwarves, Mirkwood, Beornings
; str_dunland_extra_info|Saruman^^Hard^^Rohan (South-West)^^Chief Daeglaf the Black^^Rohan
; str_beorn_extra_info|Good^^Hard^^North Rhovanion (North)^^Chief Grimbeorn the Old^^Rhun, Gundabad
; str_intro_strings_extra_end|Intro EXTRA END
; str_gundabad_intro|You have come from the far north, from the lands of long-lost Angmar, after receiving tidings of the war to come. For years beyond count you and your folk have broken many dwarf shields with your axes and spears, crushed many broken bodies of men and elves below the claws of your fierce wargs, skinned the hides of the bear-people to wear as furs. The great halls of Gundabad in the Misty Mountains are now yours once again, as they were in the time of Bolg and Azog.^^Many of you have perished over the years, somemany of them slain in these very halls and tunnels - but many still remain. Great sport you have had with the greedy little diggers and their friends, in the past - and greater sport you will have now, when you march upon them and take everything for yourselves!^^Vengeance for Bolg, for Azog, for the Great Goblin - vengeance for the goblins of Gundabad!
str_show_keybinds|Специальные клавиши: ^^ Клавиши построений:^ Шеренга - J ^ Стена щитов - K ^ Клин - L ^ Карэ - ; ^ Отмена построения - U ^^ Приказ сменить тип оружия - O ^^ Переключение типа камеры - CTRL+END ^^ Ралли - V ^^ Позвать лошадь - M ^^ Просмотр приказов / мини-карты - Backspace
; str_tactical_controls|Use the keyboard NUMBERS to select a division. Press 0 to select your entire force.^^Use F1-F4 to order selected divisions. Keep the F1 key down to place selected divisions. One may target an enemy division through this mechanism.^^Pressing the ENTER key often initiates an overhead Strategy Camera.^^Pressing the BACKSPACE key often initiates a Battle Command Display with 'radar.'
; str_division_placement|When ONE division is selected, the center of its front rank is placed at the spot indicated.^^When MANY divisions are selected, they are separated and spread out as if the player were standing at the spot indicated.^^One may memorize the placement of selected divisions relative to the player by pressing F2, F7. Default is infantry to the left, cavalry right, and ranged forward.
str_formations|В Меню Битвы есть следующие формации:^^- РЯДЫ с сильнейшими бойцами спереди^- СТЕНА ЩИТОВ, ряды с щитами спереди и длинным оружием позади^- КЛИН с лучими бойцами на острие^- КВАДРАТ без определённого порядка^- БЕЗ ФОРМАЦИИ^^Даже в последнем случае, игрок может создать формацию до 4 рядов, приказывая ВСТАТЬ ПЛОТНЕЕ соответствующее число раз.
; str_npc18_intro|Great One, hold a moment! I would speak with you!
; str_npc19_intro|Hold a moment, Commander. I would have words with you. No, no, you need not kneel, even though you speak to one of royal blood.
str_npc20_intro|Подожди. Ты. Я уже видел твое лицо. У меня был сон о тебе, но как это может быть ты ? Теперь, когда я увидел тебя своими собственными глазами, я осознал, что ты не больше чем жалкий червяк
str_npc21_intro|Добро пожаловать в Медусельд, воин!
str_npc22_intro|Приветствую, {playername}. Маэ гованнен!
str_npc23_intro|Оставь меня в покое, {незнакомец/незнакомка}. Я не хочу с тобой разговаривать.
str_npc24_intro|Кили, сын Двалина, к вашим услугам!
str_npc25_intro|Добро пожаловать в Дэйл, путник! Чем могу вам помочь?
str_npc26_intro|Тсс! Если ты будешь махать страже, я перережу тебе глотку и отдам варгам!
str_npc27_intro|Ты!
; str_npc18_intro_response_1|A slave in stocks, bound for death, would speak with me? What have you to say?
str_npc19_intro_response_1|Королевская кровь ? Ха! Что заставляет тебя думать, что ты имеешь хотя бы ее каплю 
; str_npc20_intro_response_1|Look here, what do you mean by this, witch? Who are you?
str_npc21_intro_response_1|Приветствую, моя госпожа. С кем я имею честь говорить?
str_npc22_intro_response_1|Приветствую, эльфийский владыка! Большая честь - познакомиться с вами.
str_npc23_intro_response_1|Неужели лесные эльфы приветствуют своих гостей именно таким образом?
str_npc24_intro_response_1|{playername}, к вашим услугам. Как поживает народ Дурина?
str_npc25_intro_response_1|Приветствую. Я размышлял{/а}, есть ли тут добровольцы, желающие присоединиться к нам в наших странствиях.
str_npc26_intro_response_1|Придержи язык, урук, пока дело не дошло до мордобоя. Я не доносчи{к/ца}.
str_npc27_intro_response_1|Кто ты?
; str_npc18_intro_response_2|I will not waste words on a slave bound for death.
str_npc19_intro_response_2|Наглый болван. Уйди с дороги.
; str_npc20_intro_response_2|I have no time for your mad ravings, sorceress.
str_npc21_intro_response_2|Прошу прощения, но у меня есть неотложные дела в другом месте.
str_npc22_intro_response_2|Прошу прощения, у меня есть важный разговор ещё кое с кем.
str_npc23_intro_response_2|Взаимно. Прощай.
str_npc24_intro_response_2|Неважно. Мне нужно подышать свежим воздухом.
str_npc25_intro_response_2|Неважно. Мы просто тут осматриваемся.
str_npc26_intro_response_2|Тогда я просто пойду своей дорогой, а иначе мои пальцы начнут тянуться к рукояти меча.
str_npc27_intro_response_2|[Проигнорировать и уйти]
; str_npc18_backstory_a|I am no mere slave! I am a head-taking warrior, cheated of my rightful place among the ranks! You see that I am a woman, but I am stronger and swifter than many others, and I've outfought more men than I can count. The Pit Master - accursed be he! He set me a test, to fight three men at once. Three!
; str_npc19_backstory_a|A small drop, to be sure, but my dam has told me all about my lineage. I am Heidrek, direct descendant of King Fengel, closer to the throne of Rohan and Dunland than any of our chieftains! Dark is my hair, but I fancy I have more than a strand of yellow in there somewhere.
; str_npc20_backstory_a|In my dream, there was a tree. A tree, all of white. And you, you were there, standing beside it. You placed your hand upon its trunk, and lo, it withered down to its very roots. And the shadow in the sky lengthened, and the air grew heavy. I heard a laughter then, from far away in the east. 
str_npc21_backstory_a|Меня зовут Гальмюне, и я считаю своим долгом знать ваше имя, {playername}. Позвольте объяснить, почему.
str_npc22_backstory_a|Вы могли слышать сказания о моих свершениях в битвах прошлого, забытых смертными людьми. И если смотреть с высоты времён, эта Война - лишь ещё одна опасность для эльдаров. Но всё же это будет Последняя Война.
str_npc23_backstory_a|Простите мне мою самоуверенность, незнаком{ец/ка}, но у нас тут редко бывают гости, а те, что приходят, не выглядят заслуживающими доверия. Всего лишь неделю назад, явился этот гном и... А, неважно. Меня зовут Луэванна, я из лесных эльфов Темнолесья.
str_npc24_backstory_a|Очень вежливо с вашей стороны интересоваться этим, {playername}. Мы отбиваем нашествия истерлингов и гундабадских орков, но пока мы и наши дэйльские союзники не можем с ними справиться.
str_npc25_backstory_a|Уверена, вы можете найти неплохих добровольцев, если поговорите с начальником казарм. Что до меня, то я просто лекарь и травница, и мои навыки весьма скромны.
str_npc26_backstory_a|Молодцом! Меня называют Гулм. Я выпустил кишки своему командиру, и теперь его снаги охотятся за мной.^Жалкая тварь, сам напросился. Однажды мы устроили засаду на разъезд соломенноголовых, а он всё прохлопал: закричал "Отступаем!" - и сбежал. Только Гулм и ещё несколько парней стояли непоколебимо и отбили конную атаку. А потом поколотили дубинками желтоволосых людишек, в мясо, хе-хе-хе. Если бы не мы, настоящие бойцы, всем бы быть едой для червей.
str_npc27_backstory_a|Я Дургаш!
; str_npc18_backstory_b|I prevailed! I defeated them! But... one of them was so weak that he perished from the blows I dealt him. If he had been a simple bondsman, that would have been the end of it. But no. He was one of Great Lord Lurmsakun's many sons, by a lesser wife.
; str_npc19_backstory_b|Well, you will not find any of Rohan or Dunland who will accept my claim, but it is a true one nonetheless. My grand-dam was a herdswoman, living in the hills, and one day it chanced that old King Fengel, the greedy grasping grandfather of Theoden the Pretender, happened to see her on the banks of the Isen. He took a fancy to her, and my dam was his child.
; str_npc20_backstory_b|Do you not know before whom you stand? Ignorant fool. Know that I am Zigûrphel, of ancient Akallabêth - but like as not you know nothing of that name! Know, also, that I seek to redress the wrongs of long ago, the wrongs wrought upon me and my people by the spite of the Valar, they who sank our Great Armament and our home. Ah, Ar-Pharazôn, great and glorious! Shall your vision be unremembered evermore? No, not so long as Zigûrphel lives and has hands to do her work!
str_npc21_backstory_b|Я родилась в знатной семье и была придворной девой госпожи Эовин с тех пор, как мы ещё были маленькими девочками. Наши отцы были достаточно мудры, чтобы позволить нам постигать искусство боя наравне с нашими братьями, чтобы мы стали роханскими девами щита.
str_npc22_backstory_b|Владыка Эльронд отправил меня послом к владыке Келеборну, чтобы я предоставил ему помощь и совет. Здесь, в этой части Рованиона, это нужно.
str_npc23_backstory_b|Я люблю ходить тайными тропами нашего прекрасного леса. Иногда я беззвучно продвигаюсь меж деревьев и наблюдаю за жизнью лесных животных. Песня редкой птицы, логово дикого вепря - для меня всё это так же прекрасно, как звон оружия и великие чертоги для аданов. 
str_npc24_backstory_b|Я помогаю в усилении эреборских укреплений, а также тренирую молодых гномов, под руководством моего досточимого отца Двалина. Таков наш обычай.
str_npc25_backstory_b|Я вылечила короля Бранда от запора, обычного недуга для людей, идущих на войну. Слабый отвар полыни - и сразу же и кишки, и ум приходят в норму.
str_npc26_backstory_b|И тогда я сказал себе: "Гулм, ты ведь не хочешь стать падалью?" И я ответил: "Нет".^Во время следующей битвы я отступил, прикинувшись раненым. Потом, пока никто не видел, я напал на своего командира! Почти разрубил его надвое, гарр! Потом хорошенько порезал его прихвостня-снагу...^^Но так вышло, что этот слизняк как-то выжил - и начал чесать языком обо всём этом. В следующий раз я уже постарался, чтобы он остался без башки, гарр...
str_npc27_backstory_b|Я волчий всадник Изенгарда и следопыт.
; str_npc18_backstory_c|And so here I am, cursed at and spit upon, condemned to die for being mightier than the dogs who mock me! Free me, Great One. Free me, speak for me - and my strength is yours. My blade is yours. My life is yours!
; str_npc19_backstory_c|Naturally, Chief Daeglaf and the rest wish to give me no chance at all for glory, for if I were to perform great deeds in battle, it would lend wings to my claim. Men would flock to my banner then! Your fame runs before you, Commander. If you will allow me to serve under your banner, I can perform those great deeds for you.
