dlga_start:mutiny_pretalk_1|嗨，{playername}。^伙计们在抱怨！想要乐子！不想行军！
dlga_request_meeting_6:close_window.1|{s2}说他不会见你的，立刻离开这里。
dlga_castle_gate_open:close_window|{s2}大人会高兴见到你的，{先生/女士}。请进，我现在就给你打开大门。
dlga_castle_gate_open:close_window.1|{s2}大人现在不在城堡里。但我想他应该会允许你今晚待在这里。请进。我现在就给你打开大门。
dlga_castle_gate_open:close_window.2|请进。我现在就给你打开大门。
dlga_castle_gate_open:close_window.3|进来吧，但只有你一人获得了批准。{s2}大人不想你的手下在这里惹任何的麻烦。
dlga_castle_gate_open:close_window.4|{s2}大人不允许你待在这里。立刻离开。
dlga_start:caravan_help1|感谢你的帮助！现在终于安全了。我叫托巴尔，受到袭击的时候正在运输一些货物。^^你见过那么大的半兽人么？看起来可不像是我们平时轻松搞定的普通山地种。他们盾牌的战纹貌似是一种古老的魔多标志，很久没在大河（安都因河）的这一边看到过了。^^恐怖正在踏步，战争就要来了^^我希望你能去最近的城镇，把你在这里所先到的一切告知掌权者。这很重要，请尽快。
dlga_caravan_help1:caravan_help2|你说得对，我从没见过如此大的半兽人。真是些肮脏的东西…^^我是一名正为未来大战做准备的士兵。
dlga_caravan_help2:caravan_help3|你是一名士兵？毫无疑问！你精湛的武艺我刚刚已经见识过了。^^看来今天的确走运，我应该趁此机会返回村庄，把这群肮脏野兽的消息通知给我的村民们。^^接着，这是一些可以在{s10}。
dlga_caravan_help3:caravan_help4|祝你一路平安，托巴尔。我想我们会再见面的。
dlga_caravan_help4:caravan_help5|我对此十分期待。我的护卫在这里见证了你的战斗，他们肯定会把你的消息告诉他们的领主的。^^如果你多次帮助了领主们的人民，你肯定会在他们之中声名大噪，而这将会给你带来很多好处！ ^^比如我，作为一个名人，每个月都能因为我的贡献得到一次额外收入！
dlga_caravan_help5:close_window|我会铭记的。谢谢你，托巴尔，注意安全。
dlga_start:caravan_attack1|你是谁？ 我并不需要你的帮助。
dlga_caravan_attack3:close_window|懦夫？让我来告诉你谁才是真的懦弱！ (困难)
dlga_caravan_attack3:close_window.1|滚吧， 懦夫。 总有一天我会看见你那被弃荒野的尸体的。
dlga_start:caravan_duel1|呵呵...他就是这么一个脾气暴躁的人，不是吗？你无须在意他的！你在那里帮了我一个大忙！当然还救了一些人的性命！^^看，我们从死人的口袋里弄了点钱出来。{s10}
dlga_start:caravan_duel1.1|看来我要晋升了。你是位凶猛的战士。来，拿点我们从商队那得到的战利品。守卫们当时也赌你输的，但是我没有…呵呵…你之前在哪儿做的我可全都看到了…^^{s10}
dlga_caravan_duel1:caravan_duel2|我可以直接杀了你然后带走一切的…但我已经有足够的证明了。离开。
dlga_caravan_duel2:caravan_duel3|这群人现在绝对尊敬你！或者他们是在害怕！不管怎样，他们会告诉他们的领主你在这里所做的一切。如果你能继续给他们留下好印象，他们还会给你特殊的东西！那个卢恩的骑兵给了我一匹马！然后我把它吃—掉—了！哈哈哈哈！
dlga_woodelf_help_6:woodelf_help_7|(派系军衔教程) ^^军衔点允许你提升你在出生派系(和/或者其它派系)中的地位。^^这将决定你的部队上限，每周的派系资源点收入，并解锁一些派系特殊奖励。
dlga_woodelf_help_7:close_window.1|(抬起你的手并且一言不发地离开)
dlga_start:beorn_help1|*他皱眉打量着你。* ^^闪亮的东西，比如你，才是吸引那群半兽人离开山脉进去我们森林的关键。但你干净利落的解决了他们，因此我们对你表示感谢。
dlga_beorn_help1:beorn_help2|幸会！尽管我们一般不会离开我们的森林，但我是不会吝于帮助任何与敌人爪牙抗争的人的。
dlga_beorn_help1:beorn_help2a|(默默地点头)
dlga_beorn_help2:beorn_help3|一般来说，尽量远离那些服侍他的人才是最明智的，但今天看来不管我们躲多远都不够。^^我们所有的族民都将知道你今天斩首了多少半兽人！我们每个人都会用蜜酒和面包欢迎你。
dlga_beorn_help2a:beorn_help3|*欣赏地咕哝道* ^^一个寡言少语的精灵，嗯？ 你似乎更像我们这种，完全没有沉闷的精灵歌和无趣的诗。^^一个可以追溯到山脉仍然年轻森林永无尽头年代的好故事才是我们的最爱！^^我会把你介绍给我的族民的。他们每个人都会知道你今天清除了多少半兽人的污秽。在我们的树厅当中，不管何时都会有蜜酒和真心欢迎你的到来。
dlga_beorn_help3:beorn_help4|(资源点教程)^^ 能与波宁人交易的资源点和你在罗斯洛立安取得的的资源点不同，你要在比翁之家取得波宁人派系的资源点以便与当地人交易。^^查看报告菜单获取更多消息。
dlga_beorn_help4:beorn_help4a|*以令人愉快的语调笑道* 你也觉得精灵是熊兄弟？…
dlga_beorn_help4a:beorn_help5|*以令人愉快的语调笑道* 你也觉得精灵是熊兄弟？…金黄的蜜酒甜腻而又温暖，沁人心脾；但也许精灵的刀锋和锐利的箭矢，才是这种黑暗的日子里更需要的东西…
dlga_beorn_help4:beorn_help5|(将一只手放在胸前心脏的位置，点头并微笑)
dlga_beorn_help5:beorn_help6|我们可能粗鲁、多毛，冷酷又神秘。但是我们帮助我们的朋友—那些帮助我们的朋友。^^如果我们的酋长认为你和你的行动是值得的，我们就会跟着你去战斗。
dlga_beorn_help6:beorn_help7|(派系军衔教程) ^^军衔点允许你提升你在出生派系(和/或者其它派系)中的地位。^^这将决定你的部队上限，每周的派系资源点收入，并解锁一些派系特殊奖励。
dlga_beorn_help7:close_window|Le fael（辛达林语：谢谢），朋友！再会。
dlga_beorn_help7:close_window.1|(挥手，一言不发地离开。)
dlga_start:kill_scout_1|你的眼睛和耳朵可真是灵光！要不是你的警告，那些斥候肯定会逃掉，并通知他们丑陋的领主我们的到来。
dlga_kill_scout_1:kill_scout_2|看看你把我们带到了哪里去了，半兽人…我可不想在战争正式开始前就被解决掉！
dlga_kill_scout_2:kill_scout_3|战争马上就要爆发啦！给，拿去。你可以用它在魔多给你的人买点吃喝。
dlga_kill_scout_3:kill_scout_4|(资源点教程)^^ 能在魔多用于交易的资源点和你在初始派系取得的的资源点不同，你要在魔多取得当地派系的资源点以便与当地人交易。^^查看报告菜单获取更多消息。
dlga_kill_scout_4:kill_scout_5|你想让我们喝半兽人泔水？我们宁愿喝自己的小便！
dlga_kill_scout_5:kill_scout_6|哈！我就知道你们这群外地佬会做这种事情！我跟葛斯摩赌赢啦！哈哈！^^我肯定会告诉全魔多关于你的一切！他们肯定会持续关注你的。^^如果他们喜欢你，你会得到丰厚的奖赏的。^^更多的半兽人酒！啊哈哈哈！
dlga_kill_scout_6:kill_scout_7|(派系军衔教程) ^^军衔点允许你提升你在出生派系(和/或者其它派系)中的地位。^^这将决定你的部队上限，每周的派系资源点收入，并解锁一些派系特殊奖励。
dlga_kill_scout_7:kill_scout_8|你恶心到我了，半兽人！在我们拿你的脑袋装饰长枪之前，赶快滚回魔多吧！
dlga_kill_scout_8:close_window|好呀好呀…喝尿的外地佬…！
dlga_woodelf_help_1:woodelf_help_2.1|我从没见过如此大的半兽人。真是些肮脏的东西…不用担心，我是一名正为未来大战做准备的士兵。
dlga_woodelf_help_2:woodelf_help_3.1|你是一名士兵？毫无疑问！你精湛的武艺我刚刚已经见识过了。看来今天的确走运，我应该趁此机会返回村庄，把这群肮脏野兽的消息通知给我的村民们。
dlga_woodelf_help_3:close_window|祝你一路平安，托巴尔。我想我们会再见面的。
dlga_start:close_window.9|你来得正好。让我们合并我们的军队给敌人好好上一课。
dlga_start:close_window.10|跟我们战斗你可真是愚蠢透顶。
dlga_start:ally_thanks_meet|我不觉得我们曾在正式场合见过面，我的朋友。你刚刚救了我的命，但我还不知道你的名字…
dlga_start:ally_thanks_meet.1|你出手的正是时候，陌生人。我叫{s1}。我是否能有幸知道你的名字？
dlga_start:ally_thanks_meet.2|感谢相助，陌生人。我想我们还没有正式介绍过自己，不是么？你叫什么名字？
dlga_ally_thanks_meet:ally_thanks_meet_2|我叫{playername}。
dlga_ally_thanks_meet_2:close_window|这的确是一次非常愉快的会面，{playername}。我叫{s1}，你的帮助我将终生难忘。如果有任何需要我的地方，请直接告诉我…
dlga_ally_thanks_meet_2:close_window.1|你好{playername}。你刚刚做的事情帮到了我，我欠你一个人情。希望有一天我能找到机会反过来帮助你。
dlga_ally_thanks_meet_2:close_window.2|你好{playername}。我叫{s1}。谢谢你的援助，期待和你下次见面。
dlga_start:close_window.11|你又一次救了我们，{playername}。真的，你才是真正值得深交的朋友。{s43}
dlga_start:close_window.12|真是千钧一发啊，{playername}。向你献上我最深的感谢。{s43}
dlga_start:close_window.13|你出现的正是时候，{playername}。我不会忘记你的帮助的。{s43}
dlga_start:close_window.14|很高兴在这遇到您，{playername}。{s43}。
dlga_start:close_window.17|谢谢你的帮助，指挥官。你在那儿救了{reg1?我们的命:我的命} 
dlga_start:close_window.18|谢谢你的帮助，指挥官。你的出现真是雪中送炭。
dlga_start:close_window.19|谢谢你的帮助，指挥官。你能及时赶到真是我们的幸运。
dlga_start:freed_hero_answer|你救了我的朋友，我欠你一个人情。
dlga_freed_hero_answer:freed_hero_answer_1|你哪都别想去了。你现在是我的阶下囚了！
dlga_freed_hero_answer_1:close_window|哎。我就没有转运的那一天么？
dlga_freed_hero_answer:freed_hero_answer_2|你可以走了，{s65}。
dlga_freed_hero_answer_2:close_window|谢谢你，指挥官。我不会忘记你今天的仁慈的。
dlga_freed_hero_answer:freed_hero_answer_3|你想加入我么？
dlga_freed_hero_answer_3:close_window|好，我加入。
dlga_freed_hero_answer_3:close_window.1|不，我更想单独行动。
dlga_start:defeat_hero_answer|你不会长久的活着并享受胜利的，我的族人很快将会抹去这次失败的污点。
dlga_defeat_hero_answer:defeat_hero_answer_1|你是我的俘虏了。
dlga_defeat_hero_answer_1:close_window|该死的！你会后悔的。
dlga_defeat_hero_answer:defeat_hero_answer_2|这次就放你走，不过下次可要记着别挡路。
dlga_defeat_hero_answer_2:close_window|我们还会再见面的。
dlga_start:fugitive_1|嗯，你想要做什么？
dlga_fugitive_1:fugitive_2|我正在追捕一位名为{s4}的逃犯。你和通缉上的画像一模一样。
dlga_fugitive_1:close_window|没事。对不起打扰你了。
dlga_fugitive_2:fugitive_3|我不知道你在说些什么。你一定是把我跟其他人搞混了。
dlga_fugitive_3:fugitive_4|那就把你的剑放下。如果你是无辜的，那就没必要害怕！我们可以去和这里的护卫长谈谈，看看这里是不是还有符合描述的另外一人。
dlga_fugitive_4:close_window|该死的！你哪都别想去！
dlga_start:follow_spy_talk|日安。今天天气可真不错，你觉得呢？如果你不介意的话，我有些急事儿要处理。
dlga_follow_spy_talk:follow_spy_talk_2|以{s1}的名义，你被捕了！
dlga_follow_spy_talk_2:close_window|你不会活捉我的！
dlga_follow_spy_talk:close_window|不用在意，我只是路过。
dlga_start:spy_partners_talk|向你问好。
dlga_spy_partners_talk:spy_partners_talk_2|以{s1}的名义，你被捕了！
dlga_spy_partners_talk_2:close_window|先打赢我们再说！
dlga_spy_partners_talk:close_window|不用在意，我只是路过。
dlga_start:runaway_serf_intro_1|日安，主人。
dlga_runaway_serf_intro_1:runaway_serf_intro_2|我是{s4}派来的，没错，就是你们正努力逃离的那人。如果你们现在老老实实跟我回去，你们将免受惩罚。
dlga_runaway_serf_intro_2:runaway_serf_intro_3|仁慈的主人，我们在{s1}的生活简直是猪狗不如。我们每天天不亮起来工作，半夜却饿着肚子睡觉。我们想去{s6}开始全新的生活，至少那里的人会把我们当成人来看待。
dlga_runaway_serf_intro_3:runaway_serf_go_back|你们这群逃奴已经触犯了法律！我要你们马上回{s1}去！
dlga_runaway_serf_go_back:close_window|好吧，主人。如您所愿，我们现在就转头往{s5}走。
dlga_start:runaway_serf_talk_caught|日安，主人。我们正往{s5}方向走，但恐怕我们已经迷路了。
dlga_runaway_serf_talk_caught:runaway_serf_go_back|不要考验我的耐性。你们最好马上回去！
dlga_start:runaway_serf_talk_again_return|我们在回{s5}的路上，主人。
dlga_runaway_serf_talk_again_return:runaway_serf_talk_again_return_2|快点。你们越早返回越好。
dlga_runaway_serf_talk_again_return:runaway_serf_talk_again_return_2.1|很好，继续前进。
dlga_runaway_serf_talk_again_return_2:close_window|好的主人。如您所愿。
dlga_mayor_talk:mayor_deliver_wine|有人叫我带{reg9}单位的{s4}给你。
dlga_mayor_deliver_wine:mayor_pretalk|可算来了！我们的货舱基本上都空了，我只好把{s4}的订单提前了。帮我向{s9}问好。^^[获得{s14}的{reg14}资源点]
dlga_mayor_talk:mayor_deliver_wine_incomplete|我本应携带{reg9}单位的{s4}给你，但少部分货物被敌人抢走了。
dlga_mayor_deliver_wine_incomplete:mayor_pretalk|他们早晚会为此付出代价的！至少我们有一些{s4}。不管怎样我都要谢谢你！[获得{s14}的{reg14}资源点]
dlga_start:mercenary_tavern_talk|指挥官，你需要雇佣兵吗？{reg3?我和{reg4?{reg3}名同伴:另一名同伴} 正:我正}寻找雇主。 仅仅需要{reg5}第纳尔，我们就会加入你。
dlga_start:mercenary_after_recruited|有什么命令么？指挥官。
dlga_mercenary_after_recruited:mercenary_after_recruited_2|做好准备。我们要开拔了。
dlga_mercenary_after_recruited:mercenary_after_recruited_2.1|别急，我们还要在这个镇子呆上一段时间。
dlga_mercenary_after_recruited_2:close_window|是的，指挥官，我们随时准备好开出发了。
dlga_mercenary_tavern_talk:mercenary_tavern_talk_hire|好的。我要雇佣你们所有的人。这是{reg5}第纳尔。
dlga_mercenary_tavern_talk:mercenary_tavern_talk_hire.1|好的。但是我只能雇佣{reg6}个人。这是{reg5}第纳尔。
dlga_mercenary_tavern_talk:tavern_mercenary_cant_lead|你的话听上去不错。但是我现在没有足够的佣金去雇佣更多的人了。
dlga_tavern_mercenary_cant_lead:close_window|那就很遗憾了。好吧，{reg3?我们会:我会}在这附近逗留一会的，如果你需要雇佣兵的话。
dlga_mercenary_tavern_talk:tavern_mercenary_cant_lead.1|你的话听上去不错。但是我现在无法带上更多的人了。
dlga_mercenary_tavern_talk:close_window|抱歉。我现在不需要人手。
dlga_start:trainer_pretalk|你已经存活到了第{reg2}波。{s4}
dlga_start:trainer_pretalk.1|非常好，你击败了你的对手们。
dlga_start:trainer_talk|日安。今天准备来点训练吗？
dlga_trainer_pretalk:trainer_talk|你准备好练习了吗？
dlga_trainer_talk:trainer_combat_begin|首先告诉我下战斗方面的东西…
dlga_trainer_talk:trainer_choose_mode|我准备好训练了。
dlga_trainer_talk:close_window|我要走了。再见。
dlga_trainer_combat_begin:trainer_talk_combat|你想要知道什么？
dlga_trainer_combat_pretalk:trainer_talk_combat|你还想知道些什么？
dlga_trainer_talk_combat:trainer_explain_defense|告诉我如何防守。
dlga_trainer_talk_combat:trainer_explain_attack|告诉我如何使用武器。
dlga_trainer_talk_combat:trainer_explain_horseback|告诉我如何在马上战斗。
dlga_trainer_talk_combat:trainer_pretalk|我想我学会了需要的知识，让我们谈点其他的。
dlga_trainer_explain_defense:trainer_explain_defense_2|问得好！作为一名战士你要学会的第一件事儿就是保护好你自己。保持自己不受伤害一直都是战场的第一准则，这可远远比伤害敌人要重要得多。毕竟任何人都能挥舞一两下剑，运气好的还能伤到一两名敌军。但只有那些精通如何保护自己的人才有可能在战斗之后存活下来，并且能在酒馆里吹嘘自己的经历与功勋。
dlga_trainer_explain_defense_2:trainer_explain_defense_3|现在让我们开始。保护自己最简单的方法是装备一块儿盾牌。你只需要举起盾牌格挡就行了[按住鼠标右键]。这种情况下，一切来自正面的攻击都会被盾牌挡住。但是，你的侧面或是背面依旧可以被对手砍中。
dlga_trainer_explain_defense_3:trainer_explain_defense_4|如果我没有盾牌呢？
dlga_trainer_explain_defense_4:trainer_combat_pretalk|那你就只能用武器来格挡对方的攻击了，这比用盾牌格挡难了一些。武器只能为你格挡来自一个方向的攻击，也就是说你必须在上劈，左右挥砍，和直刺这些中间选择一个。换句话说，你必须仔细观察对手的动作，在他出手之后决定格挡的方向。如果你在他起手之前就作出格挡，他很可能换一个方向，然后轻易地伤害到你。
dlga_trainer_explain_attack:trainer_explain_attack_2|问得好！老话说得好，进攻就是最好的防守。很多战士都相信保持进攻姿态是最有用的。你只需要准备好你的武器，并在恰当的时刻挥砍就好。[按住鼠标左键不放可以保持攻击姿态，释放鼠标左键立即按照当前姿态挥砍]
dlga_trainer_explain_attack_2:trainer_explain_attack_3|这听起来很有用！
dlga_trainer_explain_attack_3:trainer_explain_attack_4|这个战术通常很管用，但别忘了，对手是会试着格挡的。当你发现你的挥砍会打在对方的武器上，而不是他的身上时，你需要立即停止挥砍并换到另一个方向[你可以通过迅速单击鼠标右键取消攻击]
dlga_trainer_explain_attack_4:trainer_explain_attack_5|如果我的对手封住了我挥砍的方向，我就立刻换到另一个方向。
dlga_trainer_explain_attack_5:trainer_combat_pretalk|是的，控制攻击方向是一个非常重要的技巧。你可以从四个方向攻击你的对手：左挥砍、右挥砍、竖劈、直刺。你需要明智的选择它们。[攻击方向的默认控制：单击鼠标左键的同时向相应的方向移动鼠标]。
dlga_trainer_explain_horseback:trainer_combat_pretalk|问得很好！一匹马或许是一位战士一生中所能拥有最强大的武器了。一匹精良的战马可以给你速度、高度和力量上的优势。许多致命的武器在马背上使用都会变得更加致命！但你需要特别注意的是枪骑兵。因为他们手中的骑枪可以做到一触即死。[如何在战场上亲自使用骑枪呢，你需要先装备一把骑枪或是类似武器，然后在不做任何攻击防御动作的同时加速你的马匹。当你获得一定速度之后放下你的骑枪，并通过控制你的马匹和鼠标瞄准你的敌人]
dlga_trainer_choose_mode:trainer_choose_mode_player|我们有几种训练模式用于提高士兵的战斗技巧。 单人战斗会让你与一到四名对手进行训练。团队协作则会让你跟四名队友一起对付四，八或是十二名对手。严酷考验则是一切战士的终极挑战—你要一个人应对一波又一波越来越多的敌人。乱战则是简单的斗殴。^你想选择哪一个？
dlga_trainer_choose_mode_player:trainer_choose_opponents|单人战斗。
dlga_trainer_choose_mode_player:trainer_choose_opponents.1|团队协作。
dlga_trainer_choose_mode_player:trainer_choose_weapon|严酷考验。
dlga_trainer_choose_mode_player:trainer_choose_weapon.1|乱战。
dlga_trainer_choose_mode_player:trainer_pretalk|别这样，我改变主意了。
dlga_trainer_choose_opponents:trainer_choose_opponents_player|现在选择你对手的数量。
dlga_trainer_choose_opponents_player:trainer_choose_weapon|一。
dlga_trainer_choose_opponents_player:trainer_choose_weapon.1|两。
dlga_trainer_choose_opponents_player:trainer_choose_weapon.2|三。
dlga_trainer_choose_opponents_player:trainer_choose_weapon.3|四，今天我会走运的。
dlga_trainer_choose_opponents_player:trainer_choose_weapon.4|四。
dlga_trainer_choose_opponents_player:trainer_choose_weapon.5|八。
dlga_trainer_choose_opponents_player:trainer_choose_weapon.6|十二，我和我的同伴不可战胜。
dlga_trainer_choose_opponents_player:trainer_pretalk|不了，我改变主意了。
dlga_trainer_choose_weapon:trainer_choose_weapon_player|最后请选择你喜欢的武器。
dlga_trainer_choose_weapon_player:trainer_begin_training|单手武器
dlga_trainer_choose_weapon_player:trainer_begin_training.1|双手武器
dlga_trainer_choose_weapon_player:trainer_begin_training.2|长杆武器
dlga_trainer_choose_weapon_player:trainer_begin_training.3|弓箭
dlga_trainer_choose_weapon_player:trainer_begin_training.4|投掷武器
dlga_trainer_choose_weapon_player:trainer_pretalk|不了，我改变主意了。
dlga_trainer_begin_training:close_window|很好，让我们开始吧。等你完成训练之后再来找我。
dlga_start:close_window.20|滚出我的视线！臭要饭的！
dlga_start:mayor_begin|日安，大人。
dlga_start:mayor_talk|你好陌生人，你似乎是第一次来{s9}。我是这里的行政长官。
dlga_start:mayor_begin.1|日安，{playername}。
dlga_mayor_begin:lord_deal_with_night_bandits_completed|干得漂亮！{playername}。你对这些法外狂徒的处置真是干净利落！^^[获得{s14}的{reg14}资源点]
dlga_lord_deal_with_night_bandits_completed:close_window|这是他们自找的。
dlga_mayor_talk:mayor_deliver_iron|当初你要求的是{reg9}单位的{s3}，但我给你带来了更高质量的金属—{s4}。
dlga_mayor_talk:mayor_deliver_iron.1|这是你要的金属补给，{reg9}单位的{s4}。
dlga_mayor_talk:mayor_deliver_iron.2|当初你要求的是{reg9}单位的{s4}，但我给你带来了更多的金属—{reg8}单位。
dlga_mayor_deliver_iron:mayor_deliver_iron_completed|干得漂亮，{playername}。我们的铁匠会保证这些东西被有效利用的。
dlga_mayor_deliver_iron_completed:close_window|我只是做了我力所能及的事。
dlga_mayor_talk:mayor_deliver_food|这是你要求的{reg9}单位食物。
dlga_mayor_deliver_food:mayor_deliver_food_completed|干得漂亮，{playername}。现在我们的粮食储备又充足了，也不会有人要饿肚子了。
dlga_mayor_deliver_food_completed:close_window|我只是做了我力所能及的事。
dlga_mayor_begin:mayor_looters_quest_response|啊，{playername}，原来是你。有什么最新进展么？
dlga_mayor_looters_quest_response:mayor_looters_quest_destroyed|先生，我已经解决掉了一部分部落半兽人。
dlga_mayor_looters_quest_response:close_window|目前没有，先生。再会。
dlga_mayor_looters_quest_destroyed:mayor_looters_quest_destroyed_2|哈哈，我的斥候已经把所有事情都告诉我了。这样应该就能让那群该死的部落半兽人老实点了！^^[获得{s14}的{reg14}x{reg15}资源点]
dlga_mayor_looters_quest_destroyed_2:close_window|这可不是唯一的好消息！因为你之前的活跃，那些部落半兽人已经停止劫掠，我已经有一段时间没有收到哪怕一例攻击报告了。哪怕还有一点落网之鱼，要么逃离了这里，要么就躲藏起来不敢冒头。这对我们这儿的治安可是一件大好事儿！我想这应该足以说明你的贡献 ，{playername}。谢谢你，再会。
dlga_mayor_looters_quest_destroyed_2:mayor_looters_quest_response|你还有其他事情我能效劳的么？
dlga_mayor_begin:close_window|很高兴再一次见到你，{playername}。我听说你已经成功地把那些人送到了目的地。我会告诉我们的指挥官你有多么值得信任的。^^[获得{s14}的{reg14}资源点]
dlga_mayor_begin:move_cattle_herd_failed|我听说你保护的那些人都死在了前往{s9}的路上。我花了不少时间像我的指挥官解释你的失败，你有什么想说的么？
dlga_move_cattle_herd_failed:move_cattle_herd_failed_2|抱歉，但是我在路上被袭击了。
dlga_move_cattle_herd_failed:move_cattle_herd_failed_2.1|抱歉，那些人在半夜被袭击了。
dlga_move_cattle_herd_failed_2:close_window|不管怎么说，保护他们安全抵达目的地都是你的责任。你应该知道我的指挥官想找人为这次失败负责吧，所以我把你的名字告诉了他。
dlga_mayor_begin:mayor_friendly_pretalk|我听说了你的作为，你把相应的惩罚带给了那群半兽人，果真是名不虚传。^^[获得{s14}的{reg14}资源点]
dlga_mayor_begin:mayor_talk|有什么我可以效劳的吗？
