dlga_start:mutiny_pretalk_1|おい、{playername}。 話があるんだけどさ・・・ ^みんな不満たらたらなんだぜ！ あちこち歩き回るばっかりで、 楽しいことないのかよ。
dlga_lord_capture_troll_completed_two_trolls:lord_capture_troll_completed_two_trolls_thankyou|二匹か！ 素晴らしいぞ、 {playername}。 おぬしはみずからの価値を証明してくれた。 その能力と献身性には、 褒美をやらねばならんな。 おぬしの捕らえてきた二匹のトロルのおかげで、 いままで使っていた実験体のうちの一匹は不要になった。 あれは奴隷として完璧に訓練されていて、 命令に従っていつでも戦う準備ができておる。 おぬしの命令に従うのだ、 {playername}。
dlga_lord_capture_troll_completed_two_trolls_thankyou:lord_capture_troll_completed_two_trolls_thankyou_info|あのような凶暴な獣が、 命令など聞くようになるものなのでしょうか？
; dlga_lord_capture_troll_completed_two_trolls_thankyou:lord_capture_troll_completed_two_trolls_thankyou_accept|Thank you, Master. You will be pleased by the way this troll will be put in good use.
dlga_lord_capture_troll_completed_two_trolls_thankyou:lord_capture_troll_completed_two_trolls_thankyou_refuse|ありがとうございます、ご主人様。 しかし、この贈り物は、 私には過ぎた物です。 私には危険過ぎて扱いかねます。
dlga_lord_capture_troll_completed_two_trolls_thankyou:lord_capture_troll_completed_two_trolls_thankyou_refuse.1|ありがとうございます、ご主人様。 しかし、この贈り物は、 私には過ぎた物です。  [パーティに空きがありません！]
; dlga_lord_capture_troll_completed_two_trolls_thankyou:lord_capture_troll_completed_two_trolls_thankyou_raise|Master, I will bring greater havoc if you also provide an armour for the beast [10/{reg20} influence].
dlga_lord_capture_troll_completed_two_trolls_thankyou_info:lord_capture_troll_completed_two_trolls_thankyou|おぬしの主人の能力を疑うのか、 {playername}？ この生き物は、 敵を見つけ次第、 攻撃する。 それで充分なのだ。 しかし、 おぬしらはこの獣が戦っているときは 充分な距離をとることだ。 くれぐれもこやつと獲物との間には立たぬようにな。
; dlga_lord_capture_troll_completed_two_trolls_thankyou_accept:lord_pretalk|Now bring havoc to my enemies with your new gift
; dlga_lord_capture_troll_completed_two_trolls_thankyou_refuse:lord_pretalk|As you wish, then. Someone else among of my servants will known how to use this mighty tool of war.
; dlga_lord_capture_troll_completed_two_trolls_thankyou_raise:lord_pretalk|You dare ask for an fully armoured battle troll, {playername}, to keep under your command? That's not a small thing to ask for. But you are a skilled servant, and we know your motivations. We like that. It shall be granted.
; dlga_lord_capture_troll_completed_two_trolls_thankyou_raise:lord_capture_troll_completed_two_trolls_thankyou|How dare you ask Us for more than We have planned for you in our great Wisdom? {playername}, you proved a mighty Servant today, but don't let your insolence test Our patience any further.
; dlga_lord_capture_troll_completed_one_troll:close_window|Excellent, {playername}. You are a most faithful and useful servant. This troll will be most useful for our purposes. That it is taken to the dungeons!
; dlga_lord_start:close_window.1|Too long ago, I asked you to take me one troll alive. But I should have known. How could I expect someone like {playername} to be up to the challange. My servant was not skilled or faithful enough.
; dlga_lord_start:lord_generic_mission_completed.1|News of your accomplishment against the wild trolls reached me. {s12} has one fear less to worry about, thanks to you, {playername}.
dlga_lord_start:lord_follow_spy_half_completed|なんということだ、愚か者め！ 私は二人を捕らえよと言ったはずだ、 {playername} ―― これではほとんど意味がない！ スパイがかき集めた情報については、 私は完全に把握しているのだ。 私が狙っていたのは、 連絡係なのだ。 さあ、仕事が半分なら報酬も半分だ。 受け取ったら出て行け。
; dlga_lord_start:lord_follow_spy_half_completed.1|I asked you for two prisoners, {playername}, not one. Two. Still, I suppose you did capture the spy's handler, the more important one of the pair. The spy will not dare return here and will prove quite useless to whatever master he served. 'Tis better than nothing. However, you'll understand if I pay you half the promised reward for what is but half a success.
; dlga_lord_start:lord_follow_spy_failed|Truly, {playername}, you are nothing short of totally incompetent. Failing to capture both the spy AND his handler plumbs astonishing new depths of failure. Forget any reward I offered you. You've done nothing to earn it.
; dlga_lord_follow_spy_half_completed:lord_pretalk|I did my best, {s65}.
; dlga_lord_follow_spy_completed:lord_pretalk|Thank you, {s65}.
; dlga_lord_follow_spy_failed:lord_pretalk|Hrm. As you like, {s65}.
; dlga_lord_start:lord_generic_mission_completed.2|Damn me, but you've done it, {playername}. All the slaves are back and they're busy preparing for the harvest. You certainly earned your reward. Here, take it, with my compliments.
; dlga_lord_start:lord_bring_back_runaway_serfs_failed|{playername}. I have been waiting patiently for my slaves, yet none have returned. Have you an explanation? Were you outwitted by simple animals, or are you merely incompetent?
; dlga_lord_bring_back_runaway_serfs_failed:lord_bring_back_runaway_serfs_failed_1a|Forgive me, {s65}, those slaves were slippery as eels.
; dlga_lord_bring_back_runaway_serfs_failed_1a:lord_pretalk|Hmph, that is hardly an excuse for failure, {playername}. Now if you will excuse me, I need to capture new men to work these fields before we all starve.
dlga_lord_start:lord_runaway_serf_half_completed|おぬしにはがっかりさせられた、 {playername}。 おぬしを雇ったのは、 みっつの奴隷グループを連れ戻すためだ。 みっつだ。 {reg17}ではない。 戻ってきた連中には、 逃げおおせた者のぶんも含めて、 いままでの倍は働いてもらわねばらなんな。 おぬしへの報酬だが、 {playername}、 連れ戻した奴隷のぶんだけ払うぞ。 そら、受け取るがいい。 これでこの取引は終わりだ。
; dlga_lord_runaway_serf_half_completed:lord_pretalk|Thank you, {s65}. You are indeed generous.
; dlga_lord_runaway_serf_half_completed:lord_pretalk.1|Bah, this proved to be a waste of my time.
; dlga_lord_start:lord_deliver_cattle_to_army_thank|Ah, {playername}. I am pleased that you delivered {reg13} units of {s4}, as I requested. I'm impressed.
; dlga_lord_deliver_cattle_to_army_thank:lord_pretalk|Not a problem, {s65}.
; dlga_lord_deliver_cattle_to_army_thank:lord_pretalk.1|Glad to be of service.
; dlga_lord_start:lord_scout_waypoints_thank|You make a good scout, {playername}. My runner just brought me your reports of the mission to {s13}, {s14} and {s15}. Well done.
; dlga_lord_scout_waypoints_thank:lord_pretalk|A simple task, {s65}.
; dlga_lord_scout_waypoints_thank:lord_pretalk.1|Nothing I couldn't handle.
; dlga_lord_scout_waypoints_thank:lord_pretalk.2|My pleasure, sir.
; dlga_lord_start:lord_mission_told_deliver_cattle_to_army|The army's supplies are dwindling too quickly, {playername}. I need you to bring me {reg3} units of {s4} so I can keep the troops fed. I care very little about where you get them, just bring them to me as soon as you can.
; dlga_lord_mission_told_deliver_cattle_to_army:lord_mission_told_deliver_cattle_to_army_accepted|Very well, I can find you some {s4}.
; dlga_lord_mission_told_deliver_cattle_to_army:lord_mission_told_deliver_cattle_to_army_rejected|Sorry, sir, I have other plans.
; dlga_lord_mission_told_deliver_cattle_to_army_accepted:close_window|Excellent! You know what to do, {playername}, now get to it. I need that food sooner rather than later.
; dlga_lord_mission_told_deliver_cattle_to_army_rejected:close_window|That . . . is unfortunate, {playername}. I shall have to find someone else who's up to the task. Please go now, I've work to do.
; dlga_lord_start:lord_report_to_army_asked|Ah, you have arrived at last, {playername}. We've been expecting you. I hope you have brought with you troops of sufficient number and experience.
; dlga_lord_report_to_army_asked:lord_report_to_army_completed|I have a company of good, hardened soldiers with me. We are ready to join you.
; dlga_lord_report_to_army_asked:lord_report_to_army_continue|I don't have the sufficient number of troops yet. I will need some more time.
; dlga_lord_report_to_army_completed:close_window|Excellent. I will send the word when I have a task for you. For the moment, just follow us and stay close. We'll be moving soon.
; dlga_lord_report_to_army_continue:close_window|Then you'd better hurry. We'll be moving out soon against the enemy and I need every able hand we can muster.
; dlga_lord_start:lord_mission_told_scout_waypoints|{playername}, I need a volunteer to scout the area. We're sorely lacking in information, and I simply must have a better picture of the situation before we can proceed. I want you to go to {s13}, {s14} and {s15} and report back whatever you find.
; dlga_lord_mission_told_scout_waypoints:lord_mission_told_scout_waypoints_accepted|You've found your volunteer, sir.
; dlga_lord_mission_told_scout_waypoints:lord_mission_told_scout_waypoints_rejected|I fear I must decline.
; dlga_lord_mission_told_scout_waypoints_accepted:close_window|Good! Simply pass near {s13}, {s14} and {s15} and check out what's there. Make a note of anything you find and return to me as soon as possible.
; dlga_lord_mission_told_scout_waypoints_rejected:lord_pretalk|Hm. I'm disappointed, {playername}. Very disappointed. We'll talk later, I need to go and find somebody to scout for us.
; dlga_lord_start:lord_buy_prisoner|I heard that you have captured our enemy {s3} and he is with you at the moment. Good job!^ Leave him to us, there is a lot of information which we need to extract from him...^^[you will earn {reg14} Resource Points of {s14}]
; dlga_lord_buy_prisoner:lord_buy_prisoner_accept|Well, he is all yours.
; dlga_lord_buy_prisoner:lord_buy_prisoner_deny|I fear I have other plans for him.
; dlga_lord_buy_prisoner_accept:lord_pretalk|Excellent! I'll send my men to take him to our prison with due haste. This will surely help our cause.
; dlga_lord_buy_prisoner_deny:lord_pretalk|Too bad, he would have been precious for us, {playername}.
dlga_lord_start:lord_pretalk|ああ、{s24}、よく来てくれた。^知っての通り、{s12}。 おぬしには、 我が軍で人手を必要としているところを見つけては、 そこを手助けしてもらいたい。 私からの信頼を勝ち得たら[レベル{reg1}]、 あそこにある箱を自由に使うがよい。
dlga_lord_start:lord_talk|何の用だ？
dlga_lord_pretalk:lord_talk|他に何か？
dlga_lord_talk:lord_lend_companion_end|{s65}、 我が部下の{s14}の事ですが、 もし用事が済んでいるのでしたら、 {reg3?彼女:彼}をお返し願いたい。
; dlga_lord_lend_companion_end:lord_pretalk|You've too many men in your company already, {playername}. You could not lead any more at the moment.
dlga_lord_lend_companion_end:lord_pretalk.1|もちろんだ、{playername}。 {reg3?彼女:彼}のような優秀な{reg3?女:男}を配下に持てて、 おぬしは幸運な指揮官よな。
dlga_lord_talk:lord_message_delivered|{s9}より、手紙を預かって参りました。
dlga_lord_talk:lord_message_delivered_enemy|{s9}より、手紙を預かって参った。
dlga_lord_talk:lord_active_mission_1|例の任務の件ですが・・・
dlga_lord_talk:lord_request_mission_ask|何か私にお手伝いできる事はありますか？
dlga_lord_talk:find_lost_spears_permission|王様、 ブラードルシン王の失われた槍の探索のため、 はなれ山への入山をお許し願いたい。
dlga_find_lost_spears_permission:lord_pretalk|許可ならすでに出したであろう、 {playername}。
dlga_find_lost_spears_permission:find_lost_spears_permission_yes|よかろう、 {playername}、 入山を許可する。
dlga_find_lost_spears_permission:lord_pretalk.1|せっかくじゃが、 {playername}、 おぬしの事はよく知らぬし、 信用してよいものか判断がつかぬ。
dlga_find_lost_spears_permission_yes:lord_pretalk|感謝いたします、王様。
; dlga_lord_give_troops:lord_give_troops_check|Reinforce my party? I can always use a few more soldiers.
; dlga_lord_give_troops:lord_pretalk|Unfortunately you don't have any {s14} soldiers to reinforce me with.
; dlga_lord_give_troops_check:lord_give_troops_check_1|Let me check the soldier roster...
dlga_lord_give_troops_check_1:lord_pretalk|そうか、気が変わったのだな・・・^なるほど。
; dlga_lord_give_troops_check_1:lord_pretalk.1|I don't have use for those troops here...^Take them back.
dlga_lord_talk:lord_get_reward_item_ask|スペシャルアイテムを所望したい。
dlga_lord_get_reward_item_ask:lord_talk|おぬしのインベントリには空きがない様子。 空きを確保してからまた来るがいい。
dlga_lord_get_reward_item_ask:lord_get_reward_item|ほう？ スペシャルアイテムを持つにふさわしいとされる者には、 相応のランクである事と、 少なからぬ影響力を持っている事が求められる。^どれを所望するのだ？
dlga_lord_get_reward_item:lord_get_reward_item_answer|{s24}: {s20} [{reg14}/{reg15}の影響力を消費します]
dlga_lord_get_reward_item:lord_pretalk|では取り消します。
dlga_lord_get_reward_item_answer:lord_pretalk|よかろう。 それをもって敵を打ち破る助けとするがよい。
; dlga_lord_talk:marshall_ask|I would like to have a council with you about the War.
; dlga_marshall_ask:lord_pretalk|I would hardly take advice if you are merely {s25}, {playername}. I would have been more inclined to listen if you were {s24}, but you are not.
; dlga_marshall_ask:lord_pretalk.1|You are an accomplished commander, {playername}, but your influence is waning. It would not be prudent to listen to your advice.^[{reg15} influence needed, only {reg14} held]
; dlga_marshall_ask:lord_pretalk.2|We can hardly afford to meet the enemy head on, {playername}. We still need to build up our forces and become strong, alas we are merely {s23}.
; dlga_marshall_ask:lord_pretalk.3|We are on a campaign, {playername}, your advice would have to wait.
; dlga_marshall_ask:marshall_suggest|I'm listening, {playername}. What do you suggest?
; dlga_marshall_suggest:marshall_answer|We should ride to besiege {s1} at once.
; dlga_marshall_suggest:lord_pretalk|Never mind, I trust your judgement.
; dlga_marshall_answer:close_window|Very well, {playername}, I shall defer to your judgement. I shall send messengers to gather our forces.^Follow me and stay close - we ride to {s4}!
; dlga_lord_talk:deliver_gift_1|I bring a gift of {s1} from {s3} to the people of {s2}.
; dlga_send_gift_1:lord_pretalk|You are already {s4}, {playername}. It would be wise to deliver that one first.
; dlga_send_gift_1:lord_pretalk.1|Unfortunately, you cannot afford to send a gift right now {playername}.^^[not enough Resource Points]
; dlga_send_gift_1:send_gift_2|Very well. To whom would you like to deliver a gift?
; dlga_send_gift_1:send_gift_2.1|Very Well. Who do you want to give a bribe to?
; dlga_send_gift_2:lord_pretalk|Nevermind.
; dlga_send_gift_3:send_gift_4|Which gift would you like to give to them?
; dlga_send_gift_3:send_gift_4.1|What bribe do you want to give them?
; dlga_send_gift_4:lord_pretalk|Nevermind.
; dlga_send_gift_5:lord_pretalk|All right {playername}. Good Luck.
; dlga_lord_talk:lord_give_order_ask|I have a new task for you.
dlga_lord_give_order_ask:lord_give_order|何かご用で？
; dlga_lord_give_order:lord_give_order_answer|Follow me. [Costs {reg1}/{reg2} influence]
; dlga_lord_give_order:lord_give_order_details_ask|Go to... [Costs {reg1}/{reg2} influence]
; dlga_lord_give_order:lord_give_order_details_ask.1|Patrol around... [Costs {reg1}/{reg2} influence]
; dlga_lord_give_order:lord_give_order_details_ask.2|Engage enemies around... [Costs {reg1}/{reg2} influence]
; dlga_lord_give_order:lord_give_order_stop|I won't need you for some time. You are free to do as you like.
dlga_lord_give_order:lord_pretalk|なんでもない。
; dlga_lord_give_order_details_ask:lord_give_order_details|Where?
dlga_lord_give_order_details:lord_pretalk|なんでもない。
; dlga_lord_give_order_stop:lord_pretalk|All right. I will do that.
; dlga_lord_give_order_answer:lord_pretalk|I am sorry. I am needed somewhere else at the moment.
; dlga_lord_give_order_answer_2:close_window|I will do that.
; dlga_lord_give_order_answer_2:lord_pretalk|I am sorry, it is not possible for me to do that.
dlga_lord_talk:lord_talk_ask_something|お尋ねしたい事がある。
dlga_lord_talk_ask_something:lord_talk_ask_something_2|一体なにか？
dlga_lord_talk_ask_something_2:lord_talk_ask_location|指揮官たちの現在地を知りたい。
dlga_lord_talk_ask_something_2:lord_tell_objective|ここで何をしているのか？
dlga_lord_talk_ask_something_2:lord_talk_ask_about_war|現在の戦況は？
dlga_lord_talk_ask_something_2:lord_pretalk|なんでもない。
dlga_lord_talk_ask_location:lord_talk_ask_location_2|いいだろう、私の知っている範囲で答えよう。 誰について聞きたいのだ？
dlga_lord_talk_ask_location_2:lord_pretalk|なんでもない。
dlga_lord_talk_ask_about_war_2:lord_talk_ask_about_war_details|{s1}との戦いの戦況を知りたい。
dlga_lord_talk_ask_about_war_2:lord_pretalk|知りたかった事は以上。感謝します。
dlga_lord_talk_ask_about_war_details:lord_talk_ask_about_war_2|やつらは{s23}、対する我々は{s22}。 いまのところ、 {s9}。
; dlga_lord_talk:party_encounter_lord_hostile_ultimatum_surrender|Today is a good day for battle, {s4}!
; dlga_lord_tell_objective:lord_pretalk|What am I doing? What does it look like I'm doing?! I'm a prisoner here!
dlga_lord_tell_objective:lord_pretalk.1|いま私が指揮する配下はいない。
dlga_lord_tell_objective:lord_pretalk.2|我々は{s1}{s5}で 休息をとっているところだ。
dlga_lord_tell_objective:lord_pretalk.3|我々は{s1}{s5}を目指して 移動中だ。
dlga_lord_tell_objective:lord_pretalk.4|々は{s1}で 兵を募っているところだ。
dlga_lord_tell_objective:lord_pretalk.5|我々は{s1}{s5}周辺の偵察中だ。
dlga_lord_tell_objective:lord_pretalk.6|いま{s1}の村を 焼き払っているところだ。
dlga_lord_tell_objective:lord_pretalk.7|{s1}へ退却中だ。
dlga_lord_tell_objective:lord_pretalk.8|我々は{s1}{s5}を 攻撃しているところだ。
dlga_lord_tell_objective:lord_pretalk.9|我々は{s1}{s5}と 戦っている最中だ。
dlga_lord_tell_objective:lord_pretalk.10|我々は{s1}{s5}に　同行しているところだ。
dlga_lord_tell_objective:lord_pretalk.11|次なる目標を 検討しているところだ。
dlga_lord_tell_objective:lord_pretalk.12|知らん。: {reg1} {s1}
dlga_lord_active_mission_1:lord_mission_sorcerer_completed|お方さま、闇の森の妖術師は倒しました。
dlga_lord_active_mission_1:lord_mission_sorcerer_failed|お許しください、お方さま。 急用に手を取られている間に、 妖術師に逃げられてしまいました。
dlga_lord_active_mission_1:lord_mission_sorcerer_failed.1|闇の森の妖術師は、 まだ生きています。 やつの儀式の最中を襲いましたが、 逃げられてしまいました。
dlga_lord_mission_sorcerer_completed:lord_pretalk|ええ、{playername}、 私はあの者の死を感じとりました。 木々をおおっていた妖術の力が取り払われ、 私の力の多くが戻りました。 我々を大きく助けてくれたそなたの働きに対して、 贈り物を差し上げなくてはなりません。 これを受け取りなさい・・・
dlga_lord_mission_sorcerer_failed:lord_pretalk|ええ、{playername}、 敵意に満ちた闇の力は、 いまだ我々をおおっています。 彼の妖術は以前よりも力を増したようです。 彼を止める事ができなかったのは不運でした。 彼が今後、 我々の動きに対して いままで以上に警戒を強めるのは、 間違いないでしょう。 ドル・グルドゥアがあるかぎり、 もう二度と彼を見つけ出す事は できないかも知れません。 そなたの労には感謝しますが、 いまはひとりにしてください。 私は疲れました。
dlga_lord_active_mission_1:lord_lend_companion_end|ああ、 コンパニオンを連れ戻しに来たのだな？ なるほど・・・
dlga_lord_active_mission_1:lord_pretalk|{playername}、 まだおぬしのコンパニオンの力が必要なのだ、 もうしばらく辛抱していただこう。 また日を改めて来てくれ。
dlga_lord_active_mission_1:lord_active_mission_2|うむ、良い知らせであろうな？
dlga_lord_active_mission_2:lord_generic_mission_thank|はい。 捕虜を{reg1}名、 連行して来ました。
dlga_lord_active_mission_2:lord_generic_mission_thank_extra|もちろんです。 捕虜の件ですが、 {reg1}名では足りない事もあろうかと思い、 {reg2}名、連行してきました。
dlga_lord_active_mission_2:lord_generic_mission_thank.1|はい。 味方の捕虜を{reg1}名救出し、 わが部隊に組み入れました。
dlga_lord_active_mission_2:lord_generic_mission_thank.2|はい。 {s13}の偵察をしてまいりました。
dlga_lord_active_mission_2:lord_generic_mission_thank.3|はい。 偵察隊を派遣してまいりました。
dlga_lord_active_mission_2:lord_generic_mission_thank.4|はい。 じゅうぶんな数の敵部隊を 殲滅してまいりました。
dlga_lord_active_mission_2:capture_enemy_hero_thank|もちろんです。 敵の指揮官を捕らえてまいりました。
dlga_capture_enemy_hero_thank:capture_enemy_hero_thank_2|わが友よ、大変感謝する。 この者ならば、 我々の質問に たっぷりと答えてくれることだろう。 おぬしの仕事ぶりは素晴らしい。
; dlga_capture_enemy_hero_thank_2:lord_pretalk|Certainly, {s65}.
; dlga_capture_enemy_hero_thank_2:lord_pretalk.1|It was nothing.
; dlga_lord_active_mission_2:lord_raise_troops_thank|Indeed. I have raised {reg1} {s13}. You can take them.
dlga_lord_active_mission_2:lord_hunt_down_fugitive_success|{s3}に潜伏中だった{s4}を捕捉し、 罰を与えました。
dlga_lord_active_mission_2:lord_hunt_down_fugitive_fail|残念ながら、 彼を取り逃がしました。
; dlga_lord_hunt_down_fugitive_success:lord_hunt_down_fugitive_success_2|And we'll all be a lot better off without him! Thank you, {playername},  for removing this long-festering thorn from my side. 'Tis good to know you can be trusted to handle things  with an appropriate level of tactfulness.  I've sent a note to our intendants already, and you can count on additional supplies from us.
; dlga_lord_hunt_down_fugitive_success_2:lord_hunt_down_fugitive_reward_accept|Thank you, {s65}.
; dlga_lord_hunt_down_fugitive_reward_accept:lord_pretalk|I'll notify our intendants of your service, {playername}. Once again, you've my thanks for ridding me of that {s44}.
; dlga_lord_hunt_down_fugitive_fail:lord_pretalk|It is a sad day when that {s44} manages to avoid my grasp yet again. I thought you would be able to do this, {playername}. Clearly I was wrong.
; dlga_lord_active_mission_2:lord_active_mission_3|I am still working on it.
; dlga_lord_active_mission_2:lord_mission_failed|I am afraid I won't be able to do this quest.
dlga_lord_active_mission_3:lord_pretalk|よろしい。 私がおぬしを頼りにしている事を、 忘れるなよ。
; dlga_lord_request_mission_ask:lord_pretalk|You still haven't finished the last task I gave you, {playername}. You should be working on that, not asking me for other things to do.
dlga_lord_request_mission_ask:lord_pretalk.1|いまのところ、 差し迫った用件はない。
; dlga_lord_request_mission_ask:lord_tell_mission|A task?
dlga_lord_tell_mission:lord_mission_capture_troll_1|おぬしは勇敢な下僕だ、{playername}、 よって我らの計画の一端を見せよう。 我々には化け物のような血と肉が必要なのだ。 我らはそれをねじまげ、 組み換え、 責め立て、 調教し、 組み上げ直して繁殖させ、 独自の巨大な戦士の種を創り上げ、 改良するのだ！
dlga_lord_mission_capture_troll_1:lord_mission_capture_troll_2|ご主人様、私はどうすればよろしいのでしょうか？
dlga_lord_mission_capture_troll_2:lord_mission_capture_troll_3|野生のトロルじゃよ、 {playername}。 活きの良い標本を一体捕獲し、 わしのところへ連れてくるのだ。 生きたままでな。 実験用に、 もう一体あると良いのう！ 都合、二体あると良い。 数はあればあるほど良いのだ。
dlga_lord_mission_capture_troll_3:lord_mission_capture_troll_infoa|そのような化け物は、どこにいるのでしょうか？
