dlga_start:mutiny_pretalk_1|おい、{playername}。 話があるんだけどさ・・・ ^みんな不満たらたらなんだぜ！ あちこち歩き回るばっかりで、 楽しいことないのかよ。
dlga_lord_mission_capture_troll_3:lord_mission_capture_troll_infob|そのような化け物を、捕らえることが出来るものなのでしょうか？
dlga_lord_mission_capture_troll_3:lord_mission_capture_troll_infoc|そのような化け物を、どうやってここまで連れてくれば良いのでしょうか？
dlga_lord_mission_capture_troll_3:lord_mission_capture_troll_accepted|野生のトロルを手に入れてご覧に入れます、ご主人様。
dlga_lord_mission_capture_troll_3:lord_mission_capture_troll_rejected|ご主人様、どうかご勘弁を！あのような化け物が相手では、虫のように潰されてしまいます！
dlga_lord_mission_capture_troll_infoa:lord_mission_capture_troll_3|このような血と闇の時代には、 洞窟に住む野生のトロルどもは興奮し、 霧ふり山脈にある巣から這い出して徘徊しておるはずだ・・・ あのあたりの洞窟を探すとよかろう。
dlga_lord_mission_capture_troll_infob:lord_mission_capture_troll_3|見つけたら、力ずくで倒すのだ。 手加減の必要はない: トロルはあまりにも丈夫で、 通常の武器ではすぐに殺すことはできない・・・ それに、 あやつらは驚異的な、 おぬしの想像を上回る回復力を持っておる。 トロルがみずからの血の海に倒れたら、 我らの許へ運ぶのだ。 息のあるうちにな。
dlga_lord_mission_capture_troll_infoc:lord_mission_capture_troll_3|おぬしには、車輪のついた、 頑丈な檻をもたせよう。 トロルを入れるだけの余裕はじゅうぶんあるうえ、 引きずり回すことができる。 ここへ戻る際には急ぐのだ: 鉄でできた檻ですら、 怒りと苦痛で猛るトロルに対しては万全とは言えぬ。 檻を抜け出しておぬしに襲いかからないよう、 じゅうぶん気をつけるのだ。
dlga_lord_mission_capture_troll_rejected:lord_pretalk|とうに見抜いてはいたが、 本性を見せよったか。 弱く、臆病な{playername}。 去れ。
dlga_lord_mission_capture_troll_accepted:lord_pretalk|おぬしの強さと勇猛さは頼りに出来ると常々考えておった。 これ奴隷ども、 {playername}に、 あの車輪つきの檻をひとつ用意するのだ！ {playername}、 わしへの贈り物を捕らえたら、 ここへ戻るのだ。 わしは{reg1}回目の夜明けを見るまえに贈り物が欲しい。
; dlga_lord_tell_mission:lord_tell_mission_kill_troll|Our land is facing dangers that were unheard of in our times. People are disappearing in the outskirts of {s3}. Not only commoners, but even small armed groups who venture outside the walls never return. There have been the strangest rumors, but I know what we are facing.
; dlga_lord_tell_mission_kill_troll:lord_mission_told|Wild trolls, {playername}. Giant beasts, twisted montrousities. They never ventured so far from their dark caves in the mountains but at least one of them have been sighted around {s3}. I don't know what witchery has caused this, but I need that thing to be dispatched.
; dlga_lord_mission_told:lord_mission_kill_troll_info_a|How can those beasts be fought?
; dlga_lord_mission_kill_troll_info_a:lord_mission_told|A troll is a dangerous creature indeed. A giant monster which possesses an incredible strength in its deformed muscles. Their skin is as hard as iron, and a tree trunk is but a small club when wielded in their hands. It is rumored that a single troll can esily best a group of half a dozen well armed and trained men, wasting each of them with a single blow. Not only men but horses too fear trolls. Be careful if you plan to charge one while mounted.
; dlga_lord_mission_told:lord_mission_kill_troll_info_b|Do you think it comes from Mordor, or Isengard?
; dlga_lord_mission_kill_troll_info_b:lord_mission_told|No, I don't think so. We have news that both the White Wizard and the Black Tower have all kinds of monsters among their ranks, but from what I hear the beast terrifying {s3} is one savage, untamed beast. Remember, there could be more than one. But you can be sure that some obscure craft from the Enemy has led this new plague upon us.
; dlga_lord_tell_mission:lord_mission_investigate_fangorn_0|Here is a mission for a trusted and brave servant like you, {playername}. The strangest rumors reach my ears from the forest of Fangorn. Minions sent to harvest wood, and even my commanders traversing the place, occasionally fail to return. Other times, they report of mysterious losses among their troops. They blame ghosts, spirits of the wood, ancient curses... Nonsense! Puny excuses for their own cowardice or ineptitude!
; dlga_lord_mission_investigate_fangorn_0:lord_mission_investigate_fangorn_1|What do you command me to do about it, Master?
; dlga_lord_mission_investigate_fangorn_0:lord_mission_investigate_fangorn_rejected|But Master, there is danger and pain in Fangorn! I've felt it myself!
; dlga_lord_mission_investigate_fangorn_1:lord_mission_investigate_fangorn_2|Maybe it is just that my other servants are unable to prevent the most cowardly worms in their troops from deserting.  Fools, blinded by superstitions.   Or, maybe, it is the treacherous ambushes of elven scum, hiding in the putrid trees as they usually do.   It could even be lowborn traitors from Rohan.  Or who knows what else. I want you to find out, {playername}.
; dlga_lord_mission_investigate_fangorn_2:lord_mission_investigate_fangorn_accepted|I fear no elves or spirit. Leave this to me, Master.
; dlga_lord_mission_investigate_fangorn_2:lord_mission_investigate_fangorn_rejected|Master, pity your servant! Don't ask me to venture in that cursed place!
; dlga_lord_mission_investigate_fangorn_rejected:lord_pretalk|So you are like the other worms: a superstitious, worthless coward.  I overestimated you. Now, begone!
; dlga_lord_mission_investigate_fangorn_accepted:lord_pretalk|Good. Go there and shed some light on this matter. Then return to me and report. I expect to see you back with news before {reg1} dawns are passed.
; dlga_lord_tell_mission:lord_mission_find_lost_spears|Here is a mission for a trusted and brave commander like you, {playername}. We are ill equipped to fight off the Rhun hordes. Our armies are losing battles one by one. A legend tells that once upon a time, there were spears made by Dwarves for the armies of the great King Bladorthin (long since dead), each had a thrice-forged head and their shafts were inlaid with cunning gold, but they were never delivered or paid for..
; dlga_lord_mission_find_lost_spears:lord_mission_find_lost_spears_1|What do you command me to do about it, my lord?
; dlga_lord_mission_find_lost_spears_1:lord_mission_find_lost_spears_2|These weapons would increase the effectiveness of our armies, but above all they will lift the spirits of our men. You'll have to find these spears. You'll have to go ask the dwarves for permission to search for the spears in the deeps of the Lonely Mountain. Beware, you may encounter some orcs or trolls in the tunnels. Are you available for this task?
; dlga_lord_mission_find_lost_spears_2:lord_mission_find_lost_spears_accepted|I fear no orcs nor trolls! I will find these spears for you, my lord.
; dlga_lord_mission_find_lost_spears_2:lord_mission_find_lost_spears_rejected|I'm afraid I can't help you, my lord.
; dlga_lord_mission_find_lost_spears_rejected:lord_pretalk|I see that discretion is the better part of your valor. Maybe you should stick to scouting duties.
; dlga_lord_mission_find_lost_spears_accepted:lord_pretalk|Good luck then!
; dlga_lord_tell_mission:lord_mission_mirkwood_sorcerer|There is an important service you can deliver to our people, {playername}.
; dlga_lord_mission_mirkwood_sorcerer:lord_mission_mirkwood_sorcerer_0|My power to defend and preserve Lothlorien has been diminished by the devices of the enemy. A master sorcerer of Dol Guldur is invoking powerful charms that inhibit our defenses. Though he is a mortal, he has become one of the enemies greatest pupils in the use of arcane rituals and he represents a great threat to our people. You must hunt him down and destroy him!
; dlga_lord_mission_mirkwood_sorcerer_0:lord_mission_mirkwood_sorcerer_1|Where can I find the sorcerer, my Lady?
; dlga_lord_mission_mirkwood_sorcerer_1:lord_mission_mirkwood_sorcerer_2|Search for him in Mirkwood forest, not far from Dol Guldur itself. He is both a well guarded and a cautious foe so you will need to use stealth to prevent the alarm from being raised. If he escapes, he will relocate to other dark places that we know not of and continue his wickedness unchallenged. There will be only one opportunity to defeat him. Much depends on your success. Go with our blessings.
; dlga_lord_mission_mirkwood_sorcerer_2:lord_pretalk|As you command, my Lady. I will try my best to eliminate this evil.
; dlga_lord_mission_mirkwood_sorcerer_2:lord_mission_mirkwood_sorcerer_rejected|Forgive me, my Lady. I have some pressing matters to attend before I can help your people with this endevour.
; dlga_lord_mission_mirkwood_sorcerer_rejected:lord_pretalk|I understand, {playername}. But do not tally for too long, I'm growing tired of resisting his evil magic.
dlga_lord_tell_mission:lord_mission_deliver_message|{s4}にいる{s13}に この手紙を届けたいのだが、 もし近くに行く事があるのなら、 おぬしが届けてくれぬか？ 手紙は30日以内に 先方に届けられなくてはならん。
dlga_lord_mission_deliver_message:lord_mission_deliver_message_accepted|引き受けましょう。近々{s4}の付近を通る予定です。
dlga_lord_mission_deliver_message:lord_mission_deliver_message_rejected|{s65}、近いうちに{s13}に会う機会があるとは思えません。他の者にお申しつけください。
dlga_lord_mission_deliver_message_accepted:close_window|それは助かる、 {playername}。 これが手紙だ。 {s13}に会ったら、 よろしく伝えておいてくれ。
dlga_lord_mission_deliver_message_rejected:lord_pretalk|そうか、まあよい。 では、他の誰かに頼むとしよう。
dlga_lord_tell_mission:lord_mission_deliver_message.1|{s4}にいる{s15}の{s13}に この手紙を届けたいのだが、 もし近くに行く事があるのなら、 おぬしが届けてくれぬか？ 手紙は40日以内に 先方に届けられなくてはならん。
; dlga_lord_tell_mission:lord_mission_told|There is an urgent matter... My messenger is due to report on our battle plans to commanders in {s14}. His trip has been postponed several times already with all the trouble on the roads, but this time he must get through. So, I want to at least make sure he's well-guarded. I trust you well, {playername} so I would be very grateful if you could escort him to {s14} and make sure he arrives safe and sound.
; dlga_lord_tell_mission:lord_mission_told.1|I have a friend here, an old warrior, who is very sick. Pestilence has infected an old battle wound,and unless he is seen to by a surgeon soon, he will surely die. This man is dear to me, {playername},but he's also stubborn as a hog and refuses to have anyone look at his injury because he doesn't trust the physicians here.I have heard that you've a capable surgeon with you. If you would let your surgeon come here and have a look,{reg3?she:he} may be able to convince him to give his consent to an operation.Please, I will be deeply indebted to you if you grant me this request.
; dlga_lord_tell_mission_raise_troops:lord_tell_mission_raise_troops_2|How many men do you need?
; dlga_lord_tell_mission_raise_troops_2:lord_mission_raise_troops_told|If you can raise {reg1} {s14} and bring them to me, that will probably be enough.
; dlga_lord_mission_raise_troops_told:lord_mission_raise_troops_accepted|Of course, {s65}. Give me {reg1} fresh recruits and I'll train them to be {s14}.
; dlga_lord_mission_raise_troops_told:lord_mission_raise_troops_rejected|I am too busy these days to train anyone.
; dlga_lord_mission_raise_troops_accepted:close_window|You've taken a weight off my shoulders, {playername}. I shall tell my sergeants to send you the recruits and attach them to your command. Also, I'll advance you some money to help with expenses. Here, this purse should do it. Thank you for your help.
; dlga_lord_mission_raise_troops_rejected:lord_pretalk|Oh, of course. I had expected as much. Well, good luck to you then.
; dlga_lord_tell_mission:lord_mission_hunt_down_fugitive_told|I have something you could help with, an issue with the lawless villain known as {s4}.  He murdered one of my bodyguards and has been on the run from his judgment ever since. There were news recently that the fugitive has been seen at {s3}. You might be able to hunt him down and deliver him swift justice, and I'll reward you in turn.
; dlga_lord_mission_hunt_down_fugitive_told:lord_mission_hunt_down_fugitive_accepted|Then I will hunt him down and execute the law.
; dlga_lord_mission_hunt_down_fugitive_told:lord_mission_hunt_down_fugitive_rejected|I am too busy to go after him at the moment.
; dlga_lord_mission_hunt_down_fugitive_accepted:close_window|That's excellent, {playername}.  I will be grateful, and of course your prowess wil be duly noted.  Well, good hunting to you.
; dlga_lord_mission_hunt_down_fugitive_rejected:lord_pretalk|As you wish, {playername}.I suppose there are plenty of bounty hunters around to get the job done . . .
; dlga_lord_tell_mission:lord_mission_told.2|Well, some of the slaves working in {s4} have run away.  The ungrateful swine, whose lives we spared!  From what I've been hearing, they're running to {s3} as fast as they can, and have split up into three groups to try and avoid capture. I want you to capture all three groups and fetch them back to {s4} by whatever means necessary. I should really have them hanged for attempting to escape, but we need hands now, so I'll let them go off this time with a good beating.
; dlga_lord_tell_mission:lord_tell_mission_follow_spy|I have good information that a man in this very town is actually an enemy spy. He should be seized and hanged for his impudence, but we also believe that very soon he will leave town to meet with his master, the man to whom the spy feeds all his little whispers. The spy himself is of little import, but the master is a dangerous man, and could tell us a great deal if we could only get our hands on him...
; dlga_lord_tell_mission_follow_spy:lord_tell_mission_follow_spy_2|I want you to wait here until the spy leaves town. Then you must follow him, stealthily, to the meeting place. You must take absolute care not to be seen by the spy on your way, else he may suspect foul play and turn back. When the master appears, you must ambush and arrest them and bring the pair back to me. Alive, if you please.
; dlga_lord_tell_mission_follow_spy_2:lord_tell_mission_follow_spy_accepted|I'll do it, {s65}.
; dlga_lord_tell_mission_follow_spy_2:lord_tell_mission_follow_spy_rejected|No, this skulking is not for me.
; dlga_lord_tell_mission_follow_spy_accepted:close_window|Good, I'm sure you'll do a fine job of it. One of my men will point the spy out to you when he leaves, so you will know the man to follow. Remember, I want them both, and I want them alive.
; dlga_lord_tell_mission_follow_spy_rejected:lord_pretalk|A shame. Well, carry on as you were, {playername}...
; dlga_lord_tell_mission:lord_tell_mission_capture_enemy_hero|There is a difficult job I need done, {playername}, and you may be the one who can carry it off. I need someone to capture one of the enemy commanders and bring him to me. Afterwards, I'll be able to question him on the enemy battle plans. It is a simple enough job, but whomever you choose will be guarded by an elite band of personal retainers. Are you up for a fight?
; dlga_lord_tell_mission_capture_enemy_hero:lord_tell_mission_capture_enemy_hero_accepted|Consider it done, {s65}.
; dlga_lord_tell_mission_capture_enemy_hero:lord_tell_mission_capture_enemy_hero_rejected|I must refuse, {s65}. I don't want to get close to any of them.
; dlga_lord_tell_mission_capture_enemy_hero_accepted:close_window|I like your spirit! Go and bring me one of our enemies, and I'll toast your name in my hall when you return! And reward you for your efforts, of course...
; dlga_lord_tell_mission_capture_enemy_hero_rejected:lord_pretalk|Clearly you lack the mettle I had thought you possessed. Very well, {playername}, I will find someone else.
; dlga_lord_tell_mission:lord_tell_mission_lend_companion|I don't have a task for you right now, but your companion {s3} is a skilled {reg3?lass:fellow} and I need someone with {reg3?her:his} talents. Will you lend {reg3?her:him} to me for a while?
; dlga_lord_tell_mission_lend_companion:lord_tell_mission_lend_companion_2|How long will you be needing {reg3?her:him}?
; dlga_lord_tell_mission_lend_companion_2:lord_mission_lend_companion_told|Just a few days, a week at most.
; dlga_lord_mission_lend_companion_told:lord_tell_mission_lend_companion_accepted|Then I will leave {s3} with you for one week.
; dlga_lord_mission_lend_companion_told:lord_tell_mission_lend_companion_rejected|I am sorry, but I cannot do without {s3} for a whole week.
; dlga_lord_tell_mission_lend_companion_accepted:close_window|I cannot thank you enough, {playername}. Worry not, your companion shall be returned to you with due haste.
; dlga_lord_tell_mission_lend_companion_rejected:lord_pretalk|Well, that's damned unfortunate, but I suppose I cannot force you or {s3} to agree. I shall have to make do without.
; dlga_lord_tell_mission:lord_mission_told.3|Our scouts have noticed a recent increase in enemy activity. Unfortunately they almost never succeed in capturing live prisoners and bring them in for questioning, so we can piece together what the enemy is up to. So, I need a good warrior to find me {reg1} enemy prisoners, that I may question them.
dlga_lord_tell_mission:lord_pretalk|いや、{playername}。 今は間に合っている。
dlga_lord_mission_told:lord_mission_accepted|おまかせください、 {s65}。
dlga_lord_mission_told:lord_mission_rejected|恐れ入りますが、今はこのような任務を引き受ける事はできません。
dlga_lord_mission_accepted:close_window|素晴らしい、{playername}、 大変結構だ。 おぬしの事は全面的に信頼しておる。
dlga_lord_mission_rejected:close_window|そうか？ まあ、おぬしの手に余る任務かも知れんな。 もっと気概のある者に申し付けるとしよう。
dlga_lord_talk:lord_leave_prison|失礼させていただきます。
dlga_lord_talk:lord_leave|おしゃべりはこれまで。失礼する。
dlga_lord_talk:lord_leave.1|失礼します。
dlga_lord_leave_prison:close_window|また会おう。
dlga_lord_leave:close_window|あまり調子に乗りすぎぬことだな、 {playername}。
dlga_lord_leave:close_window.1|うむ。さらばだ、{playername}。
dlga_lord_leave:close_window.2|旅の無事を祈る、{playername}。
dlga_lord_leave:close_window.3|うむ、うむ。さらばだ。
dlga_lord_leave:close_window.4|また会おう。
dlga_start:lady_escort_lady_succeeded|ここまでの護衛を感謝します、 {playername}。 あなたの見事な仕事ぶりは、 しっかりと報告させていただきます。
dlga_lady_escort_lady_succeeded:close_window|お役に立てて光栄だ。
dlga_start:prison_guard_players|ごきげんよう、指揮官殿。牢獄にご用で？
dlga_prison_guard_players:close_window|そうだ。扉を開けて欲しい。
dlga_prison_guard_players:close_window.1|申し訳ないが、今はだめだ。
dlga_start:prison_guard_talk|何かご用で？
dlga_prison_guard_talk:prison_guard_ask_prisoners|誰が牢獄に入れられている{んだ/の}？
dlga_prison_guard_talk:prison_guard_visit_prison|捕虜と話がしたい。
dlga_prison_guard_ask_prisoners:prison_guard_talk|今は{s51}だ。
dlga_prison_guard_visit_prison:close_window|どうぞ、お通りください、指揮官殿。
dlga_prison_guard_visit_prison:prison_guard_visit_prison_2|捕虜と面会するには、 我々の主人の許可をもらう必要がある。
dlga_prison_guard_visit_prison_2:close_window|そうか。ではそちらを当たろう。
dlga_prison_guard_visit_prison_2:prison_guard_visit_prison_3|かたい事を言{うな/わないで}。ここの主は{君だろう/あなたでしょう}。
dlga_prison_guard_visit_prison_3:prison_guard_visit_prison_4|へへ。おっしゃる通りで。 それでも、 あなたをお通しするわけには参りません。
dlga_prison_guard_visit_prison_4:close_window|そうか。では引き揚げるとしよう。
; dlga_prison_guard_visit_prison_4:prison_guard_visit_prison_5|I found a purse with 100 denars a few paces away. I reckon it belongs to you.
; dlga_prison_guard_visit_prison_5:close_window|Ah! I was looking for this all day. How good of you to bring it back {sir/madam}. Well, now that I know what an honest {man/lady} you are, there can be no harm in letting you inside. Go in.
dlga_prison_guard_talk:close_window|なんでもない。
; dlga_start:castle_guard_players|Your orders, Commander?
; dlga_castle_guard_players:close_window|Open the door. I'll go in.
dlga_castle_guard_players:close_window.1|なんでもない。
; dlga_start:castle_guard_sneaked_intro_1|Get out of my sight, beggar! You stink!
; dlga_start:close_window.8|Get lost before I lose my temper you vile beggar!
dlga_castle_guard_sneaked_intro_1:castle_guard_sneaked_intro_2|ここの主に取り次ぎ願いたい。
dlga_castle_guard_sneaked_intro_1:close_window|[立ち去る]
dlga_castle_guard_sneaked_intro_2:close_window|この{男/女}は、気がふれたのか？ ここは物乞いの来るところではない。 痛い目にあわないうちに、さっさと消えろ。
dlga_start:castle_guard_intro_1|何か用か？
dlga_castle_guard_intro_1:castle_guard_intro_2|ここの主に取り次ぎ願いたい。
dlga_castle_guard_intro_1:close_window|なんでもない。
dlga_castle_guard_intro_2:castle_guard_intro_2|まずここで武器を預らせていただく。 大広間での武器の携帯は許されていない。
dlga_castle_guard_intro_2:close_window|よかろう、武器はこれだ。 では入らせてもらうぞ。
dlga_castle_guard_intro_2:castle_guard_intro_2b|武器を預ける事はできない。
dlga_castle_guard_intro_2b:close_window|では入場は許可できんな。
dlga_start:castle_gate_guard_talk|何か用か？
dlga_castle_gate_guard_pretalk:castle_gate_guard_talk|何かご用で？
; dlga_castle_gate_guard_talk:castle_gate_open|We need shelter for the night. Will you let us in?
; dlga_castle_gate_guard_talk:request_meeting_castle_lord|I want to speak with the lord of the castle.
; dlga_castle_gate_guard_talk:request_meeting_other|I want to speak with someone in the castle.
dlga_castle_gate_guard_talk:close_window|[立ち去る]
; dlga_request_meeting_castle_lord:close_window|Wait here. {s2} will see you.
; dlga_request_meeting_castle_lord:castle_gate_guard_pretalk|My lord is not here now.
; dlga_request_meeting_other:request_meeting_3|Who is that?
dlga_request_meeting_3:close_window|なんでもない。
; dlga_request_meeting_4:request_meeting_5|Wait there. I'll send him your request.
; dlga_request_meeting_5:request_meeting_6|I'm waiting...
; dlga_request_meeting_6:close_window|All right. {s2} will talk to you now.
; dlga_request_meeting_6:close_window.1|{s2} says he will not see you. Begone now.
; dlga_castle_gate_open:close_window|My lord {s2} will be happy to see you {sir/madam}. Come on in. I am opening the gates for you.
; dlga_castle_gate_open:close_window.1|My lord {s2} is not in the castle now. But I think he would approve of you taking shelter here. Come on in. I am opening the gates for you.
; dlga_castle_gate_open:close_window.2|Come on in. I am opening the gates for you.
; dlga_castle_gate_open:close_window.3|Come on in. But make sure your men behave sensibly within the walls.  My lord {s2} does not want trouble here.
; dlga_castle_gate_open:close_window.4|My lord {s2} does not want you here. Begone now.
; dlga_party_relieved:caravan_help0|Thank you for helping! We are safe now.
; dlga_caravan_help0:caravan_help1|Thank you for helping! We are safe now. Have you seen those large orcs before? Those do not look like regular mountain ilk we are used to fend off easily. And the paint on their shields is an ancient Mordor sign. I haven't seen those this side of the river for a long time. Dire things are afoot.. War is coming! I advise you to go to Edoras, the capital of your people, and deliver the message about what you've seen to whomever is in command there. It's an important matter, so please make haste.
; dlga_caravan_help1:caravan_help2|Yeah, I never seen such a large orc before. Nasty things.
