dlga_start:mutiny_pretalk_1|おい、{playername}。 話があるんだけどさ・・・ ^みんな不満たらたらなんだぜ！ あちこち歩き回るばっかりで、 楽しいことないのかよ。
; dlga_caravan_help2:caravan_help3|Also, I see you are a capable warrior. I have a personal business I would like your help with. There is a small fort near Nindalf swamps, where common people and travellers can find food and lodge. It's run by a local chief who does not answer neither to Gondor, nor to Rohan. I'm a merchant traveller myself, so I have respect for people wishing to be free from lordship bonds, as long as they behave. But being independent, they are also powerless before enemy onslaught. War outbreak in next several days looks like a certain thing to me. I want you to get to those people and see if you can help them survive. Tell the chief, Balan, that Torbal asked you to deliver 'a fishslap'. He will recognize it was me who sent you.
; dlga_caravan_help3:close_window|I'll deliver your message. Safe journey to you, Torbal. I'm sure we will meet again.
dlga_start:close_window.9|あぶないところであった。 我々の力を合わせ、 敵勢にたっぷりとお礼をしてやろうではないか。
dlga_start:close_window.10|我々に戦いを挑むとは、 おぬしは大きな間違いを犯そうとしている。
dlga_start:ally_thanks_meet|きちんとした挨拶を交わすのはこれが初めてであったな、わが友よ。 我ながら、わが命の恩人の名を知らないとは・・・
dlga_start:ally_thanks_meet.1|危ないところの助勢、かたじけない。 私の名は{s1}。 そちらの名前を伺ってもよろしいか？
dlga_start:ally_thanks_meet.2|助勢を感謝する。 挨拶はまだであったな？ おぬしの名はなんという？
dlga_ally_thanks_meet:ally_thanks_meet_2|私の名は{playername}です。
dlga_ally_thanks_meet_2:close_window|会えて光栄だ、{playername}。 私の名は{s1}、 この恩は一生忘れまい。 私に出来る事があれば、ぜひ言ってくれ。
dlga_ally_thanks_meet_2:close_window.1|会えて光栄だ、{playername}。 今日の恩は忘れまい。 いつの日か、この恩に報いたいものだ。
dlga_ally_thanks_meet_2:close_window.2|会えて光栄だ、{playername}。 私は{s1}。 おぬしの助勢に感謝する。 また会おう。
dlga_start:close_window.11|またあぶないところを助けてもらったな、 {playername}！ まったく、おぬしは私の一番の友人だ。 {s43}
dlga_start:close_window.12|おぬしの助勢があと一歩遅かったら、 私の命はなかったであろう！ {playername}。 心より感謝する！ {s43}
dlga_start:close_window.13|あぶないところを助けてもらったな、 {playername}！ この事は忘れまい。 {s43}
dlga_start:close_window.14|{playername}、 ここでおぬしに会えるとはうれしい。 {s43}
dlga_start:close_window.17|助勢を感謝します、指揮官どの。 あなたのおかげで{reg1?我々:私}は命拾いをしました。
dlga_start:close_window.18|助勢を感謝します、指揮官どの。 あなたが近くにいるだけで心強く思います。
dlga_start:close_window.19|助勢を感謝します、指揮官殿。 あなたが近くにおられたのは幸運でした。
; dlga_start:freed_hero_answer|I am in your debt for freeing me friend.
; dlga_freed_hero_answer:freed_hero_answer_1|You're not going anywhere. You'll be my prisoner now!
; dlga_freed_hero_answer_1:close_window|Alas. Will my luck never change?
; dlga_freed_hero_answer:freed_hero_answer_2|You're free to go, {s65}.
; dlga_freed_hero_answer_2:close_window|Thank you, Commander. I never forget someone who's done me a good turn.
; dlga_freed_hero_answer:freed_hero_answer_3|Would you like to join me?
; dlga_freed_hero_answer_3:close_window|All right I will join you.
; dlga_freed_hero_answer_3:close_window.1|No, I want to go on my own.
; dlga_start:defeat_hero_answer|You'll not live long to enjoy your victory. My kinsmen will soon wipe out the stain of this defeat.
dlga_defeat_hero_answer:defeat_hero_answer_1|おぬしは我らが捕虜となった。
; dlga_defeat_hero_answer_1:close_window|Damn you. You will regret this.
; dlga_defeat_hero_answer:defeat_hero_answer_2|You're free to go this time, but don't cross my path again.
dlga_defeat_hero_answer_2:close_window|また会おう。
dlga_start:fugitive_1|何だ、何か用かい？
dlga_fugitive_1:fugitive_2|{s4}という名のおたずね者を探している。 おまえは特徴が一致するのだ。
dlga_fugitive_1:close_window|なんでもない。邪魔をしたな。
dlga_fugitive_2:fugitive_3|何のことだ、俺は知らないぞ。 人違いだろう。
dlga_fugitive_3:fugitive_4|では武器を地面に落とせ。 身に覚えがないのなら、 恐れる理由はないはずだ。 警備隊長のところまで私に同行し、 私が人違いをしているかどうか、 確認を取らせてもらう。
dlga_fugitive_4:close_window|くそっ！てめえにはここで死んでもらう！
dlga_start:follow_spy_talk|やあ、こんにちは。 今日は本当に良い天気だと思いませんか？ さて、話込むわけにも参りませんので、 私はこれで失礼させていただきます。
dlga_follow_spy_talk:follow_spy_talk_2|{s1}の名において、おまえを逮捕する！
; dlga_follow_spy_talk_2:close_window|You won't get me alive!
; dlga_follow_spy_talk:close_window|Never mind me. I was just passing by.
; dlga_start:spy_partners_talk|Greetings.
; dlga_spy_partners_talk:spy_partners_talk_2|In the name of {s1} You are under arrest!
; dlga_spy_partners_talk_2:close_window|You will have to fight us first!
; dlga_spy_partners_talk:close_window|Never mind me. I was just passing by.
; dlga_start:runaway_serf_intro_1|Good day master.
; dlga_runaway_serf_intro_1:runaway_serf_intro_2|I have been sent by your {s4} whom you are running from. He will not punish you if you return now.
; dlga_runaway_serf_intro_2:runaway_serf_intro_3|My good master. Our lives at {s1} was unbearable. We worked all day long and still went to bed hungry. We are going to {s6} to start a new life, where we will be treated like humans.
; dlga_runaway_serf_intro_3:runaway_serf_go_back|You have gone against our laws by running from slavery. You will go back to {s1} now!
; dlga_runaway_serf_go_back:close_window|All right master. As you wish. We'll head back to {s5} now.
; dlga_start:runaway_serf_talk_caught|Good day master. We were heading back to {s5}, but I am afraid we lost our way.
; dlga_runaway_serf_talk_caught:runaway_serf_go_back|Do not test my patience. You are going back now!
; dlga_start:runaway_serf_talk_again_return|We are on our way back to {s5} master.
; dlga_runaway_serf_talk_again_return:runaway_serf_talk_again_return_2|Make haste now. The sooner you return the better.
; dlga_runaway_serf_talk_again_return:runaway_serf_talk_again_return_2.1|Good. Keep going.
; dlga_runaway_serf_talk_again_return_2:close_window|Yes master. As you wish.
dlga_mayor_talk:mayor_deliver_wine|君に{s4}を{reg9}ユニット届けるよう頼まれた。
dlga_mayor_deliver_wine:mayor_pretalk|ようやく届いた！ 我々の在庫はもう、 尽きかけていたところです。 前もって{s4}の手配は済ませていたんです。 {s9}にはよろしく伝えてください。^^[{s14}のリソースポイントを{reg14}獲得しました]
dlga_mayor_talk:mayor_deliver_wine_incomplete|君に{s4}を{reg9}ユニット届けるよう 頼まれたのだが、 荷をいくつか、敵に奪われてしまった。
dlga_mayor_deliver_wine_incomplete:mayor_pretalk|やつらめ、思い知らせてやる！ まあ、少なくとも{s4}はいくらか届いたわけです。 感謝します。^^[{s14}のリソースポイントを{reg14}獲得しました]
; dlga_start:mercenary_tavern_talk|Do you have a need for mercenaries, Commander? {reg3?Me and {reg4?{reg3} of my mates:one of my mates} are:I am} looking for a master. We'll join you for {reg5} denars.
; dlga_start:mercenary_after_recruited|Any orders, Commander?
; dlga_mercenary_after_recruited:mercenary_after_recruited_2|Make your preparations. We'll be moving at dawn.
; dlga_mercenary_after_recruited:mercenary_after_recruited_2.1|Take your time. We'll be staying in this town for a while.
; dlga_mercenary_after_recruited_2:close_window|Yes, Commander. We'll be ready when you tell us to leave.
; dlga_mercenary_tavern_talk:mercenary_tavern_talk_hire|All right. I will hire all of you. Here is {reg5} denars.
; dlga_mercenary_tavern_talk:mercenary_tavern_talk_hire.1|All right. But I can only hire {reg6} of you. Here is {reg5} denars.
; dlga_mercenary_tavern_talk:tavern_mercenary_cant_lead|That sounds good. But I can't afford to hire any more men right now.
; dlga_tavern_mercenary_cant_lead:close_window|That's a pity. Well, {reg3?we will:I will} be lingering around here for a while, if you need to hire anyone.
; dlga_mercenary_tavern_talk:tavern_mercenary_cant_lead.1|That sounds good. But I can't lead any more men right now.
; dlga_mercenary_tavern_talk:close_window|Sorry. I don't need any other men right now.
dlga_start:trainer_pretalk|ガントレットの第{reg2}波までいきましたね。 {s4}
dlga_start:trainer_pretalk.1|素晴らしい。全員倒してしまいました。
dlga_start:trainer_talk|訓練日和ですな。さっそくはじめますか？
dlga_trainer_pretalk:trainer_talk|訓練をはじめますか？
dlga_trainer_talk:trainer_combat_begin|まず、戦闘について教えてもらいたい・・・
dlga_trainer_talk:trainer_choose_mode|訓練をはじめよう。
dlga_trainer_talk:close_window|今日はここまでにしておこう。また来る。
dlga_trainer_combat_begin:trainer_talk_combat|何が知りたいので？
dlga_trainer_combat_pretalk:trainer_talk_combat|他に知っておきたいことは？
dlga_trainer_talk_combat:trainer_explain_defense|防御について知りたい。
dlga_trainer_talk_combat:trainer_explain_attack|武器を使った攻撃について知りたい。
dlga_trainer_talk_combat:trainer_explain_horseback|馬上での戦闘について知りたい。
dlga_trainer_talk_combat:trainer_pretalk|これで一通りの理論は頭に入れたな。他の事について話そう。
dlga_trainer_explain_defense:trainer_explain_defense_2|いい質問です。 戦士の基本は、 まず自分の身を守ることです。 危険な場所を避けることがまず戦闘の第一で、 これは敵を攻撃する事よりもずっと重要な事です。 剣を振り回していくらかの傷を敵に与えるのは誰でもできますが、 最後に生き残るのは防御に長けた者だけです。
dlga_trainer_explain_defense_2:trainer_explain_defense_3|さて。最も簡単な防御方法は、 盾を使うことです。 盾をかまえればよいだけです。 [マウスの右ボタンを押すと盾をかまえます。] この状態ならば、 前方からの攻撃はすべてはじくことができる。 しかし、 横方向や後ろからの攻撃には効果はありません。
dlga_trainer_explain_defense_3:trainer_explain_defense_4|盾を持たない場合は？
dlga_trainer_explain_defense_4:trainer_combat_pretalk|その場合は武器を使って防御しなければなりません。 これは盾を使った防御よりも少々難しい。 武器で防御をする場合、 防ぐことができるのは、 たったひとつの攻撃方向だけです。 つまり、 上段からの振り下ろし、 横へのなぎ払い、 もしくは突きのうちのいづれかのみ、 という事です。 そのため、 相手をよく見て、 相手が攻撃を出した後に、 その方向に防御しなければなりません。 これで相手からの攻撃を受け止める事ができる。 もし相手が攻撃を出すまえに防御の姿勢をとってしまうと、 相手は防御のかまえとは別の攻撃方向に切り替えて 攻撃を命中させてしまうでしょう。
dlga_trainer_explain_attack:trainer_explain_attack_2|よく聞いてくれました。 攻撃は最大の防御なり、 といわれます。 多くの戦士に好まれる戦法は、 武器を振りかぶった状態を維持し、 相手の隙をとらえた瞬間に武器を振りぬく、 というものです。 [マウスの左ボタンを押すと武器を振りかぶり、 押したままにすることで振りかぶった状態を維持します。]
dlga_trainer_explain_attack_2:trainer_explain_attack_3|それは使えそうだ。
dlga_trainer_explain_attack_3:trainer_explain_attack_4|いい戦法ですが、 相手に見透かされて、 攻撃方向に対して防御の姿勢をとられる可能性もある。 もしそうなったら、 攻撃を中断して素早く他の攻撃方向を選択しなければなりません。 [マウスの右ボタンを素早くクリックすることで、 現在の攻撃をキャンセルできます]。
dlga_trainer_explain_attack_4:trainer_explain_attack_5|もし相手が自分の攻撃方向に対して防御の姿勢をとっている場合は、 攻撃を中断して別の攻撃方向を選択する必要がある、と。
dlga_trainer_explain_attack_5:trainer_combat_pretalk|そうです、 攻撃方向の選択は、 極めて重要な技術です。 攻撃方向には4種類あります: 右へのなぎ払い、 左へのなぎ払い、 上段からの振り下ろし、 そして突きです。 これらはよく考えて選択しなければならない。 [振りの方向を選択するには、 デフォルトの設定ではマウスの左ボタンを押す直前に、 武器の攻撃方向へマウスを移動させます]。
dlga_trainer_explain_horseback:trainer_combat_pretalk|非常に良い質問です。 馬は戦士にとって、 戦闘をするうえでの最強の武器でしょう。 馬によって移動速度、 高さ、 破壊力、 それと主導権を手に入れることができる。 多くの武器は、 馬上で使うことによってその破壊力を大いに増します。 しかしながら、 相手が馬上にてランスを構えていた場合、 そのどんな相手も一撃必殺の破壊力には、 特に注意を要します。 [ランスを構えるには、 ランスかそれと同等の武器を装備し、 攻撃ボタンも防御ボタンも押さずに馬を走らせます。 ある一定の速度に達すると、 あなたは自然にランスを低く構えます。 そうしたら、 馬を操作してランスを敵に当ててください。]
dlga_trainer_choose_mode:trainer_choose_mode_player|兵士たちの技術向上のために、 ここでは訓練にいくつかの種類を用意しています。 一本勝負では、 あなたひとりで一人から四人の相手をしていただきます。 団体戦では、 お互い4人から12人づつ二手に分かれて戦います。 最後に、 ガントレットと呼ばれる、 戦士にとって最大の挑戦と言える訓練があります ― あなたひとりで対戦相手の波をさばいてもらいますが、 回を追うごとに相手の人数が増えていきます。 大勢での殴り合いは、 単なる入り乱れての大喧嘩です。^どれにしますか？
dlga_trainer_choose_mode_player:trainer_choose_opponents|一本勝負。
dlga_trainer_choose_mode_player:trainer_choose_opponents.1|団体戦。
dlga_trainer_choose_mode_player:trainer_choose_weapon|ガントレット。
dlga_trainer_choose_mode_player:trainer_choose_weapon.1|大勢での殴り合い。
dlga_trainer_choose_mode_player:trainer_pretalk|どれも結構。気が変わった。
dlga_trainer_choose_opponents:trainer_choose_opponents_player|では対戦相手の人数を選んでいただこう。
dlga_trainer_choose_opponents_player:trainer_choose_weapon|ひとり。
dlga_trainer_choose_opponents_player:trainer_choose_weapon.1|ふたり。
dlga_trainer_choose_opponents_player:trainer_choose_weapon.2|3人。
dlga_trainer_choose_opponents_player:trainer_choose_weapon.3|4人。今日はツキがある。
dlga_trainer_choose_opponents_player:trainer_choose_weapon.4|4人。
dlga_trainer_choose_opponents_player:trainer_choose_weapon.5|8人。
dlga_trainer_choose_opponents_player:trainer_choose_weapon.6|12人、私とコンパニオンは無敵だ。
dlga_trainer_choose_opponents_player:trainer_pretalk|ちょっと待ってくれ、気が変わった。
dlga_trainer_choose_weapon:trainer_choose_weapon_player|最後に、好きな武器の種類を選んでいただこう。
dlga_trainer_choose_weapon_player:trainer_begin_training|片手武器。
dlga_trainer_choose_weapon_player:trainer_begin_training.1|両手武器。
dlga_trainer_choose_weapon_player:trainer_begin_training.2|長柄武器。
dlga_trainer_choose_weapon_player:trainer_begin_training.3|弓。
dlga_trainer_choose_weapon_player:trainer_begin_training.4|投擲武器。
dlga_trainer_choose_weapon_player:trainer_pretalk|ちょっと待ってくれ、気が変わった。
dlga_trainer_begin_training:close_window|さあ、これで準備完了です。 訓練が終わったら、私に声をかけてください。
dlga_start:close_window.20|むこうへ行け、 薄汚い物乞いめ。
; dlga_start:mayor_begin|Good day, my lord.
dlga_start:mayor_talk|ごきげんよう、お客人。 {s9}へは初めてのご様子。 私はこの拠点のギルドマスターです。
dlga_start:mayor_begin.1|ごきげんよう、{playername}。
dlga_mayor_begin:lord_deal_with_night_bandits_completed|なんと鮮やかな、{playername}、 あのろくでなしどもを、 あっさり片付けてしまうとは！^^[{s14}のリソースポイントを{reg14}獲得しました]
dlga_lord_deal_with_night_bandits_completed:close_window|自業自得{だな/ね}。
; dlga_mayor_talk:mayor_deliver_iron|I've brought you better quality metal, {reg9} units of {s4}, when you requested {s3}.
; dlga_mayor_talk:mayor_deliver_iron.1|Here's your metal supply, {reg9} units of {s4}.
; dlga_mayor_talk:mayor_deliver_iron.2|I've brought more metal, {reg8} units of {s4}, when you requested {reg9}.
; dlga_mayor_deliver_iron:mayor_deliver_iron_completed|Very nice work, {playername}. Our smiths will find ways to put everything they are given to good use.
; dlga_mayor_deliver_iron_completed:close_window|I do what I can.
dlga_mayor_talk:mayor_deliver_food|さあこれが食料{だ/よ}、 {s4}を{reg9}{だ/ね}。
; dlga_mayor_deliver_food:mayor_deliver_food_completed|Very nice work, {playername}, our food stores are full again and nobody will starve for now.
; dlga_mayor_deliver_food_completed:close_window|I do what I can.
; dlga_mayor_begin:mayor_looters_quest_response|Ah, {playername}. Have you any progress to report?
; dlga_mayor_looters_quest_response:mayor_looters_quest_destroyed|I've killed some tribal orcs.
; dlga_mayor_looters_quest_response:close_window|Not yet, sir. Farewell.
; dlga_mayor_looters_quest_destroyed:mayor_looters_quest_destroyed_2|Aye, my scouts saw the whole thing. That should keep those tribal orcs at bay!^^[earned {reg14}x{reg15} Resource Points of {s14}]
; dlga_mayor_looters_quest_destroyed_2:close_window|And that's not the only good news! Thanks to you, the tribal orcs have ceased to be a threat. We've not had a single attack reported for some time now.  If there are any of them left, they've either run off or gone deep into hiding. That's good for the safety of the place!  I think that concludes your task, {playername}. Thank you, and farewell.
; dlga_mayor_looters_quest_destroyed_2:mayor_looters_quest_response|Anything else you need?
dlga_mayor_begin:close_window|よく来てくれた、{playername}。 連中を無事に届けてくれたらしいな。 我らの上官に、 おぬしは信頼できる者だと報告しておこう。 ^^[{s14}のリソースポイントを{reg14}獲得しました]
dlga_mayor_begin:move_cattle_herd_failed|{s9}に辿り着くまえに、 連中を見失ったそうだな。 おぬしの失態を 我らの上官に説明するのは ひと苦労だったぞ。 何か言う事はあるか？
dlga_move_cattle_herd_failed:move_cattle_herd_failed_2|すまない。だが、道中に攻撃を受けたのだ。
dlga_move_cattle_herd_failed:move_cattle_herd_failed_2.1|すまない。夜中に彼らを見失ってしまったのだ。
dlga_move_cattle_herd_failed_2:close_window|何が起ころうとも、 連中を安全に届けるのは おぬしの責任だ。 我らの上官が 責任は誰にあるのかを 知りたがっていたので、 おぬしの名前を伝えておいたぞ。
dlga_mayor_begin:mayor_friendly_pretalk|あなたの活躍は聞きました。 あれくらいが、 あのゴブリンどもにはふさわしい。 あなたの強さは評判通りだ。^^[{s14}のリソースポイントを{reg14}獲得しました]
dlga_mayor_begin:mayor_talk|何かご用かな？
dlga_mayor_friendly_pretalk:mayor_talk|さて・・・ 他に何かご用件は？
dlga_mayor_pretalk:mayor_talk|何かご用で？
dlga_mayor_talk:mayor_info_begin|{君/あなた}の仕事について教えてもらいたい。
dlga_mayor_talk:merchant_quest_requested|私に何か役に立てる事はあるか？
dlga_mayor_talk:merchant_quest_last_offered_job|さっき話していた仕事についてなんだが・・・
dlga_mayor_talk:merchant_quest_about_job|頼まれていた例の件についてなんだが・・・
dlga_mayor_talk:close_window|[立ち去る]
dlga_mayor_info_begin:mayor_info_talk|私はここ、{s9}の内政責任者です。 いうならば、 日常的な、 あらゆる事を管轄しています。 仕事が尽きるということがないので、 あなたがもし仕事を探しているのなら、 私に言って頂きたい。
dlga_mayor_info_talk:mayor_info_lord|ここの統治者は誰{だ/なの}？
dlga_mayor_info_lord:mayor_info_talk|ここの統治者は{s10}です。
dlga_mayor_info_talk:mayor_pretalk|これでじゅうぶん{だ/よ}。ありがとう。
dlga_merchant_quest_about_job:merchant_quest_about_job_2|どうかしましたか？
dlga_merchant_quest_about_job_2:merchant_quest_what_if_fail|仕事に失敗したらどうなるの{だ/}？
dlga_merchant_quest_about_job_2:merchant_quest_about_job_working|あの仕事はまだ終わっていない。
dlga_merchant_quest_about_job_working:mayor_pretalk|いいでしょう。あなたならうまくやってくれると信じていますよ。
dlga_merchant_quest_last_offered_job:merchant_quest_brief|ああ、考え直してくれたのですね。 ありがたい・・・
dlga_merchant_quest_what_if_fail:mayor_pretalk|あなたは失敗しないと信じていますよ。 あなたに預けた荷は、 絶対に失うわけにはいかないのです。
dlga_merchant_quest_what_if_fail:mayor_pretalk.1|では、全力を尽くしてください。
dlga_merchant_quest_taken:mayor_pretalk|素晴らしい。頼りにしてますよ。幸運を祈ります。
dlga_merchant_quest_stall:mayor_pretalk|仕方ない、他を当たってみます。 でも、もしあなたの気が変わったら、 私に教えてください。
dlga_merchant_quest_requested:merchant_quest_brief|おや、あなたは頼りになりそうだ。 あなたにちょうど良い仕事がありますよ。
dlga_merchant_quest_brief:merchant_quest_looters_choice|最近、{s5}の近くで結構な規模の戦闘がありまして、 周辺一帯はそれにともなう混乱が起こったんです。 すると、 その混乱をかぎつけた部族オークどもの群れがいくつかやって来て、 混乱に乗じて周辺一帯を襲うようになったのです。 あのオークどもは懲らしめてやらないとなりません。 あなた向きの仕事だと思うのですが、 どうでしょう？
dlga_merchant_quest_looters_choice:merchant_quest_looters_brief|よし、引き受けよう。
dlga_merchant_quest_looters_choice:merchant_quest_stall|悪いが、他をあたってくれ。
dlga_merchant_quest_looters_brief:close_window|素晴らしい！ 部族オークどもはおそらく、 獲物になる農場などを探して、 郊外をうろついているはずです。 やつらを退治して、 我々の前から消していただきたい。 部族オークの群れをひとつ退治するごとに 報酬を受け取れるよう、 我々の補給担当に 私から話をしておきますので、 すべての群れを退治するまで 頑張ってください。
dlga_merchant_quest_requested:merchant_quest_brief.1|お申し出に感謝します。 実は、 {s4}をいくつか運んでくれる方を探しているのです。 あなたなら引き受けてくれるのでは・・・
dlga_merchant_quest_brief:merchant_quest_brief_deliver_wine|ここに{s4}の{s10}へ届ける予定の、 {s6}の荷があります。 {reg5}ユニットの{s6}、 これを{reg6}日以内に {s4}まで届けていただきたい。 引き受けていただけますか？^^[{s14}のリソースポイントを{reg14}稼ぐことができます]
dlga_merchant_quest_brief_deliver_wine:merchant_quest_taken|了解した。引き受けよう。
dlga_merchant_quest_brief_deliver_wine:merchant_quest_stall|残念だが、今はこれだけの荷を運ぶ余裕がない。
