dlga_start:mutiny_pretalk_1|Hé, {playername}. Nous voulons vous dire... ^Les hommes grognent ! Nous voulons plus de loisirs et moins de marches forcées.
dlga_lord_capture_troll_completed_two_trolls_thankyou:lord_capture_troll_completed_two_trolls_thankyou_info|Une bête sauvage peut-elle obéir à des ordres ?
dlga_lord_capture_troll_completed_two_trolls_thankyou:lord_capture_troll_completed_two_trolls_thankyou_accept|Merci, Maître. Vous serez content de savoir qu'un bon usage sera fait de ce troll.
dlga_lord_capture_troll_completed_two_trolls_thankyou:lord_capture_troll_completed_two_trolls_thankyou_refuse|Merci, maître, mais je ne mérite pas votre magnifique don. Il est trop dangereux pour moi.
dlga_lord_capture_troll_completed_two_trolls_thankyou:lord_capture_troll_completed_two_trolls_thankyou_refuse.1|Thank you, master. But I'm not worth of your great gift. It is too dangerous for me. [pas de place dans le groupe !]
dlga_lord_capture_troll_completed_two_trolls_thankyou:lord_capture_troll_completed_two_trolls_thankyou_raise|Maître, je causerais plus de ravages si vous fournissez également une armure à la bête [10/{reg20} influence].
dlga_lord_capture_troll_completed_two_trolls_thankyou_info:lord_capture_troll_completed_two_trolls_thankyou|Remettez-vous en question les capacités de votre Maître, {playername} ? Cette bête est entraînée pour attaquer les ennemis à vue. C'est suffisant. Mais vous et vos hommes, restez à distance respectable de la bête lorsqu'elle se bat, et ne vous tenez jamais entre elle et ses victimes.
dlga_lord_capture_troll_completed_two_trolls_thankyou_accept:lord_pretalk|Maintenant, apportez la ruine sur mes ennemis avec votre nouveau cadeau.
dlga_lord_capture_troll_completed_two_trolls_thankyou_refuse:lord_pretalk|Comme vous voulez. Quelqu'un d'autre parmi mes serviteurs saura utiliser cette puissante arme de guerre.
dlga_lord_capture_troll_completed_two_trolls_thankyou_raise:lord_pretalk|Vous osez demander un troll de combat complètement armuré,  {playername}, pour garder sous votre commandement ? Ce n'est pas une petite chose à demander. Mais vous êtes un serviteur compétent, et nous connaissons vos motivations. Nous aimons ça. Nous vous l'accorderons.
dlga_lord_capture_troll_completed_two_trolls_thankyou_raise:lord_capture_troll_completed_two_trolls_thankyou|Comment osez-vous nous demander plus que nous avions prévu pour vous dans notre grande Sagesse ? {playername}, vous vous êtes révélé un puissant serviteur aujourd'hui, mais ne laissez pas votre insolence éprouver davantage Notre patience.
dlga_lord_capture_troll_completed_one_troll:close_window|Excellent, {playername}. Vous êtes un serviteur utile et loyal. Ce troll sera plus utile pour vos actions. Il vient des donjons !
dlga_lord_start:close_window.1|Il y a trop longtemps, je vous ai demandé de me ramener un Troll vivant. Mais j'aurais dû savoir. Comment aurais-je pu m'attendre à ce que quelqu'un comme {playername} soit de taille. Mon serviteur n'était pas assez compétent ou pas assez digne de confiance.
dlga_lord_start:lord_generic_mission_completed.1|Les nouvelles de vos prouesses face aux Trolls sauvages me sont parvenues. {s12} a un souci en moins, merci à vous, {playername}.
dlga_lord_start:lord_follow_spy_half_completed|Soyez maudit ! Je voulais DEUX prisonniers, {playername} -- ce que vous m'avez ramené ne m’est d’aucune utilité ! Je sais déjà tout ce que sait l'espion, c'était le commanditaire dont j'avais besoin. Voilà, un demi-travail mérite une demi-récompense. Prenez-la et partez.
dlga_lord_start:lord_follow_spy_half_completed.1|Je vous ai demandé deux prisonniers, {playername}, pas un. Deux. Cependant, je vois que vous avez capturé le commanditaire de l'espion, le plus important des deux. L'espion n'osera pas revenir et sera inutile quel que soit le maître qu'il servait. C'est mieux que rien. Vous comprendrez toutefois que je ne vous paie que la moitié de la récompense promise pour ce qui n'est qu'un demi-succès.
dlga_lord_start:lord_follow_spy_failed|Vraiment, {playername}, vous n'êtes rien de plus qu'un incompétent. Échouer à capturer à la fois l'espion ET son commanditaire montre les profondeurs ahurissantes de cet échec. Oubliez la récompense que je vous ai promise. Vous n'avez rien fait pour la mériter.
dlga_lord_follow_spy_half_completed:lord_pretalk|J'ai fait de mon mieux, {s65}.
dlga_lord_follow_spy_completed:lord_pretalk|Merci, {s65}.
dlga_lord_follow_spy_failed:lord_pretalk|Hrm. Comme vous voulez, {s65}.
dlga_lord_start:lord_generic_mission_completed.2|Que je sois maudit, mais vous avez réussi, {playername}. Tous les esclaves sont de retour et préparent les récoltes. Vous avez bien mérité votre récompense. Voilà, prenez-là, avec mes remerciements.
dlga_lord_start:lord_bring_back_runaway_serfs_failed|{playername}. J'ai patiemment attendu mes esclaves, et aucun n'est encore revenu. Avez-vous une explication ? Avez-vous été berné par de simples animaux, ou êtes-vous simplement incompétent ?
dlga_lord_bring_back_runaway_serfs_failed:lord_bring_back_runaway_serfs_failed_1a|Pardonnez-vous, {s65}, ces esclaves étaient glissants comme des anguilles.
dlga_lord_bring_back_runaway_serfs_failed_1a:lord_pretalk|Hmph, ça n'est pas une excuse pour votre échec, {playername}. Maintenant si vous voulez m'excuser, je doit capturer de nouveaux hommes pour travailler les champs avant que nous mourions tous de faim.
dlga_lord_start:lord_runaway_serf_half_completed|Vous me décevez, {playername}. Je vous ai chargé de récupérer trois groupes d'esclaves. Trois. Pas {reg17}. Je suppose que ceux qui sont revenus devront travailler deux fois plus dur pour remplacer ceux qui sont partis. Comme récompense, {playername}, je vous paierai uniquement les esclaves que vous avez récupérés, pas ceux que vous avez laisss s'enfuir. Voilà, prenez, et mettons fin à cette affaire.
dlga_lord_runaway_serf_half_completed:lord_pretalk|Merci, {s65}. Vous êtes effectivement généreux.
dlga_lord_runaway_serf_half_completed:lord_pretalk.1|Bah, ceci c'est révélé être une perte de temps.
dlga_lord_start:lord_deliver_cattle_to_army_thank| Ah, {playername}. Je suis heureux que vous ayez livré {reg13} unités de {s4}, comme je l'ai demandé. Je suis impressionné.
dlga_lord_deliver_cattle_to_army_thank:lord_pretalk|Ce n'est pas un problème, {s65}.
dlga_lord_deliver_cattle_to_army_thank:lord_pretalk.1|Ravi d'avoir pu aider.
dlga_lord_start:lord_scout_waypoints_thank|Vous faites un bon éclaireur, {playername}. Mon courrier vient de me rapporter les résultats de votre mission à {s13}, {s14} et {s15}. Bien joué.
dlga_lord_scout_waypoints_thank:lord_pretalk|Une tâche simple, {s65}.
dlga_lord_scout_waypoints_thank:lord_pretalk.1|Rien dont je ne puisse me charger.
dlga_lord_scout_waypoints_thank:lord_pretalk.2|C'est un plaisir, sire.
dlga_lord_start:lord_mission_told_deliver_cattle_to_army|Les fournitures de l'armée diminuent trop rapidement, {playername}. J'ai besoin que vous m'apportiez {reg3} unités de {s4} pour je continue à nourrir les troupes. Je me moque de comment vous les obtiendrez, rapportez-les moi simplement aussi rapidement que possible.
dlga_lord_mission_told_deliver_cattle_to_army:lord_mission_told_deliver_cattle_to_army_accepted|Très bien, je peux vous trouver quelques {s4}.
dlga_lord_mission_told_deliver_cattle_to_army:lord_mission_told_deliver_cattle_to_army_rejected|Désolé, sire, J'ai d'autres plans.
dlga_lord_mission_told_deliver_cattle_to_army_accepted:close_window|Excellent ! Vous savez quoi faire, {playername}, alors allez-y. J'ai besoin de cette nourriture aussi rapidement que possible.
dlga_lord_mission_told_deliver_cattle_to_army_rejected:close_window|C'est... dommage, {playername}, je devrais trouver quelqu'un d'autre pour cette tâche. Partez, je vous prie, j'ai du travail à faire.
dlga_lord_start:lord_report_to_army_asked|Ah, vous voilà finalement, {playername}. Nous vous avons attendu. J'espère que vous avez amené des troupes en nombre et en expérience suffisantes.
dlga_lord_report_to_army_asked:lord_report_to_army_completed|J'ai une compagnie de bons et solides soldats avec moi. Nous sommes près à vous rejoindre.
dlga_lord_report_to_army_asked:lord_report_to_army_continue|Je n'ai pas encore suffisamment de troupes. J'ai besoin de plus de temps.
dlga_lord_report_to_army_completed:close_window|Excellent. Je vous ferai savoir lorsque j'aurai une tâche pour vous. Pour le moment, suivez-nous et restez dans le coin. Nous allons bientôt partir.
dlga_lord_report_to_army_continue:close_window|Alors vous feriez mieux de vous dépêcher. Nous allons bientôt marcher contre l'ennemi et j'ai besoin de tous les hommes que nous pourrons rassembler.
dlga_lord_start:lord_mission_told_scout_waypoints| {playername}, j'ai besoin d'un volontaire pour explorer la région. Nous manquons d'informations et je dois avoir une meilleure idée de la situation avant que nous puissions continuer. Je veux que vous alliez à {s13}, {s14} et {s15}, et que vous me rapportiez ce que vous y trouverez.
dlga_lord_mission_told_scout_waypoints:lord_mission_told_scout_waypoints_accepted|Vous avez trouvé votre volontaire, sire.
dlga_lord_mission_told_scout_waypoints:lord_mission_told_scout_waypoints_rejected|J'ai peur de devoir décliner.
dlga_lord_mission_told_scout_waypoints_accepted:close_window|Bien ! Passez simplement près de {s13}, {s14} et {s15} et regardez ce qui se passe. Notez tout ce que vous trouvez et retournez me voir aussi vite que possible.
dlga_lord_mission_told_scout_waypoints_rejected:lord_pretalk|Hm, je suis déçu, {playername}. Très déçu. Nous parlerons plus tad, je dois partir et trouver un autre éclaireur.
dlga_lord_start:lord_buy_prisoner|J'ai entendu dire que vous avez capturé notre ennemi {s3} et qu'il est avec vous en ce moment. Bon travail ! ^Laissez-le nous, nous pouvons apprendre de lui beaucoup de choses... [Vous gagnerez {reg14} Points de Ressources de {s14}]
dlga_lord_buy_prisoner:lord_buy_prisoner_accept|D'accord, il est à vous.
dlga_lord_buy_prisoner:lord_buy_prisoner_deny|J'ai bien peur d'avoir d'autres projets pour lui.
dlga_lord_buy_prisoner_accept:lord_pretalk|Excellent ! Je vais envoyer mes hommes le conduire en prison avec toute la célérité requise. Cela aidera sûrement notre cause.
dlga_lord_buy_prisoner_deny:lord_pretalk|Dommage, il aurait été précieux à nos yeux, {playername}.
dlga_lord_start:lord_pretalk|Ah, bienvenue, {s24}. ^Vous devez déjà savoir que {s12}. Votre devoir est de nous aider dans ce conflit, {playername}. Quand vous m'aurez montré que je peux vous faire confiance [niveau {reg1}], je vous permettrai d'accéder à ce coffre là-bas.
dlga_lord_start:lord_talk|Qu'est-ce que c'est ?
dlga_lord_pretalk:lord_talk|Autre chose ?
dlga_lord_talk:lord_lend_companion_end|J'aimerais que {s14} me revienne, {s65}, si vous n'avez plus besoin de {reg3?ses:ses} services.
dlga_lord_lend_companion_end:lord_pretalk|Vous avez trop d'hommes dans votre compagnie, {playername}. Vous ne pouvez pas en diriger plus pour le moment.
dlga_lord_lend_companion_end:lord_pretalk.1|Certai nement, {playername}. {reg3?Elle:Il} est {reg3?incroyable:incroyable}, vous êtes chanceux d'avoir de tels compagnons.
dlga_lord_talk:lord_message_delivered|J'apporte un message de {s9}.
dlga_lord_talk:lord_message_delivered_enemy|J'appo rte un message de {s9}.
dlga_lord_talk:lord_active_mission_1|Au sujet de la tâche que vous m'avez confiée ...
dlga_lord_talk:lord_request_mission_ask|Avez-vous une tâche à me confier ?
dlga_lord_talk:find_lost_spears_permission|Laissez-moi aller dans les donjons.
dlga_find_lost_spears_permission:lord_pretalk|Je vous ai déjà donné la permission, {playername}.
dlga_find_lost_spears_permission:find_lost_spears_permission_yes|D'accord, {playername}, vous pouvez entrer dans les montagnes.
dlga_find_lost_spears_permission:lord_pretalk.1|Je suis désolé, mais je ne vous connais pas ou ne vous fait pas assez confiance, {playername}.
dlga_find_lost_spears_permission_yes:lord_pretalk| Je vous remercie, mon Seigneur.
dlga_lord_give_troops:lord_give_troops_check| Renforcer ma troupe ? Je peux toujours trouver une utilité à quelques soldats de plus.
dlga_lord_give_troops:lord_pretalk| Malheureusement vous n’avez pas {s14} soldats pouvant renforcer mes troupes.
dlga_lord_give_troops_check:lord_give_troops_check_1|Laissez-moi vérifier vos troupes...
dlga_lord_give_troops_check_1:lord_pretalk| Vous avez donc changer d’avis… ^Je vois. 
dlga_lord_give_troops_check_1:lord_pretalk.1| Je n’ai rien à confier à ces troupes ici… ^Reprenez vos hommes.
dlga_lord_talk:lord_get_reward_item_ask| Je voudrais vous demander un objet spécial.
dlga_lord_get_reward_item_ask:lord_talk| Il semblerait que vous ne puissiez rien transporter de plus. Déchargez-vous un peu, et revenez me voir.
dlga_lord_get_reward_item_ask:lord_get_reward_item| Vraiment ? Songez bien au fait que vous devez avoir un certain rang et disposer d’une influence considérable pour mériter cet objet bien particulier. ^Que puis-je vous donner ?
dlga_lord_get_reward_item:lord_get_reward_item_answer|{s24}: {s20} [coûte {reg14}/{reg15} Influence]
dlga_lord_get_reward_item:lord_pretalk| N’y pensez plus.
dlga_lord_get_reward_item_answer:lord_pretalk| Fort bien. Puissiez-vous l’utiliser pour vaincre nos ennemis.
dlga_lord_talk:marshall_ask| J’aimerais m’entretenir avec vous à propos de cette guerre.
dlga_marshall_ask:lord_pretalk| Je prendrais difficilement en compte votre avis si vous êtes simplement {s25}, {playername}. J’aurais été plus enclin à vous écouter si vous étiez {s24}, mais vous ne l’êtes pas.
dlga_marshall_ask:lord_pretalk.1| Vous êtes un meneur d’homme accompli, {playername}, mais votre influence est faible. Il ne serait pas sage d’écouter vos conseils.^[{reg15} d'influence requise, vous n'en avez que {reg14}]
dlga_marshall_ask:lord_pretalk.2| Nous sommes loin de pouvoir nous permettre d’attaquer l’ennemi de front {playername}. Nous devons étoffer nos forces et nous renforcer, hélas nous ne sommes que {s23}.
dlga_marshall_ask:lord_pretalk.3| Nous sommes en campagne, {playername}, vos conseils devront attendre.
dlga_marshall_ask:marshall_suggest| Je vous écoute, {playername}. Que suggérez-vous donc ? 
dlga_marshall_suggest:marshall_answer| Nous devrions nous dépêcher d’assiéger {s1} immédiatement !
dlga_marshall_suggest:lord_pretalk| Peu importe, je me fie à vos conseils.
dlga_marshall_answer:close_window| Fort bien, {playername}, je vais m’en remettre à votre expertise. J’envoie immédiatement des messagers rassembler nos troupes. ^Suivez-moi avec vos hommes et ne vous éloignez pas – nous chevauchons vers {s4} !
dlga_lord_talk:deliver_gift_1|J'apporte un don de {s1} de {s3} au peuple de {s2}.
dlga_send_gift_1:lord_pretalk|Vous êtes déjà {s4}, {playername}. Il serait plus sage de livre ceci avant.
dlga_send_gift_1:lord_pretalk.1|Malheureusement, vous ne pouvez vous permettre d'envoyer un don maintenant, {playername}. ^^[Pas assez de Points de Ressource]
dlga_send_gift_1:send_gift_2|Très bien. À qui voulez-vous délivrer un don ?
dlga_send_gift_1:send_gift_2.1|Très bien. À qui voulez-vous délivrer un don ?
dlga_send_gift_2:lord_pretalk|N'y pensez plus.
dlga_send_gift_3:send_gift_4|Quel don voudriez-vous leur envoyer ?
dlga_send_gift_3:send_gift_4.1|Quel pot de vin voudriez-vous leur envoyer ?
dlga_send_gift_4:lord_pretalk|N'y pensez plus.
dlga_send_gift_5:lord_pretalk|Très bien, {playername}. Bonne chance.
dlga_lord_talk:lord_give_order_ask| J’ai une nouvelle tâche à vous soumettre.
dlga_lord_give_order_ask:lord_give_order| Oui ?
dlga_lord_give_order:lord_give_order_answer| Suivez-moi. [Cette action vous coûtera {reg1}/{reg2} d'influence]
dlga_lord_give_order:lord_give_order_details_ask| Allez à… [Cette action vous coûtera {reg1}/{reg2} d'influence]
dlga_lord_give_order:lord_give_order_details_ask.1| Patrouillez aux alentours de… [Cette action vous coûtera {reg1}/{reg2} d'influence]
dlga_lord_give_order:lord_give_order_details_ask.2| Entamez le combat contre les forces ennemies aux alentours de… [Cette action vous coûtera {reg1}/{reg2} d'influence]
dlga_lord_give_order:lord_give_order_stop| Je vais pouvoir me passer de vous quelques temps. Vous êtes libre de partir faire ce que bon vous semble.
dlga_lord_give_order:lord_pretalk| N’y pensez plus.
dlga_lord_give_order_details_ask:lord_give_order_details|Où ?
dlga_lord_give_order_details:lord_pretalk| N’y pensez plus.
dlga_lord_give_order_stop:lord_pretalk| Fort bien. Je m’en vais faire cela.
dlga_lord_give_order_answer:lord_pretalk| Je suis désolé. Ma présence est requise ailleurs en ce moment.
dlga_lord_give_order_answer:lord_give_order_answer_2|.
dlga_lord_give_order_answer_2:close_window| Cela sera fait.
dlga_lord_give_order_answer_2:lord_pretalk| Je suis désolé, il m’est impossible de faire cela. 
dlga_lord_talk:lord_talk_ask_something| Je souhaiterais vous demander quelque chose.
dlga_lord_talk_ask_something:lord_talk_ask_something_2|Oui ? Qu'est ce que c'est ?
dlga_lord_talk_ask_something_2:lord_talk_ask_location|Je voudrais connaître la position de quelqu'un.
dlga_lord_talk_ask_something_2:lord_tell_objective| Qu’êtes-vous en train de faire, vous et vos hommes ?
dlga_lord_talk_ask_something_2:lord_talk_ask_about_war|Comment se déroule la guerre ?
dlga_lord_talk_ask_something_2:lord_pretalk| N’y pensez plus.
dlga_lord_talk_ask_location:lord_talk_ask_location_2|Très bien, j'aurais une réponse pour vous. Ou pas. Qui souhaitez-vous entendre ?
dlga_lord_talk_ask_location_2:lord_pretalk| N’y pensez plus.
dlga_lord_talk_ask_about_war_2:lord_talk_ask_about_war_details|Parlez-moi de la guerre avec {s1}.
dlga_lord_talk_ask_about_war_2:lord_pretalk| C’est là tout ce que je voulais savoir. Merci
dlga_lord_talk_ask_about_war_details:lord_talk_ask_about_war_2|Nous sommes {s22} et ils sont {s23}. Dans l'ensemble, {s9}.
dlga_lord_talk:party_encounter_lord_hostile_ultimatum_surrender|Aujourd'hui est un bon jour pour combattre, {s4} !
dlga_lord_tell_objective:lord_pretalk| Ce que je suis en train de faire ? Qu’ai-je donc l’air de faire d’après vous ? Je suis prisonnier ici !
dlga_lord_tell_objective:lord_pretalk.1| Je n’ai aucun homme sous mon commandement pour l’instant.
dlga_lord_tell_objective:lord_pretalk.2| Nous nous reposons à {s1}{s5}.
dlga_lord_tell_objective:lord_pretalk.3| Nous sommes en route vers {s1}{s5}.
dlga_lord_tell_objective:lord_pretalk.4| Nous levons des troupes fraiches à {s1}.
dlga_lord_tell_objective:lord_pretalk.5| Nous sommes partis en éclaireur à la recherche de troupes ennemies aux alentours de {s1}{s5}.
dlga_lord_tell_objective:lord_pretalk.6| Nous pillons le village de {s1}.
dlga_lord_tell_objective:lord_pretalk.7| Nous nous replions sur {s1}.
dlga_lord_tell_objective:lord_pretalk.8| Nous assiégeons {s1}{s5}.
dlga_lord_tell_objective:lord_pretalk.9| Nous combattons contre {s1}{s5}.
dlga_lord_tell_objective:lord_pretalk.10| Nous accompagnons {s1}{s5}.
dlga_lord_tell_objective:lord_pretalk.11| Nous discutons de notre prochain objectif.
dlga_lord_tell_objective:lord_pretalk.12| Je ne sais point : {reg1} {s1}
dlga_lord_active_mission_1:lord_mission_sorcerer_completed|Le sorcier de la Forêt Noire a été tué, ma Dame.
dlga_lord_active_mission_1:lord_mission_sorcerer_failed|Pardonnez-moi, ma Dame, mais des faits urgents m'ont empêché de tuer le sorcier, et il a fuit entre temps.
dlga_lord_active_mission_1:lord_mission_sorcerer_failed.1|Le sorcier de la Forêt Noire vit toujours. Nous avons interrompu ses rituels mais il a fuit.
dlga_lord_mission_sorcerer_completed:lord_pretalk|Oui, {playername}, j'ai ressenti sa mort. Le voile de la sorcellerie a été levé de ces bois et mon pouvoir est revenu. Vous avez rendu un grand service à notre peuple et ainsi vous avez mérité une récompense. Prenez ceci...
dlga_lord_mission_sorcerer_failed:lord_pretalk|Oui, {playername}, je sens que les arts sombres de l'ennemi sont toujours sur nous. Ses efforts semblent plus important encore. Il est dommage que vous n'ayez pas pu l'arrêter. Il prendra de plus grande précautions, sans aucun doute. Il ne sera sans doute plus vu tant que Dol Guldur sera debout. Merci de vos efforts, mais laissez-moi maintenant. Je suis fatiguée.
dlga_lord_active_mission_1:lord_lend_companion_end| Oh, vous souhaitez que votre compagnon revienne ? Je vois…
dlga_lord_active_mission_1:lord_pretalk|{playernam e}, je dois vous demander d’être patient, j’ai toujours besoin de votre compagnon. S’il vous plait, revenez me voir plus tard lorsque les choses se seront calmées.
dlga_lord_active_mission_1:lord_active_mission_2| Oui, avez-vous pu progresser là-dessus ?
dlga_lord_active_mission_2:lord_generic_mission_thank|Indeed. I brought you {reg1} prisoners.
dlga_lord_active_mission_2:lord_generic_mission_thank_extra|Why, I have brought you {reg2} prisoners, in case {reg1} are not enough.
dlga_lord_active_mission_2:lord_generic_mission_thank.1|Indeed. I have rescued {reg1} allied prisoners and they joined my party.
dlga_lord_active_mission_2:lord_generic_mission_thank.2|Indeed. I have scouted {s13}.
dlga_lord_active_mission_2:lord_generic_mission_thank.3|En effet, j'ai envoyé les éclaireurs.
dlga_lord_active_mission_2:lord_generic_mission_thank.4|En effet. J'ai vaincu suffisamment de groupes ennemis.
dlga_lord_active_mission_2:capture_enemy_hero_thank|Oh, en effet. J'ai capturé un commandant ennemi pour vous.
dlga_capture_enemy_hero_thank:capture_enemy_hero_thank_2|Merci beaucoup, mon ami. Nous allons l'interroger. Vous avez fait du bon travail.
dlga_capture_enemy_hero_thank_2:lord_pretalk|Certainemment, {s65}.
dlga_capture_enemy_hero_thank_2:lord_pretalk.1|Ce n’était rien.
dlga_lord_active_mission_2:lord_raise_troops_thank|En effet. J'ai entraîné {reg1} {s13}. Vous pouvez les prendre.
dlga_lord_active_mission_2:lord_hunt_down_fugitive_success|J'ai trouvé {s4} se cachant dans {s3} et je lui ai infligé sa punition.
dlga_lord_active_mission_2:lord_hunt_down_fugitive_fail|J'ai peur qu'il se soit enfuit.
dlga_lord_hunt_down_fugitive_success:lord_hunt_down_fugitive_success_2|Et nous sommes bien mieux sans lui ! Merci, {playername}, d'avoir enlevé cette épine purulente de mon pied. Il est agréable de savoir qu'on peut vous faire confiance pour gérer les choses avec le tact approprié. J'ai d'ores et déjà envoyé un note à nos intendants, et vous pouvez compter sur plus d'approvisionnements de notre part.
dlga_lord_hunt_down_fugitive_success_2:lord_hunt_down_fugitive_reward_accept|Merci, {s65}.
dlga_lord_hunt_down_fugitive_reward_accept:lord_pretalk|Je ferais passer le mot à nos intendants, {playername}. Une fois encore, vous avez mes remerciements pour m'avoir débarrassé de ce {s44}.
dlga_lord_hunt_down_fugitive_fail:lord_pretalk|La fuite de ce {s44}, qui a encore réussi à échapper à mes pièges, m'attriste. Je pensais que vous seriez capable de le faire, {playername}. J'étais clairement dans l'erreur.
dlga_lord_active_mission_2:lord_active_mission_3|Je suis toujours en train de m'en occuper.
dlga_lord_active_mission_2:lord_mission_failed|Je suis désolé, je ne peux pas m'occuper de cette tâche.
dlga_lord_active_mission_3:lord_pretalk|Bien. Rappelez-vous que je compte sur vous.
dlga_lord_request_mission_ask:lord_pretalk|Vous n'avez toujours pas fini la tâche que je vous ai donnée, {playername}. Vous devriez vous en occuper plutôt que de me demander de nouvelles choses à faire.
dlga_lord_request_mission_ask:lord_pretalk.1|Actuellement, je n'ai aucune autre tâche à vous confier.
dlga_lord_request_mission_ask:lord_tell_mission|Une tâche ?
dlga_lord_tell_mission:lord_mission_capture_troll_1|Vous êtes un brave serviteur, {playername}, et nous allons vous donner un aperçu de nos plans. Nous avons besoin de chair de et de sang frais. Nous en avons besoin pour tordre, plier et remodeler, pour produire et renforcer notre propre race de guerriers !
dlga_lord_mission_capture_troll_1:lord_mission_capture_troll_2|Comment puis-je vous servir, Maître ?
dlga_lord_mission_capture_troll_2:lord_mission_capture_troll_3|Un troll sauvage des cavernes, {playername}. Capturez-en un vivant et rapportez-le moi. Nous en avons besoin pour Nos expériences ! Deux, ce serait encore mieux. Plus nous en avons, mieux c'est.
dlga_lord_mission_capture_troll_3:lord_mission_capture_troll_infoa|Où une telle bête peut-elle être trouvée ?
dlga_lord_mission_capture_troll_3:lord_mission_capture_troll_infob|Comment une telle bête peut-elle être capturée ?
dlga_lord_mission_capture_troll_3:lord_mission_capture_troll_infoc|Comment une telle bête peut-elle être transportée jusqu'à vous ?
dlga_lord_mission_capture_troll_3:lord_mission_capture_troll_accepted|Vous aurez votre troll sauvage, Maître.
dlga_lord_mission_capture_troll_3:lord_mission_capture_troll_rejected|Pitié, Maître ! Cette bête m'écrasera comme un insecte !
dlga_lord_mission_capture_troll_infoa:lord_mission_capture_troll_3|En ces temps d'ombres et de sang, les trolls sauvages des cavernes s'enhardissent et sortent de leurs repaires des Monts Brumeux... le meilleur endroit où chercher serait autour de leurs cavernes.
dlga_lord_mission_capture_troll_infob:lord_mission_capture_troll_3|Vous devriez en trouver un, et mettez-le à terre dans un combat. N'ayez pas peur de le tuer ; un troll est une bête trop coriace pour que vos armes le tuent... et ils guérissent, plus que vous pourriez penser. Après qu'il soit tombé dans son propre sang noir, vous devrez nous l'amener, toujours en vie.
