dlga_start:mutiny_pretalk_1|Hé, {playername}. Nous voulons vous dire... ^Les hommes grognent ! Nous voulons plus de loisirs et moins de marches forcées.
dlga_start:ally_thanks_meet.1|Votre aide était plus que bienvenue, étranger. Mon nom est {s1}. Puis-je connaître le vôtre ?
dlga_start:ally_thanks_meet.2|Merci pour votre aide, étranger. Nous ne nous sommes pas présentés. Quel est votre nom ?
dlga_ally_thanks_meet:ally_thanks_meet_2|Je m'appelle {playername}.
dlga_ally_thanks_meet_2:close_window|Je suis content de vous rencontrer, {playername}. Je suis {s1}, et j'ai désormais une dette envers vous. Si je peut vous aider en quelque chose, faites-le moi savoir...
dlga_ally_thanks_meet_2:close_window.1|Je suis ravi de vous rencontrer, {playername}. J'ai une dette envers vous après ce que vous avez fait. J’espère qu'un jour je trouverai le moyen de vous remercier.
dlga_ally_thanks_meet_2:close_window.2|Je suis ravi de vous rencontrer, {playername}. Je m'appelle {s1}. Merci pour votre aide et j'espère que nous nous rencontrerons à nouveau.
dlga_start:close_window.11|Une fois encore vous nous avez sauvé, {playername}. Vraiment, vous êtes un ami précieux. {s43}
dlga_start:close_window.12|Vous êtes arrivé juste à temps, {playername}! Je vous remercie sincèrement. {s43}
dlga_start:close_window.13|Vous êtes arrivé juste à temps, {playername}! Je n'oublierai pas votre aide ! {s43}
dlga_start:close_window.14|Cela fait plaisir de vous voir, {playername}. {s43}
dlga_start:close_window.17|Merci pour votre aide, commandant. Vous venez de sauver {reg1?nos vies:ma vie}.
dlga_start:close_window.18|Merci pour votre aide, commandant. Les choses n'allaient pas bien pour nous, lorsque votre arrivée changea le cours de la bataille.
dlga_start:close_window.19|Merci pour votre aide, commandant. Nous avions de la chance que vous soyez à côté.
dlga_start:freed_hero_answer|J'ai une dette envers vous car vous venez de me sauver.
dlga_freed_hero_answer:freed_hero_answer_1|Vous n'irez plus nul part. Vous êtes mon prisonnier maintenant !
dlga_freed_hero_answer_1:close_window|Eh bien. Est-ce que ma chance ne changera donc jamais ?
dlga_freed_hero_answer:freed_hero_answer_2|Vous êtes libre d'aller où bon vous semble, {s65}
dlga_freed_hero_answer_2:close_window|Merci, Commandant. Je n'oublie jamais ceux qui m'ont aidé.
dlga_freed_hero_answer:freed_hero_answer_3|Voulez vous vous joindre à nous?
dlga_freed_hero_answer_3:close_window|Parfait, je vais me joindre à vous.
dlga_freed_hero_answer_3:close_window.1|Non merci. Je veux suivre mes propres chemins.
dlga_start:defeat_hero_answer|Vous ne vivrez pas assez longtemps pour savourer votre victoire. Mes vassaux vont venir et vous faire connaitre le goût de la défaite.
dlga_defeat_hero_answer:defeat_hero_answer_1|Vous êtes mon prisonnier maintenant.
dlga_defeat_hero_answer_1:close_window|Soyez maudit. Vous le regretterez.
dlga_defeat_hero_answer:defeat_hero_answer_2|Vous êtes libre de partir cette fois, mais ne croisez plus mon chemin.
dlga_defeat_hero_answer_2:close_window|Nous nous rencontrerons à nouveau.
dlga_start:fugitive_1|Oui, que voulez vous ?
dlga_fugitive_1:fugitive_2|Je suis à la recherche d'un fugitif nommé {s4}. Vous correspondez à sa description.
dlga_fugitive_1:close_window|Rien. Désolé de vous déranger.
dlga_fugitive_2:fugitive_3|Je ne sais pas de quoi vous parlez. Vous m'avez certainement confondu avec quelqu'un d'autre.
dlga_fugitive_3:fugitive_4|Alors relâchez votre épée. Si vous êtes innocent, vous n'avez rien à craindre. Nous allons partir et parler au capitaine de la garde pour savoir si vous êtes coupable.
dlga_fugitive_4:close_window|Allez au diable! Vous n'irez nul part !
dlga_start:follow_spy_talk|Bonjour. Un beau temps vous ne pensez pas ? Veuillez m'excuser maintenant je dois continuer mon chemin.
dlga_follow_spy_talk:follow_spy_talk_2|Au nom de {s1}, vous êtes en état d'arrestation !
dlga_follow_spy_talk_2:close_window|Vous ne m'aurez pas vivant !
dlga_follow_spy_talk:close_window|Ça ne fait rien. Je ne fais que passer.
dlga_start:spy_partners_talk|Salutations.
dlga_spy_partners_talk:spy_partners_talk_2|Au nom de {s1}, vous êtes en état d'arrestation !
dlga_spy_partners_talk_2:close_window|Vous devrez d'abord nous battre !
dlga_spy_partners_talk:close_window|Ça ne fait rien. Je ne fais que passer.
dlga_start:runaway_serf_intro_1|Bonjour maître.
dlga_runaway_serf_intro_1:runaway_serf_intro_2|J'ai été envoyé par votre {s4} que vous êtes en train de fuir. Il ne vous punira pas si vous revenez maintenant.
dlga_runaway_serf_intro_2:runaway_serf_intro_3|Mon bon maître. Notre vie à {s1} était insupportable. Nous travaillions toute la journée et nous nous couchions toujours affamés. Nous allons à {s6} pour démarrer une nouvelle vie, où nous serons traités comme des humains.
dlga_runaway_serf_intro_3:runaway_serf_go_back|Vous êtes allé à l'encontre de nos lois en vous sauvant de l'esclavage. Vous allez retourner à {s1} maintenant!
dlga_runaway_serf_go_back:close_window|Très bien maître. Comme vous voulez. Nous retournons à {s5} maintenant.
dlga_start:runaway_serf_talk_caught|Bonjour maître. Nous retournions à {s5}, mais j'ai peur que nous n'ayons perdu notre chemin.
dlga_runaway_serf_talk_caught:runaway_serf_go_back|Ne testez pas ma patience. Revenez maintenant !
dlga_start:runaway_serf_talk_again_return|Nous sommes sur notre chemin du retour de {s5}, maître.
dlga_runaway_serf_talk_again_return:runaway_serf_talk_again_return_2|Hâtez-vous maintenant. Plus tôt vous revenez, mieux c'est.
dlga_runaway_serf_talk_again_return:runaway_serf_talk_again_return_2.1|Bien. Continuez.
dlga_runaway_serf_talk_again_return_2:close_window|Oui maître. Comme vous voulez.
dlga_mayor_talk:mayor_deliver_wine|On m'a dit de vous livrer {reg9} unités de {s4}.
dlga_mayor_deliver_wine:mayor_pretalk|Enfin ! Nos stocks étaient presque épuisés. Je me suis arrangé pour la livraison des {s4} en avance. Et donnez à {s9} mes salutations.^^[Gagne {reg14} points ressources du {s14}]
dlga_mayor_talk:mayor_deliver_wine_incomplete|J'étais en mission pour vous livrer {reg9} unités de {s4}, mais j'ai perdu une partie de la cargaison face à l'ennemi.
dlga_mayor_deliver_wine_incomplete:mayor_pretalk|Ils vont payer pour ça ! Bien, au moins nous avons {s4}. Merci quand même.^^[Gagne {reg14} points ressources du {s14}]
dlga_start:mercenary_tavern_talk|Avez vous besoin de mercenaires, commandant ? {reg3?Moi et {reg4?{reg3} de mes compagnons:un de mes compagnons} sommes:je suis} à la recherche d'un maître. Nous vous rejoindrons pour {reg5} deniers.
dlga_start:mercenary_after_recruited|Des ordres, commandant ?
dlga_mercenary_after_recruited:mercenary_after_recruited_2|Faites vos préparatifs, nous partons à l'aube.
dlga_mercenary_after_recruited:mercenary_after_recruited_2.1|Prenez votre temps. Nous allons rester dans cette ville quelques temps.
dlga_mercenary_after_recruited_2:close_window|Oui, commandant. Nous serons prêts quand vous nous direz de partir.
dlga_mercenary_tavern_talk:mercenary_tavern_talk_hire|Très bien. Je vous engage tous. Voici {reg5} denars.
dlga_mercenary_tavern_talk:mercenary_tavern_talk_hire.1|Très bien, mais ne peux engager que {reg6} d'entre vous. Voici {reg5} denars.
dlga_mercenary_tavern_talk:tavern_mercenary_cant_lead|Cela semble correct. Mais je ne peux me permettre d'engager plus d'hommes pour le moment.
dlga_tavern_mercenary_cant_lead:close_window|C'est dommage. Bien, {reg3?nous allons:je vais} rester par ici pendant un moment, si vous avez besoin de recruter quelque mercenaires.
dlga_mercenary_tavern_talk:tavern_mercenary_cant_lead.1|Cela semble correct. Mais je ne peux commander plus d'hommes pour le moment.
dlga_mercenary_tavern_talk:close_window|Désolé. Je n'ai pas besoin d'autres hommes pour le moment.
dlga_start:trainer_pretalk|Vous avez survécu à la vague d'affrontement {reg2}. {s4}
dlga_start:trainer_pretalk.1|Très bien, vous avez éliminé tout les adversaires.
dlga_start:trainer_talk|Bonjour. Prêt pour un peu d'entraînement aujourd'hui ?
dlga_trainer_pretalk:trainer_talk|Êtes vous prêt pour un peu d'entraînement ?
dlga_trainer_talk:trainer_combat_begin|D'abord, parlez moi un peu des combats...
dlga_trainer_talk:trainer_choose_mode|Je suis prêt pour l'entraînement.
dlga_trainer_talk:close_window|Je dois partir maintenant. Adieu.
dlga_trainer_combat_begin:trainer_talk_combat|Que voulez vous savoir ?
dlga_trainer_combat_pretalk:trainer_talk_combat|Que voulez vous savoir d'autre ?
dlga_trainer_talk_combat:trainer_explain_defense|Parlez moi de défense.
dlga_trainer_talk_combat:trainer_explain_attack|Parlez moi d'attaque avec des armes.
dlga_trainer_talk_combat:trainer_explain_horseback|Parlez moi d'attaque de cavalerie.
dlga_trainer_talk_combat:trainer_pretalk|Je pense que je connais les théories dont j'ai besoin. Parlons d'autre chose.
dlga_trainer_explain_defense:trainer_explain_defense_2|Bonne question. la première chose que vous devez savoir en tant que combattant est comment vous défendre. Vous tenir à l'écart des blessures et la première règle du combat, et c'est plus important qu'infliger des blessures aux autres. Tout le monde peut brandir une épée et espérer couper quelques membres, mais seuls les combattants experts en défense vivent pour en parler.
dlga_trainer_explain_defense_2:trainer_explain_defense_3|Maintenant. Vous défendre est plus facile si vous avez un bouclier. Bloquer le coup avec le bouclier. [Maintenez le clic-droit pour vous défendre avec le bouclier]. Dans cet position, vous devriez parer toutes les attaques venant de face. Toutefois, vous serez vulnérables aux coups sur vos côtés et derrière.
dlga_trainer_explain_defense_3:trainer_explain_defense_4|Et si je n'ai pas de bouclier ?
dlga_trainer_explain_defense_4:trainer_combat_pretalk|Ensuite, vous devrez utiliser votre arme pour bloquer les coups de votre adversaire. C'est un peu plus difficile que la défense avec un bouclier. Avec un armes vous ne pouvez bloquer les attaques que dans UNE seule direction. Autrement dit, vous pouvez bloquer soit les frappe de taille haute, de taille d'un coté ou de l'autre ou d'estoc. Par conséquent, vous devez surveiller de près votre adversaire et le contrer APRÈS qu'il ait commencé son attaque. De cette façon, vous serez en mesure de bloquer son coup. Si vous commencerez à bloquer AVANT qu'il initie son mouvement, il peut simplement changer sa direction d’attaque et vous toucher.
dlga_trainer_explain_attack:trainer_explain_attack_2|Bonne question. L'attaquer est la meilleure défense, dit-on. Une tactique de que nombreux combattants trouve utile consiste a prendre une position offensive et préparer votre mouvement, attendant le bon moment pour frapper. [Vous pouvez préparer votre attaque en appuyant et en maintenant enfoncé le bouton gauche de la souris.]
dlga_trainer_explain_attack_2:trainer_explain_attack_3|Cela semble utile.
dlga_trainer_explain_attack_3:trainer_explain_attack_4|C'est une bonne tactique, mais n'oubliez pas que votre adversaire peut anticiper votre attaque et prendre une position défensive dans la direction de votre frappe. Si cela arrive, vous devez casser votre attaque et attaquer rapidement dans une autre direction [en appuyant rapidement sur le bouton droit de la souris, vous pouvez annuler votre attaque actuelle].
dlga_trainer_explain_attack_4:trainer_explain_attack_5|Si mon adversaire bloque dans la direction de mon attaque, je brise mon assaut et le relance dans une autre direction.
dlga_trainer_explain_attack_5:trainer_combat_pretalk|Oui, choisir la direction par lequel vous lancerez votre attaque est crucial. Il y a quatre direction d'attaque possible : taille droite, taille gauche, taille haute et estoc. Utilisez les intelligemment. [Pour diriger votre attaque avec les contrôles par défaut, bougez votre souri dans la direction voulut en même temps que vous pressez le clic gauche].
dlga_trainer_explain_horseback:trainer_combat_pretalk|Très bonne question. Une monture peut être la meilleur arme d'un guerrier. Vous y gagnez en vitesse, hauteur, puissance et initiative. Bon nombre d'armes mortelles le sont plus encore utilisées du haut d'un cheval. Par contre vous devez veiller a prendre garde aux cavaliers ennemis qui vous charge la lance couchée, car il peuvent abattre un homme d'une seul touche. [Pour utiliser vous même la lance couchée, armez vous d'une lance ou d'une arme d'hast similaire, et faite accélérer votre cheval dans effectuer d'attaque ni de parade, lorsque vous aurez assez de vitesse vous baisserez automatiquement votre lance. Ensuite vous n'avez qu'a viser un ennemi en manœuvrant votre monture.]
dlga_trainer_choose_mode:trainer_choose_mode_player|Nous avons plusieurs programmes d'entrainement pour accroitre les compétences de nos soldats. Le combat solo vous mets seul face à un à quatre opposants, en combat par équipe votre équipe de quatre personnes affronte quatre, huit ou douze adversaires, et, enfin, le Défi est le challenge ultime de tout guerrier - vous affrontez des vague d'attaquant toujours plus nombreuse sans assistance. La mêlée est une simple bagarre de groupe.^Lequel vous tente?
dlga_trainer_choose_mode_player:trainer_choose_opponents|Combat singulier.
dlga_trainer_choose_mode_player:trainer_choose_opponents.1|Combat par équipe.
dlga_trainer_choose_mode_player:trainer_choose_weapon|Gants.
dlga_trainer_choose_mode_player:trainer_choose_weapon.1|Mêlée générale.
dlga_trainer_choose_mode_player:trainer_pretalk|Aucun, j'ai changé d'avis.
dlga_trainer_choose_opponents:trainer_choose_opponents_player|Maintenant, choisissez le nombre d'adversaires.
dlga_trainer_choose_opponents_player:trainer_choose_weapon|Un.
dlga_trainer_choose_opponents_player:trainer_choose_weapon.1|Deux.
dlga_trainer_choose_opponents_player:trainer_choose_weapon.2|Trois.
dlga_trainer_choose_opponents_player:trainer_choose_weapon.3|Quatre, je me sens chanceux aujourd'hui.
dlga_trainer_choose_opponents_player:trainer_choose_weapon.4|Quatre.
dlga_trainer_choose_opponents_player:trainer_choose_weapon.5|Huit.
dlga_trainer_choose_opponents_player:trainer_choose_weapon.6|Douze, moi et mes compagnon pouvons battre n'importe qui.
dlga_trainer_choose_opponents_player:trainer_pretalk| Aucune, j'ai changé d'avis.
dlga_trainer_choose_weapon:trainer_choose_weapon_player|Et enfin, choisissez votre type d'arme préférée.
dlga_trainer_choose_weapon_player:trainer_begin_training|Armes à une mains.
dlga_trainer_choose_weapon_player:trainer_begin_training.1|Armes à deux mains.
dlga_trainer_choose_weapon_player:trainer_begin_training.2|Armes d'hast.
dlga_trainer_choose_weapon_player:trainer_begin_training.3|Arcs.
dlga_trainer_choose_weapon_player:trainer_begin_training.4|Armes de jet.
dlga_trainer_choose_weapon_player:trainer_pretalk| Aucune, j'ai changé d'avis.
dlga_trainer_begin_training:close_window|Très bien, c'est parti. Une fois que vous avez fini, revenez et venez me parler.
dlga_start:close_window.20|N'approchez pas, sale mendiant.
dlga_start:mayor_begin|Bonjour, Messire.
dlga_start:mayor_talk|Bonjour étranger, vous semblez nouveau à {s9}. Je suis le maître de guilde de la ville.
dlga_start:mayor_begin.1|Bonjour, {playername}.
dlga_mayor_begin:lord_deal_with_night_bandits_completed|Très beau travail, {playername}, vous n'avez fait qu'une bouchée de ces vermines!^^[earned {reg14} Resource Points of {s14}]
dlga_lord_deal_with_night_bandits_completed:close_window|\n
dlga_mayor_talk:mayor_deliver_iron|Voici vos provisions de métal, {reg9} unités de {s4}.
dlga_mayor_talk:mayor_deliver_iron.1|J'ai apporté plus de métal, {reg8} unités de {s4}, alors que vous en aviez demandé {reg9}.
dlga_mayor_talk:mayor_deliver_iron.2|J'ai amené plus de métal, {reg8} unité de {s4}, alors que vous en aviez demandé {reg9}.
dlga_mayor_deliver_iron:mayor_deliver_iron_completed|Très bon travail, {playername}. Nos forgerons ferons bon usage de tout ceci.
dlga_mayor_deliver_iron_completed:close_window|Je fais ce que je peux.
dlga_mayor_talk:mayor_deliver_food|Voici vos provisions, {reg9} unités.
dlga_mayor_deliver_food:mayor_deliver_food_completed|Très beau travail, {playername}, nos magasins d'alimentation sont plein à nouveau et personne ne va mourir de faim pour l'instant.
dlga_mayor_deliver_food_completed:close_window|Je fais ce que je peux.
dlga_mayor_begin:mayor_looters_quest_response|Ah, {playername}. Avez vous fait des progrès pour votre mission ?
dlga_mayor_looters_quest_response:mayor_looters_quest_destroyed|J'ai tué quelque orques tribaux.
dlga_mayor_looters_quest_response:close_window|Pas encore, seigneur. Adieu.
dlga_mayor_looters_quest_destroyed:mayor_looters_quest_destroyed_2|En effet, mes éclaireur on suivit toute l'affaire. Cela devrait dissuader ces orques tribaux de revenir!^^[earned {reg14}x{reg15} Resource Points of {s14}]
dlga_mayor_looters_quest_destroyed_2:close_window| Et ce n'est pas la seule bonne nouvelle ! Grâce à vous, les Orques tribaux ont cessé d'être une menace. Nous n'avons rapporté aucune attaque jusqu'à maintenant. S'il y en a d'autre, ils ont soit disparu ou se sont cachés. C'est bon pour la sécurité du lieu ! Je crois que votre tâche est achevée, {playername}. Merci, et adieu.
dlga_mayor_looters_quest_destroyed_2:mayor_looters_quest_response|Aviez-vous besoin d'autre chose?
dlga_mayor_begin:close_window|C'est bon de vous revoir {playername}. J'ai entendu dire que vous avez escorté ces personnes avec succès. Je dirai à notre commandant combien vous êtes efficace.^^[Gagne {reg14} points ressources du {s14}]
dlga_mayor_begin:move_cattle_herd_failed|J'ai entendu dire que vous avez perdu ces personnes sur votre route pour {s9}. J'ai eu beaucoup de mal à expliquer votre échec au commandant d'ici. Avez vous quelque chose à dire ?
dlga_move_cattle_herd_failed:move_cattle_herd_failed_2|Je suis désolé. J'ai été attaqué durant le trajet.
dlga_move_cattle_herd_failed:move_cattle_herd_failed_2.1|Je suis désolé. Ces gens se sont égaré pendant la nuit.
dlga_move_cattle_herd_failed_2:close_window|Bien, c'était votre responsabilité de les mener en sécurité, peu importe. Vous devez savoir que le commandant a demandé à connaître qui était responsable de cette échec. Donc je lui ai dit que c'était vous.
dlga_mayor_begin:mayor_friendly_pretalk|J'ai entendu parler de vos actes. Vous avez donné à ces Gobelins la punition qu'ils ont méritée. Vous êtes réellement aussi bon qu'on le prétend.^^[Gagne {reg14} points ressources du {s14}]
dlga_mayor_begin:mayor_talk|Que puis-je faire pour vous ?
dlga_mayor_friendly_pretalk:mayor_talk|Maintenant... Peut être que je peux faire quelque chose d'autre pour vous ?
dlga_mayor_pretalk:mayor_talk|Oui ?
dlga_mayor_talk:mayor_info_begin|Pouvez vous me dire ce que vous faîtes ?
dlga_mayor_talk:merchant_quest_requested|Comment puis-je servir notre cause ?
dlga_mayor_talk:merchant_quest_last_offered_job|À propos de la tâche que vous m'avez proposée...
dlga_mayor_talk:merchant_quest_about_job|À propos de la tâche que vous m'avez donnée...
dlga_mayor_talk:close_window|[Quitter]
dlga_mayor_info_begin:mayor_info_talk|Je suis l'autorité locale ici à {s9}. Vous pouvez dire que je suis en charge des tâches quotidiennes. Il y a toujours quelque chose à faire, donc si vous voulez aider, faites le moi savoir.
dlga_mayor_info_talk:mayor_info_lord|Qui règne sur cette ville ?
dlga_mayor_info_lord:mayor_info_talk|Notre seigneur est {s10}.
dlga_mayor_info_talk:mayor_pretalk|C'est tout ce que je voulais savoir. Merci.
dlga_merchant_quest_about_job:merchant_quest_about_job_2|De quoi ça parle ?
dlga_merchant_quest_about_job_2:merchant_quest_what_if_fail|Et si je ne peut pas la mener a bien?
dlga_merchant_quest_about_job_2:merchant_quest_about_job_working|Hé bien, je suis toujours en train de m'en occuper.
dlga_merchant_quest_about_job_working:mayor_pretalk|Bien. Je suis sûr que vous allez vous en sortir.
dlga_merchant_quest_last_offered_job:merchant_quest_brief|Ha, vous voulez reconsidérer mon offre. Bien...
dlga_merchant_quest_what_if_fail:mayor_pretalk|J'espère que vous n'allez pas échouer. Nous ne pouvons pas nous permettre de perdre la cargaison que vous transporterez.
dlga_merchant_quest_what_if_fail:mayor_pretalk.1|Très bien, faites votre possible pour la finir.
dlga_merchant_quest_taken:mayor_pretalk|Excellent. Je compte sur vous donc. Bonne chance.
dlga_merchant_quest_stall:mayor_pretalk|Bien, je vais devoir trouver quelqu'un d'autre. Mais dites le moi si vous changez d'avis.
dlga_merchant_quest_requested:merchant_quest_brief|Bien, vous semblez assez habile. Je pense que je dois avoir quelque chose que vous pouvez faire.
dlga_merchant_quest_brief:merchant_quest_looters_choice|Nous avons eu quelque affrontement aux alentour de {s5} ces derniers temps,  Avec tout le chaos qui va avec, 
dlga_merchant_quest_looters_choice:merchant_quest_looters_brief|Oui, je vais le faire.
dlga_merchant_quest_looters_choice:merchant_quest_stall|J'ai bien peur que vous deviez trouver quelqu'un d'autre pour faire cela.
dlga_merchant_quest_looters_brief:close_window|Exc ellent ! Vous trouverez ces Orques tribaux errants à travers la campagne, probablement à la recherche pour piller d'autres fermes. Tuez ces Orques tribaux, et débarrassez nous de leurs présences. Je passerai un mot à notre chef de provision, et vous serez récompensé pour chaque bandes d'Orques tribaux que vous éliminerez, jusqu'à ce que tout ces Orques soient traités de la même manière.
dlga_merchant_quest_requested:merchant_quest_brief.1|Merci pour votre offre d'aide. En fait je cherchais quelqu'un pour livrer quelques {s4}. Peut-être pouvez vous le faire...
dlga_merchant_quest_brief:merchant_quest_brief_deliver_wine|J'ai une cargaison de {s6} qui doit être livré au {s10} de {s4}. Nous avons besoin de {reg5} unités de {s6} à {s4} en {reg6} jours. Pouvez-vous faire cela?^^[vous gagnerez {reg14} points de réquisition de {s14}]
dlga_merchant_quest_brief_deliver_wine:merchant_quest_taken|Très bien, je ferais la livraison.
dlga_merchant_quest_brief_deliver_wine:merchant_quest_stall|J'ai bien peur de ne pas pouvoir faire la livraison pour le moment.
dlga_merchant_quest_requested:merchant_quest_brief.2|Merci pour votre offre d'aide. En fait je cherchais quelqu'un pour nous approvisionner en nourriture. Peut-être pouvez vous le faire...
dlga_merchant_quest_brief:merchant_quest_brief_deliver_food|Nos réserves de nourriture s'amenuisent et les convois d'approvisionnement sont harcelés par l'ennemi. J'ai besoin de quelqu'un pour nous apporter {reg5} unités de nourriture en {reg6} jours ou nous allons commencer à mourir de faim. Peut-être les citées voisines ont-elles assez de surplus pour nous. Quand dites-vous ?
dlga_merchant_quest_brief_deliver_food:merchant_quest_taken|Bien. Je vais trouver de la nourriture et vous l'amener a vous.
dlga_merchant_quest_brief_deliver_food:merchant_quest_stall|Je suis désolé,  vous aurez besoin de trouver quelq'un d'autre cela.
dlga_merchant_quest_requested:merchant_quest_brief.3|Une tâche, vous dites ? En fait je cherche quelqu'un pour nous fournir du minerais et des métaux. les mines et les routes ne sont plus sûrs, et être réapprovisionné en matières premières est de plus en plus difficile. L'ennemi doit avoir ses propres moyens obscurs, mais efficace d'extraction de minerai, car nous avons vu même des orques et autres vermines dans leurs rangs aller au combat couvertes de métal. Sa qualité correspond à celle de leur porteurs : c'est du fer de qualité inférieure ; le genre a vous lâcher au pire moment et que nous n'utiliserions pas en temps normal. Mais en ces temps troublé, nos forgerons ont appris comment traiter avec des matériaux pauvres si nécessaire. Le moindre geste peut aider.
dlga_merchant_quest_requested:merchant_quest_brief.4|Un devoir vous dite? Le maître demande de plus en plus de troupes chaque jours, et ils ne se sont jamais assez battu pour lui... Mais les armures ne poussent pas sur les peaux , vous savez?^ Ces larbins en charge de d'apporter le minerai sont tous perfides et faibles, ils se font facilement massacrer et alors on se retrouve sans aucun matériel. Mais , ces elfes... sont toujours couverts de brillant métaux , ce précieux métal qui les protège tous comme si ils étaient des roi , dès leur naissance.^Piller leur cadavre et ramener moi ce métal, {playername}. Avec un kilo de ce fer, notre forgeron peux faire assez de matériel pour tout une troupe de guerrier. 
dlga_merchant_quest_brief:merchant_quest_brief_deliver_iron|Nous avons besoin de {reg5} unité de {s6} en {reg6} jours, avant que le forgeron soit a court de métaux. Qu'en dites vous ? 
dlga_merchant_quest_brief_deliver_iron:merchant_quest_taken|Très bien. J'irais chercher le reste de métal et je vous le donnerais. 
dlga_merchant_quest_brief_deliver_iron:merchant_quest_stall|Je n'ai guère le temps de m'occuper de ça.
dlga_merchant_quest_requested:merchant_quest_brief.5|Merci de m'offrir votre aide. Actuellement je recherche quelqu'un pour escorter un convoi. Peut-être que vous pourriez le faire...
dlga_merchant_quest_brief:escort_merchant_caravan_quest_brief|Je vais envoyer un convoi de marchandise à {s8}. Et avec tous ces ennemis en patrouille par ci , par là , je n'ai pas envie de les envoyer sans une escorte supplémentaire. Un groupe d'au moins {reg4} leur offrirait une bonne protection. Pourriez vous emmenez le convoi à {s8} en 7 jours?^^[you will earn {reg14} Resource Points of {s14}]
dlga_escort_merchant_caravan_quest_brief:merchant_quest_taken|Bien. Je vais escorter le convoi de ravitaillement.
