dlga_start:mutiny_pretalk_1|Hé, {playername}. Nous voulons vous dire... ^Les hommes grognent ! Nous voulons plus de loisirs et moins de marches forcées.
dlga_lord_mission_capture_troll_infoc:lord_mission_capture_troll_3|Vous aurez une robuste cage sur roues. Elle est suffisamment spacieuse pour un troll, et elle peut être tirée. Hâtez vos pas sur le chemin du retour, car même le métal n'est pas une protection suffisante contre la furie d'un troll, aveuglé par la rage et la douleur. Assurez-vous qu'il ne s'échappe et ne vous tue pas.
dlga_lord_mission_capture_troll_rejected:lord_pretalk|Maintenant seulement vous révélez votre vraie valeur, mais je la connaissais depuis longtemps. Allez, lâche {playername}, partez maintenant.
dlga_lord_mission_capture_troll_accepted:lord_pretalk|Je savais que je pouvais compter sur votre force et votre bravoure. Esclaves, donnez à {playername} une de nos cages sur roues ! {playername}, revenez lorsque vous aurez mon dû. Je le veux avant que {reg1} aubes soient passées.
dlga_lord_tell_mission:lord_tell_mission_kill_troll|Notre terre fait face à des dangers inconnus de nos temps. Des gens disparaissent aux alentours de {s3}. Pas seulement des roturiers, mais même de petits groupes armés qui s'aventurent à l'extérieur des murs ne reviennent jamais. Il y a d'étranges rumeurs, mais je sais à quoi nous faisons face.
dlga_lord_tell_mission_kill_troll:lord_mission_told|Des trolls sauvages, {playername}. Des bêtes géantes et monstrueuses. Ils ne s'aventurent jamais si loin de leurs sombres cavernes des montagnes, mais au moins un d'entre eux a été aperçu autour de {s3}. Je ne sais quelle sorcellerie en est la cause, mais j'ai besoin que cette chose soit chassée.
dlga_lord_mission_told:lord_mission_kill_troll_info_a|Comment ces monstres peuvent-ils être combattus ?
dlga_lord_mission_kill_troll_info_a:lord_mission_told|Un troll est en effet une dangereuse créature. Ils possèdent une force incroyable dans leur muscles déformés. Leur peau est dure comme le fer, et un arbre n'est qu'une brindille dans leurs mains. Il est dit qu'un troll seul peut vaincre facilement un groupe d'une demi-douzaine d'hommes bien armés et entraînés, les tuant chacun d'un seul coup. Non seulement les hommes, mais aussi les chevaux craignent les Orques. Soyez prudent si vous chargez un lorsque vous êtes montés.
dlga_lord_mission_told:lord_mission_kill_troll_info_b|Pensez-vous qu'ils viennent du Mordor, ou de l'Isengard ?
dlga_lord_mission_kill_troll_info_b:lord_mission_told|Non, je ne pense pas. Nous savons qu'à la fois le Magicien Blanc et la Tour Noire ont toutes sortes de monstres dans leurs rangs, mais d'après ce que j'ai entendu, la bête terrifiant {s3} est sauvage et indomptée. Souvenez-vous, il pourrait y en avoir plusieurs. Mais vous pouvez être sûr que quelque obscure machination de l'Ennemi a envoyé cette nouvelle plaie sur nous.
dlga_lord_tell_mission:lord_mission_investigate_fangorn_0|Voici une mission pour un brave serviteur de confiance comme vous, {playername}. Les plus étranges rumeurs ont atteint mes oreilles depuis la Forêt de Fangorn. Des sbires envoyés couper du bois et même des commandants traversant l'endroit ne reviennent régulièrement pas. Ils accusent les fantômes, les esprits des bois, d'anciennes malédictions... Bah ! De mauvaises excuses pour leur couardise ou leur incompétence.
dlga_lord_mission_investigate_fangorn_0:lord_mission_investigate_fangorn_1|Que me commandez-vous de faire à ce sujet, Maître ?
dlga_lord_mission_investigate_fangorn_0:lord_mission_investigate_fangorn_rejected|Mais Maître, il y a du danger et de la souffrance dans Fangorn ! Je l'ai moi-même ressenti !
dlga_lord_mission_investigate_fangorn_1:lord_mission_investigate_fangorn_2|Peut-être simplement que mes autres serviteurs sont incapables d'empêcher les plus lâches vers de terres parmi leurs troupes de déserter. Imbéciles, aveuglés par les superstitions. Ou peut-être est-ce une traître embuscade de ces racailles d'Elfes, cachés dans leurs arbres putrides comme c'est leur usage. Ou qui sait quoi d'autre. Je veux que vous enquêtiez, {playername}.
dlga_lord_mission_investigate_fangorn_2:lord_mission_investigate_fangorn_accepted|Je n'ai peur ni des Elfes, ni des esprits. Laissez-moi m'en occuper, Maître.
dlga_lord_mission_investigate_fangorn_2:lord_mission_investigate_fangorn_rejected|Maître, pitié pour votre serviteur ! Ne me demandez pas de m'aventurer dans cet endroit maudit !
dlga_lord_mission_investigate_fangorn_rejected:lord_pretalk|Ainsi, vous êtes comme les autres vers : un couard inutile et superstitieux. Je vous ai surestimé. Maintenant, partez !
dlga_lord_mission_investigate_fangorn_accepted:lord_pretalk|Bien. Allez-y et apportez des éclairsissements sur cette affaire. Puis revenez ici et faites-moi votre rapport. J'attends votre retour avec des nouvelles avant que {reg1} aubes ne soit passées.
dlga_lord_tell_mission:lord_mission_find_lost_spears|Voici une mission pour un commandant brave et digne de confiance comme vous, {playername}. Nous sommes mal équipés pour combattre les hordes de Rhûn. Nos armées perdent les batailles les unes après les autres. Une légende raconte qu'il y a longtemps, il existant des lances fabriquées par les Nains pour les armées du grand Roi Bladorthin (mort depuis longtemps), dont chacune avait un fer par trois fois forgé et un bois finement incrusté d'or, mais qui n'ont jamais été payées ni livrées…
dlga_lord_mission_find_lost_spears:lord_mission_find_lost_spears_1|Que voulez-vous que je fasse, mon seigneur ?
dlga_lord_mission_find_lost_spears_1:lord_mission_find_lost_spears_2|Ces armes augmenteraient l'efficacité de nos armées, mais surtout elles relèveront le moral de nos hommes. Vous allez devoir trouver ces lances. Vous devrez demander aux Nains la permission de les chercher dans les profondeurs de la Montagne Solitaire. Attention, vous pourriez rencontrer quelques Orques ou Trolls dans les tunnels. Êtes-vous près à accomplir cette tâche ?
dlga_lord_mission_find_lost_spears_2:lord_mission_find_lost_spears_accepted|Je n'ai peur ni des Orques, ni des Trolls ! Je trouverai ces lances pour vous, mon seigneur.
dlga_lord_mission_find_lost_spears_2:lord_mission_find_lost_spears_rejected|J'ai peur de ne pas pouvoir vous aider, mon seigneur.
dlga_lord_mission_find_lost_spears_rejected:lord_pretalk|Je vois que la discrétion est le meilleur aspect de votre valeur. Peut-être devriez-vous continuer à suivre des devoirs d'éclaireur.
dlga_lord_mission_find_lost_spears_accepted:lord_pretalk|Bonne chance, alors !
dlga_lord_tell_mission:lord_mission_mirkwood_sorcerer|Il est un important service que vous pourriez accomplir pour notre peuple, {playername}.
dlga_lord_mission_mirkwood_sorcerer:lord_mission_mirkwood_sorcerer_0|Mon pouvoir pour défendre et préserver la Lothlórien a été diminué par les dispositifs de l'ennemi. Un maître-sorcier de Dol Guldur invoque de puissants charmes qui inhibent nos défenses. Bien qu'il soit mortel, il est devenu l'un des plus grands élèves de nos ennemis dans l'utilisation des rituels des arcanes, et il représente une grande menace pour notre peuple. Vous devez le chasser et le détruire !
dlga_lord_mission_mirkwood_sorcerer_0:lord_mission_mirkwood_sorcerer_1|Où puis-je trouver le sorcier, ma Dame ?
dlga_lord_mission_mirkwood_sorcerer_1:lord_mission_mirkwood_sorcerer_2|Cherchez-le dans la Forêt Noire, à proximité de Dol Guldur elle-même. Il est un ennemi à la fois bien protégé et prudent, il vous faudra donc être discret pour empêcher que l'alarme soit donnée. S'il s'échappe, il se relogera dans quelque noir endroit que nous ne connaissons pas et il continuera ses malveillances. C'est notre seule opportunité de le vaincre. Beaucoup dépend de votre succès. Partez, avec nos bénédictions.
dlga_lord_mission_mirkwood_sorcerer_2:lord_pretalk|Il en sera fait selon votre volonté, ma Dame. Je ferai de mon mieux pour éliminer ce mal.
dlga_lord_mission_mirkwood_sorcerer_2:lord_mission_mirkwood_sorcerer_rejected|Pardonnez-moi, ma Dame. J'ai certaines affaires pressantes dont je dois m'occuper avant d'aider votre peuple à contrer cette menace.
dlga_lord_mission_mirkwood_sorcerer_rejected:lord_pretalk|Je comprends, {playername}. Mais ne tardez pas trop, résister à cette magie noire m'épuise.
dlga_lord_tell_mission:lord_mission_deliver_message|Je dois envoyer une lettre à {s13}, qui devrait être en ce moment à {s4}. Si vous allez dans sa direction, pourriez-vous la lui livrer ? La lettre doit être entre ces mains dans les 30 jours.
dlga_lord_mission_deliver_message:lord_mission_deliver_message_accepted|Certainement, j'ai l'intention de passer par {s4}, et cela ne me pose pas de problème.
dlga_lord_mission_deliver_message:lord_mission_deliver_message_rejected|De doute de voir {s13} avant longtemps, {s65}. Vous feriez mieux d'envoyer quelqu'un d'autre.
dlga_lord_mission_deliver_message_accepted:close_window|J'apprécie, {playername}. Voici la lettre. Présentez mes salutations à {s13} lorsque vous le verrez.
dlga_lord_mission_deliver_message_rejected:lord_pretalk|Ah, très bien. Je suis sûr que je trouverai quelqu'un d'autre.
dlga_lord_tell_mission:lord_mission_deliver_message.1|J'ai besoin d'envoyer une lettre à {s13} de {s15}, qui devrait se trouver en ce moment à {s4}. Si vous allez dans cette direction, pourriez-vous lui transmettre ma lettre ? Elle doit être entre ses mains avant 40 jours.
dlga_lord_tell_mission:lord_mission_told|Voici une mission urgente... Mon messager doit donner nos plans de batailles aux commandants se trouvant à {s14}. Son trajet a été interrompu de nombreuses fois, à cause des dangers que l'on rencontre sur les routes, mais cette fois, il doit arriver à destination. Ainsi, je veux être sûr qu'il est bien gardé. Je vous fais confiance, {playername}, et je vous serai reconnaissant si vous l'escortez jusqu'à {s14}, afin qu'il y arrive sans problème.
dlga_lord_tell_mission:lord_mission_told.1|J’ai un ami là-bas, un vieux guerrier, qui est très malade. Une vieille plaie s'est infectée et, s'il ne voit pas bientôt un médecin, il mourra. Cet homme m'est cher, {playername}, mais il est aussi têtu qu'un âne, et il refuse que quelqu'un examine sa blessure car il ne croit pas les médecins de cette ville. J'ai appris que vous aviez un bon guérisseur avec vous. Je voudrais que vous l'emmeniez voir mon ami pour examiner sa blessure. {reg3?Elle:Il} serait donc peut-être d'accord pour se faire enfin opérer. S'il vous plaît, je vous serais très reconnaissant si vous faisiez cela pour moi.
dlga_lord_tell_mission_raise_troops:lord_tell_mission_raise_troops_2|De combien d'hommes avez-vous besoin ?
dlga_lord_tell_mission_raise_troops_2:lord_mission_raise_troops_told|Si vous pouviez former {reg1} {s14} et me les apporter, cela devrait probablement suffire.
dlga_lord_mission_raise_troops_told:lord_mission_raise_troops_accepted|Bien sûr, {65}. Donnez moi {reg1} fraîches recrues et je les entraînerai jusqu'à devenir {s14}. 
dlga_lord_mission_raise_troops_told:lord_mission_raise_troops_rejected|Je suis trop occupé en ce moment pour entraîner qui que ce soit.
dlga_lord_mission_raise_troops_accepted:close_window|Vous enlevez un poids de mes épaules, {playername}. Je vais faire dire à mes sergents de vous envoyer les recrues et de les passer sous votre commandement. De plus, je vais vous avancer quelque argent pour leurs dépenses. Voici, cette somme devrait suffire. Merci pour votre aide.
dlga_lord_mission_raise_troops_rejected:lord_pretalk|Oh, bien sûr. Je m'attendais à plus. Et bien, bonne chance à vous.
dlga_lord_tell_mission:lord_mission_hunt_down_fugitive_told|J'ai quelque chose pour lequel vous pourriez être utile, un problème avec le bandit sans foi ni loi connu sous le nom de {s4}. Il a assassiné un de mes gardes du corps et a échappé à son jugement jusqu'ici. Les nouvelles disent qu'il a été aperçu à {s3}. Vous pourriez le traquer et lui infliger une justice rapide, et je vous récompenserai à votre retour.
dlga_lord_mission_hunt_down_fugitive_told:lord_mission_hunt_down_fugitive_accepted|Je vais le traquer et exécuter la loi.
dlga_lord_mission_hunt_down_fugitive_told:lord_mission_hunt_down_fugitive_rejected|Je suis trop occupé pour aller à sa recherche pour le moment.
dlga_lord_mission_hunt_down_fugitive_accepted:close_window|C'est excellent, {playername}. Je vous serai reconnaissant, et votre prouesses seront notée. Et bien, bonne chasse !
dlga_lord_mission_hunt_down_fugitive_rejected:lord_pretalk|Comme vous voulez, {playername}. Je suppose qu'il y a de nombreux chasseurs de primes par ici pour accomplir ce travail.
dlga_lord_tell_mission:lord_mission_told.2|Bien, quelques esclaves travaillant à {s4} se sont enfuis. Vermine ingrate, qui nous remercie ainsi de leur avoir épargné la vie ! D'après ce que nous savons, ils se dirigent vers {s3} aussi vite que possible. Ils se sont séparés en trois groupes pour échapper à la capture. Je voudrais que vous capturiez ces trois groupes et que vous les rameniez à {s4} par tous les moyens à votre disposition. Je les aurais bien punis pour s'être échappé, mais nous avons vraiment besoin de main-d’œuvre, et je ne ferais que les battre.
dlga_lord_tell_mission:lord_tell_mission_follow_spy|J'ai reçu l'information qu'un homme dans cette ville est un espion ennemi. Il doit être attrapé et pendu pour son impudence, mais nous croyons qu'il devrait bientôt quitter la ville pour rencontrer son maître, l'homme à qui il rapporte ce qu'il a vu. L'espion lui-même importe peu, mais le maître est un homme dangereux, et il pourrait nous être utile si nous mettons la main dessus.
dlga_lord_tell_mission_follow_spy:lord_tell_mission_follow_spy_2|Je voudrais que vous attendiez jusqu'à ce que l'espion quitte la ville. Puis vous devrez le suivre, discrètement, jusqu'au lieu de rendez-vous. Vous devez absolument faire attention à ce qu'il ne vous voit pas, ou il pourrait soupçonner une embuscade et faire demi-tour. Lorsque le maître apparaîtra, vous devrez l'arrêter et me rapporter les deux hommes. Vivants, s'il vous plaît.
dlga_lord_tell_mission_follow_spy_2:lord_tell_mission_follow_spy_accepted|Je vais le faire, {s65}.
dlga_lord_tell_mission_follow_spy_2:lord_tell_mission_follow_spy_rejected|Non, cette tâche n'est pas pour moi.
dlga_lord_tell_mission_follow_spy_accepted:close_window|Bien, je suis sûr que vous ferez du bon travail. Un de mes hommes vous designera l'espion lorsqu'il partira, pour que vous sachiez qui suivre. Souvenez-vous, je veux les deux, et je les veux vivants.
dlga_lord_tell_mission_follow_spy_rejected:lord_pretalk|C'est dommage. Bien, continuez ce que vous faisiez, {playername}...
dlga_lord_tell_mission:lord_tell_mission_capture_enemy_hero|J'ai une tâche difficile qui doit être accomplie, {playername}, et vous pourriez être celui qui la mènera à bien. J'ai besoin de quelqu'un pour capturer un des commandants ennemis et me l'apporter. Je l'interrogerai alors sur les plans de bataille ennemis. C'est un travail simple, mais celui que vous choisirez sera gardé par des soldats d'élite. Êtes-vous près à un combat ?
dlga_lord_tell_mission_capture_enemy_hero:lord_tell_mission_capture_enemy_hero_accepted|Considérez ceci comme accompli, {s65}.
dlga_lord_tell_mission_capture_enemy_hero:lord_tell_mission_capture_enemy_hero_rejected|Je dois refuser, {s65}. Je ne veux pas m'approcher de l'un d'entre eux.
dlga_lord_tell_mission_capture_enemy_hero_accepted:close_window|J'aime votre esprit ! Allez-y, rapportez-moi un de nos ennemis et je trinquerai à votre nom dans mon hall à votre retour. Et vous récompenserai pour vos efforts, bien sûr.
dlga_lord_tell_mission_capture_enemy_hero_rejected:lord_pretalk|Vous manquez du courage que je pensais que vous possédiez. Très bien, {playername}, je trouverai quelqu'un d'autre.
dlga_lord_tell_mission:lord_tell_mission_lend_companion|Je n'ai pas de tâche pour vous pour le moment, mais votre compagnon {s3} est  {reg3?une jeune fille:un jeune homme} compétent et j'ai besoin de quelqu'un avec {reg3?ses:ses} talents. Pourriez-vous me {reg3?l':l'}envoyer pour quelques temps ?
dlga_lord_tell_mission_lend_companion:lord_tell_mission_lend_companion_2|Combien de temps aurez-vous besoin {reg3?d'elle:de lui}?
dlga_lord_tell_mission_lend_companion_2:lord_mission_lend_companion_told|Juste quelques jours, une semaine tout au plus.
dlga_lord_mission_lend_companion_told:lord_tell_mission_lend_companion_accepted|Alors je vous laisserai {s3} pour une semaine.
dlga_lord_mission_lend_companion_told:lord_tell_mission_lend_companion_rejected|Je suis désolé, mais je ne peux me passer {s3} tout une semaine.
dlga_lord_tell_mission_lend_companion_accepted:close_window|Je ne peux suffisamment vous remercier, {playername}. Ne vous inquiétez pas, votre compagnon vous sera retourné dans les temps.
dlga_lord_tell_mission_lend_companion_rejected:lord_pretalk|Et bien, c'est vraiment dommage, mais je suppose que je ne peux pas vous forcer, ou forcer {s3} à accepter. Je ferai sans.
dlga_lord_tell_mission:lord_mission_told.3|Mes éclaireurs ont remarqué une récente augmentation de l'activité ennemie, mais ils n'ont pas réussi à capturer d'ennemis vivants et à me les apporter pour que je puisse les questionner. J'ai donc besoin d'un bon guerrier qui puisse me trouver {reg1} prisonniers ennemis et me les apporter pour que je les interroge.
dlga_lord_tell_mission:lord_pretalk|Non, {playername}, je n'ai pas besoin de votre aide en ce moment.
dlga_lord_mission_told:lord_mission_accepted|Vous pouvez compter sur moi, {s65}.
dlga_lord_mission_told:lord_mission_rejected|J'ai peur de ne pas pouvoir accepter une telle mission en ce moment.
dlga_lord_mission_accepted:close_window|Excellent, {playername}, excellent. Je vous fait entièrement confiance.
dlga_lord_mission_rejected:close_window|Ah bon ? Bien, je suppose qu'en fait vous n'êtes pas capable d'accomplir une telle tâche. Je chercherai donc quelqu'un de plus courageux que vous.
dlga_lord_talk:lord_leave_prison|Je dois partir maintenant.
dlga_lord_talk:lord_leave|Cette petite discussion est terminée. Je dois y aller.
dlga_lord_talk:lord_leave.1|Je dois prendre congé.
dlga_lord_leave_prison:close_window|On se reverra, je pense.
dlga_lord_leave:close_window|Nous discuterons de cela, {playername}.
dlga_lord_leave:close_window.1|Bien sûr, {playername}. Au revoir.
dlga_lord_leave:close_window.2|Je vous souhaite un bon voyage, {playername}.
dlga_lord_leave:close_window.3|Oui, oui. Bien sûr.
dlga_lord_leave:close_window.4|En espérant vous revoir.
dlga_start:lady_escort_lady_succeeded|Merci de m'avoir escorté, {playername}, et de m'avoir permis de voyager en sécurité. Vos services seront récompensés.
dlga_lady_escort_lady_succeeded:close_window|C'était un honneur de vous servir.
dlga_start:prison_guard_players|Bonjour, messire. Voulez-vous visiter la prison ?
dlga_prison_guard_players:close_window|Oui, ouvrez la porte.
dlga_prison_guard_players:close_window.1|Non, pas maintenant.
dlga_start:prison_guard_talk|Oui, que désirez-vous ?
dlga_prison_guard_talk:prison_guard_ask_prisoners|Qui est emprisonné ici ?
dlga_prison_guard_talk:prison_guard_visit_prison|Je voudrais parler avec un prisonnier.
dlga_prison_guard_ask_prisoners:prison_guard_talk| En ce moment, {s51} {reg1?sont:est} en prison ici.
dlga_prison_guard_visit_prison:close_window|Bien sûr, messire. Entrez.
dlga_prison_guard_visit_prison:prison_guard_visit_prison_2|Vous devez avoir la permission du seigneur pour parler aux prisonniers.
dlga_prison_guard_visit_prison_2:close_window|D'accord. J'irai donc la lui demander.
dlga_prison_guard_visit_prison_2:prison_guard_visit_prison_3|Allez, je pensais que vous étiez le chef ici.
dlga_prison_guard_visit_prison_3:prison_guard_visit_prison_4|He-heh, vous avez raison. Toutefois, je ne peux quand même pas vous laisser entrer dans la prison.
dlga_prison_guard_visit_prison_4:close_window|D'accord. Je vais donc partir.
dlga_prison_guard_visit_prison_4:prison_guard_visit_prison_5|J'ai trouvé une bourse de 100 pièces à quelques pas d'ici. Je crois qu'elle vous appartient.
dlga_prison_guard_visit_prison_5:close_window|Ah ! Je l'ai cherchée toute la journée. Merci beaucoup de me l'avoir rapportée, {monsieur/madame}. Maintenant que je sais que vous êtes une personne honnête, je sais que je peux vous laisser entrer. Allez-y.
dlga_prison_guard_talk:close_window|Au revoir.
dlga_start:castle_guard_players|À vos ordres, messire.
dlga_castle_guard_players:close_window|Ouvrez la porte, je vais entrer.
dlga_castle_guard_players:close_window.1|Au revoir.
dlga_start:castle_guard_sneaked_intro_1|Sortez de ma vue, manant ! Tu pues !
dlga_start:close_window.8|Pars avant que je ne perde mon calme, voyou !
dlga_castle_guard_sneaked_intro_1:castle_guard_sneaked_intro_2|Je désire entrer et parler à votre seigneur.
dlga_castle_guard_sneaked_intro_1:close_window|[Partir]
dlga_castle_guard_sneaked_intro_2:close_window|Es-tu fou, {homme/femme} ? Les mendiants ne sont pas admis dans la salle. Maintenant pars ou je vais te frapper.
dlga_start:castle_guard_intro_1|Que désirez-vous ?
dlga_castle_guard_intro_1:castle_guard_intro_2|Je désire entrer et parler à votre seigneur.
dlga_castle_guard_intro_1:close_window|Au revoir.
dlga_castle_guard_intro_2:castle_guard_intro_2|Vous pourrez rentrer après m'avoir laissé vos armes. Personne n'est autorisé à porter des armes dans la salle du seigneur.
dlga_castle_guard_intro_2:close_window|Tenez, voici mes armes. J'entre de ce pas.
dlga_castle_guard_intro_2:castle_guard_intro_2b|Désolé, je ne donne mes armes à personne.
dlga_castle_guard_intro_2b:close_window|Vous n'entrerez donc pas.
dlga_start:castle_gate_guard_talk|Que voulez-vous ?
dlga_castle_gate_guard_pretalk:castle_gate_guard_talk|Oui ?
dlga_castle_gate_guard_talk:castle_gate_open|Nous voudrions une protection pour la nuit. Me laissez-vous rentrer ?
dlga_castle_gate_guard_talk:request_meeting_castle_lord|Je veux parler au seigneur du château.
dlga_castle_gate_guard_talk:request_meeting_other| Je désire parler avec quelqu'un au château.
dlga_castle_gate_guard_talk:close_window|[Quitter]
dlga_request_meeting_castle_lord:close_window|Attendez ici. {s2} va vous recevoir.
dlga_request_meeting_castle_lord:castle_gate_guard_pretalk|Mon seigneur n'est pas là pour le moment.
dlga_request_meeting_other:request_meeting_3|Qu'y a-t'il ?
dlga_request_meeting_3:close_window|Au revoir.
dlga_request_meeting_4:request_meeting_5|Attendez. Je vais lui transmettre votre requête.
dlga_request_meeting_5:request_meeting_6|J'attendrai...
dlga_request_meeting_6:close_window|Parfait. {s2} va venir vous parler.
dlga_request_meeting_6:close_window.1|{s2} dit qu'il ne veut pas vous voir. Partez maintenant.
dlga_castle_gate_open:close_window|Mon seigneur {s2} est enchanté de vous recevoir {sire/madame}. Venez, je vous ouvre les portes.
dlga_castle_gate_open:close_window.1|Mon maître {s2} n'est pas au château en ce moment. Mais je pense qu'il vous aurait fait confiance. Je vous ouvre les portes.
dlga_castle_gate_open:close_window.2|Entrez, je vais vous ouvrir les portes.
dlga_castle_gate_open:close_window.3|Entrez, mais faites en sorte que vos hommes se tiennent bien à l'intérieur de ces murs. Mon maître {s2} ne souhaite pas avoir d'ennui avec vous.
dlga_castle_gate_open:close_window.4|Mon seigneur {s2} ne souhaite pas vous voir. Partez.
dlga_party_relieved:caravan_help0|Merci de nous avoir aidés. Nous sommes en sécurité maintenant.
dlga_caravan_help0:caravan_help1|Merci de nous avoir aidés. Aviez-vous déjà aperçu ces énormes Orques auparavant ? Ils ne ressemblent pas à ceux qui viennent des montagnes et que nous avons l'habitude d'affronter. Et la marque sur leur bouclier est l'ancien insigne du Mordor. Je n'en avait jamais vu de ce coté-ci de la rivière. De dangereuses créatures remarchent. La guerre arrive ! Je vous conseille d'aller à Edoras, la capitale de votre peuple, et de prévenir le maître des lieux, quel qu'il soit, de ce que vous avez vu. Dépêchez vous, nous n'avons guère de temps.
dlga_caravan_help1:caravan_help2|En effet, je n'avais jamais vu de tels Orques auparavant. Ce sont des choses répugnantes.
dlga_caravan_help2:caravan_help3|Je vois aussi que vous êtes un guerrier aguerri. Je voudrais que vous m'aidiez pour une affaire personnelle. Il y a un petit fort près des marais de Nindalf, ou les voyageurs et les gens du commun peuvent trouver de la nourriture et un toit. Il est gouverné par un seigneur local, qui n'obéit ni au Rohan, ni au Gondor. Comme je suis un marchant ambulant moi-même, je comprends cette homme qui ne veut pas de seigneur. Mais, comme il est indépendant, il sera aussi impuissant face à l'ennemi. La guerre va éclater dans les prochains jours, c'est pour moi chose certaine. Je voudrais donc que vous alliez voir ces gens et que vous fassiez tout ce qui est en votre pouvoir pour les aider à survivre. Dites au chef, Balan, que Torbal vous a demandé de lui donner une tour à poisson. Il saura alors que c'est moi qui vous ai envoyé.
dlga_caravan_help3:close_window|Je lui remettrai votre message. Je vous souhaite un bon voyage. Je suis sûr que nous nous reverrons.
dlga_start:close_window.9|Vous êtes arrivés juste à temps. Joignez-vous à nous et venez nous aider à donner une leçon à nos ennemis.
dlga_start:close_window.10|En nous combattant, vous commettez une grosse erreur.
dlga_start:ally_thanks_meet|Je ne pense pas que nous nous soyons proprement présentés l'un à l'autre, mon ami. Vous venez de me sauver la vie, et je ne connais toujours pas votre nom...
