str_yes|Oui.
str_rohan_rumor_begin|Cela me brise le coeur de voir mes bébés partir à la guerre ! Mais sans eux, les hommes devraient marcher.
str_rohan_rumor_2|J'ai entendu dire que les orques mangent les chevaux ! Maudites bêtes ! Ils mangent aussi les prisonniers.  C'est mal également, bien sûr.
str_rohan_rumor_3|Il n'y a pas de meilleurs chevaux que ceux du Rohan. Même les elfes prennent leurs chevaux chez nous !
str_rohan_rumor_4|Si vous pouvez soigner les hommes, veuillez traiter mes chevaux avez autant d'égards s'ils venaient à être blessés.
str_rohan_rumor_5|Apportez-moi huit chevaux de somme, a-t-il demandé... après les sept qu'il a demandé hier. On finit par se poser des questions...
str_rohan_rumor_6|Le Gondor préfère les chevaux robustes. Nos cavaliers apprécient la vitesse. Les elfes prennent seulement le meilleur. Et nos ennemis les volent !
str_rohan_rumor_7|J'ai vu des juments du désert et des chevaux variags. Les chevaux du Rohan sont clairement supérieurs mais requièrent plus d'expérience pour les monter.
str_rohan_rumor_8|Les wargs sont plus lents que les chevaux, mais sont plus agiles. Ils sont aussi plus fragiles qu'un cheval de guerre bien élevé.
str_rohan_rumor_9|Des armées marchent contre le Rohan avec des piques et des lances destinées à nos cavaliers. Le traître Saruman abattra toute la forêt de Fangorn pour équiper ses armées avant la fin de la guerre.
str_rohan_rumor_10|Être les meilleurs cavaliers du royaume commence en élevant les meilleurs chevaux.
str_rohan_rumor_11|La plupart des chevaux que vous voyez au Gondor viennent de nous. Ils préfèrent les chevaux légèrement plus forts et plus lents qui peuvent porter leurs armures lourdes.
str_rohan_rumor_12|On dit au Rohan qu'un cheval est comme un homme. Que si un cheval est bon, il est comme un homme bon, et que si un cheval est mauvais, il est comme un homme mauvais. Et si un cheval a faim, c'est comme si un homme avait faim, et si cheval est triste, c'est comme si un homme était triste. Et nous disons qu'un cheval en colère est comme un homme en colère. Nous disons que si un cheval marche, il marche comme un homme, qu'un vieux cheval est comme un vieil homme et qu'un jeune cheval est comme un jeune homme. Et de même qu'un cheval est vieux comme un homme est vieux, un petit cheval est comme un petit homme.
str_rohan_rumor_13|Les orques de Saruman sont mauvais mais ils ne portent pas beaucoup de protections. Ils ne sont pas de taille contre une bonne hache.
str_rohan_rumor_14|Nos haches de jet et nos lances peuvent sembler encombrants, mais combien de temps avez-vous pour lancer sur l'ennemi un objet quelconque avant de le charger ? Faites en sorte de jeter quelque chose qui fasse mal.
str_rohan_rumor_15|Toucher un orque avec une flèche tirée depuis un cheval semble difficile, et ça l'est, mais le prix d'une charge sur une ligne de longues piques est plus élevé.
str_rohan_rumor_16|Le Gondor pratique l'archerie. Nous pratiquons l'archerie montée. Les Dunlandais ne pratiquent ni l'un, ni l'autre.
str_rohan_rumor_17|Beaucoup des orques de Saruman sont de mortels archers. Beaucoup ne le sont pas. Un sage commandant de cavalerie ne devrait pas attendre pour découvrir ce qu'il en est.
str_rohan_rumor_18|Nous sommes tous des amis, ici. Ou nous le devrions ; car le ricanement du Mordor sera notre seul récompense, si nous nous disputons.
str_rohan_rumor_19|Pendant longtemps, nous avons élevé nos bêtes et entretenu nos champs, construit nos maisons, forgé nos outils ou chevauché dans les guerres de Minas Tirith. Et nous appelons cela la vie des hommes,  ainsi va le monde.
str_gondor_rumor_begin|Le Gondor n'a pas de roi et ses ennemis sont à ses portes. L'ombre grandit dans l'est. Les choses ne se présentent pas bien.
str_gondor_rumor_2|Au Gondor, il n'y a rien sous le soleil que nous ne fabriquons, construisons ou élevons en certaine quantité. Mais pour combien de temps encore ?
str_gondor_rumor_3|Le Mordor est une terre stérile et aride. Qu'y mangent donc les créatures ? Quand même pas les plus faibles d'entre eux ? A moins que...
str_gondor_rumor_4|Nos peinons sur nos terres, comme nous l'avons fait pendant des générations. Notre passé est glorieux et brave, mais notre futur semble incertain.
str_gondor_rumor_5|Les ressources de l'Ombre pour la guerre semblent sans limites, mais elles reposent sur un large réservoir d'esclaves.
str_gondor_rumor_6|Nous connaissons les elfes du nord, mais aujourd'hui personne ne peut plus les voir.
str_gondor_rumor_7|Je voudrais voir l'Arbre Blanc à nouveau en fleurs dans la cour des rois, et la Couronne d'Argent revenir, et Minas Tirith en paix : Minas Anor comme autrefois, pleine de lumière, noble et juste, belle comme une reine parmi d'autres reines.
str_gondor_rumor_8|Pourquoi l'Umbar continue-t-il de nous envahir ? Leurs corsaires auraient bien plus avantage à commercer avec nous. Quel butin pourrait égaler les richesses qu'ils amasseraient en vendant les antiques artefacts númenóréens aux nobles de Gondor ?
str_gondor_rumor_9|La guerre doit être menée, tandis que nous défendons nos vie contre un destructeur qui dévore tout ; mais je n'aime pas l'épée brillante pour sa finesse, ni la flèche pour sa rapidité, ni le guerrier pour sa gloire. Je n'aime que ce qu'ils défendent.
str_gondor_rumor_10|Gil-galad était un roi elfe. Pour lui les harpistes chantent tristement : le dernier dont le royaume était juste et équitable entre les Montagnes et la Mer.
str_gondor_rumor_11|Dol Guldur ? Jamais entendu parler.
str_gondor_rumor_12|La Moria ? Les nains y ont des mines, n'est-ce pas ?
str_gondor_rumor_13|Ne le dites à personne, mais je pense que le Prince Imrahil devrait devenir roi. Le Seigneur Denethor est un homme noble, mais le Gondor s'est beaucoup fané sous son règne. Et pas seulement depuis que son fils aîné est parti.
str_gondor_rumor_14|Les gens disent que les Neufs chevauchent à nouveau hors de Minas Morgul. Je souhaiterais que nous ayons plus de braves capitaines comme Boromir pour mener nos hommes au combat contre de tels antiques ennemis.
str_gondor_rumor_15|Les Suderons nous poussent hors du Harondor. Ils nous harcèlent fortement depuis quelques temps. Je souhaite pouvoir marcher à nouveau à travers les champs verts du Lebennin. Mais on nous dit « non », nos soldats doivent protéger le coeur du royaume.
str_gondor_rumor_16|Le cousin de mon ami est archer au service de Hirluin le Beau. Ils ont de loin les plus beaux uniformes, si vous voulez mon avis.
str_gondor_rumor_17|Ceux qui demeurent dans la profonde vallée de Sourcenoire sont accoutumés à l'obscurité. J'ai entendu dire qu'ils voient dans la nuit.
str_gondor_rumor_18|Nous sommes des gens de parole, nous les Gondoriens. Nous nous vantons rarement, et puis nous oeuvrons, ou nous mourons en essayant.
str_dwarf_rumor_begin|Ils nous demandent si les nains ont des amis. Bien sûr que nous avons des amis. Mais nous ne les aimons pas.
str_dwarf_rumor_2|Les orques ? Pfft, ils ne sont que du lubrifiant pour épée.
str_dwarf_rumor_3|Qu'est-ce que c'est que vous portez ? A première vue ça ne vous protégerait même pas d'une piqûre d'abeille. Et vous avez l'air ridicule.
str_dwarf_rumor_4|Bien sûr que nous pouvons monter des chevaux. Nous n'en avons simplement pas envie !
str_dwarf_rumor_5|Fichez le camp ! Nous n'avons pas besoin de gens comme vous par ici, les orques sont suffisants.
str_dwarf_rumor_6|Qui appelez-vous "petit" ?
str_dwarf_rumor_7|Vous devriez voir les cavernes de la Ferté-au-Cor. Si seulement nous pouvions récolter toutes ces pierres précieuses...
str_dwarf_rumor_8|Aucune nouvelle de nos frères de la Moria depuis quelques temps. Je parie qu'ils veulent juste garder toutes les richesses pour eux-mêmes !
str_dwarf_rumor_9|Les elfes ? Qu'ont déjà fait les elfes pour nous ? D'accord, les arts de la guérison, mais à part ça ? Certes, quelques techniques de forgeage, mais quoi d'autre ? D'accord, ils combattent l'Ombre, mais à part ça, qu'ont-ils déjà fait pour nous, je vous le demande !
str_dwarf_rumor_10|Une chope de bière, un porc rôti, une fille avec une barbe épaisse et je suis heureux !
str_dwarf_rumor_11|Eh bien, Brian, j'ouvre une mine ! Quoi  ? Hein ? Ben, Brian, j'ouvre une mine !
str_dwarf_rumor_12|Nous, les nains, construisons toujours plus d'une entrée dans nos mines. Et puis il y a les entrées secrètes, aussi.
str_dwarf_rumor_13|Étranges sont les coutumes des hommes.
str_dwarf_rumor_14|Infatigable était le Peuple de Durin lorsque sous les montagnes la musique s'élevait. Les harpistes jouaient, les ménestrels chantaient et aux portes les trompettes sonnaient.
str_dwarf_rumor_15|*fredonne doucement* Tuer les hommes ! Tuer les elfes ! Garder l'or pour nous-mêmes !
str_mordor_rumor_begin|Lugbúrz commande !
str_mordor_rumor_2|Les Nazgûl vaincront le monde des hommes !
str_mordor_rumor_3|Pourquoi ne travailles-tu pas, glob ! L'Oeil regarde !
str_mordor_rumor_4|Bientôt l'obscurité arrivera ! Durb-burz !
str_mordor_rumor_5|Faim ! Où est nourriture ?
str_mordor_rumor_6|Nous nous régalerons avec les hommes de la Cité Blanche !
str_mordor_rumor_7|Maîtres entraînent Olog-hai pour guerre !
str_mordor_rumor_8|Warg mordu mon doigt. Fait vraiment mal ! Saleté de Warg !
str_mordor_rumor_9|Ne vous fiez pas à Saruman-glob !
str_mordor_rumor_10|Les orques des Montagnes sont faibles ! Nous sommes forts ! Nous mangerons les snagas des tribus !
str_mordor_rumor_11|Uruk glob ishi krimp shar-kûk.
str_mordor_rumor_12|Nazgûl ronk ishi gimb olog-hosh sha uruk-bag. Ha ha ha !
str_mordor_rumor_13|Snaga volé viande moi, pushdug !
str_mordor_rumor_14|Gu kibum kelkum-ishi, burzum-ishi. Akha-gum-ishi ashi gurum.
str_mordor_rumor_15|Isengard uruk-hai u bagronk sha pushdug Saruman-glob bubhosh skai !
str_mordor_rumor_16|Si ça vous insulte, tuez-le. Si ça vous combat, tuez-le. Si ça vous regarde, tuez-le. Si c'est mort, mangez-le.
str_mordor_rumor_17|Les Uruk-hai de Saruman disent que le soleil ne les dérange pas. Bûbhosh skai !
str_mordor_rumor_18|Tous morts, tous pourris. Elfes, hommes et orques. Dans les Marais des Morts !
str_mordor_rumor_19|Ne te mets pas entre un Nazgûl et sa proie !
str_mordor_rumor_20|Ceux de l'Isengard ? Des raclures de fumier d'un sale petit magicien ! Ils mangent de la chair d'orque, je le garantis.
str_mordor_rumor_21|La forêt de Grand'Peur est déjà entre nos mains, mais les elfes ne le savent pas encore.
str_mordor_rumor_22|Cachez vos traces si vous ne voulez pas être attaqués par surprise en Ithilien. Ces maudits capuchons verts...
str_mordor_rumor_23|Où il y a un fouet, il y a un moyen.
str_isengard_rumor_begin|Sharkû commande !
str_isengard_rumor_2|Cavaliers sont nourriture ! Bubhosh !
str_isengard_rumor_3|Cavaliers auront une pique-surprise ! Ha ha ha !
str_isengard_rumor_4|Saruman a de nombreuses astuces ! De l'acier solide et de la pierre à feu !
str_isengard_rumor_5|Les hommes-sauvages puent ! Mais Sharkû est sage. Il sait comment les utiliser.
str_isengard_rumor_6|La racaille de la Moria nourrit les Olog-hai ! Big ! Skai !
str_isengard_rumor_7|Maître sage fait Uruk-hai forts !
str_isengard_rumor_8|Warg est plus rapide que cheval ! Warg mange cheval !
str_isengard_rumor_9|Uruk-hai piétineront cavaliers !
str_isengard_rumor_10|Grind ! Grind ! Grind !
str_isengard_rumor_11|Uruk glob ishi krimp shar-kûk.
str_isengard_rumor_12|Brûlez les forêts ! Fabriquez des armes ! Tuez les cavaliers !
str_isengard_rumor_13|Restez loin du berserk avant qu'il ne nous hache menu !
str_isengard_rumor_14|J'ai vu un berserk être transpercé par la lance d'un cavalier. Il a jeté l'homme de son cheval en tirant la lance à travers ses tripes.
str_isengard_rumor_15|Je ne fais pas confiance à ces pourceaux de petits orques des Montagnes. L'Isengard gagnera la guerre, avec ou sans eux.
str_isengard_rumor_16|Par la Main Blanche ! À quoi sert d'envoyer ces asticots des montagnes combattre pour nous s'ils sont à moitié entraînés ! Maudits soient les Gobelins et les orques du nord !
str_isengard_rumor_17|J'aimerais chatouiller quelques prisonniers avec mon couteau. Parfois vous avez besoin de faire couiner ces misérables rats !
str_isengard_rumor_18|Il n'y a qu'une chose que les asticots et les rats de Lugbúrz peuvent faire : voir dans le noir.
str_isengard_rumor_19|Nous abattons la forêt, mais nombre d'orques qui y rentrent n'en ressortent pas.
str_isengard_rumor_20|Où il y a un fouet, il y a un moyen.
str_rhun_rumor_begin|Chevauchez comme le vent des steppes !
str_rhun_rumor_2|Les nains sont cupides et vils. Et les hommes du Val les aident à nous exploiter et à nous tromper.
str_rhun_rumor_3|Trois magiciens sont venus sur nos terres, il y a quelque temps. Je me demande ce qu'ils vont faire.
str_rhun_rumor_4|Nos terres sont vastes et peu peuplées. Mais nous savons comment survivre ici.
str_rhun_rumor_5|Nous vendions notre vin et notre herbe à pipe avec les elfes et les nains. Mais ils trichent et mentent !
str_rhun_rumor_6|Nos cousins de Khand préfèrent combattre à pied, mais nous savons qu'être à cheval est mieux.
str_rhun_rumor_7|Nous avons déjà vaincu les légions du Gondor, et nous le ferons à nouveau !
str_rhun_rumor_8|Nous nous battons jusqu'à la mort ! On ne bat jamais en retraite, on ne se retourne jamais pour courir ! Jamais un pas en arrière !
str_rhun_rumor_9|Une aube rouge s'est élevée à l'est. Un crépuscule rouge attend à l'ouest !
str_rhun_rumor_10|Femme-elfe ? Nah. Trop fragile !
str_rhun_rumor_11|Chacun de mes fils m'a déjà rapporté la tête d'un ennemi. Et ma fille les testicules de l'un d'entre eux. Ha ha ha !
str_rhun_rumor_12|Les orques sont de sales bêtes sans compétence ni courage. Ils n'ont pas leur place sur le champ de bataille.
str_rhun_rumor_13|Qu'est-ce qu'il y a de mieux dans la vie ? Massacrer vos ennemis, les voir fuir devant vous et entendre les lamentations de leurs femmes.
str_dunland_rumor_begin|Nous de nous reposerons pas jusqu'à ce que nous nous soyons vengés et que les Têtes-de-paille soient à genou !
str_dunland_rumor_2|Les bâtards Rohirrim sont amicaux avec leurs chevaux la nuit ! Ha ha ha !
str_dunland_rumor_3|Les Loups Nocturnes peuvent voir dans les ténèbres. Même dans la nuit, leurs lances de jet ne ratent jamais leur cible.
str_dunland_rumor_4|Mort aux Forgoil ! Mort aux Têtes-de-paille ! Mort aux voleurs du Nord !
str_dunland_rumor_5|Ils l'appellent le Rohan à présent, mais c'est notre terre ancestrale ! Nous vengerons nos ancêtres et chasseront ces sales voleurs de terres.
str_dunland_rumor_6|Ne laissez pas les Têtes-de-paille vous attraper, ou ils vous tortureront et vous brûleront vif !
str_dunland_rumor_7|Nous sommes la furie du loup et la force de l'ours !
str_dunland_rumor_8|Les Forgoil pensent que nous sommes sauvages et stupides ! Voyons ce qu'ils penseront après que leurs cavaliers aient rencontrés nos piquiers.
str_dunland_rumor_9|Les corbeaux de l'Isengard crèveront les yeux des Têtes-de-paille. Les loups de la Dunlande leur mordront la gorge.
str_dunland_rumor_10|J'ai attrapé et tué un loup à mains nues ! Je vais briser la nuque d'une Tête-de-paille comme une brindille ! Grrr !
str_dunland_rumor_11|Notre chef a trouvé une vieille épée de bronze dans un tumulus. Il l'a courbée puis l'a jetée dans les marais. Les esprits des collines seront de notre côté, c'est sûr. C'est l'ancienne manière.
str_dunland_rumor_12|Mes ancêtres ont combattu avec Freca puis plus tard avec Wulf contre les foutues Têtes-de-paille. Nous nous rappelons leur courage.
str_beorn_rumor_begin|Les bois sont vastes et toutes sortes de créatures y vivent.
str_beorn_rumor_2|Les abeilles sauvages font le meilleur miel !
str_beorn_rumor_3|Les elfes sylvestres sont insaisissables, mais bons. Les nains des montagnes sont bruyants et joyeux. Les hommes du Val sont vaillants. 
str_beorn_rumor_4|Nous voyons beaucoup de bêtes étranges passer à travers nos terres.
str_beorn_rumor_5|Je dors toute la nuit et travaille tout le jour !
str_beorn_rumor_6|Le Mal se répand depuis montagnes là-bas.
str_beorn_rumor_7|La grande forêt n'est plus ce qu'elle était !
str_beorn_rumor_8|La force de la hache n'est pas dans la lame, mais dans le manche.
str_beorn_rumor_9|Nous avons dormi durant tout l'hiver dernier. Comment ? Oui, il faut beaucoup manger à l'automne pour tenir un hiver comme celui-ci.
str_beorn_rumor_10|Les hommes du Rohan sont nos parents, les ours sont notre sang, les gobelins sont nos proies !
str_beorn_rumor_11|Nous transformer en ours ? Bien sûr que non. Qui vous a dit ça ? Ha ha ha !
str_beorn_rumor_12|Beorn était un grand homme. Non, pas un homme, un géant !
str_beorn_rumor_13|Les plus grands et les plus courageux guerriers forestiers ne craignent pas les ombres de la forêt. Ils peuvent combattre dans l'obscurité aussi bien que les orques et les autres créatures qui rampent dans les bois.
str_beorn_rumor_14|Ne vous promenez pas tout seul dans les montagnes ! Les ours et les loups restent à distance des gros groupes d'hommes. Mais la faim, ou de sombres esprits comme disent certains, peuvent les pousser à vous attaquer.
str_lorien_rumor_begin|Ô Lórien ! L'Hiver arrive, le Jour nu et sans feuilles ; Les Feuilles tombent dans le ruisseau, la Rivière s'écoule.
str_lorien_rumor_2|Ne parlez pas en mal de Dame Galadriel ! Il n'y a de mal ni en elle, ni en cette terre, à moins qu'un homme ne l'amène ici lui-même. Alors qu'il prenne garde !
str_lorien_rumor_3|Le monde est en effet plein de périls et il s'y trouve nombre de mauvais endroits. Mais beaucoup restent justes, et bien que dans toutes les terres l'amour soit désormais mêlé de douleur, il en sortira peut-être un grand bien.
str_lorien_rumor_4|Le bien et le mal n’ont pas changé depuis l’année dernière ; et ils ne sont pas une chose chez les elfes et les nains et une autre chez les hommes. Il appartient à l’homme de les discerner, autant dans le Bois Doré que dans sa propre maison.
str_lorien_rumor_5|Souvent le haineux se blesse lui-même !
str_lorien_rumor_6|Une ancienne magie protège la Lothlórien, si puissante que l'Ombre n'ose pas encore s'y confronter.
str_lorien_rumor_7|Nathlo i nathal ! Vous êtes en sécurité dans le Bois Doré. Posto vae, reposez-vous, mangez et buvez maintenant. Si vous devez partir ensuite, emportez avec vous le souvenir de ce qu'était la Lórien.
str_lorien_rumor_8|Il est dit que la mer nous appelle tous, tôt ou tard. Moi aussi, un jour, j'entendrai les mouettes en quittant la Laurelindórenan pour toujours. I Harthon an lend and.
str_lorien_rumor_9|Av-'osto, n'ayez pas peur ! Il y a bien plus que nos manteaux gris nous protège de l'ennemi ici.
str_imladris_rumor_begin|Puissent les bénédictions des elfes, des hommes et de tous les Peuples libres vous accompagner.
str_imladris_rumor_2|Puissent les étoiles briller sur vos visages !
str_imladris_rumor_3| Celui qui brise quelque chose pour découvrir ce que c'est a quitté la voie de la sagesse.
str_imladris_rumor_4|Nous devons prendre une route difficile, une route imprévue. Là se trouve notre espoir, si espoir il y a.
str_imladris_rumor_5|Le désespoir est seulement pour ceux qui voient la fin au-delà de tout doute. Nous ne le faisons pas.
str_imladris_rumor_6|Même après le plus froid des hivers les fleurs renaissent. Et après la plus longue nuit arrive une nouvelle aube.
str_imladris_rumor_7|Tant étaient rassemblés la dernière fois que j'ai chevauché à la guerre. La lumière de nos épées était comme un feu dans un champ de roseaux. Si peu ont quitté Fendeval à présent.
str_imladris_rumor_8|Áva rucë ! Les Eldar ont pris les armes pour combattre l'ennemi une nouvelle fois aux côtés des courageux Edain. Peut-être pour la dernière fois, qui sait ? Nous chantons la guerre, le feu et la fin de la Nuit.
str_imladris_rumor_9|Je vois les hommes de l'Est chevaucher sous la bannière du Seigneur Sombre et c'est comme si je voyais leurs ancêtres à nouveau : des vagues de cavaliers se brisant sur le mur brillant des boucliers de la Dernière Alliance. Si seulement la mémoire des Edain était aussi longue que la nôtre.
str_woodelf_rumor_begin|Jadis fut elfe demoiselle, /Étoile brillante en journée,/Brodée d’or sa blanche mantelle, / Chaussures de gris argenté.
str_woodelf_rumor_2|Le temps ne s'attarde jamais, mais il change et croît de façon différente selon les lieux. Pour les elfes, le monde bouge, et il se déplace à la fois très vite et très lentement. Rapidement, car les elfes eux-mêmes changent peu alors que tout le reste passe : c'est une grande douleur pour eux. Lentement, car ils ne comptent pas les ans, pas pour eux-mêmes.
str_woodelf_rumor_3|L'ombre et le mal se rependront sur ces bois jadis superbes. À moins qu'ils ne soient stoppés, ils étoufferont tout espoir et toute lumière.
str_woodelf_rumor_4|Rapide et agile, calme et précis, nous pouvons encore tenir l'Obscurité à distance. Mais pour combien de temps encore ?
str_woodelf_rumor_5|Chut, no dhínen ! Il pourrait y avoir des orques rôdant aux alentours. Nous devons être sur nos gardes.
str_woodelf_rumor_6|*vous dévisage, visiblement agacé par votre présence*
str_woodelf_rumor_7|Oduleg hi am man theled ? Nous avons besoin de connaître la raison de votre présence. Les espions du Sorcier sont partout.
str_woodelf_rumor_8|Les Edain du Val fabriquent de curieux jouets de nos jours ! Ils ont beaucoup appris des Naugrim.
str_woodelf_rumor_9|L'ombre de Dol Guldur se répand. De noires créatures ont été aperçues dans les bois, nos avant-postes attaqués, des chasseurs disparaissent et nous ne les revoyons plus. Nos patrouilles comptent maintenant au moins 35 soldats, c'est à l'échelle de notre peur !
str_dale_rumor_begin|Avant il y eut le dragon, maintenant ceci...
str_dale_rumor_2|Comme si les orques venant du nord n'étaient pas déjà un mal suffisant, les hordes de l'est sont maintenant sur nous !
str_dale_rumor_3|Depuis que nous avons battu le dragon, nous savons comment trouver le point faible de l'ennemi.
str_dale_rumor_4|Les orientaux ne passeront jamais sur nous et nos alliés nains.
str_dale_rumor_5|Avez-vous déjà vu le soleil se lever sur le Long Lac ? Les couleurs faisaient chanter mon coeur. Mais maintenant, tout ce que je vois c'est une aube rouge. Un mauvais présage.
str_dale_rumor_6|Les nains sont un peu trop attachés aux trésors. Ne ne savons toujours pas quoi penser de Thorin Écu-de-chêne.
str_dale_rumor_7|Les hommes du Rohan sont nos cousins, et notre langue est très proche de la leur.
str_dale_rumor_8|Esgaroth tire son nom du mot elfique pour « roseaux », à cause de ses bancs de roseaux. Le saviez-vous ?
str_dale_rumor_9|Le dragon est une sorte de monstre que personne ne veut jamais revoir.
str_dale_rumor_10|Notre prospérité vient du commerce avec les nains et les elfes. Mais il est difficile de négocier avec les nains. Très peu de profit à faire.
str_harad_rumor_begin|Le Serpent Noir frappera vite et fort.
str_harad_rumor_2|Par le Serpent ! Nos bêtes fouleront les Gondoriens dans la poussière.
str_harad_rumor_3|Odum vermajál otí verthaba av daranaja-e-jatánus !
str_harad_rumor_4|Il y a beaucoup d'or et de pierres précieuses au Gondor. Et plus encore dans les terres au-delà.
str_harad_rumor_5|Nous attraperons beaucoup de mauviettes de l'Ouest et nous les sacrifierons au Dieu Serpent.
str_harad_rumor_6|Les Corsaires sont utiles et naviguent bien, mais ils sont tapageurs, sales d'apparence et sournois dans leur comportement.
str_harad_rumor_7|Les Panthères du Harad Lointain traquent leurs proies à la faveur de la nuit. Nos ennemis ne les verront pas arriver.
str_harad_rumor_8|Les guerriers de Khand sont fiers et sans peur, mais leur stratégie est trop simpliste.
str_harad_rumor_9|Je compte sur un bon butin dans l'Ouest. On nous l'a promis. Alors je pourrais retourner chez moi et lancer mon magasin de tapis en paix.
str_harad_rumor_10|Restez loin des Mûmakil. Ce sont des bêtes qui ont fort mauvaise humeur et qui vous écraseront en un instant.
str_harad_rumor_11|Au Harad, nous avons des déserts et des jungles, des montagnes et la mer. Nos peuples sont aussi variés que nos terres et aussi nombreux que les grains du sable.
str_harad_rumor_12|De nombreux chevaliers du Harondor préfèrent les sabres aux lames droites. Ils sont très bons pour abattre des paysans en fuite, mais vous aurez besoin d'une lance ou d'une bonne épée pour percer une solide armure.
str_harad_rumor_13|Mon frère de sang s'est engagé avec les Karka, il est éclaireur maintenant. Les cavaliers « des Fang » mènent une vie dangereuse, mais c'est une bonne expérience pour des jeunes gens impétueux.
str_harad_rumor_14|N'enclenchez jamais un combat contre la Confrérie des Lions ! Leur réputation est méritée.
str_harad_rumor_15|J'aimerais que nous ayons plus d'armes faites avec du fer noir. Beaucoup doivent encore se débrouiller avec du bronze, certains même avec des gourdins en bois et des javelots en verre noir, se jetant nus dans la bataille.
str_gunda_rumor_begin|Vous venons pour prendre les terres chaudes des hommes !
str_gunda_rumor_2|Sharkû a promis des cavernes chaudes.
str_gunda_rumor_3|Assez de se terrer dans les froides montagnes ! Maintenant, nous marchons vers les chaudes terres des hommes.
str_gunda_rumor_4|Nous avons vu un rôdeur sournois dans les tunnels de nos montagnes, mais nous n'avons pas pu l'attraper. Il a disparu quand nous nous sommes approchés.
str_gunda_rumor_5|Ceux de l'Isengard pensent qu'ils sont spéciaux car le vieil homme les équipe.
