str_yes|Oui.
str_npc21_intro|Dégage, p'tit' mouche, avant que J'T'ÉCRASE ! RRAAARGHH ! (Le troll montre ses crocs en grognant.)
str_npc22_intro|Salut {playername}. Mae govannen !
str_npc23_intro|Laissez-moi seul, étranger, je ne souhaite pas vous parler.
str_npc24_intro|Kíli, fils de Dwalin, à votre service !
str_npc25_intro|Bienvenue au Val, voyageur ! Comment puis-je vous aider ?
str_npc26_intro|Chut ! Si vous alertez les gardes, je vais arracher votre estomac et le donner à manger aux wargs !
str_npc27_intro|Vous !
str_npc18_intro_response_1|Un esclave remplaçable, voué a mourir, voudrait parler avec moi ? Qu'est ce que t'as à dire ? 
str_npc19_intro_response_1|Du sang royal vous dites ? Ah ! Qu'est ce qui vous fait croire que vous avez ne serait-ce qu'une goutte de sang royal ? 
str_npc20_intro_response_1|Que veux tu dire, sorcière ? Qui es-tu ?
str_npc21_intro_response_1|Ah oui, vous m'avez fait trembler dans mes bottes. Quel troll effrayant, retenu par cette minuscule chaîne ! Pourquoi vous ne m'écrasez pas, alors ?
str_npc22_intro_response_1|Salutations Seigneur elfe ! C'est un grand honneur de vous rencontrer.
str_npc23_intro_response_1|Est-ce ainsi que les elfes sylvains accueillent leurs hôtes ?
str_npc24_intro_response_1|{playername}, à votre service. Comment se porte le peuple de Durin ?
str_npc25_intro_response_1|Salutations. Je me demandais s'il se trouvait ici des volontaires pour se joindre à nous dans nos voyages.
str_npc26_intro_response_1|Retiens tes menaces, Uruk, avant qu'on en arrive aux coups. Je ne suis pas un mouchard.
str_npc27_intro_response_1|Qui êtes-vous ?
str_npc18_intro_response_2|Je ne gaspillerai pas ma salive pour un esclave voué a mourir.
str_npc19_intro_response_2|Misérable impudent. Hors de mon chemin.
str_npc20_intro_response_2|Je n'ai pas le temps pour vos folles divagations, sorcière.
str_npc21_intro_response_2|Pour cette fois je vais vous laisser vivre, espèce de sale bête. (Partir)
str_npc22_intro_response_2|Excusez-moi, j'ai des personnes moins importantes à qui parler.
str_npc23_intro_response_2|Ce sentiment est partagé. Au revoir.
str_npc24_intro_response_2|Peu importe, j'ai besoin d'un peu d'air frais.
str_npc25_intro_response_2|Peu importe, nous sommes simplement de passage.
str_npc26_intro_response_2|Je vais continuer ma route alors, ou mon épée va commencer à me démanger.
str_npc27_intro_response_2|[Ignorer et partir]
str_npc18_backstory_a|Je ne suis pas une simple esclave ! Je suis une guerrière de premier ordre qui s'est faite voler sa place légitime dans les rangs ! Vous voyez que je suis une femme, mais je suis plus forte et plus rapide que beaucoup d'autres, et j'ai battu plus d'hommes que je ne peux en compter. Le maitre d'arène... qu'il soit maudit ! Il m'a mis un test pour combattre trois hommes à la fois. Trois !
str_npc19_backstory_a|Une petite goutte, bien sûr, mais ma mère m'a tout dit sur ma lignée. Je suis Heidrek, descendant direct du roi Fengel, plus proche du trône de Rohan et de la Dunlande que n'importe lequel de nos chefs ! Mes cheveux sont foncés, mais j'imagine que j'ai plus qu'un brin de jaune quelque part.
str_npc20_backstory_a|Dans mon rêve, il y avait un arbre. Un arbre tout blanc. Et vous, vous étiez là, debout à côté. Vous avez placé votre main sur son tronc et hop, il s'est fané jusqu'aux racines. Et l'ombre dans le ciel s'est allongée, et l'air s'est alourdi. J'ai alors entendu un rire, très loin à l'est.
str_npc21_backstory_a|Ha ! Ramène-toi un peu plus près et j'te casse le cou comme une brindille. Allez ! J'piétinerai ton foie, j'réduirai tes os en poussière et j'f'rai du jus avec ta tête comme si c'était du raisin.
str_npc22_backstory_a|Vous avez dû entendre le récit de mes exploits dans des batailles passées et oubliées par les hommes mortels. Dans la totalité de notre histoire, une guerre comme celle-ci n'est qu'une période dangereuse de plus pour les Eldar, mais ce sera la Dernière Guerre.
str_npc23_backstory_a|Pardonnez ma hardiesse, étranger, mais nous n'avons pas beaucoup de visiteurs, et beaucoup semblent peu dignes de confiance. Il y a seulement une semaine, ce nain est apparu et... peu importe. Mon nom est Luevanna, des elfes sylvains de la forêt de Grand'Peur.
str_npc24_backstory_a|C'est aimable de votre part de demander, {playername}. Nous sommes en train de combattre les incursions des Orientaux et des orques de Gungabad, mais jusque là rien que nous et nos alliés du Val ne puissions gérer.
str_npc25_backstory_a|Je suis sûr que vous pourrez trouver des volontaires si vous parlez avec le quartier-maître de nos casernes. Quand à moi je ne suis qu'un guérisseur et herboriste aux modestes compétences.
str_npc26_backstory_a|C'est bien pour vous. On m'appelle Gulm. J'ai éventré mon sergent et maintenant ses snagas me poursuivent.^Ce porc paresseux n'a rien vu venir ! Une fois, on s'est fait attaquer par des têtes-blondes... et il a paniqué ! "Repli !" qu'il a crié. Et il s'est tiré ce lâche ! Seul Gulm et quelques braves ont tenu ferme et ont brisé la charge de leurs chevaux. Ensuite on a fait de la purée avec leur têtes ! HA HA HA ! Si les plus forts d'entre nous n'avaient pas été là, on serait tous de la nourriture pour les vers.
str_npc27_backstory_a|Je suis Durgash !
str_npc18_backstory_b|J'ai triomphé ! Je les ai vaincus ! Mais ... l'un d'eux était si faible qu'il a péri des coups que je lui ai infligés. S'il avait été un simple esclavagiste, cette histoire aurait été déjà fini. Mais non. Il était l'un des nombreux fils du grand seigneur Lurmsakun, d'une femme moindre.
str_npc19_backstory_b|Eh bien, vous ne trouverez personne de Rohan ou de la Dunlande qui acceptera ma revendication, mais elle est néanmoins vraie. Ma grand-mère était bergère et vivait dans les collines. Un jour, il est arrivé par hasard que le vieux roi Fengel, le grand-père cupide de Théoden le Prétendant, la voie sur les rives de l'Isen. Il s'est pris d'affection pour elle et ma mère fut son enfant.
str_npc20_backstory_b|Ne savez-vous pas devant qui vous vous trouvez ? Idiot ignorant. Sachez que je suis Zigûrphel, de l'ancienne Akallabêth - mais on dirait que tu ne sais rien de ce nom ! Sachez aussi que je cherche à réparer les torts d'autrefois, les torts qui nous ont été infligés, à moi et à mon peuple, par les Valar, ceux qui ont coulé notre Grande Armada et notre maison. Ah, Ar-Pharazôn, grand et glorieux ! Ta vision restera-t-elle à jamais gravée dans les mémoires ? Non, pas tant que Zigûrphel vivra et aura des mains pour faire son travail !
str_npc21_backstory_b|Z'et' pas du genre facile, hein ? (soupirs) J'm'appelle Berta. J'avais une bande d'pillards dans les Montagnes de Brume, les plus méchants gobelins voleurs du coin. C'était l'bon temps. Pis on est tombés sur une bande de sauvages de Gundabad. On a bu un peu, joué un peu... L'lend'main matin, j'me suis réveillée toute attachée, mes gars dans l'vent. Maint'nant j'casse des pierres et j'transporte leurs bagages. Parfois y prêt' pour de l'argent.
str_npc22_backstory_b|Le Seigneur Elrond m'a envoyé en tant qu'émissaire auprès du Seigneur Celeborn afin de lui apporter aide et conseils, car il en a besoin pour la guerre dans cette partie du Rhovanion.
str_npc23_backstory_b|J'aime marcher le long des sentiers cachés de cette belle forêt. Parfois je me déplace silencieusement entre les arbres et j'observe les habitudes de nombreux animaux des bois. Le chant d'un oiseau rare et le grognement d'un sanglier sauvage sont pour moi aussi beaux que le fracas des armes et les grands murs le sont pour les Edain.
str_npc24_backstory_b|J'ai aidé à améliorer les défenses d'Erebor et j'ai entraîné un certain nombre de jeunes nains, sous la supervision de mon père Dwalin, comme le veulent nos coutumes.
str_npc25_backstory_b|Je me suis occupé du Roi Brand pour une constipation, un malaise commun qui affecte les hommes partant à la guerre. Une petite décoction d'absinthe, et tripes et moral sont remis en place.
str_npc26_backstory_b|Je me suis dit, 'Gulm, veux-tu finir comme une charogne ?' et je me suis répondu, 'Non.'^À la bataille suivante, je suis tombé en simulant une blessure. Puis, quand personne ne regardait, je me suis jeté sur mon sergent ! Je l'ai presque fendu en deux, gharr ! Puis j'ai taillé son acolyte snaga^^... Il semble que ce misérable ver ait survécu et a agité sa langue à propos de tout ceci. La prochaine fois, je m'assurerai de lui couper la tête, gharr...
str_npc27_backstory_b|Je suis un Chevaucheur de Loup de l'Isengard, et un pisteur.
str_npc18_backstory_c|Et me voici donc, maudit et conspué, condamné à mourir parce que je suis plus fort que les chiens qui se moquent de moi ! Libère-moi, Grand. Libère-moi, parle pour moi, et ma force est à toi. Ma lame est à toi. Ma vie est à toi !
str_npc19_backstory_c|Naturellement, le chef Daeglaf et les autres ne veulent pas me donner la moindre chance de gloire, car si je devais accomplir de grandes actions au combat, cela donnerait des ailes à ma revendication. Les hommes afflueraient alors vers ma bannière ! Votre gloire vous précède, commandant. Si vous me permettez de servir sous votre bannière, je peux accomplir ces grands exploits pour vous.
str_npc20_backstory_c|O Akallabêth, où es-tu maintenant ? Effacé, tout est effacé... Là où il y avait autrefois la lumière, la gloire de notre nation qui était grande au-dessus de toutes les autres, maintenant il n'y a plus que l'Ombre. Ma belle maison connaît maintenant le silence éternel de la mer. Mais mon coeur est encore plein de feu et de noires bêtes y courent en liberté. Je connais des arts puissants que vous et vos semblables n'avez même pas imaginés. Écoutez-moi, maintenant ! Mendierez-vous mon aide, comme vous le devriez, ou partirez-vous d'ici en rampant comme un ver ? Choisissez vite !
str_npc21_backstory_c|'Coute-moi bien, nabot ! Si t'es un grand chef, tu peux p'têt' parler au patron et lui payer c'que j'lui dois ? J'pense que j'pourrais r'joind' votre p'tit group'. Voir le monde, manger des moutons... (Elle lèche ses crocs impressionnants.)
str_npc22_backstory_c|Toutefois, si les ennemis de la Lothlórien sont en déroute, je pourrais envisager de vous rejoindre pour quelques temps, {playername}. Je sens que nos destins dans cette guerre sont étroitement liés.
str_npc23_backstory_c|Vous ne comprendriez pas ça, je pense, à vous voir préparé à la guerre. Mais vous devez avoir beaucoup voyagé, avez-vous rencontré les autres grandes forêts ? Pouvez-vous m'y emmener ?
str_npc24_backstory_c|Il y a une accalmie dans les combats, qui rendrait malade tout guerrier nain de mon ascendance et de mon tempérament. Je suppose qu'il y a beaucoup d'actions dans vos voyages et que votre cause est amicale avec les nains ? Je connais un guerrier nain qui améliorerait grandement vos chances de survie.
str_npc25_backstory_c|J'ai entendu dire qu'il y a de nombreux combats partout et que nos terres sont épargnées pour le moment. D'après les rayures de votre armure, vous avez dû être en danger à de nombreuses reprises. Peut-être que mes humbles compétences seront utiles à votre compagnie, pour le plus grand bien de tous.
str_npc26_backstory_c|Je suis un combattant Uruk-hai, et un berserker ! Tout ce qu'il faut savoir pour tuer des hommes, je le sais. J'étais au service de la Main Blanche, mais maintenant la Main aurait plutôt tendance à me jeter dans les fosses enflammées. ^^Je viendrais bien avec vous et chasserais des hommes dans le sud pendant que les snagas de l'Isengard grinceront des dents.
str_npc27_backstory_c|Peut-être que vous pouvez être mon nouveau maître.
str_npc18_backstory_later|J'ai eu la chance, je suppose, que le Grand Seigneur Lurmsakun ait été occupé ailleurs. Ses intendants m'ont laissé pourrir ici. Mais mon destin n'est pas de mourir en prisonnier ! Êtes-vous venu pour m'accorder la mort qui me revient de droit sur le champ de bataille ?
str_npc19_backstory_later|Ho là ! Vous êtes revenu{/e}, comme je savais que vous le feriez. Mes chefs jaloux me laissent les mains sans rien faire. Parlons, commandant ! Je vous suivrai, et je me battrai dans vos rangs pour gagner ma renommée.
str_npc20_backstory_later|Vous troublez encore mes rêves ! Ne me laisserez-vous pas en paix ? Mon oeil rêveur voit loin et profondément. Ici, à Dol Guldur, j'ai encore des visions de tes oeuvres. Je dis ceci : si tu étais sage, tu demanderais mon aide à nouveau ici et maintenant.
str_npc21_backstory_later|R'garde c'que l'chat vient d'attraper ! T'es bien débrouillée, alors, hein ? T'as passé un bon moment à t'balader, sans être enchaînée à un maudit rocher ? C'est pas génial ? Et si t'allais parler au patron pour moi ? Mieux vaux maint'nant qu'jamais.
str_npc22_backstory_later|Avez-vous reconsidéré la question ? Le temps est compté, pour les Eldar.
str_npc23_backstory_later|J'ai observé un nid d'araignées géantes pendant quelques jours. De vilaines bêtes, à première vue, mais elles gardent les intrus à l'écart. Etes-vous venu me demander de voyager avec vous ?
str_npc24_backstory_later|Construire des murs défensifs est digne de n'importe quel nain. Mais j'ai aussi besoin d'utiliser ma hache. Bientôt. Laissez-moi vous accompagner.
str_npc25_backstory_later|J'ai répondu à un autre appel de notre Roi, cette fois pour des vomissements. J'espère que sa détermination à engager l'ennemi n'est pas liée à sa condition physique. Souffrez-vous vous aussi de constipations et de vomissements ?
str_npc26_backstory_later|Que croyez-vous que je fasse ? Gulm est assis ici et attend que quelques snagas sournois le collent dans l'obscurité. Prenez-moi avec vous, je vous servirai bien.
str_npc27_backstory_later|Avez-vous reconsidéré la question ? Je vous servirai bien.
str_npc18_backstory_response_1|Si vous êtes vraiment aussi féroce que vous en avez l'air, peut-être pourriez-vous vous battre pour moi. Après que l'on vous ait nourri un peu, bien sûr.
str_npc19_backstory_response_1|Très bien. Tant que vous pouvez vous battre sur la ligne de bataille, vous pouvez être utile, Dunlandais.
str_npc20_backstory_response_1|Étrange façon de demander à me rejoindre, sorcière. Mais très bien, vous pouvez venir.
str_npc21_backstory_response_1|C'est vrai que vous êtes d'une bonne taille et que vous semblez pouvoir vous débrouiller dans une bagarre. Je pourrais avoir besoin de vous.
str_npc22_backstory_response_1|Il peut paraître présomptueux de ma part de demander, mais ma compagnie pourrait avoir besoin de vos compétences dans les batailles à venir.
str_npc23_backstory_response_1|Nous voyageons dans le monde, mais c'est pour défendre tout ce qui est juste et bon ici bas que nous livrons bataille à l'ennemi.
str_npc24_backstory_response_1|En effet, un guerrier nain serait le bienvenu dans ma compagnie.
str_npc25_backstory_response_1|Nous pouvons avoir l'utilité d'un guérisseur et d'un botaniste.
str_npc26_backstory_response_1|J'admets qu'un berserker nous serait utile.
str_npc27_backstory_response_1|Vous le ferez.
str_npc18_backstory_response_2|Pouah ! Un chien d'arène meurtrier n'est pas digne d'être mon compagnon.
str_npc19_backstory_response_2|Vous parlez de grandes actions. Allez en faire quelques-unes vous-même, avant de m'approcher à nouveau !
str_npc20_backstory_response_2|Pah ! Je suppose que vos aboiements sont biens pires que votre morsure. J'ai du travail à faire !
str_npc21_backstory_response_2|Pas de chance, troll. Je ne peux pas me permettre de marchander pour des gens comme vous.
str_npc22_backstory_response_2|Alors je reviendrai lorsque la Lothlórien sera moins en danger.
str_npc23_backstory_response_2|Non, désolé{/e}. Nous ne pouvons prendre de parasites.
str_npc24_backstory_response_2|Non, désolé{/e}. Nous nous en sortons bien tout seuls.
str_npc25_backstory_response_2|Non, désolé{/e}. Nous ne visitons les guérisseurs que lorsque nous en avons besoin.
str_npc26_backstory_response_2|Bah. Je n'accorde pas ma confiance aux traîtres.
str_npc27_backstory_response_2|Je n'ai pas besoin de toi, esclave !
str_npc18_signup|Oh, planter encore mes dents dans de la viande ! Vous verrez mon vrai visage bien assez tôt, une fois que mes mains et mes pieds seront libres et que j'aurai de la nourriture dans le ventre !
str_npc19_signup|Oui, vous pouvez m'appeler ainsi pour l'instant, car je n'ai pas honte de mon sang dunlandais. Mon peuple a beaucoup souffert sous les rois tyrans du Rohan et je ne  me sens pas la moindre parenté avec eux. Je vous aiderai dans cette guerre et dans tous vos efforts. Mais en retour, commandant, vous devrez m'aider à faire valoir mes droits le moment venu.
str_npc20_signup|Je vais ignorer votre arrogance pendant un certain temps, mais sachez qu'un jour nous aurons des mots. Peut-être qu'à ce moment-là, nous serons tous les deux devant le Seigneur Sombre, que j'ai autrefois connu sous un nom bien différent, et alors nous verrons qui a son oreille. Peut-être qu'alors je vous enseignerai les bonnes manières.
str_npc21_signup|Assez d'parlotes ! Allez voir l'patron et sortez-moi d'ce trou.
str_npc22_signup|Je vois. Il me semble avoir eu vent de vous et de vos exploits.
str_npc23_signup|Je n'aime pas la violence et les armes, mais je sais me défendre en cas d'attaque.
str_npc24_signup|Je suis adroit avec une hache, je sais la manier et la lancer. Je peux également garder vos factures basses si vous me laissez parlez aux marchands. Et j'ai l’oeil pour trouver et piller les ennemis tués sur le champs de bataille.
str_npc25_signup|Et bien dans ce cas, j'ai simplement besoin de rassembler mes herbes et mes recettes.
str_npc26_signup|Un guerrier Uruk est bien plus valeureux que tous les snagas. Un guerrier Uruk ne s'enfuit jamais du combat.
str_npc27_signup|Ah vraiment ? Vous feriez bien de m'engager !
str_npc18_signup_2|Ma mère m'a dit un jour que j'étais né pour tailler de nombreux ennemis. Pour vous, je vais tuer beaucoup de ces faiblards de l'ouest. Mettez seulement une bonne lame dans mes mains, et je ferai le reste !
str_npc19_signup_2|Je me bats comme le fait mon peuple, comme des loups dans la nuit. Je peux faire voler une lance ou enfoncer une pique dans la poitrine d'un cavalier qui charge. Je taille les membres à la hache ou à l'épée. Avec vous, je parlerai ouvertement : peu m'importe que vous rendiez plus de services à l'Oeil ou à la Main Blanche. Tout cela est sans importance pour moi, tant que je peux m'asseoir sur mon trône légitime dans le Château d'Or.
str_npc20_signup_2|Mais pour l'instant, que mes traditions et mon artisanat fondés il y a de nombreuses années soient mis à votre service. Sachez ceci : avec l'aide de Zigûrphel, vous êtes comme un dragon à qui ouvre ses ailes dans la fosse d'Utumno. Je ferai de grandes choses pour vous et pour votre but, même si vous ne les comprenez pas !
str_npc21_signup_2|Je s'rai juste derrière toi, t'inquiète pas.
str_npc22_signup_2|Peut-être qu'en rejoignant votre compagnie et en frappant fort là où on ne m'attend pas, l'Ennemi sera contré. Je viens.
str_npc23_signup_2|Peut-être que je peux vous apprendre à vous déplacer plus vite et à faire moins de bruit. Allons-y.
str_npc24_signup_2|Si vous pouvez garder les grandes-gens de votre compagnie dans les rangs, en particulier les elfes sournois, je vous rejoindrai avec plaisir.
str_npc25_signup_2|Je dois cependant vous avertir, je suis assez inutile an combat. Mais je suis sûre que vous êtes capable de garder une femme de mon âge en sécurité.
str_npc26_signup_2|Mais vous devriez vous décider vite, les gardes deviennent suspicieux.
str_npc27_signup_2|Vous ne regretterez pas de m'avoir pris.
str_npc18_signup_response_1|J'aime votre esprit. Très bien, je vais envoyer un message à Lurmsakun en votre nom.
str_npc19_signup_response_1|Alors, "Prince", prenez vos armes. Maintenant vous vous battez pour moi.
str_npc20_signup_response_1|J'espère pour vous que vos paroles ne sont pas de l’esbroufe. Ne me décevez pas, Zigûrphel.
str_npc21_signup_response_1|Très bien, nous verrons si vous savez prouver que vous valez quelque chose.
str_npc22_signup_response_1|Nous serons honorés d'avoir la compagnie d'un Seigneur elfe.
str_npc23_signup_response_1|Très bien. J'espère que vous ne vous enfuirez pas dès le premier orque rencontré.
str_npc24_signup_response_1|Très bien, Maître nain, vous êtes le bienvenu.
str_npc25_signup_response_1|Vous serez en sécurité avec nous, je vous le promets. Nous partirons bientôt.
str_npc26_signup_response_1|Très bien. Faites ce que l'on vous dit, et je vous nourrirai bien.
str_npc27_signup_response_1|Très bien. Allons-y.
str_npc18_signup_response_2|Vous êtes féroce... peut-être trop féroce. Un peu plus de temps dans les réserves pour l'instant pourrait vous apprendre l'obéissance.
str_npc19_signup_response_2|Vous devrez rester assis sur ces bottes de foin un peu plus longtemps, "Prince".
str_npc20_signup_response_2|Votre vantardise et vos abus me cassent les oreilles. Domptez votre langue avant que nous ne parlions à nouveau !
str_npc21_signup_response_2|Je n'ai pas besoin de vous pour le moment.
str_npc22_signup_response_2|À y repenser, peut-être devrions-nous aider la Lothlórien à notre manière.
str_npc23_signup_response_2|Désolé{/e}, mais je n'arrive pas à vous imaginer sur un champ de bataille.
str_npc24_signup_response_2|Désolé{/e}, il se trouve que j'aime bien les elfes.
str_npc25_signup_response_2|Je suis désolé{/e}, tout le monde se bat dans ma compagnie.
str_npc26_signup_response_2|J'ai changé d'avis. Qui que ce soit vous cherchant pourrait venir pour moi la prochaine fois.
str_npc27_signup_response_2|J'ai changé d'avis.
str_npc18_payment|Un puissant commandant de votre envergure n'a sûrement qu'un mot à dire, et on me libérera. [Coûte {reg14} d'influence avec {s14}]
str_npc19_payment|Il semble que Daeglaf le Noir cherche une excuse pour me retenir ici, commandant. [Coûte {reg14} d'influence avec {s14}]
str_npc20_payment|C'est plutôt vous qui feriez bien de ne pas me décevoir, ni le Maître que nous servons tous deux. Avez-vous assez bien réussi suivant son estimation ? [Coûte {reg14} d'influence avec {s14}]
str_npc21_payment|En parlant d'valeur, ma p'tit' dette pourrait n'pas être si p'tit' que ça, si vous voyez c'que j'veux dire. Et le patron pourrait essayer d'se payer sur vot' dos, alors fait' gaffe ! [Coûte {reg14} d'influence avec {s14}]
str_npc22_payment|Nous devrions bientôt partir. La valeur de ma venue sera diminuée si l'ennemi sent ma présence avant que nous ayons frappé. Mais la Lothlórien a aussi besoin de moi ici. [coûte {reg14} d'Influence avec {s14}]
str_npc23_payment|Je vous rejoindrais bien, mais mon devoir se trouve ici. [Coûte {reg14} d'Influence avec {s14}]
str_npc24_payment|Je vous rejoindrais bien, mais j'ai peur que mon honorable père Dwalin ne comprenne pas que je laisse la ville en temps de besoin. [Coûte {reg14} Influence {s14}]
str_npc25_payment|Je ne peux pas abandonner mon devoir ici, mon roi a toujours besoin de moi. Je suis trop préoccupé par sa santé. [Coûte {reg14} d'Influence avec {s14}]
str_npc26_payment|Je voudrais partir avec vous, mais les gardes à la porte ne me laisseront pas.^Croyez-moi, j'ai essayé. [Coûte {reg14} d'Influence avec {s14}]
str_npc27_payment|Je vous rejoindrais bien, mais mon devoir se trouve ici. [Coûte {reg14} d'Influence avec {s14}]
str_npc18_payment_response|Cela ne fait aucun doute. Les subordonnés de Lurmsakun n'oseront pas me refuser. [Coûte {reg14}/{reg15} d'influence]
str_npc19_payment_response|Le chef Daeglaf devra céder devant mon souhait, une fois que je l'aurai exprimé clairement. [Coûte {reg14}/{reg15} d'influence]
str_npc20_payment_response|En effet. Venez maintenant ! Ce n'est pas, après tout, un simple snaga que vous allez suivre. [Coûte {reg14}/{reg15} d'influence]
str_npc21_payment_response|Quoi qu'il puisse essayer, vous partez avec moi. [Coûte {reg14}/{reg15} en influence]
str_npc22_payment_response|Croyez-moi, vous serez plus utile avec moi. [Coûte {reg14}/{reg15} d'Influence]
str_npc23_payment_response|À partir de maintenant, votre devoir est avec moi. [Coûte {reg14}/{reg15} d'Influence]
str_npc24_payment_response|Maître Dwalin comprendra qu'un nain né pour le combat ne doit pas être tenu à l'écart de nos ennemis trop longtemps. [Coûte {reg14}/{reg15} d'Influence]
str_npc25_payment_response|La bonne santé du roi est importante, mais vous sauverez plus de vies avec moi. [Coûte {reg14}/{reg15} d'Influence]
str_npc26_payment_response|Oh, mais les gardes n'oseront pas vous arrêter, si vous êtes avec moi. [Coûte {reg14}/{reg15} d'Influence]
str_npc27_payment_response|À partir de maintenant, votre devoir est avec moi. [Coûte {reg14}/{reg15} d'Influence]
str_npc18_morality_speech|Votre grandeur ! Ma soif de sang n'est pas étanchée ! Pourquoi devons-nous {s21}, comme des lâches ? Laissez-moi les combattre !
str_npc19_morality_speech|Commandant, je n'aime pas du tout le fait de {s21}. Un roi comme moi devrait toujours être ouvert, mais si les bourses sont vides, je n'ai rien à donner et nos soldats nous abandonneront.
str_npc20_morality_speech|Je dirais que j'attendais mieux de vous, commandant, mais ce serait un mensonge. Prenez garde, de peur que vos manières égoïstes ne nuisent aux nobles desseins de vos supérieurs !
